username;date;retweets;favorites;text;geo;mentions;hashtags;id;permalink
talkSPORT2;29/01/2018 21:59;0;0;ICYMI: The Transfer Centre on @talkSPORT2 Pierre-Emerick Aubameyang latest Joe Hart on the move? Leonardo Ulloa re-signs for @OfficialBHAFC on loan Join @AlexBiddleUK & @SamEllard with all the latest transfer news and rumours. http:// tlks.pt/2ListenLive pic.twitter.com/5YwV9dz5B7;;@talkSPORT2 @OfficialBHAFC @AlexBiddleUK @SamEllard;;9,58127E+17;https://twitter.com/talkSPORT2/status/958127369872642048
FPLHazardous;29/01/2018 21:28;0;1;Here are the recent ones... Aaron Lennon (Burnley) Kenedy (Newcastle Utd) Guido Carrillo (Southampton) Joao Mario (West Ham) Leonardo Ulloa (Brighton & Hove Albion) Daniel Sturridge (West Bromich Albion) Gerard Deulofeu (Watford);;;;9,5812E+17;https://twitter.com/FPLHazardous/status/958119578906722305
FoxesFaithful_;29/01/2018 21:08;0;0;Claude Puel insists he is happy for Leonardo Ulloa following his move on Loan to Brighton but refused to confirm whether the striker had a future at Leicester.;;;;9,58115E+17;https://twitter.com/FoxesFaithful_/status/958114687861878784
FoxesNews;29/01/2018 20:53;0;1;#Leicester #LeicesterCity #LCFC Leonardo Ulloa joins Brighton on loan from Leicester http:// dld.bz/g8VPD pic.twitter.com/nRFZPgKADd;;;#Leicester #LeicesterCity #LCFC;9,58111E+17;https://twitter.com/FoxesNews/status/958110921125134337
USANewsGoogle;29/01/2018 20:51;0;0;Brighton sign Leonardo Ulloa on season-long loan from Leicester http:// usanewsgoogle.com/brighton-sign- leonardo-ulloa-on-season-long-loan-from-leicester/ … pic.twitter.com/rSKRUe4kgy;;;;9,5811E+17;https://twitter.com/USANewsGoogle/status/958110468492660736
RealHypeTrain;29/01/2018 20:50;0;0;Escaping our attention earlier today, Leonardo Ulloa has rejoined Brighton and will provide competition for Glenn Murray's spot in attack. Ulloa is only £4.8m in the #FPL , and with a good end of season run, many have their fingers crossed the moves works out. https:// twitter.com/OfficialBHAFC/ status/957923551540948993 …;;;#FPL;9,5811E+17;https://twitter.com/RealHypeTrain/status/958110159829700609
FoxesFaithful_;29/01/2018 20:46;0;0;Leonardo Ulloa has rejoined Brighton & Hove Albion on Loan until the end of the season.;;;;9,58109E+17;https://twitter.com/FoxesFaithful_/status/958109147140165632
mjmarr_star;29/01/2018 20:44;3;3;#avfc boss Steve Bruce vows to avoid panic buys after missing out on top striker target Leonardo Ulloa .... https://www. expressandstar.com/sport/football /aston-villa/2018/01/29/aston-villa-boss-steve-bruce-wary-of-panic-buys-after-missing-out-on-leonardo-ulloa/ …;;;#avfc;9,58109E+17;https://twitter.com/mjmarr_star/status/958108575246766085
theFPLdabbler;29/01/2018 20:37;0;1;Plenty of transfer activity today! Here’s another one, Leonardo Ulloa rejoined former club Brighton Anyone tempted? Bit of a bargain and great fixtures #FPL £4.8m 0.2% TSB sou (a), WHU (H), sto (a) pic.twitter.com/vE5j5y14Sz;;;#FPL;9,58107E+17;https://twitter.com/theFPLdabbler/status/958106847948562432
sheby_24;29/01/2018 20:22;0;0;We don't need him, we don't need anyone. Although I Wouldn't have minded Leonardo Ulloa on loan from Leicester, He would have been a good solid addition to our team, and would also have been eligible to play in the @ChampionsLeague . #FSGmissedATrick;;@ChampionsLeague;#FSGmissedATrick;9,58103E+17;https://twitter.com/sheby_24/status/958103086815416321
covinosports;29/01/2018 20:21;0;0;English Premier League Soccer: Brighton & Hove Albion have signed striker Leonardo Ulloa on loan from Leicester City for the rest of the season. #TransferTalk #TransferWindow;;;#TransferTalk #TransferWindow;9,58103E+17;https://twitter.com/covinosports/status/958102839708012544
ligapropremier;29/01/2018 20:00;0;0;#Brighton Brighton manager Chris Hughton has confirmed loan signing Leonardo Ulloa has.. http://www. ligapromanager.com/foro/viewtopic .php?f=35&t=357628 … pic.twitter.com/XFqMdPtxb4;;;#Brighton;9,58097E+17;https://twitter.com/ligapropremier/status/958097478145933312
FanSidedSoccer;29/01/2018 19:50;0;1;Leonardo Ulloa off to Brighton and Hove Albion on loan http:// dlvr.it/QDBFVN via @foxesofLCFC pic.twitter.com/Sq9u3W5w9i;;@foxesofLCFC;;9,58095E+17;https://twitter.com/FanSidedSoccer/status/958094931859394560
hanhnguyenthih1;29/01/2018 19:42;0;0;Brighton sign Leonardo Ulloa on season-long loan from Leicester - U.S. News: http:// youtu.be/3EuGGhqvN3k?a via @YouTube;;@YouTube;;9,58093E+17;https://twitter.com/hanhnguyenthih1/status/958092940940861440
talkSPORT;29/01/2018 19:20;4;29;ICYMI: Leicester's Leonardo Ulloa has returned to Brighton until the end of the season http:// tlks.pt/LtteO6 #BHAFC #LCFC pic.twitter.com/VK1SvsOuXZ;;;#BHAFC #LCFC;9,58087E+17;https://twitter.com/talkSPORT/status/958087355717468160
BRIGHTONASH;29/01/2018 19:15;0;0;BBC Sport - Leonardo Ulloa : Brighton re-sign Leicester striker until end of season http://www. bbc.co.uk/sport/football /42858428 …;;;;9,58086E+17;https://twitter.com/BRIGHTONASH/status/958086130058104832
kevwe;29/01/2018 18:02;0;0;Chris Hughton has confirmed that new signing Leonardo Ulloa will go straight into the Brighton squad for their crucial game against Southampton on Wednesday.;;;;9,58068E+17;https://twitter.com/kevwe/status/958067907111587840
kevwe;29/01/2018 18:02;0;0;Claude Puel has refused to confirm whether Leonardo Ulloa has a future at Leicester following his loan move to Brighton, but says it is a good opportunity for the striker.;;;;9,58068E+17;https://twitter.com/kevwe/status/958067881379614727
physioroom;29/01/2018 17:35;0;2;Chris Hughton confirms new loan signing [and former Seagull] Leonardo Ulloa will be included in Wednesdays squad at Southampton. #BHAFC;;;#BHAFC;9,58061E+17;https://twitter.com/physioroom/status/958060931120029703
uklocalnet;29/01/2018 17:10;0;0;Leonardo Ulloa in Brighton squad for Southampton game, says Chris Hughton – SkySports http:// uklocal.net/leonardo-ulloa -in-brighton-squad-for-southampton-game-says-chris-hughton-skysports/ …;;;;9,58055E+17;https://twitter.com/uklocalnet/status/958054770366910465
LCFC_Indonesia;29/01/2018 17:07;0;0;lcfc striker Leonardo Ulloa has today joined Brighton and Hove Albion in a loan deal until the… https://www. instagram.com/p/Bei2atIhxp5/;;;;9,58054E+17;https://twitter.com/LCFC_Indonesia/status/958054109244002305
Easa052;29/01/2018 17:03;0;1;#Free #Discount #Coupon .& free #delivery !: #Code : [ db8aa6 ] On carriage application #google_play and apple_store . #Bahrain #RoyalRumble #ReddVelvet #GDNonline #ArcticMonkeys #Sisu2018 #Villalobos #LeonardoUlloa #DiafraSakho #AlexiaDaval #CallosadeSegura #INTI pic.twitter.com/NFc49TdZK1;;;#Free #Discount #Coupon #delivery #Code #google_play #Bahrain #RoyalRumble #ReddVelvet #GDNonline #ArcticMonkeys #Sisu2018 #Villalobos #LeonardoUlloa #DiafraSakho #AlexiaDaval #CallosadeSegura #INTI;9,58053E+17;https://twitter.com/Easa052/status/958053107933569025
Augustus_sm;29/01/2018 16:27;0;0;Brighton & Holve Albion have completed the signing of Leonardo Ulloa from @LCFC on loan until the end of the season. #ASM pic.twitter.com/xVFZRr80qN;;@LCFC;#ASM;9,58044E+17;https://twitter.com/Augustus_sm/status/958043906100400128
MrShafMan;29/01/2018 16:26;0;0;If he's going to go anywhere it will be back to wolves. Alah leonardo ulloa;;;;9,58044E+17;https://twitter.com/MrShafMan/status/958043714844229632
MidlandFootball;29/01/2018 16:07;0;0;Puel unclear on Ulloa future: Claude Puel insists he is happy for Leonardo Ulloa following his move on loan to Brighton but refused to confirm whether the striker had a future at Leicester. http:// dlvr.it/QD95Ql;;;;9,58039E+17;https://twitter.com/MidlandFootball/status/958038932368707584
SirLechiffre;29/01/2018 15:57;0;0;Leonardo Ulloa joins Brighton on loan from Leicester http:// dailym.ai/2GuhLCc via @MailSport;;@MailSport;;9,58037E+17;https://twitter.com/SirLechiffre/status/958036501950066690
TFS_Brighton;29/01/2018 15:56;0;0;Chris Hughton revealed that Leonardo Ulloa will be in the squad for Wednesday's game against #SouthamptonFC . #BHAFC #BHA … http:// dlvr.it/QD91CD;;;#SouthamptonFC #BHAFC #BHA;9,58036E+17;https://twitter.com/TFS_Brighton/status/958036031978160129
FootballAddictA;29/01/2018 15:50;0;0;#Brighton sign Leonardo Ulloa on loan from #Leicester | Squawka http://www. football-addict.com/article/home/s quawka/5a6f5deee0544757173c20aa/brighton-sign-leonardo-ulloa-on-loan-from-leicester?lang=en&utm_campaign=post-auto&utm_medium=twitter&utm_source=foot-addict-en …;;;#Brighton #Leicester;9,58035E+17;https://twitter.com/FootballAddictA/status/958034524335722496
knotty38;29/01/2018 15:32;0;1;Gutted to see Leonardo Ulloa leave @LCFC but understand the move, great servant & scored many important goals #ohhisnameisLeonardo;;@LCFC;#ohhisnameisLeonardo;9,5803E+17;https://twitter.com/knotty38/status/958030043355152386
Damieng86;29/01/2018 15:30;0;0;#LCFC #BHAFC Leonardo Ulloa : Brighton re-sign Leicester striker until end of season - http://www. bbc.co.uk/sport/football /42858428 …;;;#LCFC #BHAFC;9,5803E+17;https://twitter.com/Damieng86/status/958029554999791617
OfficialBHAFC;29/01/2018 15:23;8;46;Need a reminder of Leonardo Ulloa 's first spell at the club? Watch this special montage of the striker's best moments on #SeagullsTV . #BHAFC Read + Watch https:// goo.gl/WZUh7m pic.twitter.com/HKztjMFcjU;;;#SeagullsTV #BHAFC;9,58028E+17;https://twitter.com/OfficialBHAFC/status/958027736844591106
seancardo;29/01/2018 15:00;0;2;#Brighton re-signed #LeicesterCity striker Leonardo Ulloa on loan until the end of the season. #BHAFC #LCFC #seanknows pic.twitter.com/5uzihAoJX9;;;#Brighton #LeicesterCity #BHAFC #LCFC #seanknows;9,58022E+17;https://twitter.com/seancardo/status/958021947501236224
GreenyCJ;29/01/2018 14:49;0;0;Can’t see Slimani happening if Leicester has let Leonardo Ulloa out on loan to Brighton!!! Left with Vardy and Iheanacho;;;;9,58019E+17;https://twitter.com/GreenyCJ/status/958019204694859776
westsxseagulls;29/01/2018 14:48;0;5;Brighton boss Chris Hughton says loan signing Leonardo Ulloa has gone straight into the squad for the Southampton game. http://www. skysports.com/watch/video/sp orts/football/teams/brighton-and-hove-albion/11227966/hughton-ulloa-straight-into-brighton-squad … Welcome Back Leonardo #Ulloa 16;;;#Ulloa;9,58019E+17;https://twitter.com/westsxseagulls/status/958019087589920769
sportbiztech1;29/01/2018 14:46;0;0;Brighton sign Leonardo Ulloa on loan from Leicester City https:// sportbiztech.com/2018/01/29/bri ghton-sign-leonardo-ulloa-on-loan-from-leicester-city/ … pic.twitter.com/eG7RLNprrw;;;;9,58019E+17;https://twitter.com/sportbiztech1/status/958018503256231936
TransferNetHub;29/01/2018 14:43;3;5;ULLOA THROWN STRAIGHT IN Chris Hughton has confirmed that new signing Leonardo Ulloa will go straight into the Brighton squad for their crucial game against Southampton on Wednesday. #BHAFC;;;#BHAFC;9,58018E+17;https://twitter.com/TransferNetHub/status/958017665485934592
LCFCWorld;29/01/2018 14:19;0;1;Brighton n have completed the signing of City striker Leonardo Ulloa on loan, three-and-a-half years after the player left the Seagulls.;;;;9,58012E+17;https://twitter.com/LCFCWorld/status/958011691886891010
JordanWebber96;29/01/2018 14:16;0;1;What’s the bet Leonardo Ulloa after being a long term target for us he’s gonna score the winner for Brighton against us in February;;;;9,58011E+17;https://twitter.com/JordanWebber96/status/958011007863083011
KeegSports;29/01/2018 14:13;0;0;OFFICIAL: Brighton have completed the signing of Leonardo Ulloa from Leicester on loan until the end of the season. (Source: @OfficialBHAFC ) pic.twitter.com/pfV3haF3Mh;;@OfficialBHAFC;;9,5801E+17;https://twitter.com/KeegSports/status/958010235930775552
todayng;29/01/2018 14:13;0;1;Brighton re-sign Leicester’s Leonardo Ulloa until end of season http:// tdy.ng/QD8RZM pic.twitter.com/EIXkefzFXz;;;;9,5801E+17;https://twitter.com/todayng/status/958010145757278208
NigeriaNewsdesk;29/01/2018 14:13;0;1;Brighton re-sign Leicester’s Leonardo Ulloa until end of season http:// nnd.ng/QD8RSm via @todayng pic.twitter.com/uoZLfvI6EX;;@todayng;;9,5801E+17;https://twitter.com/NigeriaNewsdesk/status/958010127818227713
BlueFoxNews;29/01/2018 14:09;0;0;Claude Puel unclear on Leonardo Ulloa future after move to Brighton (Sky Sports) http:// ift.tt/2DHG9y9;;;;9,58009E+17;https://twitter.com/BlueFoxNews/status/958009183793803265
FOXES_Fanly;29/01/2018 14:06;0;0;Claude Puel unclear on Leonardo Ulloa future after move to Brighton #LCFC https:// fanly.link/1751514aab pic.twitter.com/hHS93KhwSy;;;#LCFC;9,58008E+17;https://twitter.com/FOXES_Fanly/status/958008455998173184
MatexJnr;29/01/2018 14:04;0;1;Leonardo Ulloa off to Brighton and Hove Albion https:// foxesofleicester.com/2018/01/29/leo nardo-ulloa-off-to-brighton-and-hove-albion-on-loan/ …;;;;9,58008E+17;https://twitter.com/MatexJnr/status/958007999137812481
ligapropremier;29/01/2018 14:02;0;0;#Leicester Claude Puel is happy for Leonardo Ulloa after his move to Brighton but did not.. http://www. ligapromanager.com/foro/viewtopic .php?f=35&t=357577 … pic.twitter.com/uh3ccwEW2v;;;#Leicester;9,58007E+17;https://twitter.com/ligapropremier/status/958007381765623814
IsItSoccer;29/01/2018 14:01;0;0;Brighton and Hove Albion have signed Leonardo Ulloa from Leicester City pic.twitter.com/hRLWcLz0tn;;;;9,58007E+17;https://twitter.com/IsItSoccer/status/958007271555874816
FOOTYnewsSKY;29/01/2018 13:59;0;0;Puel unclear on Ulloa future Claude Puel insists he is happy for Leonardo Ulloa following his move on loan to Brighton but refused to confirm whether the striker had a future at Leicester. http:// ift.tt/2DKdFUq;;;;9,58007E+17;https://twitter.com/FOOTYnewsSKY/status/958006614975377408
EPLnewsSKY;29/01/2018 13:58;0;0;Puel unclear on Ulloa future Claude Puel insists he is happy for Leonardo Ulloa following his move on loan to Brighton but refused to confirm whether the striker had a future at Leicester. http:// ift.tt/2DKdFUq;;;;9,58006E+17;https://twitter.com/EPLnewsSKY/status/958006365317926913
BlueFoxNews;29/01/2018 13:54;0;0;ENGLAND SOCCER - Leonardo Ulloa returns to Brighton on loan from Leicester (EFE) http:// ift.tt/2nqs9lo;;;;9,58005E+17;https://twitter.com/BlueFoxNews/status/958005382105960453
FanSidedSoccer;29/01/2018 13:48;0;1;Leonardo Ulloa off to Brighton and Hove Albion on loan http:// dlvr.it/QD8K9Y via @foxesofLCFC pic.twitter.com/8OH9BIVcfU;;@foxesofLCFC;;9,58004E+17;https://twitter.com/FanSidedSoccer/status/958003976082829312
HalaTransfers;29/01/2018 13:32;0;1;DEAL DONE: Brighton have signed Leonardo Ulloa from Leicester City on loan until the end of the season. ( Src: @OfficialBHAFC ) #HalaFootball pic.twitter.com/IneryeqVeR;;@OfficialBHAFC;#HalaFootball;9,58E+17;https://twitter.com/HalaTransfers/status/957999836682444800
weddingJstore;29/01/2018 13:31;0;0;Chris Hughton revealed that Leonardo Ulloa will be in the squad for Wednesday's game against @SouthamptonFC . #BHAFC #BHASOU;;@SouthamptonFC;#BHAFC #BHASOU;9,58E+17;https://twitter.com/weddingJstore/status/957999610466852864
ScottDannFan;29/01/2018 13:29;0;2;I’m so jealous! Oh my God, the mighty Leonardo Ulloa . How could we have missed out on this legend of the game. I’m ashamed Palace, I really am;;;;9,57999E+17;https://twitter.com/ScottDannFan/status/957999086455742464
limpio_jpn_2315;29/01/2018 13:24;0;0;Leonardo Ulloa joins Brighton on loan from Leicester City http://www. skysports.com/football/news/ 11712/11227510/leonardo-ulloa-joins-brighton-on-loan-from-leicester-city …;;;;9,57998E+17;https://twitter.com/limpio_jpn_2315/status/957997947836252161
Hitman_Hatton84;29/01/2018 13:23;7;19;Strikers who havent won an English Premier League winners medal. Daniel Sturridge Romelu Lukaku Alexis Sanchez Firmino Harry Kane Coutinho Messi Zidane Pele Maradona Brighton players who have a premier league winners medal. Leonardo Ulloa “Who’s that man from Argentina...”;;;;9,57998E+17;https://twitter.com/Hitman_Hatton84/status/957997683981082624
sports_news4uu;29/01/2018 13:21;0;0;Leonardo Ulloa : Brighton re-sign Leicester striker until end of season http:// betting-tips4u.com/leonardo-ulloa -brighton-re-sign-leicester-striker-until-end-of-season/ …;;;;9,57997E+17;https://twitter.com/sports_news4uu/status/957997040042160128
OkayNigeria;29/01/2018 13:10;0;0;DONE DEAL: Brighton re-signed striker Leonardo Ulloa from Leicester on loan until the end of the season. - https://www. okay.ng/188572;;;;9,57994E+17;https://twitter.com/OkayNigeria/status/957994484935077889
JPW_NBCSports;29/01/2018 12:52;0;2;Latest done deals: Leonardo Ulloa returns to Brighton & Sakho finally gets his wish to leave West Ham | #PLonNBC https:// wp.me/p2g4vo-1R9j;;;#PLonNBC;9,5799E+17;https://twitter.com/JPW_NBCSports/status/957989891199197184
NBCSportsSoccer;29/01/2018 12:51;2;4;Latest done deals: Leonardo Ulloa returns to Brighton & Sakho finally gets his wish to leave West Ham | #PLonNBC https:// wp.me/p2g4vo-1R9j;;;#PLonNBC;9,5799E+17;https://twitter.com/NBCSportsSoccer/status/957989579138715650
ProSoccerTalk;29/01/2018 12:51;0;0;Latest done deals: Leonardo Ulloa returns to Brighton & Sakho finally gets his wish to leave West Ham | #PLonNBC https:// wp.me/p2g4vo-1R9j;;;#PLonNBC;9,5799E+17;https://twitter.com/ProSoccerTalk/status/957989575539949569
chronicle_ng;29/01/2018 12:50;0;0;Brighton signs Leonardo Ulloa from Leicester City http:// dlvr.it/QD80VJ pic.twitter.com/IARHTApPtJ;;;;9,57989E+17;https://twitter.com/chronicle_ng/status/957989239467122689
EliteOffers;29/01/2018 12:46;0;0;Leonardo Ulloa joins Brighton on loan from Leicester pic.twitter.com/kIYjiUxvlu;;;;9,57988E+17;https://twitter.com/EliteOffers/status/957988221199290368
rumorstransfers;29/01/2018 12:46;0;0;Brighton & Hove Albion have completed the signing of Leicester City striker Leonardo Ulloa on loan from Leicester City;;;;9,57988E+17;https://twitter.com/rumorstransfers/status/957988202534486018
chronicle_ng;29/01/2018 12:45;0;0;Brighton signs Leonardo Ulloa from Leicester City http:// chronicle.ng/2018/01/29/bri ghton-signs-leonardo-ulloa-leicester-city/ … pic.twitter.com/OUlCRF2ZDR;;;;9,57988E+17;https://twitter.com/chronicle_ng/status/957988058388983809
VEEGGroup;29/01/2018 12:42;0;0;Leicester's Leonardo Ulloa joins Brighton on loan until end of season (via @Pocket ) http://www. espnfc.com/soccer-transfe rs/story/3364165/leicesters-leonardo-ulloa-joins-brighton-on-loan-until-end-of-season …;;@Pocket;;9,57987E+17;https://twitter.com/VEEGGroup/status/957987256484225024
roundclocksport;29/01/2018 12:41;0;0;Leonardo Ulloa joins Brighton on loan from Leicester : Brighton & Hove Albion have co.. http:// dld.bz/g8Qnv pic.twitter.com/qSxNOUJBax;;;;9,57987E+17;https://twitter.com/roundclocksport/status/957986967878283264
freebigbetssky;29/01/2018 12:37;0;0;Leonardo Ulloa joins Brighton on loan from Leicester : Brighton & Hove Albion have co.. http:// dld.bz/g8Qnv pic.twitter.com/cTErSAJaYa;;;;9,57986E+17;https://twitter.com/freebigbetssky/status/957985963128565760
freebigbetsbs;29/01/2018 12:37;0;0;Leonardo Ulloa joins Brighton on loan from Leicester : Brighton & Hove Albion have co.. http:// dld.bz/g8Qnv pic.twitter.com/Np15g2sl9u;;;;9,57986E+17;https://twitter.com/freebigbetsbs/status/957985956803604480
freebigbets;29/01/2018 12:37;0;0;Leonardo Ulloa joins Brighton on loan from Leicester : Brighton & Hove Albion have co.. http:// dld.bz/g8Qnv pic.twitter.com/U0xQcips9V;;;;9,57986E+17;https://twitter.com/freebigbets/status/957985950285606915
fbbpp;29/01/2018 12:36;0;0;Leonardo Ulloa joins Brighton on loan from Leicester : Brighton & Hove Albion have co.. http:// dld.bz/g8Qnv pic.twitter.com/FnC8lwBtNu;;;;9,57986E+17;https://twitter.com/fbbpp/status/957985928064184321
fbbbetf;29/01/2018 12:36;0;0;Leonardo Ulloa joins Brighton on loan from Leicester : Brighton & Hove Albion have co.. http:// dld.bz/g8Qnv pic.twitter.com/IRLvlFKatK;;;;9,57986E+17;https://twitter.com/fbbbetf/status/957985922666164225
fbb888;29/01/2018 12:36;0;0;Leonardo Ulloa joins Brighton on loan from Leicester : Brighton & Hove Albion have co.. http:// dld.bz/g8Qnv pic.twitter.com/lhz9dhJWli;;;;9,57986E+17;https://twitter.com/fbb888/status/957985915812663296
sporttlad;29/01/2018 12:36;0;0;Leonardo Ulloa joins Brighton on loan from Leicester : Brighton & Hove Albion have co.. http:// dld.bz/g8Qnv pic.twitter.com/MkLZpVko3p;;;;9,57986E+17;https://twitter.com/sporttlad/status/957985877241810949
dbofbb;29/01/2018 12:36;0;0;Leonardo Ulloa joins Brighton on loan from Leicester : Brighton & Hove Albion have co.. http:// dld.bz/g8Qnv pic.twitter.com/hPO1tgsEFD;;;;9,57986E+17;https://twitter.com/dbofbb/status/957985863887187968
allsportsfbb;29/01/2018 12:36;0;0;Leonardo Ulloa joins Brighton on loan from Leicester : Brighton & Hove Albion have co.. http:// dld.bz/g8Qnv pic.twitter.com/6dUJttnscM;;;;9,57986E+17;https://twitter.com/allsportsfbb/status/957985857855741952
sportsupdatefbb;29/01/2018 12:36;0;0;Leonardo Ulloa joins Brighton on loan from Leicester : Brighton & Hove Albion have co.. http:// dld.bz/g8Qnv pic.twitter.com/gxqqnpeLUP;;;;9,57986E+17;https://twitter.com/sportsupdatefbb/status/957985849303584768
sportslab7;29/01/2018 12:36;0;0;Leonardo Ulloa joins Brighton on loan from Leicester : Brighton & Hove Albion have co.. http:// dld.bz/g8Qnv pic.twitter.com/mulf6YzCO9;;;;9,57986E+17;https://twitter.com/sportslab7/status/957985842601086976
sportsbetbf;29/01/2018 12:36;0;1;Leonardo Ulloa joins Brighton on loan from Leicester : Brighton & Hove Albion have co.. http:// dld.bz/g8Qnv pic.twitter.com/U0I04Pm1tq;;;;9,57986E+17;https://twitter.com/sportsbetbf/status/957985825547018240
sportingnewsww;29/01/2018 12:36;0;0;Leonardo Ulloa joins Brighton on loan from Leicester : Brighton & Hove Albion have co.. http:// dld.bz/g8Qnv pic.twitter.com/a83SbhI2IQ;;;;9,57986E+17;https://twitter.com/sportingnewsww/status/957985819406602241
sntcor;29/01/2018 12:36;0;0;Leonardo Ulloa joins Brighton on loan from Leicester : Brighton & Hove Albion have co.. http:// dld.bz/g8Qnv pic.twitter.com/NuXBJIHo0I;;;;9,57986E+17;https://twitter.com/sntcor/status/957985810380349440
snb188;29/01/2018 12:36;0;0;Leonardo Ulloa joins Brighton on loan from Leicester : Brighton & Hove Albion have co.. http:// dld.bz/g8Qnv pic.twitter.com/fwRVa89wlv;;;;9,57986E+17;https://twitter.com/snb188/status/957985800892928005
oss365;29/01/2018 12:36;0;0;Leonardo Ulloa joins Brighton on loan from Leicester : Brighton & Hove Albion have co.. http:// dld.bz/g8Qnv pic.twitter.com/1csd93pLCt;;;;9,57986E+17;https://twitter.com/oss365/status/957985793389350914
riderbetnaija;29/01/2018 12:34;0;1;Brighton & Hove Albion have completed the signing of Leicester City striker Leonardo Ulloa on loan, three-and-a-half years after the player left the Seagulls. pic.twitter.com/1kYD8ODIut;;;;9,57985E+17;https://twitter.com/riderbetnaija/status/957985224121561088
OfficialBHAFC;29/01/2018 12:30;37;227;It has been confirmed that Leonardo Ulloa will wear squad number 16. #BHAFC;;;#BHAFC;9,57984E+17;https://twitter.com/OfficialBHAFC/status/957984332114784256
BHAFC_TT;29/01/2018 12:28;0;1;Leonardo Ulloa : Brighton re-sign Leicester striker until end of season #BHAFC http://www. bbc.co.uk/sport/football /42858428 …;;;#BHAFC;9,57984E+17;https://twitter.com/BHAFC_TT/status/957983732530597890
GhanaliveTwitt;29/01/2018 12:26;0;0;Brighton re-sign Leonardo Ulloa >> https:// goo.gl/4sdGUL pic.twitter.com/gLphmpfYrW;;;;9,57983E+17;https://twitter.com/GhanaliveTwitt/status/957983409179119616
footietalks;29/01/2018 12:26;0;0;"RT OfficialBHAFC: Chris Hughton revealed that Leonardo Ulloa will be in the squad for Wednesday's game against SouthamptonFC. #BHAFC #BHASOU "" #RT premierleague""";;;#BHAFC #BHASOU #RT;9,57983E+17;https://twitter.com/footietalks/status/957983203263905792
BlueFoxNews;29/01/2018 12:24;0;0;Leonardo Ulloa joins Brighton on loan from Leicester ( http:// NewsReality.com ) http:// ift.tt/2DMqX2Z;;;;9,57983E+17;https://twitter.com/BlueFoxNews/status/957982770713841664
BenDinnery;29/01/2018 12:15;2;8;Chris Hughton confirms new loan signing [and former Seagull] Leonardo Ulloa will be included in Wednesdays squad at Southampton. #BHAFC;;;#BHAFC;9,57981E+17;https://twitter.com/BenDinnery/status/957980502266470400
golazoargentino;29/01/2018 12:11;2;6;Brighton have resigned Leonardo Ulloa on loan for the rest of the season https:// twitter.com/OfficialBHAFC/ status/957924293098201088 …;;;;9,5798E+17;https://twitter.com/golazoargentino/status/957979588537221121
OfficialBHAFC;29/01/2018 12:11;77;602;Chris Hughton revealed that Leonardo Ulloa will be in the squad for Wednesday's game against @SouthamptonFC . #BHAFC #BHASOU;;@SouthamptonFC;#BHAFC #BHASOU;9,57979E+17;https://twitter.com/OfficialBHAFC/status/957979453103263749
unique11_;29/01/2018 12:10;0;0;Brighton re-sign Leicester striker Leonardo Ulloa until end of season http://www. bbc.com/sport/football /42858428 … #LCFC #FPL;;;#LCFC #FPL;9,57979E+17;https://twitter.com/unique11_/status/957979235146190848
MercuryLCFC;29/01/2018 12:09;2;14;"Puel on Leonardo Ulloa 's loan move to Brighton. It was a good chance for him to have more game-time. He needed to play because he is an experienced player with good quality. ""We will see at the end of the season. I am happy for him because he is a good man, a good player.""""";;;;9,57979E+17;https://twitter.com/MercuryLCFC/status/957979057332858880
Jeisonalbirojo;29/01/2018 12:06;0;0;Leonardo Ulloa seals Brighton return More on the loan deal: http:// ridder.co/DA9Zr3 ... by #premierleague via @ridder_co pic.twitter.com/lCDNjCdm9D;;@ridder_co;#premierleague;9,57978E+17;https://twitter.com/Jeisonalbirojo/status/957978230484537350
ozzyfire06;29/01/2018 12:02;0;0;Brighton have completed signing of Leonardo Ulloa on season-long loan from Leicester city;;;;9,57977E+17;https://twitter.com/ozzyfire06/status/957977210283053056
