username;date;retweets;favorites;text;geo;mentions;hashtags;id;permalink
FoxesAddictLCFC;29/01/2018 08:50;0;0;Deal done! #Brighton re-sign Leonardo Ulloa on loan from #Leicester for remainder of the season | Talk Sport http://www. football-addict.com/article/leices ter-city-fc/talksport/5a6efafbe05447675a04cc45/deal-done-brighton-re-sign-leonardo-ulloa-on-loan-from-leicester-for-remainder-of-the-season?lang=en&utm_campaign=post-auto&utm_medium=twitter&utm_source=foxes-addict-en …;;;#Brighton #Leicester;9,57929E+17;https://twitter.com/FoxesAddictLCFC/status/957928999640059904
JoeSport67;29/01/2018 08:50;0;0;Leonardo Ulloa : Brighton re-sign Leicester striker until end of season via BBC Sport - Sport http:// ift.tt/2njAWGM;;;;9,57929E+17;https://twitter.com/JoeSport67/status/957928944363343872
iLeicesterApp;29/01/2018 08:50;0;0;90Min: Brighton Sign Leicester Striker Leonardo Ulloa on Loan Until the End of the Seas... http://www. football-news365.co.uk/go/82298499;;;;9,57929E+17;https://twitter.com/iLeicesterApp/status/957928937300152320
BarclaysLeague;29/01/2018 08:50;1;7;Deal done! Brighton re-sign Leonardo Ulloa on loan from @LCFC for remainder of the season https:// goo.gl/7t5byC pic.twitter.com/XssQyz2FhM;;@LCFC;;9,57929E+17;https://twitter.com/BarclaysLeague/status/957928859625811968
TheNewsGlobe;29/01/2018 08:50;0;0;Leonardo Ulloa : Brighton re-sign Leicester striker until end of season - http:// f0rk.in/tTw;;;;9,57929E+17;https://twitter.com/TheNewsGlobe/status/957928838054465536
goalsbug;29/01/2018 08:49;0;0;Guess who's back, #BHAFC fans... Four years after leaving for Leicester, Leonardo Ulloa re-joins Brighton on loan until the end of the season;;;#BHAFC;9,57929E+17;https://twitter.com/goalsbug/status/957928727287037952
Soccerlogist;29/01/2018 08:49;1;0;OFFICIAL: Leonardo Ulloa Joins Brighton And Hove Albion On Loan From Leicester City http://www. soccerlogy.com/official-leona rdo-ulloa-joins-brighton-and-hove-albion-on-loan-from-leicester-city/ … pic.twitter.com/6xrnirdN6r;;;;9,57929E+17;https://twitter.com/Soccerlogist/status/957928721981345792
FotbalTransfer;29/01/2018 08:49;0;0;Brighton have re-signed former striker Leonardo Ulloa on loan from Leicester.;;;;9,57929E+17;https://twitter.com/FotbalTransfer/status/957928693845946368
transfercenlive;29/01/2018 08:48;2;11;DONE DEAL: Brighton have signed Leonardo Ulloa from Leicester City on loan until the end of the season. (Source: @OfficialBHAFC ) #BHAFC #LCFC pic.twitter.com/mXInmg0Hcf;;@OfficialBHAFC;#BHAFC #LCFC;9,57929E+17;https://twitter.com/transfercenlive/status/957928509741117440
ONTV_NIGERIA;29/01/2018 08:48;0;0;Deal done! Brighton re-sign Leonardo Ulloa on loan from Leicester for remainder of the season | http:// ontvsite.com;;;;9,57928E+17;https://twitter.com/ONTV_NIGERIA/status/957928413683216385
GoalTorGol;29/01/2018 08:47;0;0;Leonardo Ulloa also joins former club @OfficialBHAFC on loan for the remainder of the season. pic.twitter.com/e6gEOXmM8U;;@OfficialBHAFC;;9,57928E+17;https://twitter.com/GoalTorGol/status/957928287979954178
CheruiyotHQ;29/01/2018 08:47;0;0;Brighton have signed Leonardo Ulloa from Leicester on loan for the rest of the season;;;;9,57928E+17;https://twitter.com/CheruiyotHQ/status/957928164763848704
Otman9915;29/01/2018 08:47;0;0;Leonardo Ulloa : Brighton re-sign Leicester striker until end of season pic.twitter.com/LZD0HOvLL3;;;;9,57928E+17;https://twitter.com/Otman9915/status/957928121034072064
thefunnyoldgame;29/01/2018 08:47;0;0;Ulloa joins Brighton on loan - Brighton have completed the signing of striker Leonardo Ulloa on loan... http:// tinyurl.com/yahqthkx #iafog;;;#iafog;9,57928E+17;https://twitter.com/thefunnyoldgame/status/957928067955077120
Transfer_Agency;29/01/2018 08:46;1;1;Brighton have signed Leonardo Ulloa from Leicester on loan for the rest of the season. pic.twitter.com/AFRNtBeQGr;;;;9,57928E+17;https://twitter.com/Transfer_Agency/status/957928020928532480
UKSport24;29/01/2018 08:46;0;1;" Leonardo Ulloa joins Brighton on loan from Leicester City"" http:// zpr.io/nYSap""";;;;9,57928E+17;https://twitter.com/UKSport24/status/957927967035977728
wearegorgeousfm;29/01/2018 08:46;0;0;Brighton have completed the signing of striker Leonardo Ulloa on loan from Leicester City until the end of the... https:// fb.me/1G57BIfvO;;;;9,57928E+17;https://twitter.com/wearegorgeousfm/status/957927962246090752
goalsbug;29/01/2018 08:46;0;0;Brighton have re-signed Leonardo Ulloa on loan until the end of the season. A club the forward certainly knows well.;;;;9,57928E+17;https://twitter.com/goalsbug/status/957927937982025729
FCExclusive;29/01/2018 08:46;0;0;Deal done! Brighton re-sign Leonardo Ulloa on loan from Leicester for remainder of th.. http://www. fcexclusive.com/news/breaking- news-facebook/deal-done-brighton-re-sign-leonardo-ulloa-on-loan-from-leicester-for-remainder-of-the-season-5074244 … (Source: talkSPORT) #football #footballnews #soccer #premierleague;;;#football #footballnews #soccer #premierleague;9,57928E+17;https://twitter.com/FCExclusive/status/957927824261869568
thefunnyoldgame;29/01/2018 08:46;0;0;Brighton re-sign Leicesters Ulloa on loan - Brighton re-sign Leicester City striker Leonardo Ulloa o... http:// tinyurl.com/y8ulmy8t #iafog;;;#iafog;9,57928E+17;https://twitter.com/thefunnyoldgame/status/957927810944851968
ligapropremier;29/01/2018 08:45;0;0;#Leicester Brighton have completed the signing of striker Leonardo Ulloa on loan from.. http://www. ligapromanager.com/foro/viewtopic .php?f=35&t=357412 … pic.twitter.com/y4n4rAyntN;;;#Leicester;9,57928E+17;https://twitter.com/ligapropremier/status/957927695286927360
xtsoccer;29/01/2018 08:45;0;0;#footballnews Brighton re-sign Leicester's Ulloa on loan - Brighton re-sign Leicester City striker Leonardo Ulloa on loan until the end of the season. http:// ow.ly/RuCa50gi38q;;;#footballnews;9,57928E+17;https://twitter.com/xtsoccer/status/957927672180551680
FoxesTalk;29/01/2018 08:45;5;14;Leonardo Ulloa has joined @OfficialBHAFC on loan for the rest of the season http:// bit.ly/2Gr1Vbb #LCFC #BHAFC pic.twitter.com/Z3KpqaNVl5;;@OfficialBHAFC;#LCFC #BHAFC;9,57928E+17;https://twitter.com/FoxesTalk/status/957927615775563776
FOXES_Fanly;29/01/2018 08:45;0;0;Leonardo Ulloa joins Brighton on loan from Leicester City #LeicesterCity https:// fanly.link/cdcda36fd9 pic.twitter.com/tOnqlRAOTf;;;#LeicesterCity;9,57928E+17;https://twitter.com/FOXES_Fanly/status/957927591905775617
SportsbookBTC;29/01/2018 08:45;0;1;Deal done! Brighton re-sign Leonardo Ulloa on loan from Leicester for remainder of the season http:// dlvr.it/QD6smf pic.twitter.com/6IqhmQ3cp1;;;;9,57928E+17;https://twitter.com/SportsbookBTC/status/957927581235359744
TFS_Leicester;29/01/2018 08:45;0;0;#lcfc striker Leonardo Ulloa has today joined Brighton and Hove Albion in a loan deal until the end of the 2017/18 season ?? http… http:// dlvr.it/QD6sh1;;;#lcfc;9,57928E+17;https://twitter.com/TFS_Leicester/status/957927559961788417
CapeTown_FPL;29/01/2018 08:44;0;0;"RT FFScout Brighton sign Leonardo Ulloa on loan from Leicester until the end of the season https:// goo.gl/AqpWGZ """"";;;;9,57927E+17;https://twitter.com/CapeTown_FPL/status/957927361923731457
FOOTYnewsSKY;29/01/2018 08:44;0;0;Ulloa joins Brighton on loan Brighton have completed the signing of striker Leonardo Ulloa on loan from Leicester City until the end of the season. http:// ift.tt/2DJBLPt;;;;9,57927E+17;https://twitter.com/FOOTYnewsSKY/status/957927349084938245
globalcloud_net;29/01/2018 08:43;0;0;Confirmed: Brighton sign Leicester’s Leonardo Ulloa - https:// global-cloud.net/2018/01/29/con firmed-brighton-sign-leicesters-leonardo-ulloa/ …;;;;9,57927E+17;https://twitter.com/globalcloud_net/status/957927295590846465
globalcloud_net;29/01/2018 08:43;0;0;Deal done! Brighton re-sign Leonardo Ulloa on loan from Leicester for remainder of the season - https:// global-cloud.net/2018/01/29/dea l-done-brighton-re-sign-leonardo-ulloa-on-loan-from-leicester-for-remainder-of-the-season/ …;;;;9,57927E+17;https://twitter.com/globalcloud_net/status/957927219577413633
RahulBarmon14;29/01/2018 08:43;0;0;My new #flyer #design . How is it? Looking for #flyer #poster #banner ect Contact here : https:// goo.gl/WeKQTu #MondayMotivaton Grammys #FSF2018 Paloma Faith #JeremstarGate #JeremyKyle #MondayBlogs NEW SHOW Arctic Monkeys Justine Greening Leonardo Ulloa pic.twitter.com/iz4lxO0ZAD;;;#flyer #design #flyer #poster #banner #MondayMotivaton #FSF2018 #JeremstarGate #JeremyKyle #MondayBlogs;9,57927E+17;https://twitter.com/RahulBarmon14/status/957927200417697793
OfficialBHAFC;29/01/2018 08:43;65;300;"This club feels like home."" Leonardo Ulloa 's full interview after he returned to the Albion is in full on #SeagullsTV . #BHAFC Read + watch http:// goo.gl/Q2dYzf pic.twitter.com/5948oEu8rs""";;;#SeagullsTV #BHAFC;9,57927E+17;https://twitter.com/OfficialBHAFC/status/957927157086478337
DotBall;29/01/2018 08:43;0;0;Brighton re-sign Leicester City striker Leonardo Ulloa on loan until the end of the season. #worldcup;;;#worldcup;9,57927E+17;https://twitter.com/DotBall/status/957927155387850752
Coral;29/01/2018 08:43;2;10;Brighton have re-signed Leonardo Ulloa on loan until the end of the season. A club the forward certainly knows well. pic.twitter.com/Fclklb3vZP;;;;9,57927E+17;https://twitter.com/Coral/status/957927150547537920
EPLnewsSKY;29/01/2018 08:43;0;1;Ulloa joins Brighton on loan Brighton have completed the signing of striker Leonardo Ulloa on loan from Leicester City until the end of the season. http:// ift.tt/2DJBLPt;;;;9,57927E+17;https://twitter.com/EPLnewsSKY/status/957927125880836096
seun_odewale;29/01/2018 08:43;0;0;BREAKING: @OfficialBHAFC re-sign Leonardo Ulloa from @LCFC on loan until end of season. #SSN pic.twitter.com/36un1p8agq;;@OfficialBHAFC @LCFC;#SSN;9,57927E+17;https://twitter.com/seun_odewale/status/957927085988831232
FFScout;29/01/2018 08:43;0;11;Brighton sign Leonardo Ulloa on loan from Leicester until the end of the season https:// goo.gl/AqpWGZ;;;;9,57927E+17;https://twitter.com/FFScout/status/957927072189550593
EPLnewsBBC;29/01/2018 08:42;0;0;Brighton re-sign Leicester's Ulloa on loan Brighton re-sign Leicester City striker Leonardo Ulloa on loan until the end of the season. http:// ift.tt/2njAWGM;;;;9,57927E+17;https://twitter.com/EPLnewsBBC/status/957926866178007040
EflCupDraw;29/01/2018 08:41;0;0;Leonardo Ulloa : Brighton re-sign Leicester striker until end of season https://www. eflcupdraw.com/leonardo-ulloa -brighton-re-sign-leicester-striker-until-end-of-season/ … pic.twitter.com/yE8mCERETl;;;;9,57927E+17;https://twitter.com/EflCupDraw/status/957926665426014208
Sportxclusive1;29/01/2018 08:41;0;0;#LCFC striker Leonardo Ulloa has today joined #BHAFC in a loan deal until the end of the 2017/18 season pic.twitter.com/pZ5XhHWaqW;;;#LCFC #BHAFC;9,57927E+17;https://twitter.com/Sportxclusive1/status/957926616671440898
FootballSwoop;29/01/2018 08:41;6;13;DEAL DONE: Brighton have signed Leonardo Ulloa from Leicester on loan for the rest of the season. #BHAFC #LCFC pic.twitter.com/w8oKkB3xqD;;;#BHAFC #LCFC;9,57927E+17;https://twitter.com/FootballSwoop/status/957926609901760512
MackdonaldMakom;29/01/2018 08:41;0;0;Brighton have signed Leonardo Ulloa from Leicester on loan for the rest of the season. https://twitter.com/TransferRelated/status/957924866136707073/photo/1 pic.twitter.com/I3aXNcTsV8;;;;9,57927E+17;https://twitter.com/MackdonaldMakom/status/957926607502565376
BetFastBTC;29/01/2018 08:41;0;0;The man to help keep them away from the relegation zone? Brighton have signed Leonardo Ulloa on loan until the end of the season. Live pic.twitter.com/CZNSrBp3bP http:// btf.st/Betcoin pic.twitter.com/kSm2TkhvlP;;;;9,57927E+17;https://twitter.com/BetFastBTC/status/957926588514906112
BetFastcom;29/01/2018 08:41;0;0;DONE DEAL Brighton have completed the signing of striker Leonardo Ulloa on loan from Leicester City until the end of the season. pic.twitter.com/4LbETD2jj2 http:// btf.st/betonline;;;;9,57927E+17;https://twitter.com/BetFastcom/status/957926580059172866
transferfan;29/01/2018 08:40;0;0;Brighton re-sign Leicester's Ulloa on loan: Brighton re-sign Leicester City striker Leonardo Ulloa on loan until the end of the season. - http:// ift.tt/2njAWGM;;;;9,57926E+17;https://twitter.com/transferfan/status/957926447762563072
goldan_news;29/01/2018 08:40;0;0;BREAKING: Albion have completed the signing of Leonardo Ulloa from @LCFC on loan until the end of the season. The striker returns three-and-a-half years after leaving the Amex Stadium. #BHAFC Read more https:// goo.gl/cm8hKo pic.twitter.com/D1KGZskHCQ;;@LCFC;#BHAFC;9,57926E+17;https://twitter.com/goldan_news/status/957926439784992768
maxifiles;29/01/2018 08:40;0;0;Brighton & Hove Albion have completed the signing of Leicester City striker Leonardo Ulloa on loan from Leicester City, three-and-a-half years after the player left the Seagulls;;;;9,57926E+17;https://twitter.com/maxifiles/status/957926383174537216
FoxesNews;29/01/2018 08:40;0;0;#Leicester #LeicesterCity #LCFC Deal done! Brighton re-sign Leonardo Ulloa on loan from Leicester for remainde.. http:// dld.bz/g8QdY;;;#Leicester #LeicesterCity #LCFC;9,57926E+17;https://twitter.com/FoxesNews/status/957926360009334784
SkySportsPL;29/01/2018 08:40;52;253;DONE DEAL Brighton have completed the signing of striker Leonardo Ulloa on loan from Leicester City until the end of the season. http:// skysports.tv/HsQD0F pic.twitter.com/ccrsaB4lZB;;;;9,57926E+17;https://twitter.com/SkySportsPL/status/957926322197671937
tf365official;29/01/2018 08:40;1;0;He cost a fortune for Leicester but now he's back at his former club, Brighton. Leonardo Ulloa completes his loan move. #LCFC #BHAFC #LeonardoUlloa http:// bit.ly/2DLuPoU;;;#LCFC #BHAFC #LeonardoUlloa;9,57926E+17;https://twitter.com/tf365official/status/957926305407864832
BrightonFanbase;29/01/2018 08:39;0;20;. @OfficialBHAFC have completed the signing of @LCFC striker Leonardo Ulloa on loan until the end of the season. #BHAFC pic.twitter.com/X0MzUMdMsF;;@OfficialBHAFC @LCFC;#BHAFC;9,57926E+17;https://twitter.com/BrightonFanbase/status/957926269223612416
oktranking;29/01/2018 08:39;0;1;OFFICIAL: Brighton have re-signed striker Leonardo Ulloa from Leicester on loan until the end of the season.;;;;9,57926E+17;https://twitter.com/oktranking/status/957926244334690305
_bbcfootball;29/01/2018 08:39;0;0;Brighton re-sign Leicester City striker Leonardo Ulloa on loan until the end of the season. http://www. bbc.co.uk/sport/football /42858428 …;;;;9,57926E+17;https://twitter.com/_bbcfootball/status/957926216081793025
goldan_news;29/01/2018 08:39;0;0;#lcfc striker Leonardo Ulloa has today joined Brighton and Hove Albion in a loan deal until the end of the 2017/18 season http:// leic.it/2rO3mgM pic.twitter.com/Ok4J1jG6zH;;;#lcfc;9,57926E+17;https://twitter.com/goldan_news/status/957926211677716480
BlueFoxNews;29/01/2018 08:39;0;0;Leonardo Ulloa joins Brighton on loan from Leicester City (Sky Sports) http:// ift.tt/2DK6QCm;;;;9,57926E+17;https://twitter.com/BlueFoxNews/status/957926114999103488
TransferNewsCen;29/01/2018 08:39;32;48;OFFICIAL: Brighton have re-signed striker Leonardo Ulloa from Leicester on loan until the end of the season. pic.twitter.com/mLEkus55BO;;;;9,57926E+17;https://twitter.com/TransferNewsCen/status/957926040034316288
TrnsfrFootball;29/01/2018 08:38;0;0;DONE DEAL: Brighton have signed Leonardo Ulloa from Leicester on loan for the rest of the season. https://twitter.com/TransferRelated/status/957924866136707073/photo/1 pic.twitter.com/wKeMVrPlxi;;;;9,57926E+17;https://twitter.com/TrnsfrFootball/status/957925899424403456
annan_quareman;29/01/2018 08:36;0;0;DEAL DONE: Brighton have signed Leonardo Ulloa from Leicester on loan for the rest of the season.;;;;9,57925E+17;https://twitter.com/annan_quareman/status/957925426126622720
SportStories247;29/01/2018 08:36;0;1;#LeicesterCity striker Leonardo #Ulloa has joined #Brighton on loan until the end of the season #EPL;;;#LeicesterCity #Ulloa #Brighton #EPL;9,57925E+17;https://twitter.com/SportStories247/status/957925335428993024
TransferSite;29/01/2018 08:36;6;14;DONE DEAL: Brighton announce the signing of striker Leonardo Ulloa from Leicester City on loan until the end of the season - (via @LCFC ) #TransferNews #LCFC pic.twitter.com/FYBhg3hNdE;;@LCFC;#TransferNews #LCFC;9,57925E+17;https://twitter.com/TransferSite/status/957925335324069888
bolddk;29/01/2018 08:36;0;0;Brighton lejer Leonardo Ulloa i Leicester https://www. bold.dk/fodbold/nyhede r/brighton-lejer-leonardo-ulloa-i-leicester/ … #pldk #lcfc #Brighton;;;#pldk #lcfc #Brighton;9,57925E+17;https://twitter.com/bolddk/status/957925326545440770
bold_prl;29/01/2018 08:36;0;0;Brighton lejer Leonardo Ulloa i Leicester https://www. bold.dk/fodbold/nyhede r/brighton-lejer-leonardo-ulloa-i-leicester/ … #pldk #lcfc #Brighton;;;#pldk #lcfc #Brighton;9,57925E+17;https://twitter.com/bold_prl/status/957925320887324672
Ladbrokes;29/01/2018 08:35;1;5;Guess who's back, #BHAFC fans... Four years after leaving for Leicester, Leonardo Ulloa re-joins Brighton on loan until the end of the season pic.twitter.com/hE2ixnGEv8;;;#BHAFC;9,57925E+17;https://twitter.com/Ladbrokes/status/957925176871710720
marrowborges;29/01/2018 08:35;0;0;DONE DEAL: Brighton have completed the loan signing of Leonardo Ulloa on loan until the end of the season from Leicester.;;;;9,57925E+17;https://twitter.com/marrowborges/status/957925139022270465
BBCSport;29/01/2018 08:35;15;134;The man to help keep them away from the relegation zone? Brighton have signed Leonardo Ulloa on loan until the end of the season. Live http:// bbc.in/2niETvo pic.twitter.com/aP2JNYmO6u;;;;9,57925E+17;https://twitter.com/BBCSport/status/957925127345393664
HITCdeadlineday;29/01/2018 08:35;0;0;Confirmed: Brighton complete deal for Jose Leonardo Ulloa https://www. brightonandhovealbion.com/news/2018/janu ary/ulloa-returns-to-albion/ … #BHAFC #LCFC #EPL;;;#BHAFC #LCFC #EPL;9,57925E+17;https://twitter.com/HITCdeadlineday/status/957925054188310528
Daily1Football;29/01/2018 08:34;0;0;DEAL DONE Brighton have signed striker Leonardo Ulloa on loan until the end of the season from Leicester, 3 and a half years after leaving. #Bhafc pic.twitter.com/66iaQfC80x;;;#Bhafc;9,57925E+17;https://twitter.com/Daily1Football/status/957924995392516096
Leicester_VAVEL;29/01/2018 08:34;1;1;CONFIRMED: Leicester City striker Leonardo Ulloa has joined former club Brighton and Hove Albion on loan until the end of the season. #lcfc #bhafc pic.twitter.com/DaYXGNu5Yn;;;#lcfc #bhafc;9,57925E+17;https://twitter.com/Leicester_VAVEL/status/957924975243157505
BBCSussex;29/01/2018 08:34;0;12;. @OfficialBHAFC have completed the signing of striker Leonardo Ulloa on loan from @LCFC , three-and-a-half years after the player left the Seagulls. http:// bbc.in/2nmPvZq pic.twitter.com/wIzAVYZjBJ;;@OfficialBHAFC @LCFC;;9,57925E+17;https://twitter.com/BBCSussex/status/957924921375674368
bbcsoutheast;29/01/2018 08:34;1;5;. @OfficialBHAFC have completed the signing of striker Leonardo Ulloa on loan from @LCFC , three-and-a-half years after the player left the Seagulls. http:// bbc.in/2DLu3Iw pic.twitter.com/nQYthRazjZ;;@OfficialBHAFC @LCFC;;9,57925E+17;https://twitter.com/bbcsoutheast/status/957924917747634177
SkyFantasyFooty;29/01/2018 08:34;14;39;Leonardo Ulloa - homecoming. #bhafc pic.twitter.com/Asx4jW1dY5;;;#bhafc;9,57925E+17;https://twitter.com/SkyFantasyFooty/status/957924888131637248
BetFastcom;29/01/2018 08:34;0;0;| Brighton re-sign Leonardo Ulloa from Leicester until the end of the season. #BHAFC #LCFC pic.twitter.com/XE2XDCF1qy http:// btf.st/betonline;;;#BHAFC #LCFC;9,57925E+17;https://twitter.com/BetFastcom/status/957924858553286656
miha38_28;29/01/2018 08:34;0;0;DEAL DONE: Brighton have signed Leonardo Ulloa from Leicester on loan for the rest of the season. pic.twitter.com/vuxXS312jm pic.twitter.com/OdsFxfY6Et;;;;9,57925E+17;https://twitter.com/miha38_28/status/957924855952871424
BetFastcom;29/01/2018 08:34;0;0;BREAKING: @OfficialBHAFC re-sign Leonardo Ulloa from @LCFC on loan until end of season. #SSN pic.twitter.com/NZmtQI9Qpw http:// btf.st/betonline;;@OfficialBHAFC @LCFC;#SSN;9,57925E+17;https://twitter.com/BetFastcom/status/957924849699008512
Dugout;29/01/2018 08:34;5;19;DONE DEAL: Brighton have completed the signing of Leonardo Ulloa from Leicester on loan for the rest of the season. pic.twitter.com/JBLCE2JmQl;;;;9,57925E+17;https://twitter.com/Dugout/status/957924818636206082
TrnsfrFootball;29/01/2018 08:34;0;0;DEAL DONE: Brighton have signed Leonardo Ulloa from Leicester on loan for the rest of the season. (Source: OfficialBHAFC) pic.twitter.com/SaEEzZrYyw;;;;9,57925E+17;https://twitter.com/TrnsfrFootball/status/957924810373332992
The_SportMag;29/01/2018 08:34;0;0;ALERT @OfficialBHAFC re-sign Leonardo Ulloa from @LCFC on loan until end of season. pic.twitter.com/UBJzYzISUG;;@OfficialBHAFC @LCFC;;9,57925E+17;https://twitter.com/The_SportMag/status/957924791251546112
firminorob39;29/01/2018 08:33;0;0;DEAL DONE: Brighton have signed Leonardo Ulloa from Leicester on loan for the rest of the season. (Source: @OfficialBHAFC ) pic.twitter.com/RAjKxtwlZY;;@OfficialBHAFC;;9,57925E+17;https://twitter.com/firminorob39/status/957924762235392000
guardian_sport;29/01/2018 08:33;5;21;Brighton complete the loan signing of Leonardo Ulloa from Leicester – transfer window live! https://www. theguardian.com/football/live/ 2018/jan/29/transfer-updates-latest-on-aubameyang-to-arsenal-laporte-dzeko-live?CMP=share_btn_tw … pic.twitter.com/3Sht3yiXZj;;;;9,57925E+17;https://twitter.com/guardian_sport/status/957924750986276864
SuperSportBlitz;29/01/2018 08:33;12;28;Leicester City striker Leonardo Ulloa has joined Brighton & Hove Albion on loan until the end of the season #SSFootball;;;#SSFootball;9,57925E+17;https://twitter.com/SuperSportBlitz/status/957924749992169472
freebets;29/01/2018 08:33;0;0;#BHAFC have signed Leonardo Ulloa from #LCFC on loan until the end of the season pic.twitter.com/ioCEgwbHcY;;;#BHAFC #LCFC;9,57925E+17;https://twitter.com/freebets/status/957924668110983168
FourFourTweet;29/01/2018 08:33;31;93;OFFICIAL: Brighton have signed Leonardo Ulloa from Leicester on loan for the rest of the season. pic.twitter.com/4CTkXQ71D2;;;;9,57925E+17;https://twitter.com/FourFourTweet/status/957924650302001153
TransferNetHub;29/01/2018 08:33;0;1;BREAKING NEWS Brighton & Hove Albion have completed the signing of Leicester City striker Leonardo Ulloa on loan from Leicester City, three-and-a-half years after the player left the Seagulls. #BHAFC #LCFC;;;#BHAFC #LCFC;9,57925E+17;https://twitter.com/TransferNetHub/status/957924553522663424
Betfred;29/01/2018 08:32;0;2;| Brighton re-sign Leonardo Ulloa from Leicester until the end of the season. #BHAFC #LCFC pic.twitter.com/v7LZ8bvGed;;;#BHAFC #LCFC;9,57924E+17;https://twitter.com/Betfred/status/957924462531432448
football_bang;29/01/2018 08:32;6;11;Brighton & Hove Albion have completed the signing of Leicester City striker Leonardo Ulloa on loan, three-and-a-half years after the player left the Seagulls pic.twitter.com/qOoJOmT9C5;;;;9,57924E+17;https://twitter.com/football_bang/status/957924441056534528
transfercentre6;29/01/2018 08:32;0;0;DEAL DONE: Brighton have signed Leonardo Ulloa from Leicester on loan for the rest of the season. (Source: @OfficialBHAFC ) pic.twitter.com/cO66A7469i;;@OfficialBHAFC;;9,57924E+17;https://twitter.com/transfercentre6/status/957924438246330368
TransferChanger;29/01/2018 08:32;4;26;DONE DEAL: Brighton have completed the loan signing of Leonardo Ulloa on loan until the end of the season from Leicester. https:// twitter.com/OfficialBHAFC/ status/957923551540948993 …;;;;9,57924E+17;https://twitter.com/TransferChanger/status/957924435431952385
Football__Tweet;29/01/2018 08:32;9;56;DEAL DONE: Brighton have signed Leonardo Ulloa from Leicester on loan for the rest of the season. pic.twitter.com/1iAP3tsUyF;;;;9,57924E+17;https://twitter.com/Football__Tweet/status/957924376833413120
Mental_Football;29/01/2018 08:32;0;0;DEAL DONE: Brighton have signed Leonardo Ulloa from Leicester on loan for the rest of the season. (Source: OfficialBHAFC) pic.twitter.com/oBjmTJGW8t;;;;9,57924E+17;https://twitter.com/Mental_Football/status/957924320168349696
Fussball_inside;29/01/2018 08:32;0;0;DEAL DONE: Brighton have signed Leonardo Ulloa from Leicester on loan for the rest of the season. (Source: OfficialBHAFC) pic.twitter.com/zDW09nUH7p https:// twitter.com/DeadlineDayLiv e/status/957924278745337856 … #News #Football #Transfer #Inside;;;#News #Football #Transfer #Inside;9,57924E+17;https://twitter.com/Fussball_inside/status/957924308222914560
SkySportsNews;29/01/2018 08:32;173;495;BREAKING: @OfficialBHAFC re-sign Leonardo Ulloa from @LCFC on loan until end of season. #SSN pic.twitter.com/WfBs2nH5DT;;@OfficialBHAFC @LCFC;#SSN;9,57924E+17;https://twitter.com/SkySportsNews/status/957924303747547136
OfficialBHAFC;29/01/2018 08:32;553;1295;BREAKING: Albion have completed the signing of Leonardo Ulloa from @LCFC on loan until the end of the season. The striker returns three-and-a-half years after leaving the Amex Stadium. #BHAFC Read more https:// goo.gl/cm8hKo pic.twitter.com/5vwJZOpQfr;;@LCFC;#BHAFC;9,57924E+17;https://twitter.com/OfficialBHAFC/status/957924293098201088
DeadlineDayLive;29/01/2018 08:32;252;604;DEAL DONE: Brighton have signed Leonardo Ulloa from Leicester on loan for the rest of the season. (Source: @OfficialBHAFC ) pic.twitter.com/8HNaDOnfv6;;@OfficialBHAFC;;9,57924E+17;https://twitter.com/DeadlineDayLive/status/957924278745337856
Oddschanger;29/01/2018 08:31;0;0;DONE DEAL Brighton have completed the signing of Leonardo Ulloa on loan till the end of the season! #BHAFC fans, good deal...?! pic.twitter.com/0uzixI2jzz;;;#BHAFC;9,57924E+17;https://twitter.com/Oddschanger/status/957924233543409665
