username;date;retweets;favorites;text;geo;mentions;hashtags;id;permalink
ammo_sports;29/01/2018 10:15;0;0;DONE DEAL: Leonardo Ulloa has joined Brighton from Leicester on loan for the remainder of the season.;;;;9,5795E+17;https://twitter.com/ammo_sports/status/957950287456616448
occp1967;29/01/2018 10:15;0;0;Brighton have signed Leicester City striker Leonardo Ulloa on loan until the end of the season.;;;;9,5795E+17;https://twitter.com/occp1967/status/957950280464781313
sir_dagi;29/01/2018 10:13;0;1;DONE DEAL: Leonardo Ulloa has joined Brighton from Leicester on loan for the remainder of the season.;;;;9,5795E+17;https://twitter.com/sir_dagi/status/957949908492914689
mincelet_ijay;29/01/2018 10:13;0;0;Brighton have signed Leonardo Ulloa from Leicester on loan for the rest of the season.;;;;9,5795E+17;https://twitter.com/mincelet_ijay/status/957949845293105152
sportsinformer7;29/01/2018 10:13;0;0;Brighton have signed Leonardo Ulloa from Leicester on loan for the rest of the season.;;;;9,5795E+17;https://twitter.com/sportsinformer7/status/957949845200953344
MackdonaldMakom;29/01/2018 10:13;0;0;Brighton have signed Leonardo Ulloa from Leicester on loan for the rest of the season.;;;;9,5795E+17;https://twitter.com/MackdonaldMakom/status/957949844919934976
DailyGawRTs;29/01/2018 10:13;0;0;You wٌonٌ't Beٍٍlَievُe Whaًt Is Realِly Going On ! Leonarِdًo Ulَloa #pَopmastَeّr Flaَgّgeٌ http:// j.mp/2FqrDeE;;;#p;9,5795E+17;https://twitter.com/DailyGawRTs/status/957949734060285954
SquawkaNews;29/01/2018 10:12;61;135;DONE DEAL: Leonardo Ulloa has joined Brighton from Leicester on loan for the remainder of the season. [via @OfficialBHAFC ] pic.twitter.com/rUYM5Zvkl6;;@OfficialBHAFC;;9,5795E+17;https://twitter.com/SquawkaNews/status/957949505063866368
ginolafcb;29/01/2018 10:12;0;2;She'sّ Beaّuٌtّiٌfٌul ! Weَ'rّe LIVE ON-AIR Leّonٍardo Ulًloa #MAFS http:// j.mp/2FqN7bo;;;#MAFS;9,57949E+17;https://twitter.com/ginolafcb/status/957949464521662464
City2cityW;29/01/2018 10:11;0;0;Leonardo Ulloa joins Brighton on loan from Leicester <b>City</b> https:// goo.gl/fb/L79jKd;;;;9,57949E+17;https://twitter.com/City2cityW/status/957949292995665920
MarkEBarden;29/01/2018 10:10;0;1;"Good luck to Leonardo Ulloa on his return to @OfficialBHAFC ; decent striker who scored some important goals for @LCFC .";;@OfficialBHAFC @LCFC;;9,57949E+17;https://twitter.com/MarkEBarden/status/957949077265829888
nguyentungsla;29/01/2018 10:10;0;1;Shُeِ's Beauّtّiّfulَ ! Leّoَnarَdo Ulloa #MAFS Flًagُgeّ http:// j.mp/2Frx2C9;;;#MAFS;9,57949E+17;https://twitter.com/nguyentungsla/status/957948959288451073
Woods7Michael;29/01/2018 10:09;0;2;Sheَ'sً Beauٌtَiًfulٌ ! Weً'rًe LIVE ON-AIR Leoّnaًrdo Ulًloa Flَaَggeَ http:// j.mp/2FsAr3Y;;;;9,57949E+17;https://twitter.com/Woods7Michael/status/957948728874295296
wotstoday;29/01/2018 10:08;0;0;Leonardo Ulloa joins Brighton on loan from Leicester http:// ift.tt/2DMP59S #wots pic.twitter.com/mE7BIrbQEW;;;#wots;9,57949E+17;https://twitter.com/wotstoday/status/957948501983363072
SA_Scholtz;29/01/2018 10:07;0;2;Shّe's Beaُuُtiِfَulُ ! Flّaِgَge #MAFS Leonaٌrّdo Ulًloa http:// j.mp/2DYrOkg;;;#MAFS;9,57948E+17;https://twitter.com/SA_Scholtz/status/957948203663544320
sportiqnews;29/01/2018 10:05;0;0;Leonardo Ulloa : Brighton re-sign Leicester striker until end of season http:// dlvr.it/QD7Dnc pic.twitter.com/VVVXpQEonS;;;;9,57948E+17;https://twitter.com/sportiqnews/status/957947744043155457
IamGr8Swapnil;29/01/2018 10:05;0;0;Leicester's Leonardo Ulloa joins Brighton on loan until end of season http:// dlvr.it/QD7DX3 pic.twitter.com/pPA6b3pqkj;;;;9,57948E+17;https://twitter.com/IamGr8Swapnil/status/957947718722179072
News47855360;29/01/2018 10:04;0;0;Leonardo Ulloa heads back to Brighton on loan deal: http:// youtu.be/ClvEP0z_-p4?a via @YouTube;;@YouTube;;9,57948E+17;https://twitter.com/News47855360/status/957947553441435654
SoccerWho;29/01/2018 10:03;0;0;"Transfer news; Leonardo Ulloa returns to Brighton on loan after slipping out of favour at Leicester Click He...";;;;9,57947E+17;https://twitter.com/SoccerWho/status/957947411808309248
paulmega64;29/01/2018 10:03;0;0;"Leonardo Ulloa has rejoined Brighton on loan from Leicester... ∙ Deal until the end of the season ∙ Premier League winner at the Foxes ∙ 26 goals in 58 games for Brighton between 2013 and 2014 It was an easy decision because I have a unique feeling with this club.""""";;;;9,57947E+17;https://twitter.com/paulmega64/status/957947289594671104
rjperez123;29/01/2018 10:03;0;2;Yoُu wonً't Beٍliّeve Whُat Isِ Realِly Goingً On ! #صوُتَ_انفجارّ_يهز_جده #popmastًeًrَ Leonًaّrdo Ulَloa http:// j.mp/2Fqxn8k;;;# #popmast;9,57947E+17;https://twitter.com/rjperez123/status/957947235949531137
FeelTheTweet_;29/01/2018 10:02;0;0;Sentiment Analysis: Arctic Monkeys - Leonardo Ulloa - Diafra Sakho - Gary Haggarty -;;;;9,57947E+17;https://twitter.com/FeelTheTweet_/status/957946988116529153
Ovatheline;29/01/2018 10:02;0;0;Brighton re-sign Leicester's Ulloa on loan - Brighton re-sign Leicester City striker Leonardo Ulloa on loan until the end of the season. http:// ht.ly/H6Dg50gi5sI;;;;9,57947E+17;https://twitter.com/Ovatheline/status/957946953140236288
ChrisSteer111;29/01/2018 10:02;0;0;You wٌonُ't Beٍlَievًe Whَat Is Realِlyً Going On ! #poٍpmaٌsٍter Leّonٌardo Ulًloa #صوت_انَفّجار_يهّز_جده http:// j.mp/2DVwp6Q;;;#po #;9,57947E+17;https://twitter.com/ChrisSteer111/status/957946942872530945
london_kipper;29/01/2018 10:01;0;2;Shِe's Beaَuٌtِiٌfّul ! #pٌopmasّterً Leonٌaًrdo Ulُloa #jًerُemykِyle http:// j.mp/2FrkSZY;;;#p #j;9,57947E+17;https://twitter.com/london_kipper/status/957946725330833408
talkSPORT2;29/01/2018 10:00;2;2;NOW: The Transfer Centre on @talkSPORT2 Pierre-Emerick Aubameyang latest Joe Hart on the move? Leonardo Ulloa re-signs for @OfficialBHAFC on loan Join @AlexBiddleUK & @SamEllard with all the latest transfer news and rumours. http:// tlks.pt/2ListenLive pic.twitter.com/7RSU7jfgJX;;@talkSPORT2 @OfficialBHAFC @AlexBiddleUK @SamEllard;;9,57947E+17;https://twitter.com/talkSPORT2/status/957946556245860352
footballmanics;29/01/2018 10:00;1;2;Brighton & Hove Albion have completed the signing of their former striker Leonardo Ulloa on loan from Leicester City until the end of the season. #BHAFC #Seagulls #LCFC #Foxes pic.twitter.com/KjRO1OMQMd;;;#BHAFC #Seagulls #LCFC #Foxes;9,57946E+17;https://twitter.com/footballmanics/status/957946496074371072
Trends5UK;29/01/2018 10:00;0;0;Top 5: 1: #MondayMotivation 2: Arctic Monkeys 3: Leonardo Ulloa 4: Gary Haggarty +7 5: #ThisMorning;;;#MondayMotivation #ThisMorning;9,57946E+17;https://twitter.com/Trends5UK/status/957946438725464064
___Syahrul;29/01/2018 09:59;0;0;Brighton Sign Leicester Striker Leonardo Ulloa on Loan Until the End of the Season http://www. 90min.com/posts/5962089- brighton-sign-leicester-striker-leonardo-ulloa-on-loan-until-the-end-of-the-season?old_domain=ftbpro.com/90min.com/&utm_source=app&utm_medium=share …;;;;9,57946E+17;https://twitter.com/___Syahrul/status/957946337256923136
BlueFoxNews;29/01/2018 09:59;0;0;Leonardo Ulloa : Brighton re-sign Leicester striker until end of season (Latest Nigerian http:// News.com ) http:// ift.tt/2BAplHG;;;;9,57946E+17;https://twitter.com/BlueFoxNews/status/957946256755712006
BlueFoxNews;29/01/2018 09:59;0;0;Brighton re-sign Leicester City forward Leonardo Ulloa on loan until the end of the season (Brief http:// Report.co.uk ) http:// ift.tt/2BCgSnf;;;;9,57946E+17;https://twitter.com/BlueFoxNews/status/957946252037062656
naa_vonney;29/01/2018 09:59;0;0;Leicester's Leonardo Ulloa joins Brighton on loan until end of season http:// dlvr.it/QD7CHK pic.twitter.com/MKK6VUU2rJ;;;;9,57946E+17;https://twitter.com/naa_vonney/status/957946200023449600
Flipje52;29/01/2018 09:59;0;2;Shَe's Beaَuُtiّfّulُ ! #poٌpmaَsterً #PISA Leُonًardo Ulِloa http:// j.mp/2Fq0wAn;;;#po #PISA;9,57946E+17;https://twitter.com/Flipje52/status/957946193405009920
EnochJeremiah13;29/01/2018 09:57;0;0;Confirmed: Brighton sign Leicester’s Leonardo Ulloa http:// dlvr.it/QD7BmK;;;;9,57946E+17;https://twitter.com/EnochJeremiah13/status/957945692462268417
PidginBBCNews;29/01/2018 09:55;0;0;Brighton don re-sign Leicester striker Leonardo Ulloa - Di Argentine international player go remain wit Brighton till end of season as dem do resign am https://www. bbc.com/pidgin/sport-4 2860634 … #BBCNews #Pidgin;;;#BBCNews #Pidgin;9,57945E+17;https://twitter.com/PidginBBCNews/status/957945205264715778
DavideCapozzi80;29/01/2018 09:52;0;0;Leonardo Ulloa : Brighton re-sign Leicester striker until end of season http:// dlvr.it/QD79rk pic.twitter.com/F01y9WZ2Ha;;;;9,57944E+17;https://twitter.com/DavideCapozzi80/status/957944452403744769
OptaJoe;29/01/2018 09:49;46;171;24% - Leonardo Ulloa either scored (23) or assisted (7) 24% of Brighton & Hove Albion's 126 goals during two seasons at the club in the Championship. Return. pic.twitter.com/o4gn3quG48;;;;9,57944E+17;https://twitter.com/OptaJoe/status/957943761631358976
peak8964;29/01/2018 09:49;0;0;The man to help keep them away from the relegation zone? Brighton have signed Leonardo Ulloa on loan until the end of the season. Live http…;;;;9,57944E+17;https://twitter.com/peak8964/status/957943758657646593
VillaTotal;29/01/2018 09:48;0;0;DONE DEAL: @OfficialBHAFC have signed Leonardo Ulloa on loan until the end of the season. Do we now need to target another striker? #AVFC #AstonVilla #TransferWindow #TransferNews #TransferTalk pic.twitter.com/UFQWddQzFP;;@OfficialBHAFC;#AVFC #AstonVilla #TransferWindow #TransferNews #TransferTalk;9,57944E+17;https://twitter.com/VillaTotal/status/957943655431467009
76placidcasual;29/01/2018 09:47;0;2;Leonardo Ulloa . The penalty v West Ham. The goal v Norwich. The Swansea game. Every time he was needed, he made something happen.;;;;9,57943E+17;https://twitter.com/76placidcasual/status/957943388397031425
maborisova46377;29/01/2018 09:47;0;0;Leonardo Ulloa : Brighton re-sign Leicester striker until end of season https:// goo.gl/fb/vc6Ti6;;;;9,57943E+17;https://twitter.com/maborisova46377/status/957943218431254528
TransferScout;29/01/2018 09:47;0;0;Leonardo Ulloa joins Brighton on loan from Leicester http:// dlvr.it/QD78Ly pic.twitter.com/TQEh7CwtK8;;;;9,57943E+17;https://twitter.com/TransferScout/status/957943177079476224
PremStatsnet;29/01/2018 09:45;0;0;#android #app https:// goo.gl/Rga4fy #BrightonandHoveAlbion #epl #football Leonardo Ulloa joins Brighton on loan from Leicester http:// ow.ly/S2CX50gi4xS;;;#android #app #BrightonandHoveAlbion #epl #football;9,57943E+17;https://twitter.com/PremStatsnet/status/957942828465782784
Sport_Sport1;29/01/2018 09:42;0;0;Leonardo Ulloa : Brighton re-sign Leicester striker until end of season: Brighton re-sign Leicester City striker… https:// goo.gl/fb/MoaEEk;;;;9,57942E+17;https://twitter.com/Sport_Sport1/status/957942115794931712
KoooraAe;29/01/2018 09:42;0;0;Leonardo Ulloa joins Brighton on loan from Leicester: Brighton & Hove Albion have completed… https:// goo.gl/fb/xodZAJ;;;;9,57942E+17;https://twitter.com/KoooraAe/status/957942106424795136
flexzy007;29/01/2018 09:42;0;0;Leicester's Leonardo Ulloa joins Brighton on loan until end of season https:// goo.gl/Kpqfco https:// fb.me/F00WtrFu;;;;9,57942E+17;https://twitter.com/flexzy007/status/957942100615684096
sleemtinz;29/01/2018 09:42;0;0;Leicester's Leonardo Ulloa joins Brighton on loan until end of season https:// goo.gl/Kpqfco;;;;9,57942E+17;https://twitter.com/sleemtinz/status/957941995611279360
SeagullsNews;29/01/2018 09:42;0;0;#BrightonHoveAlbion #BHAFC Brighton Sign Leicester Striker Leonardo Ulloa on Loan Until th.. #Seagulls #Brighton http:// dld.bz/g8Qzt;;;#BrightonHoveAlbion #BHAFC #Seagulls #Brighton;9,57942E+17;https://twitter.com/SeagullsNews/status/957941943761293312
FoxesNews;29/01/2018 09:42;0;0;#LCFC #Foxes Brighton Sign Leicester Striker Leonardo Ulloa on Loan Until the End of the Season #LeicesterCity http:// dld.bz/g8Qzt;;;#LCFC #Foxes #LeicesterCity;9,57942E+17;https://twitter.com/FoxesNews/status/957941923515457536
worldcupsport;29/01/2018 09:42;0;0;BBC #Sportnews UK Leonardo Ulloa : Brighton re-sign Leicester striker until end of season http:// ift.tt/2njAWGM;;;#Sportnews;9,57942E+17;https://twitter.com/worldcupsport/status/957941919992119296
Lucreti63220108;29/01/2018 09:41;0;0;Leonardo Ulloa : Brighton re-sign Leicester striker until end of season https:// goo.gl/fb/t8cSHS;;;;9,57942E+17;https://twitter.com/Lucreti63220108/status/957941841634177024
DebaoLing;29/01/2018 09:40;0;0;Leonardo Ulloa : Brighton re-sign Leicester striker until end of season https:// goo.gl/fb/8kfp7T;;;;9,57941E+17;https://twitter.com/DebaoLing/status/957941473508503552
MbararaS;29/01/2018 09:39;0;0;@abou_sports Brighton have signed Leonardo Ulloa from Leicester on loan for the rest of the season. #Sunsport;;@abou_sports;#Sunsport;9,57941E+17;https://twitter.com/MbararaS/status/957941150542958592
TundeGbedo;29/01/2018 09:38;0;2;Brighton have completed the signing of striker Leonardo Ulloa on loan from Leicester City until the end of the season.;;;;9,57941E+17;https://twitter.com/TundeGbedo/status/957941128799584256
IrishNewsFinder;29/01/2018 09:38;0;0;Sports News - Leonardo Ulloa : Brighton re-sign Leicester striker until end of season https:// goo.gl/fb/v6Bz8w;;;;9,57941E+17;https://twitter.com/IrishNewsFinder/status/957941075649363969
allthescoresuk;29/01/2018 09:37;0;0;Brighton Sign Leicester Striker Leonardo Ulloa on Loan Until the End of the Season http:// ift.tt/2njI85K pic.twitter.com/IUFMlu1KMy;;;;9,57941E+17;https://twitter.com/allthescoresuk/status/957940696790560768
iambolar;29/01/2018 09:36;6;7;OFFICIAL: Brighton & Hove Albion have signed Leonardo Ulloa from Leicester on loan for the rest of the season. pic.twitter.com/5firfIXYzM;;;;9,57941E+17;https://twitter.com/iambolar/status/957940602083135488
alibuda12;29/01/2018 09:36;0;0;Leonardo Ulloa : Brighton re-sign Leicester striker until end of season https:// goo.gl/fb/Q9a5Tv;;;;9,57941E+17;https://twitter.com/alibuda12/status/957940553731239936
nsfooty;29/01/2018 09:36;0;0;Deal done! Brighton re-sign Leonardo Ulloa on loan from Leicester for remainder of the season http:// dld.bz/g8Qn6;;;;9,57941E+17;https://twitter.com/nsfooty/status/957940549813723137
footynew247;29/01/2018 09:36;0;0;Deal done! Brighton re-sign Leonardo Ulloa on loan from Leicester for remainder of the season http:// dld.bz/g8Qn6;;;;9,57941E+17;https://twitter.com/footynew247/status/957940543631319040
footynew24;29/01/2018 09:36;0;0;Deal done! Brighton re-sign Leonardo Ulloa on loan from Leicester for remainder of the season http:// dld.bz/g8Qn6;;;;9,57941E+17;https://twitter.com/footynew24/status/957940542167543809
footyn247;29/01/2018 09:36;0;0;Deal done! Brighton re-sign Leonardo Ulloa on loan from Leicester for remainder of the season http:// dld.bz/g8Qn6;;;;9,57941E+17;https://twitter.com/footyn247/status/957940540850532352
footyhlines;29/01/2018 09:36;0;0;Deal done! Brighton re-sign Leonardo Ulloa on loan from Leicester for remainder of the season http:// dld.bz/g8Qn6;;;;9,57941E+17;https://twitter.com/footyhlines/status/957940534684930048
footballfbb;29/01/2018 09:36;0;0;Deal done! Brighton re-sign Leonardo Ulloa on loan from Leicester for remainder of the season http:// dld.bz/g8Qn6;;;;9,57941E+17;https://twitter.com/footballfbb/status/957940519526715392
davemasters;29/01/2018 09:36;0;0;Leicester's Leonardo Ulloa joins Brighton on loan until end of season http://www. espnfc.com/story/3364165/ leicesters-leonardo-ulloa-joins-brighton-on-loan-until-end-of-season?utm_source=dlvr.it&utm_medium=twitter … pic.twitter.com/TeXsmIfmDC;;;;9,5794E+17;https://twitter.com/davemasters/status/957940446340067329
h8mpy;29/01/2018 09:34;0;0;" Leonardo Ulloa "" Good signing, Ulloa quality player. He will get goals.. When he was 1st team at Leicester.. his stats speak for themselves. All the best.""";;;;9,5794E+17;https://twitter.com/h8mpy/status/957940039975137280
LeicesterFNH;29/01/2018 09:34;0;0;Deal done! Brighton re-sign Leonardo Ulloa on loan from Leicester for rem #LCFC #Foxes #LeicesterCity http://www. nshnd.com/to.aspx?i=3861 913 …;;;#LCFC #Foxes #LeicesterCity;9,5794E+17;https://twitter.com/LeicesterFNH/status/957939991740604417
LeicesterFNH;29/01/2018 09:34;0;0;Leonardo Ulloa joins Brighton on loan from Leicester #LCFC #Foxes #LeicesterCity http://www. nshnd.com/to.aspx?i=3861 911 …;;;#LCFC #Foxes #LeicesterCity;9,5794E+17;https://twitter.com/LeicesterFNH/status/957939989286924288
EniSports;29/01/2018 09:34;0;0;Brighton confirm snapping up Ulloa on loan ##Brighton ##Chrishughton ##FAcup ##Leicestercity ##Leonardoulloa http://www. enisports.com/brighton-confi rm-snapping-ulloa-loan/ … pic.twitter.com/TVNe0phfjh;;;# #Brighton # #Chrishughton # #FAcup # #Leicestercity # #Leonardoulloa;9,5794E+17;https://twitter.com/EniSports/status/957939922425524224
thegermanhut;29/01/2018 09:33;0;1;Leonardo Ulloa : Brighton re-sign Leicester striker until end of season http:// dlvr.it/QD75BM pic.twitter.com/mjX1DOvih7;;;;9,5794E+17;https://twitter.com/thegermanhut/status/957939632859070464
thefunnyoldgame;29/01/2018 09:31;0;0;Leicesters Ulloa joins Brighton on loan - Brighton have re-signed striker Leonardo Ulloa on loan fro... http:// tinyurl.com/y6w7klwy #iafog;;;#iafog;9,57939E+17;https://twitter.com/thefunnyoldgame/status/957939319431467010
andhuipusei;29/01/2018 09:31;0;0;Leonardo Ulloa : Brighton re-sign Leicester striker until end of season https:// goo.gl/fb/T4y5tA;;;;9,57939E+17;https://twitter.com/andhuipusei/status/957939148316401664
in_form_99;29/01/2018 09:30;0;0;Leonardo Ulloa Leicester to Brighton Loan Ulloa is like the 6th choice striker at Leicester and he used to play for Brighton so this a good move for the Argentine. He is another option for the seagulls as they try and stay up in the prem. http:// ift.tt/2rQRE4U Leonardo Ulloa … pic.twitter.com/FydxcPh262;;;;9,57939E+17;https://twitter.com/in_form_99/status/957939089243824128
100Lcfc;29/01/2018 09:30;3;11;Brighton have re-signed striker Leonardo Ulloa on loan from Leicester ... we wish him well http:// es.pn/2DKcLrn;;;;9,57939E+17;https://twitter.com/100Lcfc/status/957938956406022145
Trends5UK;29/01/2018 09:30;0;0;Top 5: 1: #MondayMotivation 2: Arctic Monkeys 3: Leonardo Ulloa +1 4: #fsf2018 -1 5: #ThisMorning +6;;;#MondayMotivation #fsf2018 #ThisMorning;9,57939E+17;https://twitter.com/Trends5UK/status/957938887862632448
rtisantraveller;29/01/2018 09:28;0;0;Good luck to Leonardo Ulloa . Played a huge part in our success during his time here at #lcfc all the best @Ciclone1923;;@Ciclone1923;#lcfc;9,57939E+17;https://twitter.com/rtisantraveller/status/957938605070090241
footyscoutouts;29/01/2018 09:28;0;0;#football #transferupdate Leonardo Ulloa goes to #Brighton and Hove Albion on loan;;;#football #transferupdate #Brighton;9,57939E+17;https://twitter.com/footyscoutouts/status/957938595142258690
KiCKmagazine;29/01/2018 09:27;0;1;DONE DEAL! @OfficialBHAFC have signed Leicester striker Leonardo Ulloa on loan until the end of the season #TransferWindow #BHFC pic.twitter.com/VR0kni6HfF;;@OfficialBHAFC;#TransferWindow #BHFC;9,57938E+17;https://twitter.com/KiCKmagazine/status/957938255227432960
misslozzid;29/01/2018 09:27;0;4;Who's that man from Argentina.... #BHAFC #LEONARDOULLOA;;;#BHAFC #LEONARDOULLOA;9,57938E+17;https://twitter.com/misslozzid/status/957938219664007168
AlfaKayode;29/01/2018 09:26;0;0;OFFICIAL: Brighton have signed Leonardo Ulloa from Leicester on loan for the rest of the season.;;;;9,57938E+17;https://twitter.com/AlfaKayode/status/957938025178304512
golazolivetw;29/01/2018 09:26;0;3;OFFICIAL | Brighton have signed Leonardo Ulloa from Leicester on… https://www. instagram.com/p/BeiBlqGlVzjM KbVVYkLin3OonUQPfWHEXzDBpc0/ …;;;;9,57938E+17;https://twitter.com/golazolivetw/status/957937923818754048
btsportscore;29/01/2018 09:25;18;111;"Leonardo Ulloa has rejoined Brighton on loan from Leicester... ∙ Deal until the end of the season ∙ Premier League winner at the Foxes ∙ 26 goals in 58 games for Brighton between 2013 and 2014 It was an easy decision because I have a unique feeling with this club."" pic.twitter.com/QLw26D9BxK""";;;;9,57938E+17;https://twitter.com/btsportscore/status/957937703781314560
ManchesterDrb;29/01/2018 09:25;0;0;#MUFC #MCFC Confirmed: Brighton sign Leicester’s Leonardo Ulloa http:// ift.tt/2Gqv2vt;;;#MUFC #MCFC;9,57938E+17;https://twitter.com/ManchesterDrb/status/957937678770688000
ChengfaZhe;29/01/2018 09:24;0;0;Leonardo Ulloa : Brighton re-sign Leicester striker until end of season https:// goo.gl/fb/mPpRWG;;;;9,57938E+17;https://twitter.com/ChengfaZhe/status/957937515121475584
sathish_footbal;29/01/2018 09:24;0;0;#lcfc striker Leonardo Ulloa has today joined Brighton and Hove Albion in a loan deal until the end of the 2017/18 season http://www. lcfc.com.convey.pro/l/a0bNZ2m by #BenDinnery via @c0nvey pic.twitter.com/igTYvyJ0kw;;@c0nvey;#lcfc #BenDinnery;9,57937E+17;https://twitter.com/sathish_footbal/status/957937412482707456
PremFanZone;29/01/2018 09:24;0;0;Leonardo Ulloa joins Brighton on loan from Leicester pic.twitter.com/cngW6FkPhS;;;;9,57937E+17;https://twitter.com/PremFanZone/status/957937401619468288
EPLBible_;29/01/2018 09:24;0;2;Leonardo Ulloa joins Brighton on loan from Leicester pic.twitter.com/2kS6332QAK;;;;9,57937E+17;https://twitter.com/EPLBible_/status/957937393893593089
SlySportsFooty;29/01/2018 09:24;0;1;Leonardo Ulloa joins Brighton on loan from Leicester pic.twitter.com/7yj8axs8XK;;;;9,57937E+17;https://twitter.com/SlySportsFooty/status/957937378202673152
PAdugout;29/01/2018 09:24;0;0;Leonardo Ulloa heads back to Brighton on loan deal via @AndyCSims http://www. newsandstar.co.uk/news/national/ article/Leonardo-Ulloa-heads-back-to-Brighton-on-loan-deal-dedff1fd-7dda-40b4-8864-57721110c664-ds …;;@AndyCSims;;9,57937E+17;https://twitter.com/PAdugout/status/957937368320937985
BBCRLSport;29/01/2018 09:23;5;24;ICYMI: Leonardo Ulloa has joined Brighton on a loan deal until the end of the season. pic.twitter.com/UsLZ49Qw0p;;;;9,57937E+17;https://twitter.com/BBCRLSport/status/957937250284785664
ouggi;29/01/2018 09:22;1;0;Brighton have signed Leonardo Ulloa from Leicester on loan for the rest of the season.;;;;9,57937E+17;https://twitter.com/ouggi/status/957937039738994688
sportnsdesk;29/01/2018 09:22;0;0;Leonardo Ulloa joins Brighton on loan from Leicester : Brighton & Hove Albion have co.. http:// dld.bz/g8Qnv pic.twitter.com/MKgFtwZxwV;;;;9,57937E+17;https://twitter.com/sportnsdesk/status/957937005945610241
socclab;29/01/2018 09:22;0;0;Leonardo Ulloa joins Brighton on loan from Leicester : Brighton & Hove Albion have co.. http:// dld.bz/g8Qnv pic.twitter.com/KPKS2LKs0V;;;;9,57937E+17;https://twitter.com/socclab/status/957936985078976513
soccetalk;29/01/2018 09:22;0;1;Leonardo Ulloa joins Brighton on loan from Leicester : Brighton & Hove Albion have co.. http:// dld.bz/g8Qnv pic.twitter.com/RoWKiAPg1c;;;;9,57937E+17;https://twitter.com/soccetalk/status/957936976971358208
nsfooty;29/01/2018 09:22;0;0;Leonardo Ulloa joins Brighton on loan from Leicester : Brighton & Hove Albion have co.. http:// dld.bz/g8Qnv pic.twitter.com/hsfuAhR703;;;;9,57937E+17;https://twitter.com/nsfooty/status/957936944658436096
footynew247;29/01/2018 09:22;0;0;Leonardo Ulloa joins Brighton on loan from Leicester : Brighton & Hove Albion have co.. http:// dld.bz/g8Qnv pic.twitter.com/2zk81WkGrt;;;;9,57937E+17;https://twitter.com/footynew247/status/957936923040940032
footynew24;29/01/2018 09:22;0;0;Leonardo Ulloa joins Brighton on loan from Leicester : Brighton & Hove Albion have co.. http:// dld.bz/g8Qnv pic.twitter.com/sNzdNDclRu;;;;9,57937E+17;https://twitter.com/footynew24/status/957936915931680768
footyn247;29/01/2018 09:22;0;0;Leonardo Ulloa joins Brighton on loan from Leicester : Brighton & Hove Albion have co.. http:// dld.bz/g8Qnv pic.twitter.com/caPgD5FrR2;;;;9,57937E+17;https://twitter.com/footyn247/status/957936909292056576
footyhlines;29/01/2018 09:22;0;0;Leonardo Ulloa joins Brighton on loan from Leicester : Brighton & Hove Albion have co.. http:// dld.bz/g8Qnv pic.twitter.com/76zAvtN2fu;;;;9,57937E+17;https://twitter.com/footyhlines/status/957936894595264512
footycor;29/01/2018 09:22;0;0;Leonardo Ulloa joins Brighton on loan from Leicester : Brighton & Hove Albion have co.. http:// dld.bz/g8Qnv pic.twitter.com/Ef0pZqpBLB;;;;9,57937E+17;https://twitter.com/footycor/status/957936875582443520
Footheadl;29/01/2018 09:22;0;0;Leonardo Ulloa joins Brighton on loan from Leicester : Brighton & Hove Albion have co.. http:// dld.bz/g8Qnv pic.twitter.com/A7WJNRZbXE;;;;9,57937E+17;https://twitter.com/Footheadl/status/957936868720631813
footballfbb;29/01/2018 09:21;0;0;Leonardo Ulloa joins Brighton on loan from Leicester : Brighton & Hove Albion have co.. http:// dld.bz/g8Qnv pic.twitter.com/kICWNTRYDm;;;;9,57937E+17;https://twitter.com/footballfbb/status/957936847371587584
90minu;29/01/2018 09:21;0;1;Leonardo Ulloa joins Brighton on loan from Leicester : Brighton & Hove Albion have co.. http:// dld.bz/g8Qnv pic.twitter.com/4lDc7wwQuc;;;;9,57937E+17;https://twitter.com/90minu/status/957936830053306370
18dMedia;29/01/2018 09:21;0;0;Brighton Sign Leicester Striker Leonardo Ulloa on Loan Until the End of the Season http:// dlvr.it/QD72jl pic.twitter.com/DzQEVSwlNt;;;;9,57937E+17;https://twitter.com/18dMedia/status/957936700067430400
VL_solution;29/01/2018 09:21;0;0;Leonardo Ulloa : Brighton re-sign Leicester striker until end of season http://www. bbc.co.uk/sport/football /42858428 … via @VL_price #ENJOY #sports pic.twitter.com/KfNgYOUxXM;;@VL_price;#ENJOY #sports;9,57937E+17;https://twitter.com/VL_solution/status/957936624209416193
