username;date;retweets;favorites;text;geo;mentions;hashtags;id;permalink
sportsfeedia;17/10/2017 08:21;0;0;DeMarcus #Cousins tweaked his ankle but is expected to play a regular dose of minutes in Wednesday's season opener against the Grizzlies,;;;#Cousins;9,20248E+17;https://twitter.com/sportsfeedia/status/920248294814646272
seanmontee;17/10/2017 07:44;0;1;@dmorey , I’m glad Capela is restricted. Let’s go recruiting Demarcus Cousins and be able to match Spurs bigs with an actual Big on both ends;;@dmorey;;9,20239E+17;https://twitter.com/seanmontee/status/920239058445619201
CafeDeRick;17/10/2017 05:11;0;0;DeMarcus Cousins , LeBron James...;;;;9,20201E+17;https://twitter.com/CafeDeRick/status/920200534086348801
StillBullsToMe;17/10/2017 05:02;0;0;Thibs Talk: Is Kyrie Irving just a sidekick? Is DeMarcus Cousins not a winner? Five players with labels to shed. - http:// ift.tt/2x1628P …;;;;9,20198E+17;https://twitter.com/StillBullsToMe/status/920198206650224640
DPostSports;17/10/2017 03:51;0;1;Is Kyrie Irving just a sidekick? Is DeMarcus Cousins not a winner? Five players with labels to shed. http:// dpo.st/2yOaGfb pic.twitter.com/nyGxpBzhL0;;;;9,2018E+17;https://twitter.com/DPostSports/status/920180329670959105
cameronjbirdbot;17/10/2017 03:17;0;0;Demarcus Cousins;;;;9,20172E+17;https://twitter.com/cameronjbirdbot/status/920171775895527424
valrond;17/10/2017 03:00;1;2;Demarcus Cousins y Avery Bradley pic.twitter.com/3Or5c1mmhO;;;;9,20168E+17;https://twitter.com/valrond/status/920167667234934784
ChicoLavel;17/10/2017 01:27;0;1;I'm so excited about the twin tandems of Anthony Davis and Demarcus Cousins ...I don't know what to do with myself;;;;9,20144E+17;https://twitter.com/ChicoLavel/status/920144237621948416
JoshGray34;17/10/2017 00:36;0;0;2k logic, DeMarcus Cousins makes 2 free throws in a row, Dwayne Wade misses wide open layup. @NBA2K @Ronnie2K;;@NBA2K @Ronnie2K;;9,20131E+17;https://twitter.com/JoshGray34/status/920131283480592385
icE_Izahar;17/10/2017 00:28;0;0;Can they start rebuilding and trading their assets or try to get a star like example, Demarcus Cousins ?;;;;9,20129E+17;https://twitter.com/icE_Izahar/status/920129440650334209
MarcJSpearsESPN;16/10/2017 23:38;217;778;Pelicans coach Alvin Gentry said the team’s best 3-point shooter could be DeMarcus Cousins . Sounds like they need to sign Anthony Morrow.;;;;9,20117E+17;https://twitter.com/MarcJSpearsESPN/status/920116883872915456
jeremyshapiro42;16/10/2017 23:30;0;3;Paul Milsap, Blake Griffin, Al Horford, Demarcus Cousins , so many more bro he's still solid but not worth 24 million a year....;;;;9,20115E+17;https://twitter.com/jeremyshapiro42/status/920114853435490304
xBIazer;16/10/2017 22:34;0;0;I liked a @YouTube video http:// youtu.be/5eqGiJc8Zy4?a Demarcus Cousins doesn't let Isaiah Thomas shake CP3's hand;;@YouTube;;9,20101E+17;https://twitter.com/xBIazer/status/920100597461913600
xBIazer;16/10/2017 22:33;0;0;I liked a @YouTube video http:// youtu.be/BVFYTnojSTg?a DeMarcus Cousins Shoves Kevin Durant;;@YouTube;;9,201E+17;https://twitter.com/xBIazer/status/920100343471640576
outshinenyc;16/10/2017 21:52;0;0;#KicksOffCourt : DeMarcus Cousins rocking the “Bred” Air Jordan 1 Low. https://www. instagram.com/p/BaVGXJsD07f/;;;#KicksOffCourt;9,2009E+17;https://twitter.com/outshinenyc/status/920090039614345216
NuggetsFGSN;16/10/2017 21:00;0;0;Is Kyrie Irving just a sidekick? Is DeMarcus Cousins not a winner? Five pl... #Nuggets https:// fanly.link/2b83ade370 pic.twitter.com/ytOIWCgUuM;;;#Nuggets;9,20077E+17;https://twitter.com/NuggetsFGSN/status/920077005823119361
