username;date;retweets;favorites;text;geo;mentions;hashtags;id;permalink
MHaywxrd;11/01/2018 21:59;1;0;My boy Francis Coquelin ! He is a rare, rare kind...;;;;9,51605E+17;https://twitter.com/MHaywxrd/status/951604532584304641
LouiseStaintonU;11/01/2018 21:59;0;0;Francis Coquelin reveals regret at not quitting Arsenal sooner following Valencia switch http:// dlvr.it/Q9sRdp #football #soccer pic.twitter.com/v6yy89H65F;;;#football #soccer;9,51604E+17;https://twitter.com/LouiseStaintonU/status/951604429966356480
arsenalnewsonly;11/01/2018 21:59;0;1;#OneArsenal #ArsenalFC #Arsenal Francis Coquelin reveals regret at not quitting Arsenal sooner following Valen.. http:// dld.bz/g5BQN;;;#OneArsenal #ArsenalFC #Arsenal;9,51604E+17;https://twitter.com/arsenalnewsonly/status/951604404771282944
AIS_BKS;11/01/2018 21:47;12;7;Francis Coquelin resmi di jual ke @valenciacf Goodluck le coq. pic.twitter.com/DW8978R6SC;;@valenciacf;;9,51602E+17;https://twitter.com/AIS_BKS/status/951601613294088192
DavidJackman15;11/01/2018 21:38;0;0;In a world where Francis Coquelin goes for 15 mil you can surely throw another 10 on for Harry Arter, no?;;;;9,51599E+17;https://twitter.com/DavidJackman15/status/951599296989876224
welly1978;11/01/2018 21:29;1;4;Francis Coquelin Best moment in the EPL , good luck at Valencia #Arsenal #Chelsea pic.twitter.com/j7JqRgp6MV;;;#Arsenal #Chelsea;9,51597E+17;https://twitter.com/welly1978/status/951596987698368513
Kanjefe;11/01/2018 21:24;0;0;Enjoyed laughing at his lack of skill. adios RT @ChrisWheatley_ : Francis Coquelin follows in the footsteps of Gabriel Paulista after joining Valencia. Always gave everything for the Arsenal shirt and leaves having won 2 FA Cups. pic.twitter.com/7JnMnqh1Hh;;@ChrisWheatley_;;9,51596E+17;https://twitter.com/Kanjefe/status/951595698826473474
MuhdDen;11/01/2018 21:18;0;0;Best of luck francis coquelin;;;;9,51594E+17;https://twitter.com/MuhdDen/status/951594119729565696
ArsenalJournal;11/01/2018 21:18;0;1;Francis Coquelin claims he should have left Arsenal before http:// dlvr.it/Q9sG0l #Dailymail;;;#Dailymail;9,51594E+17;https://twitter.com/ArsenalJournal/status/951594091661246464
alexdemetris;11/01/2018 21:13;0;0;Thanks and best of luck #FrancisCoquelin . https:// twitter.com/ChrisWheatley_ /status/951479350045618177 …;;;#FrancisCoquelin;9,51593E+17;https://twitter.com/alexdemetris/status/951593016996909056
BetMediaNG;11/01/2018 21:06;0;1;DONE DEAL: Valencia signs Francis Coquelin for £12m from Arsenal. He's signed a deal until 2022. pic.twitter.com/sVl7ekFsxp;;;;9,51591E+17;https://twitter.com/BetMediaNG/status/951591223122415616
firstpressNg;11/01/2018 21:05;0;0;Francis Coquelin : I almost regret not leaving Arsenal for Valencia sooner https://www. firstpress.com.ng/2018/01/franci s-coquelin-i-almost-regret-not-leaving-arsenal-for-valencia-sooner/ … pic.twitter.com/Bx38j1Jamh;;;;9,51591E+17;https://twitter.com/firstpressNg/status/951591012954128385
TheSweFan;11/01/2018 21:05;0;0;Thank you for everything you gave on the pitch for Arsenal every single game Francis Coquelin ! Good luck with your next step in your career! #Gooner #leCoq #favorite;;;#Gooner #leCoq #favorite;9,51591E+17;https://twitter.com/TheSweFan/status/951590819273822208
NewsHandle_News;11/01/2018 21:01;0;0;Francis Coquelin feels he should have left Arsenal soone... pic.twitter.com/g5x9LJH6qS;;;;9,5159E+17;https://twitter.com/NewsHandle_News/status/951589819548913665
Bellerins_Boots;11/01/2018 20:59;0;2;Best of luck Francis #Coquelin . Wish you all the best #AFC;;;#Coquelin #AFC;9,51589E+17;https://twitter.com/Bellerins_Boots/status/951589494867755009
UKBizTweet;11/01/2018 20:52;0;0;Arsene Wenger confirms Arsenal have sold Francis Coquelin to Valencia https:// londonbizuk.wordpress.com/2018/01/11/ars ene-wenger-confirms-arsenal-have-sold-francis-coquelin-to-valencia/ …;;;;9,51588E+17;https://twitter.com/UKBizTweet/status/951587699131023360
retweetbizuk;11/01/2018 20:52;0;0;Arsene Wenger confirms Arsenal have sold Francis Coquelin to Valencia https:// londonbizuk.wordpress.com/2018/01/11/ars ene-wenger-confirms-arsenal-have-sold-francis-coquelin-to-valencia/ …;;;;9,51588E+17;https://twitter.com/retweetbizuk/status/951587694068621312
LondonBizUK;11/01/2018 20:52;0;0;Arsene Wenger confirms Arsenal have sold Francis Coquelin to Valencia https:// londonbizuk.wordpress.com/2018/01/11/ars ene-wenger-confirms-arsenal-have-sold-francis-coquelin-to-valencia/ …;;;;9,51588E+17;https://twitter.com/LondonBizUK/status/951587689077379073
9ja_sports;11/01/2018 20:52;0;0;DEAL DONE: Valencia have completed the £12m signing of Francis Coquelin from Arsenal. He's signed a deal until 2022.;;;;9,51588E+17;https://twitter.com/9ja_sports/status/951587668164599808
EuropeanBiz;11/01/2018 20:52;0;0;Arsene Wenger confirms Arsenal have sold Francis Coquelin to Valencia https:// europeanbiz.wordpress.com/2018/01/11/ars ene-wenger-confirms-arsenal-have-sold-francis-coquelin-to-valencia/ …;;;;9,51588E+17;https://twitter.com/EuropeanBiz/status/951587619946815488
cheapgoals;11/01/2018 20:51;0;0;Official : Francis Coquelin Agreed To A Four-And-A-Half-Year Deal With Valencia http:// cheapgoals.com/official-franc is-coquelin-agreed-to-a-four-and-a-half-year-deal-with-valencia/ … pic.twitter.com/INB0oh3ISX;;;;9,51587E+17;https://twitter.com/cheapgoals/status/951587279990067200
HIMSELFisHERE;11/01/2018 20:49;0;0;Think we should get Francis Coquelin from Valencia.. here he’s a baller;;;;9,51587E+17;https://twitter.com/HIMSELFisHERE/status/951586791269851136
matchthebar;11/01/2018 20:45;0;0;Arsenal midfielder Francis Coquelin set for £12m move to Valencia https:// buff.ly/2CRUyHP pic.twitter.com/TPBnLT4mTv;;;;9,51586E+17;https://twitter.com/matchthebar/status/951585769390510080
surewin_betting;11/01/2018 20:42;0;0;Francis Coquelin leaves Arsenal to sign for La Liga club Valencia http:// ift.tt/2CVFAAI;;;;9,51585E+17;https://twitter.com/surewin_betting/status/951585077540130816
scorehighlights;11/01/2018 20:40;0;0;Francis Coquelin : I almost regret not leaving Arsenal for Valencia sooner Click He...;;;;9,51585E+17;https://twitter.com/scorehighlights/status/951584600370958338
SheddyMac;11/01/2018 20:35;0;1;I feel gutted the Coq didn't score for Arsenal.... I would've loved to have seen his passion. He loved being a Gunner. Thank you Francis. #FrancisCoquelin;;;#FrancisCoquelin;9,51583E+17;https://twitter.com/SheddyMac/status/951583415324889088
valenciacf_en;11/01/2018 20:35;22;56;To end the day, Francis Coquelin has a little message for the fans! pic.twitter.com/rC17ZpEujK;;;;9,51583E+17;https://twitter.com/valenciacf_en/status/951583310874103810
SoccerWho;11/01/2018 20:31;0;0;Francis Coquelin : I almost regret not leaving Arsenal for Valencia sooner Click Here https://www. soccerwho.com/francis-coquel in-i-almost-regret-not-leaving-arsenal-for-valencia-sooner/ …;;;;9,51582E+17;https://twitter.com/SoccerWho/status/951582349619351552
Jimmyjog94;11/01/2018 20:29;0;1;Best of luck at @valenciacf to Francis Coquelin , not the most technically gifted player but always gave 100%. £12 million is useless for him though when championship players are going for that money.;;@valenciacf;;9,51582E+17;https://twitter.com/Jimmyjog94/status/951581815822745600
ArsenalNewsUK;11/01/2018 20:25;1;2;Francis Coquelin feels he should have left Arsenal sooner http://www. arsenalnews.co.uk/francis-coquel in-feels-he-should-have-left-arsenal-sooner/ …;;;;9,51581E+17;https://twitter.com/ArsenalNewsUK/status/951580844606545920
betintTV;11/01/2018 20:25;0;1;"French midfielder Francis Coquelin has admitted that he 'almost regrets' not leaving Arsenal during last summer's transfer window. The 26-year-old joined Valencia for an initial andpound;12m fee earlier on Thursday. #Francis #Coquelin #Arsenal pic.twitter.com/Ky5lRsejYp";;;#Francis #Coquelin #Arsenal;9,51581E+17;https://twitter.com/betintTV/status/951580769822142466
FCEArsenal;11/01/2018 20:24;0;0;Francis Coquelin feels he should have left Arsenal sooner http://www. fcexclusive.com/news/arsenal/f rancis-coquelin-feels-he-should-have-left-arsenal-sooner-5002148 … (Source: Eyefootball: Football News);;;;9,51581E+17;https://twitter.com/FCEArsenal/status/951580607284473856
EnochJeremiah13;11/01/2018 20:24;0;0;Francis Coquelin feels he should have left Arsenal sooner http:// dlvr.it/Q9s0mQ;;;;9,5158E+17;https://twitter.com/EnochJeremiah13/status/951580487192948736
WestHamFZ;11/01/2018 20:23;0;0;Reported West Ham target Francis Coquelin has completed a move to Valencia for a fee of around £12m. (via @valenciacf ) #COYI pic.twitter.com/mPOZ87nB8F;;@valenciacf;#COYI;9,5158E+17;https://twitter.com/WestHamFZ/status/951580461645664256
newsaddup;11/01/2018 20:22;0;0;Francis Coquelin feels he should have left Arsenal soone... pic.twitter.com/rI1tEgoDaY;;;;9,5158E+17;https://twitter.com/newsaddup/status/951580036318027778
TimesSport;11/01/2018 20:21;3;10;Francis Coquelin has signed for @valenciacf_en after a decade with @Arsenal #AFC His contract includes a £71 million buy-out clause https://www. thetimes.co.uk/edition/sport/ francis-coquelin-joins-valencia-from-arsenal-with-71m-buy-out-clause-jvklm8g98 …;;@valenciacf_en @Arsenal;#AFC;9,5158E+17;https://twitter.com/TimesSport/status/951579724475543552
eyefootball;11/01/2018 20:20;0;1;Francis Coquelin feels he should have left #Arsenal #afc @Arsenal sooner https://www. eyefootball.com/r/36135 #Coquelin #FrancisCoquelin @BBCSport @ESPNfc;;@Arsenal @BBCSport @ESPNfc;#Arsenal #afc #Coquelin #FrancisCoquelin;9,5158E+17;https://twitter.com/eyefootball/status/951579584583077888
eddygunners101;11/01/2018 20:17;1;1;But to be honest i hope wenger wudnt regret selling francis coquelin to valencia,cos wat macelino garcia the coach has transformed dead bits players like simone zaza,jeffreykondogbia into top players Wud be something to think about..;;;;9,51579E+17;https://twitter.com/eddygunners101/status/951578958839078912
SKYSP0RTSHD;11/01/2018 20:17;1;4;Thierry Henry's priceless reaction when heard Francis Coquelin has joined Valencia. https:// cards.twitter.com/cards/18ce53ut 1q7/582p0 …;;;;9,51579E+17;https://twitter.com/SKYSP0RTSHD/status/951578838349135872
NotJustLong;11/01/2018 20:16;1;0;Francis Coquelin will now likely prosper very quickly as he's now #WengerOut;;;#WengerOut;9,51579E+17;https://twitter.com/NotJustLong/status/951578607150882816
i_am_emmydeey;11/01/2018 20:15;0;0;Arsenal sold Francis coquelin the only true DM we have because they have nothing to defend since they are out of the major tournament.;;;;9,51578E+17;https://twitter.com/i_am_emmydeey/status/951578443115913216
WestHamPro;11/01/2018 20:15;0;0;West Ham Fans Split as Rumoured Target Francis Coquelin Elects to Join Valencia http://www. 90min.com/posts/5944952- west-ham-fans-split-as-rumoured-target-francis-coquelin-elects-to-join-valencia&ref=twitter&utm_source=twitter.com&utm_medium=feed …;;;;9,51578E+17;https://twitter.com/WestHamPro/status/951578320189112320
ArsenalPro;11/01/2018 20:15;0;0;Arsene Wenger Claims Rising Starlet Could Replace Outgoing Francis Coquelin in Midfield @MrPeckham9 http://www. 90min.com/posts/5944487- arsene-wenger-claims-rising-starlet-could-replace-outgoing-francis-coquelin-in-midfield&ref=twitter&utm_source=twitter.com&utm_medium=feed …;;@MrPeckham9;;9,51578E+17;https://twitter.com/ArsenalPro/status/951578320092606464
BabaGrumpy;11/01/2018 20:08;0;3;While some are hating on Francis Coquelin . He has done a Trade Up. Moved from a team in 6th to a team in 3rd Place. Next year when Francis Coquelin is playing Champions League football, the might of England's midfield in Dele All, Eric Dier, Harry Winks will be playing Europa;;;;9,51577E+17;https://twitter.com/BabaGrumpy/status/951576630622867457
SibsMUFC;11/01/2018 20:05;0;2;Even Francis Coquelin has an 80m clause so it wouldn't surprise me!;;;;9,51576E+17;https://twitter.com/SibsMUFC/status/951575878454083584
escoba85;11/01/2018 20:05;0;0;Best Of Luck Francis. #Coquelin pic.twitter.com/XPzrctHDd3;;;#Coquelin;9,51576E+17;https://twitter.com/escoba85/status/951575748179058690
TifoFootball_;11/01/2018 20:00;0;6;Francis Coquelin showed glimpses of promise at Arsenal, but @RichJolly explains how the Gunners not only lost one player with Santi Cazorla's horrific injury - but two. http:// bit.ly/CoquelinCareer pic.twitter.com/WKT68xy5Js;;@RichJolly;;9,51574E+17;https://twitter.com/TifoFootball_/status/951574450624974848
Sidvolt;11/01/2018 19:55;0;0;Valencia Confirms Signing Francis Coquelin From Arsenal For £12M http:// dlvr.it/Q9rsMx #Sport #Arsenal pic.twitter.com/iMwFjZEbf3;;;#Sport #Arsenal;9,51573E+17;https://twitter.com/Sidvolt/status/951573237191749632
beINSPORTS_AUS;11/01/2018 19:50;0;0;DONE DEAL: Francis Coquelin is a @valenciacf player #LaLiga http://www. beinsports.com/au/transfers/n ews/valencia-confirms-coquelin-deal/758655 …;;@valenciacf;#LaLiga;9,51572E+17;https://twitter.com/beINSPORTS_AUS/status/951571922378084354
EfaEffikoEgberi;11/01/2018 19:47;0;0;Francis Coquelin to finally realize that world class potential in Valencia .....Nice move!;;;;9,51571E+17;https://twitter.com/EfaEffikoEgberi/status/951571234642432000
Juscoville;11/01/2018 19:44;0;0;Francis Coquelin agrees to join Valencia http:// po.st/XEXCQb via @po_st;;@po_st;;9,5157E+17;https://twitter.com/Juscoville/status/951570467785265154
KAKoozaR;11/01/2018 19:43;0;0;Jack Wilshere confirms Francis Coquelin departure from Arsenal in his facebook post. #AmRamzankmgt;;;#AmRamzankmgt;9,5157E+17;https://twitter.com/KAKoozaR/status/951570318409203712
1blog_;11/01/2018 19:39;0;0;Francis Coquelin : Valencia sign Arsenal midfielder http:// dlvr.it/Q9rmpR pic.twitter.com/vvpe7Jbuyi;;;;9,51569E+17;https://twitter.com/1blog_/status/951569400405966848
LpN117;11/01/2018 19:39;0;0;Farewell Francis Coquelin . For a brief moment after coming back from loan I thought you might be what we have been looking for, but I was wrong. We were all wrong.;;;;9,51569E+17;https://twitter.com/LpN117/status/951569307615612928
RealGMSoccer;11/01/2018 19:39;0;1;Arsenal Sells Francis Coquelin To Valencia For $16.3M http:// soccer.realgm.com/wiretap/5854/A rsenal-Sells-Francis-Coquelin-To-Valencia-For-$163M …;;;;9,51569E+17;https://twitter.com/RealGMSoccer/status/951569225340112898
peak8964;11/01/2018 19:37;0;0;It's time to say goodbye... Francis Coquelin is leaving Arsenal after 10 years! Full story http:// bbc.in/2CQ4XDL pic.twitter.com/ltcDLEz4L1 …;;;;9,51569E+17;https://twitter.com/peak8964/status/951568708702539782
DaiIyLONDON;11/01/2018 19:36;0;0;Francis Coquelin : Valencia agree to sign Arsenal midfielder http:// j.mp/2EwDYxm #London pic.twitter.com/Md3ov771eZ;;;#London;9,51569E+17;https://twitter.com/DaiIyLONDON/status/951568627387396096
Sirjayoyj;11/01/2018 19:34;0;0;'' Francis Coquelin finally joins Valencia from Arsenal. Valencia… https://www. instagram.com/p/Bd0w4XMAxG6r F8CY1LhTBE7R4D3WRtH3bSBDLk0/ …;;;;9,51568E+17;https://twitter.com/Sirjayoyj/status/951568002108960768
laliga_athleets;11/01/2018 19:32;0;0;http:// athleets.com/#laliga adds Francis Coquelin via http://www. laliga.es/en/player/fran cis-coquelin …;;;#laliga;9,51568E+17;https://twitter.com/laliga_athleets/status/951567578048159746
UmerJanuzaj;11/01/2018 19:32;0;0;Francis Coquelin has Signed for Spanish side Valencia CF. Welcome to Laliga! #LaLiga #Valencia;;;#LaLiga #Valencia;9,51567E+17;https://twitter.com/UmerJanuzaj/status/951567433608978433
iamUmeriii;11/01/2018 19:31;0;0;Francis Coquelin has Signed for Spanish side Valencia CF. Welcome to Laliga! #LaLiga #Valencia #WorldMagazine;;;#LaLiga #Valencia #WorldMagazine;9,51567E+17;https://twitter.com/iamUmeriii/status/951567286334259200
LibertyMbabazi;11/01/2018 19:30;0;0;Valencia have signed French midfielder Francis Coquelin from Arsenal for a reported £12m.;;;;9,51567E+17;https://twitter.com/LibertyMbabazi/status/951567017118765056
rumorstransfers;11/01/2018 19:30;0;0;Valencia have completed the signing of Arsenal midfielder Francis Coquelin , Arsene Wenger confirmed on Wednesday night.;;;;9,51567E+17;https://twitter.com/rumorstransfers/status/951566890891018240
ArsenalRelevant;11/01/2018 19:23;42;96;Francis Coquelin with former Arsenal defender Gabriel. #afc pic.twitter.com/RRa5gwRPau;;;#afc;9,51565E+17;https://twitter.com/ArsenalRelevant/status/951565276495187968
vanpersie_mx;11/01/2018 19:23;0;1;loved #FrancisCoquelin 's passion, intensity , and commitment with which he played at every oportunity... did the job when not many expected him to. The best of luck to him.;;;#FrancisCoquelin;9,51565E+17;https://twitter.com/vanpersie_mx/status/951565236548517888
SalamanderNews;11/01/2018 19:22;0;0;OFFICIAL! | Spanish LaLiga football club @valenciacf have confirmed and completed the signing of Francis Coquelin from Arsenal after signing a contract until 2022. #VCF #AFC #SNsTransfer pic.twitter.com/rVEGHK0fLt;;@valenciacf;#VCF #AFC #SNsTransfer;9,51565E+17;https://twitter.com/SalamanderNews/status/951564981937504256
Rambsiee;11/01/2018 19:22;0;1;Francis Coquelin never did get that goal for arsenal.;;;;9,51565E+17;https://twitter.com/Rambsiee/status/951564883769942016
uncovaweb;11/01/2018 19:21;0;0;No one can believe Francis Coquelin ’s Valencia release clause.... http:// uncova.com/no-one-can-bel ieve-francis-coquelins-valencia-release-clause … https:// fb.me/Eo47mbe6;;;;9,51565E+17;https://twitter.com/uncovaweb/status/951564849229676544
uncovaweb;11/01/2018 19:21;0;0;No one can believe Francis Coquelin ’s Valencia release clause.... http:// uncova.com/no-one-can-bel ieve-francis-coquelins-valencia-release-clause …;;;;9,51565E+17;https://twitter.com/uncovaweb/status/951564790052237312
CornfedCre8tive;11/01/2018 19:18;0;0;Raise your hand if you tried to tweet a good luck message to Francis Coquelin only to find out that he is #oldschool #notwitteraccount #COYG #arsenalfc #ohtobeagooner @Arsenal;;@Arsenal;#oldschool #notwitteraccount #COYG #arsenalfc #ohtobeagooner;9,51564E+17;https://twitter.com/CornfedCre8tive/status/951564075552649216
Boogle08;11/01/2018 19:15;0;1;Francis Coquelin is gonna be a huge miss from the Premier League alreeet then!;;;;9,51563E+17;https://twitter.com/Boogle08/status/951563196925702145
NawarZaaroura;11/01/2018 19:14;0;0;Bye bye dude… till we meet again Once a gunner always a gunner #FrancisCoquelin pic.twitter.com/9Lv0Ps2DGb;;;#FrancisCoquelin;9,51563E+17;https://twitter.com/NawarZaaroura/status/951563014049759232
bigmj515;11/01/2018 19:14;0;0;#Valencia Confirms Signing Francis #Coquelin From #Arsenal For £12M https:// goo.gl/fb/VZVsW8 #sport #franciscoquelin;;;#Valencia #Coquelin #Arsenal #sport #franciscoquelin;9,51563E+17;https://twitter.com/bigmj515/status/951562911704584192
OffsideRulePod;11/01/2018 19:13;0;0;Valencia have completed the £12m signing of Francis Coquelin from Arsenal. And it's a as he signs a deal until 2022. ( @valenciacf ) pic.twitter.com/4KX1UVkrtR;;@valenciacf;;9,51563E+17;https://twitter.com/OffsideRulePod/status/951562757261979649
bigpaleface;11/01/2018 19:11;0;0;Arsenal news: Francis Coquelin regrets not having left sooner for Valencia transfer | London Evening Standard https://www. standard.co.uk/sport/football /arsenal-news-francis-coquelin-regrets-not-having-left-sooner-for-valencia-transfer-a3738101.html …;;;;9,51562E+17;https://twitter.com/bigpaleface/status/951562224795049984
ArsenalFCAddict;11/01/2018 19:10;0;0;Francis Coquelin : 'I almost regret not leaving #Arsenal sooner' | Sports Mole http://www. football-addict.com/article/arsena l-fc/sportsmole/5a57d0f0e05447180217f517/francis-coquelin-i-almost-regret-not-leaving-arsenal-sooner?lang=en&utm_campaign=post-auto&utm_medium=twitter&utm_source=arsenal-addict-en …;;;#Arsenal;9,51562E+17;https://twitter.com/ArsenalFCAddict/status/951561906069876736
mashdolski;11/01/2018 19:09;0;0;Francis Coquelin : I almost regret not leaving Arsenal sooner;;;;9,51562E+17;https://twitter.com/mashdolski/status/951561820275429376
FCEArsenal;11/01/2018 19:09;0;0;Fans Are All Saying The Same About Francis Coquelin 's Valencia Move http://www. fcexclusive.com/news/arsenal/f ans-are-all-saying-the-same-about-francis-coquelins-valencia-move-5001971 … (Source: SPORTbible);;;;9,51562E+17;https://twitter.com/FCEArsenal/status/951561755200839681
nglifestyle_ng;11/01/2018 19:07;0;0;#Nglifestyle #Sport #update ( Francis Coquelin : 'I almost regret not leaving Arsenal sooner') Francis Coquelin admits that he almost regrets not leaving Arsenal sooner after completing a January move to La Liga side... https:// goo.gl/LxkZaS pic.twitter.com/Z6GHPe2lSv;;;#Nglifestyle #Sport #update;9,51561E+17;https://twitter.com/nglifestyle_ng/status/951561347673808897
TUtv;11/01/2018 19:06;0;1;Francis coquelin completes 12m valencia transfer, confirms arsenal boss arsene wenger en http:// tu.tv/videos/francis -coquelin-completes-12m-valencia-transfer-confirms-arsenal-boss-arsene-wenger?utm_source=Engagement&utm_medium=twitter&utm_campaign=Twtutvmex …;;;;9,51561E+17;https://twitter.com/TUtv/status/951560890670813185
BLU_Products;11/01/2018 19:05;14;44;Welcome Francis Coquelin to the @valenciacf and BLU family! #BLU #BoldLikeUs #VCFBLU #ValenciaCF #AmuntValencia #WelcomeCoquelin pic.twitter.com/kROiK3P8H3;;@valenciacf;#BLU #BoldLikeUs #VCFBLU #ValenciaCF #AmuntValencia #WelcomeCoquelin;9,51561E+17;https://twitter.com/BLU_Products/status/951560616053039104
GoonerChris1983;11/01/2018 19:04;1;0;Francis Coquelin has a £71.2m release clause in his contract with Valencia CF.;;;;9,5156E+17;https://twitter.com/GoonerChris1983/status/951560356522053638
Corndog1975;11/01/2018 19:03;0;3;I wish Francis Coquelin all the best at Valencia. Loved his passion for the game and I will miss him;;;;9,5156E+17;https://twitter.com/Corndog1975/status/951560234413240320
m_christenson;11/01/2018 19:02;14;16;The 10 most expensive signings of the window so far. Must say I didn't expect to find Francis Coquelin there at the start of the window ... https://www. theguardian.com/football/ng-in teractive/2017/dec/29/transfer-window-january-2018-every-deal-in-europes-top-five-leagues … #afc pic.twitter.com/Ew8YfbedhE;;;#afc;9,5156E+17;https://twitter.com/m_christenson/status/951560050014851073
Ovatheline;11/01/2018 19:00;0;0;Francis Coquelin : Valencia sign Arsenal midfielder - La Liga side Valencia sign French midfielder Francis Coquelin from Arsenal for a reported £12m. http:// ht.ly/fCEC50g5ZEj;;;;9,5156E+17;https://twitter.com/Ovatheline/status/951559509750829057
NickDeanWright;11/01/2018 19:00;0;0;Sad to see our Policeman go, best of a bad bunch, I personally would of kept him, good luck Francis Coquelin @valenciacf;;@valenciacf;;9,51559E+17;https://twitter.com/NickDeanWright/status/951559478113193984
Esmunes;11/01/2018 19:00;0;0;All the Europa League sides' winter transfers - The transfer window is open! http:// UEFA.com rounds up all the ins and outs from the 32 contenders, with Francis Coquelin leaving Arsenal for Valencia on Thursday. http:// ow.ly/VEJd50g5Zvf;;;;9,51559E+17;https://twitter.com/Esmunes/status/951559466805317637
MailSport;11/01/2018 19:00;17;21;'I almost regret not having come before' Francis Coquelin admits he should have left Arsenal for Valencia six months ago http:// dailym.ai/2Dl64wc pic.twitter.com/XKEPoUyfYT;;;;9,51559E+17;https://twitter.com/MailSport/status/951559434223964160
FCEArsenal;11/01/2018 18:58;0;0;Francis Coquelin : 'I almost regret not leaving Arsenal sooner' http://www. fcexclusive.com/news/arsenal/f rancis-coquelin-i-almost-regret-not-leaving-arsenal-sooner-5001903 … (Source: Sports Mole);;;;9,51559E+17;https://twitter.com/FCEArsenal/status/951559027925843975
SM_Headlines;11/01/2018 18:56;0;0;Francis Coquelin : 'I almost regret not leaving Arsenal sooner' http:// sm.mg/qvkrmsv #arsenal #vcf #valenciacf;;;#arsenal #vcf #valenciacf;9,51559E+17;https://twitter.com/SM_Headlines/status/951558561519333377
SMLaLiga;11/01/2018 18:56;0;0;Francis Coquelin : 'I almost regret not leaving Arsenal sooner' http:// sm.mg/fb6m8ct #arsenal #vcf #valenciacf;;;#arsenal #vcf #valenciacf;9,51559E+17;https://twitter.com/SMLaLiga/status/951558558067326976
SMArsenal;11/01/2018 18:56;0;0;Francis Coquelin : 'I almost regret not leaving Arsenal sooner' http:// sm.mg/54n8bjp #arsenal;;;#arsenal;9,51559E+17;https://twitter.com/SMArsenal/status/951558554493902849
The_MAHADI;11/01/2018 18:55;0;0;Goodluck to my man Francis Coquelin . Passionate Gooner;;;;9,51558E+17;https://twitter.com/The_MAHADI/status/951558283202088965
bigmj515;11/01/2018 18:54;0;0;Valencia Confirms Signing Francis Coquelin From Arsenal For £12M http:// e9ja.net/valencia-confi rms-signing-francis-coquelin-from-arsenal-for-12m/ … pic.twitter.com/OjI0eNw5Cc;;;;9,51558E+17;https://twitter.com/bigmj515/status/951558058949464064
datboyjerry;11/01/2018 18:54;0;0;Valencia Confirms Signing Francis Coquelin From Arsenal For £12M... https:// fb.me/1jEFctZ4D;;;;9,51558E+17;https://twitter.com/datboyjerry/status/951557992046059520
bigmj515;11/01/2018 18:54;0;0;Valencia Confirms Signing Francis Coquelin From Arsenal For £12M - ... pic.twitter.com/ieOwRahBIx;;;;9,51558E+17;https://twitter.com/bigmj515/status/951557984106229762
matt1taylor;11/01/2018 18:52;0;0;Good luck Francis Coquelin . Wore his heart on his sleeve and worked his arse off, despite his limited technical ability. #lecoq https:// twitter.com/arsenal/status /951473470352785408 …;;;#lecoq;9,51557E+17;https://twitter.com/matt1taylor/status/951557411894104065
LukeHeppos;11/01/2018 18:46;1;1;My only Francis Coquelin memory https:// twitter.com/eplbible/statu s/951509200001228800 …;;;;9,51556E+17;https://twitter.com/LukeHeppos/status/951555838711422978
AdamSavage14;11/01/2018 18:44;0;0;Good bye and good luck to Francis #coquelin who joins @valenciacf . One of the only Arsenal players to actually kick people. Something I think we need more of #afc;;@valenciacf;#coquelin #afc;9,51556E+17;https://twitter.com/AdamSavage14/status/951555502248464384
