username;date;retweets;favorites;text;geo;mentions;hashtags;id;permalink
LenM4;11/01/2018 13:43;0;0;Francis Coquelin is good, but not quite good enough for the top level. https:// twitter.com/Arsenal/status /951469542387134465 …;;;;9,5148E+17;https://twitter.com/LenM4/status/951479631571451904
TonyBekederemo;11/01/2018 13:43;0;0;@valenciacf have unveiled Francis Coquelin after signing him from @Arsenal on a four-and-a-half-year deal. Bought him for €12million and inserted an €80million buyout clause in his contract. pic.twitter.com/J1WmBN5t7j;;@valenciacf @Arsenal;;9,5148E+17;https://twitter.com/TonyBekederemo/status/951479619101831168
ArsenalHQNews;11/01/2018 13:43;0;0;Valencia announce that Francis Coquelin has £71m release clause following Arsenal transfer http:// ift.tt/2miiz3D #gunners #coyg #Arsenal;;;#gunners #coyg #Arsenal;9,5148E+17;https://twitter.com/ArsenalHQNews/status/951479585899675648
Metro_Sport;11/01/2018 13:42;4;7;Valencia announce that Francis Coquelin has £71m release clause http:// metro.co.uk/2018/01/11/val encia-announce-francis-coquelin-71m-release-clause-following-arsenal-transfer-7222361/ … #AFC;;;#AFC;9,5148E+17;https://twitter.com/Metro_Sport/status/951479555734335488
Arsenal_Fanly;11/01/2018 13:42;0;0;Arsenal confirm Francis Coquelin completes £10.6million move to Valencia... #ArsenalFC https:// fanly.link/79f8ecf6c3 pic.twitter.com/gEstQC8w5f;;;#ArsenalFC;9,5148E+17;https://twitter.com/Arsenal_Fanly/status/951479509504622593
shahirulamir_;11/01/2018 13:42;0;0;Good luck at Valencia, Francis Coquelin . Thank you for the effective defense reinforcement in 14-15 even though it was just a short period of time. Superb defensive-minded player. You deserve better.;;;;9,51479E+17;https://twitter.com/shahirulamir_/status/951479468232556545
ArsenalJournal;11/01/2018 13:42;0;0;#ArsenalNews Francis Coquelin agrees to join Valencia http:// dlvr.it/Q9pZPF #Arsenal;;;#ArsenalNews #Arsenal;9,51479E+17;https://twitter.com/ArsenalJournal/status/951479450293518336
alexjk17;11/01/2018 13:42;0;1;Good luck to Francis coquelin @valenciacf thank you for all u did, all the bes;;@valenciacf;;9,51479E+17;https://twitter.com/alexjk17/status/951479444979535872
KeegSports;11/01/2018 13:42;0;1;OFFICIAL: Valencia have confirmed the signing of Francis Coquelin from Arsenal on a contract until June 2022. (Source: @valenciacf ) pic.twitter.com/ov9j6keYxb;;@valenciacf;;9,51479E+17;https://twitter.com/KeegSports/status/951479434690867200
FCEArsenal;11/01/2018 13:42;0;0;Francis Coquelin completes £10.6million Arsenal exit and Valencia slap £70MILLION buy.. http://www. fcexclusive.com/news/arsenal/f rancis-coquelin-completes-ps10-6million-arsenal-exit-and-valencia-slap-ps70million-buyout-clause-on-gunners-outcast-5000331 … (Source: The Sun);;;;9,51479E+17;https://twitter.com/FCEArsenal/status/951479420627439616
nglifestyle_ng;11/01/2018 13:42;0;0;#Nglifestyle #Sport #update ( Francis Coquelin completes move from Arsenal to Valencia) Francis Coquelin has agreed to join LaLiga side Valencia on a four-and-a-half-year contract following a decade with Arsenal, the... https:// goo.gl/3cCSWo pic.twitter.com/LovCFBKkJh;;;#Nglifestyle #Sport #update;9,51479E+17;https://twitter.com/nglifestyle_ng/status/951479412943392768
ChrisWheatley_;11/01/2018 13:42;230;825;Francis Coquelin follows in the footsteps of Gabriel Paulista after joining Valencia. Always gave everything for the Arsenal shirt and leaves having won 2 FA Cups. pic.twitter.com/tQ7kt4L0Wf;;;;9,51479E+17;https://twitter.com/ChrisWheatley_/status/951479350045618177
TransfersFNH;11/01/2018 13:41;0;0;Francis Coquelin leaves Arsenal for Valencia in £10.8m deal #FNH #Transfers #DeadlineDay http://www. nshnd.com/to.aspx?i=3813 366 …;;;#FNH #Transfers #DeadlineDay;9,51479E+17;https://twitter.com/TransfersFNH/status/951479219976097793
IndyFootball;11/01/2018 13:41;1;3;Francis Coquelin leaves Arsenal for Valencia in £10.8m deal https:// ind.pn/2mvIfef #afc pic.twitter.com/d90AaK5NUw;;;#afc;9,51479E+17;https://twitter.com/IndyFootball/status/951479185901522945
cfctrendz;11/01/2018 13:41;0;0;DONE DEAL: Francis Coquelin has joined @valenciacf from Arsenal for a reported £12m on a five year deal. Release clause- €80m pic.twitter.com/xkKklPtd3Q;;@valenciacf;;9,51479E+17;https://twitter.com/cfctrendz/status/951479155127877632
TheFootballGram;11/01/2018 13:41;0;0;OFFICIAL: Francis Coquelin has completed his move to Valencia. #ValenciaFC pic.twitter.com/SX8s86mLFP;;;#ValenciaFC;9,51479E+17;https://twitter.com/TheFootballGram/status/951479118046154752
IlyasMAbdullah;11/01/2018 13:41;0;0;Valencia name Francis Coquelin ’s staggering buy-out clause after flop completes transfer from Arsenal pic.twitter.com/QnAIUfu04N;;;;9,51479E+17;https://twitter.com/IlyasMAbdullah/status/951479102808129536
PrimePierre;11/01/2018 13:41;0;0;Francis Coquelin - Our Beast 2017 - Crazy Skills, Tackles & Passes 2016/... https:// youtu.be/rDeA9JfoMOY via @YouTube;;@YouTube;;9,51479E+17;https://twitter.com/PrimePierre/status/951479096005054466
__samhudson;11/01/2018 13:41;0;1;Francis Coquelin has an £80 million release clause... let’s just put that into perspective.;;;;9,51479E+17;https://twitter.com/__samhudson/status/951479089038348289
KiCKmagazine;11/01/2018 13:41;0;1;There's an outgoing at @Arsenal ! Francis Coquelin has joined Spanish club Valencia. #Donedeal #TransferWindow pic.twitter.com/DM4i537Vag;;@Arsenal;#Donedeal #TransferWindow;9,51479E+17;https://twitter.com/KiCKmagazine/status/951479072118525952
SoccerWho;11/01/2018 13:40;0;0;No one can believe Francis Coquelin 's Valencia release clause Click Here http://www. soccerwho.com/no-one-can-bel ieve-francis-coquelins-valencia-release-clause/ … pic.twitter.com/QiBF2DmmUo;;;;9,51479E+17;https://twitter.com/SoccerWho/status/951479044960374785
bongofuse;11/01/2018 13:40;0;0;Francis Coquelin Officially Seals Valencia Move After Nearly a Decade With Arsenal, http:// bongofuse.com/2018/01/11/fra ncis-coquelin-officially-seals-valencia-move-after-nearly-a-decade-with-arsenal/,#…;;;#;9,51479E+17;https://twitter.com/bongofuse/status/951479035997147137
LeeArsenal2;11/01/2018 13:40;0;1;Francis Coquelin gone to Valencia. Never the greatest player we’ve had but always gave 100%. Good luck and Thank You.;;;;9,51479E+17;https://twitter.com/LeeArsenal2/status/951478923052879874
ArsenalFCAddict;11/01/2018 13:40;0;0;Francis Coquelin Officially Seals #Valencia Move After Nearly a Decade With #Arsenal | http:// 90min.com http://www. football-addict.com/article/arsena l-fc/90min/5a5783fbe0544756d838bf89/francis-coquelin-officially-seals-valencia-move-after-nearly-a-decade-with-arsenal?lang=en&utm_campaign=post-auto&utm_medium=twitter&utm_source=arsenal-addict-en&redirect_url=http%3A%2F%2Fwww.90min.com%2Fposts%2F5944670-francis-coquelin-officially-seals-valencia-move-after-nearly-a-decade-with-arsenal%3Futm_source%3DRSS%26a_aid%3D42974 …;;;#Valencia #Arsenal;9,51479E+17;https://twitter.com/ArsenalFCAddict/status/951478878178070529
LouiseStaintonU;11/01/2018 13:40;0;0;Valencia announce that Francis Coquelin has £71m release clause following Arsenal transfer http:// dlvr.it/Q9pY9D #football #soccer pic.twitter.com/HvC7gi1WFn;;;#football #soccer;9,51479E+17;https://twitter.com/LouiseStaintonU/status/951478841410691072
arsenalbuzztap;11/01/2018 13:39;0;0;si​.com >> Francis Coquelin Officially Seals Valencia Move After Nearly a Decade With Arsenal http:// buzztap.com/-J9LNar;;;;9,51479E+17;https://twitter.com/arsenalbuzztap/status/951478799018938368
PrimaScriptura;11/01/2018 13:39;0;0;Arsenal have sold holding midfielder Francis Coquelin to Valencia for a reported £12m fee.;;;;9,51479E+17;https://twitter.com/PrimaScriptura/status/951478722829287424
ammo_sports;11/01/2018 13:39;0;0;DONE DEAL: Francis Coquelin has joined @valenciacf from Arsenal for a reported £12m, signing a contract until June 2022. He has a release clause of €80m.;;@valenciacf;;9,51479E+17;https://twitter.com/ammo_sports/status/951478620391919616
TheOlutee;11/01/2018 13:38;0;0;Retweeted Chris Wheatley ( @ChrisWheatley_ ): Francis Coquelin has passed his medical at Valencia. Official... https:// fb.me/FTtazA6Y;;@ChrisWheatley_;;9,51478E+17;https://twitter.com/TheOlutee/status/951478480310558720
TEAMtalk;11/01/2018 13:38;0;0;Arsenal have sold Francis Coquelin for a reported fee of €12m. Valencia though have inserted a massive buyout clause in his deal... http://www. teamtalk.com/news/valencia- complete-coquelin-transfer-and-insert-mega-buyout-clause … pic.twitter.com/gywmZFcONS;;;;9,51478E+17;https://twitter.com/TEAMtalk/status/951478475080204288
FTransferNews;11/01/2018 13:38;5;17;OFFICIAL: #Valencia have signed midfielder Francis Coquelin from Arsenal for £12million on a contract until 2022. #AFC;;;#Valencia #AFC;9,51478E+17;https://twitter.com/FTransferNews/status/951478451411800064
KalogirosThanos;11/01/2018 13:38;0;0;Francis Coquelin has passed his medical at Valencia. #TransferNews#@Arsenal;;@Arsenal;#TransferNews #;9,51478E+17;https://twitter.com/KalogirosThanos/status/951478355676860416
JwanWilshere;11/01/2018 13:38;0;1;Farewell my dear , Francis Coquelin pic.twitter.com/yZRJxFwMhJ;;;;9,51478E+17;https://twitter.com/JwanWilshere/status/951478310390779904
ArsenalNewsUK;11/01/2018 13:37;0;1;Valencia announce that Francis Coquelin has £71m release clause following Arsenal transfer http://www. arsenalnews.co.uk/valencia-annou nce-that-francis-coquelin-has-71m-release-clause-following-arsenal-transfer/ …;;;;9,51478E+17;https://twitter.com/ArsenalNewsUK/status/951478204774088705
AaronRamsey88;11/01/2018 13:37;0;6;Good luck Francis Coquelin in the future for your time at Valencia. Thanks for the passion and dedication you showed to Arsenal. All the best!! pic.twitter.com/3ZHb0fLpJQ;;;;9,51478E+17;https://twitter.com/AaronRamsey88/status/951478174449192960
nglifestyle_ng;11/01/2018 13:37;0;0;#Nglifestyle #Sport #update ( Francis Coquelin completes £10.6million Arsenal exit and Valencia slap £70MILLION buyout clause on Gunners outcast) VALENCIA have confirmed the signing of Francis Coquelin from Arsenal and slapped a massive ... https:// goo.gl/EvK8ps pic.twitter.com/2ZlbpprSm3;;;#Nglifestyle #Sport #update;9,51478E+17;https://twitter.com/nglifestyle_ng/status/951478144237756416
amirffarhan;11/01/2018 13:37;0;1;Francis Coquelin is the only player is see in an @Arsenal shirt who truly plays for the badge,will miss him. All the best at @valenciacf #Arsenal;;@Arsenal @valenciacf;#Arsenal;9,51478E+17;https://twitter.com/amirffarhan/status/951478097693483008
bryoshavin;11/01/2018 13:36;0;2;Francis Coquelin . Thanks for everything, especially this moment! #coyg pic.twitter.com/LVyir0A0HD;;;#coyg;9,51478E+17;https://twitter.com/bryoshavin/status/951477964079861760
TransferChanger;11/01/2018 13:36;5;20;DONE DEAL: Valencia have confirmed the signing of Francis Coquelin from Arsenal on a contract until 2022. (Source: @valenciacf );;@valenciacf;;9,51478E+17;https://twitter.com/TransferChanger/status/951477952256135169
FreddyMumeru;11/01/2018 13:35;1;2;Good luck Francis Coquelin;;;;9,51478E+17;https://twitter.com/FreddyMumeru/status/951477794256470016
BetsAndStats;11/01/2018 13:35;0;0;Francis Coquelin Officially Seals Valencia Move After Nearly a Decade With Arsenal http://www. betsandstats.com/francis-coquel in-officially-seals-valencia-move-after-nearly-a-decade-with-arsenal/ …;;;;9,51478E+17;https://twitter.com/BetsAndStats/status/951477775881383936
SportsBeastNews;11/01/2018 13:35;0;1;Francis Coquelin leaves Arsenal to sign for La Liga club Valencia http:// sportsbeast.info/2018/01/11/fra ncis-coquelin-leaves-arsenal-to-sign-for-la-liga-club-valencia/ … pic.twitter.com/SrNVFsZikM;;;;9,51478E+17;https://twitter.com/SportsBeastNews/status/951477745573392387
iArsenalApp;11/01/2018 13:35;0;0;Daily Mail: Francis Coquelin completes move from Arsenal to Valencia http://www. football-news365.co.uk/go/82275960;;;;9,51478E+17;https://twitter.com/iArsenalApp/status/951477719178629121
90minutesonline;11/01/2018 13:35;0;0;Ultimately, @Arsenal selling Francis Coquelin to @valenciacf , is good business. He got his chance, after looking like he never would, filled a void & will be missed by fans, who appreciated his passion for the club #ThursdayThoughts;;@Arsenal @valenciacf;#ThursdayThoughts;9,51478E+17;https://twitter.com/90minutesonline/status/951477710722871296
andTimsaid;11/01/2018 13:35;0;0;A very good CDM. We will miss his partnership with Cazorla. All the best @FrancisCoquelin;;@FrancisCoquelin;;9,51478E+17;https://twitter.com/andTimsaid/status/951477559711199232
lbudhrani;11/01/2018 13:34;0;0;Francis Coquelin Officially Seals Valencia Move After Nearly a Decade With Arsenal,,, https:// lokeshbudhrani.com/francis-coquel in-officially-seals-valencia-move-after-nearly-a-decade-with-arsenal/,lokesh1994 …;;;;9,51477E+17;https://twitter.com/lbudhrani/status/951477456770293760
rumorstransfers;11/01/2018 13:34;1;0;Valencia confirm the signing of Francis Coquelin from Arsenal on a contract until 2022.;;;;9,51477E+17;https://twitter.com/rumorstransfers/status/951477357155676161
TundeBharbs96;11/01/2018 13:34;0;0;Good luck Francis Coquelin .;;;;9,51477E+17;https://twitter.com/TundeBharbs96/status/951477354286764033
eplfeeds;11/01/2018 13:34;0;0;Francis Coquelin completes move from Arsenal to Valencia #epl @MailSport : Francis Coquelin has agreed to join LaLiga side Valencia on a four-and-a-half-year contract following a decade with Arsenal, the Spanish club announced on Thursday. http:// dlvr.it/Q9pWCH;;@MailSport;#epl;9,51477E+17;https://twitter.com/eplfeeds/status/951477321982124032
TFS_Arsenal;11/01/2018 13:34;0;0;New: Confirmed: Valencia sign Francis Coquelin http:// p1r.es/2CSZufl #arsenal #afc pic.twitter.com/egJEB6DysH http:// dlvr.it/Q9pW8y;;;#arsenal #afc;9,51477E+17;https://twitter.com/TFS_Arsenal/status/951477318832156673
Ebo_Pedrito;11/01/2018 13:34;0;0;OFFICIAL: Valencia have signed midfielder Francis Coquelin from Arsenal for £12million on a contract until 2022. pic.twitter.com/xj0QLbHzaO;;;;9,51477E+17;https://twitter.com/Ebo_Pedrito/status/951477307448971264
ScugoCom;11/01/2018 13:33;0;0;Francis Coquelin leaves Arsenal to sign for La Liga club Valencia http:// scugo.com/spain/la-liga/ francis-coquelin-leaves-arsenal-to-sign-for-la-liga-club-valencia/ … pic.twitter.com/nRetagrtCV;;;;9,51477E+17;https://twitter.com/ScugoCom/status/951477293658107904
FCEArsenal;11/01/2018 13:33;0;0;Arsenal news: Arsene Wenger backs Ainsley Maitland-Niles to replace Francis Coquelin .. http://www. fcexclusive.com/news/arsenal/a rsenal-news-arsene-wenger-backs-ainsley-maitland-niles-to-replace-francis-coquelin-in-midfield-5000245 … (Source: IB Times);;;;9,51477E+17;https://twitter.com/FCEArsenal/status/951477244488245248
FCEArsenal;11/01/2018 13:33;0;0;Francis Coquelin Officially Seals Valencia Move After Nearly a Decade With Arsenal http://www. fcexclusive.com/news/arsenal/f rancis-coquelin-officially-seals-valencia-move-after-nearly-a-decade-with-arsenal-5000253 … (Source: 90min);;;;9,51477E+17;https://twitter.com/FCEArsenal/status/951477236481261574
aChillMonger;11/01/2018 13:33;0;0;Francis Coquelin agrees to join Valencia http:// po.st/fxJ1Vu via @po_st;;@po_st;;9,51477E+17;https://twitter.com/aChillMonger/status/951477222493192192
JamesLaLiga;11/01/2018 13:33;0;0;It’s official! Francis #Coquelin is a #Valencia player. https:// twitter.com/valenciacf_en/ status/951468963443171328 …;;;#Coquelin #Valencia;9,51477E+17;https://twitter.com/JamesLaLiga/status/951477194370486272
Socca90;11/01/2018 13:33;0;0;Francis Coquelin leaves Arsenal to sign for La Liga club Valencia http:// ift.tt/2D3LbZC;;;;9,51477E+17;https://twitter.com/Socca90/status/951477188125184000
RomanoFirstHalf;11/01/2018 13:33;1;6;OFFICIAL: Francis Coquelin has completed his move to Valencia. Goodluck out there! Thoughts? #afc pic.twitter.com/dc8pULtGEz;;;#afc;9,51477E+17;https://twitter.com/RomanoFirstHalf/status/951477146282754048
LWOSworld;11/01/2018 13:33;0;0;Francis Coquelin Leaves Arsenal for Valencia - http:// lwosonfootball.ms.lastwordonsports.com/2018/01/11/fra ncis-coquelin-leaves-arsenal-valencia/ … via @LastWordFC;;@LastWordFC;;9,51477E+17;https://twitter.com/LWOSworld/status/951477080943923201
LWOSUK;11/01/2018 13:33;1;0;Francis Coquelin Leaves Arsenal for Valencia - http:// lwosonfootball.ms.lastwordonsports.com/2018/01/11/fra ncis-coquelin-leaves-arsenal-valencia/ …;;;;9,51477E+17;https://twitter.com/LWOSUK/status/951477079475879938
lastwordonsport;11/01/2018 13:33;1;1;Francis Coquelin Leaves Arsenal for Valencia - http:// lwosonfootball.ms.lastwordonsports.com/2018/01/11/fra ncis-coquelin-leaves-arsenal-valencia/ … via @LastWordFC;;@LastWordFC;;9,51477E+17;https://twitter.com/lastwordonsport/status/951477078171504640
LastWordFC;11/01/2018 13:33;1;0;Francis Coquelin Leaves Arsenal for Valencia - http:// lwosonfootball.ms.lastwordonsports.com/2018/01/11/fra ncis-coquelin-leaves-arsenal-valencia/ …;;;;9,51477E+17;https://twitter.com/LastWordFC/status/951477076871340033
extra_time_talk;11/01/2018 13:33;0;0;Francis Coquelin Leaves Arsenal for Valencia - http:// lwosonfootball.ms.lastwordonsports.com/2018/01/11/fra ncis-coquelin-leaves-arsenal-valencia/ …;;;;9,51477E+17;https://twitter.com/extra_time_talk/status/951477075407527937
elioda_n;11/01/2018 13:33;0;0;Valencia have completed the signing of French midfielder Francis Coquelin from Arsenal on a deal until 2022 #TransferNews;;;#TransferNews;9,51477E+17;https://twitter.com/elioda_n/status/951477073306177536
wixsports;11/01/2018 13:32;1;0;Francis Coquelin completes move from Arsenal to Valencia - http:// wixsports.com/francis-coquel in-completes-move-from-arsenal-to-valencia/ … #sports pic.twitter.com/xydXPcjKnF;;;#sports;9,51477E+17;https://twitter.com/wixsports/status/951476978422550530
TransferNewsCen;11/01/2018 13:32;62;96;OFFICIAL: Valencia have signed midfielder Francis Coquelin from Arsenal for £12million on a contract until 2022. pic.twitter.com/sEsBuLm6rQ;;;;9,51477E+17;https://twitter.com/TransferNewsCen/status/951476971959144449
ShiemaLove;11/01/2018 13:32;0;0;Spanish outfits Valencia confirmed that they have reached an agreement with Arsenal for French midfielder Francis Coquelin who will sign a 4-and-a-half-year deal with a release clause set at €80M.;;;;9,51477E+17;https://twitter.com/ShiemaLove/status/951476922499944448
SoccerTipsOnlin;11/01/2018 13:32;0;0;New post: Francis Coquelin Officially Seals Valencia Move After Nearly a Decade With Arsenal http://www. soccertipsonline.com/2018/01/11/fra ncis-coquelin-officially-seals-valencia-move-after-nearly-a-decade-with-arsenal/ …;;;;9,51477E+17;https://twitter.com/SoccerTipsOnlin/status/951476885065740290
sdouglas80;11/01/2018 13:32;0;0;Valencia announce the signing of Francis Coquelin and say he has a release clause of 80 million euros #AFC;;;#AFC;9,51477E+17;https://twitter.com/sdouglas80/status/951476873774714881
Olu_tee;11/01/2018 13:32;0;2;This man gives his all when in an arsenal shirt. Thanks for your services Francis Coquelin #lecoq pic.twitter.com/bdMtVpaA49;;;#lecoq;9,51477E+17;https://twitter.com/Olu_tee/status/951476832737652736
TEAMtalk;11/01/2018 13:31;1;0;Done Deal: Valencia announce they have signed Arsenal midfielder Francis Coquelin , and his buyout clause is something else! http://www. teamtalk.com/news/valencia- complete-coquelin-transfer-and-insert-mega-buyout-clause … pic.twitter.com/LlpYg6op1I;;;;9,51477E+17;https://twitter.com/TEAMtalk/status/951476789787885568
TrustyTransfers;11/01/2018 13:31;84;360;Francis Coquelin has joined Valencia for £12m. pic.twitter.com/9f4yctPlZb;;;;9,51477E+17;https://twitter.com/TrustyTransfers/status/951476778576596992
EFL_TRANSFERS17;11/01/2018 13:31;0;0;BREAKING: Valencia confirm signing of Francis Coquelin from @Arsenal on contract until 2022. #SSN pic.twitter.com/u4QX3YW245 pic.twitter.com/pPVFiySZdR;;@Arsenal;#SSN;9,51477E+17;https://twitter.com/EFL_TRANSFERS17/status/951476775829360642
PAdugout;11/01/2018 13:31;2;0;French midfielder Francis Coquelin bids adieu to @Arsenal after signing a four-and-a-half-year contract @valenciacf_en pic.twitter.com/lKcAHAMa42;;@Arsenal @valenciacf_en;;9,51477E+17;https://twitter.com/PAdugout/status/951476750848053248
Vintage_Gunner;11/01/2018 13:31;1;2;Francis Coquelin has officially left Arsenal to Valencia for a reported £12m http:// bleacherreport.com/post/uk-nation al/17bda41b-3cd0-41f1-b49d-d56acee90472?share=twitter …;;;;9,51477E+17;https://twitter.com/Vintage_Gunner/status/951476710435901440
DeswiseDenn;11/01/2018 13:31;0;0;Selling Le Cog ( Francis Coquelin ) and leaving Mohammed Elneny does not make sense-- At least Coquelin is a... https:// fb.me/7vDYQOqmr;;;;9,51477E+17;https://twitter.com/DeswiseDenn/status/951476697005740032
DeswiseDenn;11/01/2018 13:31;0;0;Selling Le Cog ( Francis Coquelin ) and leaving Mohammed Elneny does not make sense-- At least Coquelin is a defensive midfielder. What sort of midfielder is Elneny? I am confused about his best position;;;;9,51477E+17;https://twitter.com/DeswiseDenn/status/951476688852078592
AnuaryMgonde;11/01/2018 13:31;0;0;#TransferUpdates . Francis Coquelin has joined #Valencia from #Arsenal for a reported £12M,… https://www. instagram.com/p/Bd0HW86B7kM/;;;#TransferUpdates #Valencia #Arsenal;9,51477E+17;https://twitter.com/AnuaryMgonde/status/951476678068457472
Rotoworld_PL;11/01/2018 13:31;0;0;Francis Coquelin moves to Valencia http:// tinyurl.com/y8o8p7gf;;;;9,51477E+17;https://twitter.com/Rotoworld_PL/status/951476634435117056
arsenalbuzztap;11/01/2018 13:31;0;1;dailymail​.co​.uk >> Francis Coquelin completes move from Arsenal to Valencia http:// buzztap.com/-erB9YH;;;;9,51477E+17;https://twitter.com/arsenalbuzztap/status/951476605901254658
LaLigaFanBoy;11/01/2018 13:30;0;0;Francis Coquelin for Arsenal in the Premier League: 105 games 264 (73%) tackles won 244 interceptions 139 clearances 85 chances created 84 take-ons completed Defensively strong. Via Squawka Football https:// twitter.com/ashishkumrrome a/status/951474802832826368 …;;;;9,51477E+17;https://twitter.com/LaLigaFanBoy/status/951476531531927552
PremPlace;11/01/2018 13:30;0;0;It has been confirmed that Francis Coquelin has signed for Valencia from #Arsenal . The few is rumoured to be about £12m.;;;#Arsenal;9,51477E+17;https://twitter.com/PremPlace/status/951476525601361926
footietheory;11/01/2018 13:30;0;0;Football news... Francis Coquelin : Valencia agree to sign Arsenal midfielder - Valencia agree to sign French midfielder Francis Coquelin from Arsenal for a reported £12m. http:// ow.ly/LHQK50g5OPX;;;;9,51476E+17;https://twitter.com/footietheory/status/951476493988884480
iArsenalApp;11/01/2018 13:30;0;0;90Min: Francis Coquelin Officially Seals Valencia Move After Nearly a Decade With Arsen... http://www. football-news365.co.uk/go/82275944;;;;9,51476E+17;https://twitter.com/iArsenalApp/status/951476386614726657
DeswiseDenn;11/01/2018 13:30;0;0;Selling Le Cog ( Francis Coquelin ) and leaving Mohammed Elneny does make sense-- At least Coquelin is a defensive... https:// fb.me/6glzYdOzQ;;;;9,51476E+17;https://twitter.com/DeswiseDenn/status/951476377332649984
Coral;11/01/2018 13:30;5;41;Francis Coquelin has officially joined Valencia. 10 years at the club. 160 appearances. 0 goals. pic.twitter.com/LnbRbR8s5a;;;;9,51476E+17;https://twitter.com/Coral/status/951476374560272389
ArsenalFCAddict;11/01/2018 13:30;0;0;#Arsenal FC #transfer news: Francis Coquelin completes move to LaLiga side #Valencia | Talk Sport http://www. football-addict.com/article/arsena l-fc/talksport/5a57819ae05447426070d1da/arsenal-fc-transfer-news-francis-coquelin-completes-move-to-laliga-side-valencia?lang=en&utm_campaign=post-auto&utm_medium=twitter&utm_source=arsenal-addict-en …;;;#Arsenal #transfer #Valencia;9,51476E+17;https://twitter.com/ArsenalFCAddict/status/951476372282728448
ArsenalFCAddict;11/01/2018 13:30;0;0;#Valencia complete £12m move for #Arsenal midfielder Francis Coquelin with £71m release clause | Mirror http://www. football-addict.com/article/arsena l-fc/mirror/5a5781b4e05447426070d1e0/valencia-complete-12m-move-for-arsenal-midfielder-francis-coquelin-with-71m-release-clause?lang=en&utm_campaign=post-auto&utm_medium=twitter&utm_source=arsenal-addict-en …;;;#Valencia #Arsenal;9,51476E+17;https://twitter.com/ArsenalFCAddict/status/951476370823147520
TransferBibIe;11/01/2018 13:30;8;54;Done Deal Valencia have confirmed the signing of Francis Coquelin from Arsenal on a contract until 2022 for a deal worth £12m and a buyout clause of £71m pic.twitter.com/fnU9rjR2ID;;;;9,51476E+17;https://twitter.com/TransferBibIe/status/951476370454077440
ArsenalFCAddict;11/01/2018 13:30;0;0;#Valencia insert €80million release clause after Francis Coquelin signs from #Arsenal | Evening Standard http://www. football-addict.com/article/arsena l-fc/standard/5a5781b4e05447426070d1e2/valencia-insert-80million-release-clause-after-francis-coquelin-signs-from-arsenal?lang=en&utm_campaign=post-auto&utm_medium=twitter&utm_source=arsenal-addict-en …;;;#Valencia #Arsenal;9,51476E+17;https://twitter.com/ArsenalFCAddict/status/951476369061498882
DeswiseDenn;11/01/2018 13:30;0;0;Selling Le Cog ( Francis Coquelin ) and leaving Mohammed Elneny does make sense-- At least Coquelin is a defensive midfielder. What sort of midfielder is Elneny? I am confused about his best position;;;;9,51476E+17;https://twitter.com/DeswiseDenn/status/951476368231030784
MichaelImianvan;11/01/2018 13:30;1;2;OFFICIAL: Francis Coquelin has joined Valencia from Arsenal for a reported £12m, signing a contract until June 2022. pic.twitter.com/YB3Hj4ePTe;;;;9,51476E+17;https://twitter.com/MichaelImianvan/status/951476363797712896
