username;date;retweets;favorites;text;geo;mentions;hashtags;id;permalink
SoccersAm_;11/01/2018 15:01;0;1;Francis Coquelin completes move from Arsenal to Valencia pic.twitter.com/4BKGYxMEf3;;;;9,51499E+17;https://twitter.com/SoccersAm_/status/951499222712487938
FootyHubHQ;11/01/2018 15:01;0;0;Francis Coquelin completes move from Arsenal to Valencia pic.twitter.com/CTSGI9We3L;;;;9,51499E+17;https://twitter.com/FootyHubHQ/status/951499205184507904
HotUteh;11/01/2018 15:00;0;0;Welcome to Ruthnekky's blog: Francis Coquelin completes move to Valencia from A... http:// nnekatheposer.blogspot.com/2018/01/franci s-coquelin-completes-move-to.html?spref=tw …;;;;9,51499E+17;https://twitter.com/HotUteh/status/951499164126470144
GunnersReddit;11/01/2018 15:00;0;0;Francis Coquelin First Interview as a Valencia Player. https:// redd.it/7pozxg;;;;9,51499E+17;https://twitter.com/GunnersReddit/status/951498966352515072
YMutawe;11/01/2018 14:59;0;0;@Arsenal ​ midfielder Francis Coquelin joins Valencia for £10.6million signing a four-and-a-half-year contract. pic.twitter.com/fwq8ccySz3;;@Arsenal;;9,51499E+17;https://twitter.com/YMutawe/status/951498807547715584
MagnusEnt_Mag;11/01/2018 14:59;0;0;Valencia Confirm £12m Signing Of Francis Coquelin From Arsenal: Valencia have confirmed the… https:// goo.gl/fb/berQ25;;;;9,51499E+17;https://twitter.com/MagnusEnt_Mag/status/951498700395868160
W0RLDSOCCERNEWS;11/01/2018 14:57;0;0;Valencia confirm Coquelin deal: Valencia have announced the signing of Francis Coquelin … https:// goo.gl/fb/zHJaZY;;;;9,51498E+17;https://twitter.com/W0RLDSOCCERNEWS/status/951498276150366209
sallu_hajaree;11/01/2018 14:55;0;1;Francis Coquelin to Valencia confirmed. Now watch Wenger sign no fukn replacement.;;;;9,51498E+17;https://twitter.com/sallu_hajaree/status/951497908053999616
ellishossack;11/01/2018 14:55;0;0;Francis Coquelin , one of the most passionate players I have ever seen. Good Luck at Valencia! Hopefully this isn't goodbye forever pic.twitter.com/H9B7BUXfAK;;;;9,51498E+17;https://twitter.com/ellishossack/status/951497743037554690
mpnaija;11/01/2018 14:55;0;0;MPNAIJA GIST:Valencia Confirm £12m Signing Of Francis Coquelin From Arsenal http:// dlvr.it/Q9q3ZS pic.twitter.com/1gqQrlxNXy;;;;9,51498E+17;https://twitter.com/mpnaija/status/951497729187880960
precious11117;11/01/2018 14:55;0;0;MPNAIJA GIST:Valencia Confirm £12m Signing Of Francis Coquelin From Arsenal http:// dlvr.it/Q9q3d8 pic.twitter.com/dEmzMKuHCC;;;;9,51498E+17;https://twitter.com/precious11117/status/951497727874969600
precious11117;11/01/2018 14:55;0;0;MPNAIJA GIST:Valencia Confirm £12m Signing Of Francis Coquelin From Arsenal http:// dlvr.it/Q9q3W1 pic.twitter.com/UMGFTJqY7l;;;;9,51498E+17;https://twitter.com/precious11117/status/951497718593044480
_keatings;11/01/2018 14:54;0;0;Francis Coquelin an interesting loan signing for @valenciacf . Don't see how he can walk straight in though, with Kondogbia, Parejo, Soler, Guedes and Pereira all performing well.;;@valenciacf;;9,51498E+17;https://twitter.com/_keatings/status/951497673437310976
frostc79;11/01/2018 14:54;1;4;Best of luck Francis Coquelin . I hope your next chapter goes well. #goonerfamily #afc;;;#goonerfamily #afc;9,51498E+17;https://twitter.com/frostc79/status/951497646581145600
TransferRumou14;11/01/2018 14:54;0;0;DEAL DONE Valencia have completed the £12m signing of Francis Coquelin from Arsenal. He's signed a deal until 2022 ( @valenciacf ) #AFC #Valencia pic.twitter.com/sUkZuArrnm;;@valenciacf;#AFC #Valencia;9,51498E+17;https://twitter.com/TransferRumou14/status/951497549667622913
jmak316;11/01/2018 14:54;0;0;Surely the most useless stipulation of any contract of all time? #FrancisCoquelin has a buy out clause of £70million. #wtf #TransferTalk #TransferWindow;;;#FrancisCoquelin #wtf #TransferTalk #TransferWindow;9,51498E+17;https://twitter.com/jmak316/status/951497549554372609
coolemson2013;11/01/2018 14:54;0;0;Francis Coquelin completes move from Arsenal to Valencia http:// dailym.ai/2FtCSnl via @MailSport;;@MailSport;;9,51497E+17;https://twitter.com/coolemson2013/status/951497446386958336
FCEWesthamutd;11/01/2018 14:53;0;0;Francis Coquelin swaps Arsenal for Valencia http://www. fcexclusive.com/news/west-ham- utd/francis-coquelin-swaps-arsenal-for-valencia-5000838 … (Source: ITV);;;;9,51497E+17;https://twitter.com/FCEWesthamutd/status/951497222105034752
nicks_mufc;11/01/2018 14:52;1;0;Francis Coquelin does not deserve to be club like Valencia CF! This guy deserves to be in some Mid-table French Ligue 1 club! #PL #FPL @OfficialFPL @premierleague #Coquelin #Arsenal #AFC #puma #Ligue1 #Valencia pic.twitter.com/ERGSRyhK3j;;@OfficialFPL @premierleague;#PL #FPL #Coquelin #Arsenal #AFC #puma #Ligue1 #Valencia;9,51497E+17;https://twitter.com/nicks_mufc/status/951497110926409730
Waziuu_Junaid;11/01/2018 14:52;0;0;Francis Coquelin is a decent player, servant for @Arsenal Best of luck in your new journey pic.twitter.com/ogtaOrh0ft;;@Arsenal;;9,51497E+17;https://twitter.com/Waziuu_Junaid/status/951497063916822529
Rosicky_Indo;11/01/2018 14:52;0;0;#ArsenalNews Francis Coquelin agrees to join Valencia http:// dlvr.it/Q9q2dn;;;#ArsenalNews;9,51497E+17;https://twitter.com/Rosicky_Indo/status/951496962934693888
TweetNaijaBlog;11/01/2018 14:51;0;0;Spanish La Liga side, Valencia CF, has on Thursday, January 11, announced the signing of Francis Coquelin from Arsenal in a deal reportedly worth £12 million as the defensive midfielder leaves the EPL club after 10 years. pic.twitter.com/TUDRVQqOra;;;;9,51497E+17;https://twitter.com/TweetNaijaBlog/status/951496863814946817
chrinho;11/01/2018 14:51;0;0;To be fair I'll miss Francis Coquelin;;;;9,51497E+17;https://twitter.com/chrinho/status/951496862539878401
EliteOffers;11/01/2018 14:50;0;0;Francis Coquelin completes move from Arsenal to Valencia pic.twitter.com/Z2nWcBV4lA;;;;9,51497E+17;https://twitter.com/EliteOffers/status/951496541092614144
paulmega64;11/01/2018 14:50;0;0;"Francis Coquelin is officially a Valencia player! • Reported £12m fee • Signs a contract until 2022 • Won the FA Cup twice with Arsenal I have seen the team, they are going along very well, they are third in the table."" #Paulmega64""";;;#Paulmega64;9,51496E+17;https://twitter.com/paulmega64/status/951496471391719425
KoooraAe;11/01/2018 14:49;0;0;Valencia sign Coquelin, take no chances with buy-out clause: Francis Coquelin has agreed to… https:// goo.gl/fb/V2xKM1;;;;9,51496E+17;https://twitter.com/KoooraAe/status/951496411086024704
Joviland964;11/01/2018 14:49;0;0;#Francis Coquelin https:// twitter.com/valenciacf/sta tus/951496043606282240 …;;;#Francis;9,51496E+17;https://twitter.com/Joviland964/status/951496305980911619
EPLStuff;11/01/2018 14:45;18;21;OFFICIAL: Valencia have completed the £12m signing of Francis Coquelin from Arsenal. pic.twitter.com/ncECuX5VIg;;;;9,51495E+17;https://twitter.com/EPLStuff/status/951495393120063488
official_nkosi;11/01/2018 14:45;1;0;Francis Coquelin . Our 2015 player of the year, definitely gonna miss him. Showed so much passion. Just lacked the hunger once he got established but I'm sure he'll flourish in La Liga.;;;;9,51495E+17;https://twitter.com/official_nkosi/status/951495336429850624
ROADMANBOT;11/01/2018 14:44;0;0;bare mans be chattin about Francis Coquelin;;;;9,51495E+17;https://twitter.com/ROADMANBOT/status/951494929200672768
FCEArsenal;11/01/2018 14:43;0;0;Francis Coquelin Officially Seals Valencia Move After Nearly a Decade With Arsenal http://www. fcexclusive.com/news/arsenal/f rancis-coquelin-officially-seals-valencia-move-after-nearly-a-decade-with-arsenal-5000837 … (Source: Sports Illustrated);;;;9,51495E+17;https://twitter.com/FCEArsenal/status/951494898976526336
FCEArsenal;11/01/2018 14:43;0;0;Francis Coquelin swaps Arsenal for Valencia http://www. fcexclusive.com/news/arsenal/f rancis-coquelin-swaps-arsenal-for-valencia-5000838 … (Source: ITV);;;;9,51495E+17;https://twitter.com/FCEArsenal/status/951494851836686337
DjChigga;11/01/2018 14:43;0;0;Valencia Confirm £12m Signing Of Francis Coquelin From Arsenal | http:// 360Nobs.com https:// fb.me/EO9P6pAk;;;;9,51495E+17;https://twitter.com/DjChigga/status/951494788997615617
Super_Ferra;11/01/2018 14:43;3;9;Francis Coquelin at Arsenal: 160 appearances 0 goals 3 assists 28 yellow cards 1 red card What exactly are you thanking him for??;;;;9,51495E+17;https://twitter.com/Super_Ferra/status/951494767501807616
ChiaLook;11/01/2018 14:43;0;0;The guy is a beast! Watch him rule in Spain. Good luck @FrancisCoquelin you will be missed.;;@FrancisCoquelin;;9,51495E+17;https://twitter.com/ChiaLook/status/951494710555824129
indexfootball;11/01/2018 14:43;0;0;Francis Coquelin Officially Seals Valencia Move After Nearly a Decade With Arsenal http:// dlvr.it/Q9pz8Q;;;;9,51495E+17;https://twitter.com/indexfootball/status/951494682470567936
brown_buzi;11/01/2018 14:42;1;0;Francis Coquelin has joined Valencia from Arsenal for a reported £12m, signing a contract until June 2022. pic.twitter.com/KEXYjvtSgd;;;;9,51495E+17;https://twitter.com/brown_buzi/status/951494599788367872
i_am_aoejnr;11/01/2018 14:42;0;0;Valencia confirm signing of Francis Coquelin . Contract until 2022. pic.twitter.com/6BwgjPyZNi;;;;9,51495E+17;https://twitter.com/i_am_aoejnr/status/951494564308832257
andrewsoar;11/01/2018 14:42;0;0;Good luck to Francis Coquelin - a player who always gave his best and was hugely undervalued. Sad say to see him leave @Arsenal pic.twitter.com/jQRAIR8jje;;@Arsenal;;9,51494E+17;https://twitter.com/andrewsoar/status/951494477574754304
Whittz10;11/01/2018 14:42;0;2;What a career Francis Coquelin had at Arsenal: 2 FA Cups 3 Community Shields 0 Europa/Champions Leagues 0 Premier League Titles 0 Captial One Cups 0 Goals 1 Assist 17 Yellow cards 1 Red Card Crikey what a player. That's Francis Coquelin for you;;;;9,51494E+17;https://twitter.com/Whittz10/status/951494411954868225
footballmanics;11/01/2018 14:41;0;2;Arsenal have confirmed that Francis Coquelin has joined Valencia for an undisclosed fee, thought to be around £12m. https:// footballmanics.com/home/arsenal/f rancis-coquelin-leaves-arsenal-to-join-valencia-r2953/ …;;;;9,51494E+17;https://twitter.com/footballmanics/status/951494298893209601
manas_akram;11/01/2018 14:40;0;0;Francis Coquelin : Frenchman Coquelin leaves Arsenal for Valencia | Football News https://www. latesthubnews.com/2018/01/franci s-coquelin-frenchman-coquelin-leaves-arsenal-for-valencia-football-news.html … pic.twitter.com/zW76yQwcIn;;;;9,51494E+17;https://twitter.com/manas_akram/status/951494014708211715
neerajbeck;11/01/2018 14:39;0;0;Good Luck for you Future.... #FrancisCoquelin .... Will miss you.... #CoqTheBlock https:// twitter.com/Arsenal/status /951469542387134465 …;;;#FrancisCoquelin #CoqTheBlock;9,51494E+17;https://twitter.com/neerajbeck/status/951493815415664641
Areal3000;11/01/2018 14:39;0;0;Valencia Confirm £12m Signing Of Francis Coquelin From Arsenal http:// darkyblog.joorjoor.com/2018/01/11/val encia-confirm-12m-signing-of-francis-coquelin-from-arsenal/ …;;;;9,51494E+17;https://twitter.com/Areal3000/status/951493769756594176
in_form_99;11/01/2018 14:39;0;0;FIDGET SPINNER * Francis Coquelin Arsenal to Valencia £10 milion After faking a career at Arsenal and scoring 0 goals. The French midfield has finally moved on from the emirates. After what Hazard did to him it’s surprising he even got a move to a decent club. … pic.twitter.com/HNIZBrMFaT;;;;9,51494E+17;https://twitter.com/in_form_99/status/951493724869222401
ondu1;11/01/2018 14:39;0;0;Valencia sign Coquelin: Valencia have confirmed the signing of midfielder Francis Coquelin … https:// goo.gl/fb/9uiQJT;;;;9,51494E+17;https://twitter.com/ondu1/status/951493709740367874
Super_Ferra;11/01/2018 14:39;2;0;Francis Coquelin at Arsenal: 160 appearances 0 goals 3 assists 28 yellow cards 1 red card;;;;9,51494E+17;https://twitter.com/Super_Ferra/status/951493657353482240
Breaklng__News;11/01/2018 14:36;0;0;Valencia Confirm £12m Signing Of Francis Coquelin From Arsenal https://www. 360nobs.com/2018/01/valenc ia-confirm-12m-signing-of-francis-coquelin-from-arsenal/ … pic.twitter.com/liRbAreBZV;;;;9,51493E+17;https://twitter.com/Breaklng__News/status/951493074387025921
datboyjerry;11/01/2018 14:36;0;0;Valencia have confirmed the signing of Francis Coquelin from Arsenal on a contract until 2022. Francis Coquelin ,... https:// fb.me/GybrYlmt;;;;9,51493E+17;https://twitter.com/datboyjerry/status/951493064954032128
360Nobs;11/01/2018 14:36;2;0;Valencia Confirm £12m Signing Of Francis Coquelin From Arsenal https://www. 360nobs.com/2018/01/valenc ia-confirm-12m-signing-of-francis-coquelin-from-arsenal/ … pic.twitter.com/zeSITMdvGb;;;;9,51493E+17;https://twitter.com/360Nobs/status/951493056460554240
datboyjerry;11/01/2018 14:36;0;0;Valencia Confirm £12m Signing Of Francis Coquelin From Arsenal https://www. 360nobs.com/2018/01/valenc ia-confirm-12m-signing-of-francis-coquelin-from-arsenal/ … pic.twitter.com/Kik7fuRZsb;;;;9,51493E+17;https://twitter.com/datboyjerry/status/951493011636023296
Sylvia_Tailor;11/01/2018 14:36;0;0;Valencia Confirm £12m Signing Of Francis Coquelin From Arsenal https://www. 360nobs.com/2018/01/valenc ia-confirm-12m-signing-of-francis-coquelin-from-arsenal/ … pic.twitter.com/qYJZ1KthMW;;;;9,51493E+17;https://twitter.com/Sylvia_Tailor/status/951492977750257664
dprincefanclub;11/01/2018 14:36;0;0;Valencia Confirm £12m Signing Of Francis Coquelin From Arsenal https://www. 360nobs.com/2018/01/valenc ia-confirm-12m-signing-of-francis-coquelin-from-arsenal/ … pic.twitter.com/8rg7sSw9Vw;;;;9,51493E+17;https://twitter.com/dprincefanclub/status/951492960259944449
_thesf6;11/01/2018 14:36;0;1;Goodbye Francis Coquelin pic.twitter.com/kg1C2d4yYo;;;;9,51493E+17;https://twitter.com/_thesf6/status/951492945642844160
AnneToniaA;11/01/2018 14:36;0;0;Valencia Confirm £12m Signing Of Francis Coquelin From Arsenal https://www. 360nobs.com/2018/01/valenc ia-confirm-12m-signing-of-francis-coquelin-from-arsenal/ … pic.twitter.com/6T9LZyVMtn;;;;9,51493E+17;https://twitter.com/AnneToniaA/status/951492910083485701
Nobsdaslushhkid;11/01/2018 14:35;0;0;Valencia Confirm £12m Signing Of Francis Coquelin From Arsenal https://www. 360nobs.com/2018/01/valenc ia-confirm-12m-signing-of-francis-coquelin-from-arsenal/ … pic.twitter.com/lVRJdq1dF0;;;;9,51493E+17;https://twitter.com/Nobsdaslushhkid/status/951492892513648640
oyeakd;11/01/2018 14:35;0;0;Valencia Confirm £12m Signing Of Francis Coquelin From Arsenal https://www. 360nobs.com/2018/01/valenc ia-confirm-12m-signing-of-francis-coquelin-from-arsenal/ … pic.twitter.com/ierz9Zx5xd;;;;9,51493E+17;https://twitter.com/oyeakd/status/951492873328848896
FTL_Live;11/01/2018 14:35;0;1;DONE DEAL - Valencia have signed Francis Coquelin for £12m from Arsenal. #AFC #Arsenalfc pic.twitter.com/sZlspnEc00;;;#AFC #Arsenalfc;9,51493E+17;https://twitter.com/FTL_Live/status/951492685046657024
nicks_mufc;11/01/2018 14:34;0;0;Francis Coquelin deserves to be in some Mid-table French Ligue 1 club! His luck is very good that club like Valencia CF signed him! Valencia CF is great club, Coquelin dont belong there! Heck he doesn't even belong in club like Arsenal! #Coquelin;;;#Coquelin;9,51493E+17;https://twitter.com/nicks_mufc/status/951492574325297152
CEOArsenal;11/01/2018 14:33;0;1;Francis Coquelin is off to @valenciacf for £12M. he played with passion this fella, got booked a few times but a decent player. Sad to see him go.;;@valenciacf;;9,51492E+17;https://twitter.com/CEOArsenal/status/951492225392922624
Ema_Ralte;11/01/2018 14:33;0;1;Francis Coquelin will wear no. '17'. pic.twitter.com/JUTDkI0nfp;;;;9,51492E+17;https://twitter.com/Ema_Ralte/status/951492213116092416
anonymousnthabi;11/01/2018 14:33;0;0;Francis Coquelin has agreed to join La Liga side Valencia on a four-and-a-half-year contract following a decade with Arsenal, the Spanish club announced on Thursday. pic.twitter.com/ON5DFeS3fP;;;;9,51492E+17;https://twitter.com/anonymousnthabi/status/951492170028060674
robinio73;11/01/2018 14:32;0;0;#FrancisCoquelin thank you and good luck. Loved your passion;;;#FrancisCoquelin;9,51492E+17;https://twitter.com/robinio73/status/951492116571676672
thefunnyoldgame;11/01/2018 14:31;0;0;Valencia sign Coquelin - Valencia have confirmed the signing of midfielder Francis Coquelin from Ars... http:// tinyurl.com/yaomhbro #iafog;;;#iafog;9,51492E+17;https://twitter.com/thefunnyoldgame/status/951491870588375040
socclab;11/01/2018 14:31;0;0;Francis Coquelin leaves Arsenal for Valencia in £10.8m deal: Valencia beat West Ham to the midfielder with Coq.. http:// dld.bz/g574Z;;;;9,51492E+17;https://twitter.com/socclab/status/951491695425835009
soccetalk;11/01/2018 14:31;0;1;Francis Coquelin leaves Arsenal for Valencia in £10.8m deal: Valencia beat West Ham to the midfielder with Coq.. http:// dld.bz/g574Z;;;;9,51492E+17;https://twitter.com/soccetalk/status/951491688425508864
bookmakersnews;11/01/2018 14:31;1;1;Francis Coquelin has joined #Valencia from #Arsenal for £12m. The 26-year-old defensive midfielder’s opportunities have dried up this season and the 26-year-old started only one game in the #PremierLeague #LaLiga pic.twitter.com/uos9pLnCFA;;;#Valencia #Arsenal #PremierLeague #LaLiga;9,51492E+17;https://twitter.com/bookmakersnews/status/951491687754452992
nsfooty;11/01/2018 14:31;0;0;Francis Coquelin leaves Arsenal for Valencia in £10.8m deal: Valencia beat West Ham to the midfielder with Coq.. http:// dld.bz/g574Z;;;;9,51492E+17;https://twitter.com/nsfooty/status/951491676454912007
footynew247;11/01/2018 14:31;0;0;Francis Coquelin leaves Arsenal for Valencia in £10.8m deal: Valencia beat West Ham to the midfielder with Coq.. http:// dld.bz/g574Z;;;;9,51492E+17;https://twitter.com/footynew247/status/951491669807026178
footynew24;11/01/2018 14:31;0;0;Francis Coquelin leaves Arsenal for Valencia in £10.8m deal: Valencia beat West Ham to the midfielder with Coq.. http:// dld.bz/g574Z;;;;9,51492E+17;https://twitter.com/footynew24/status/951491667638579200
footyn247;11/01/2018 14:31;0;0;Francis Coquelin leaves Arsenal for Valencia in £10.8m deal: Valencia beat West Ham to the midfielder with Coq.. http:// dld.bz/g574Z;;;;9,51492E+17;https://twitter.com/footyn247/status/951491665637801985
footyhlines;11/01/2018 14:31;0;0;Francis Coquelin leaves Arsenal for Valencia in £10.8m deal: Valencia beat West Ham to the midfielder with Coq.. http:// dld.bz/g574Z;;;;9,51492E+17;https://twitter.com/footyhlines/status/951491661569380354
footycor;11/01/2018 14:31;0;0;Francis Coquelin leaves Arsenal for Valencia in £10.8m deal: Valencia beat West Ham to the midfielder with Coq.. http:// dld.bz/g574Z;;;;9,51492E+17;https://twitter.com/footycor/status/951491648722296832
footballfbb;11/01/2018 14:30;0;0;Francis Coquelin leaves Arsenal for Valencia in £10.8m deal: Valencia beat West Ham to the midfielder with Coq.. http:// dld.bz/g574Z;;;;9,51492E+17;https://twitter.com/footballfbb/status/951491635090808832
nicks_mufc;11/01/2018 14:30;1;4;Francis Coquelin deserves to be in some Mid-table French Ligue 1 club! His luck is very good that club like Valencia CF signed him! Valencia CF is great club, Coquelin dont belong there! Heck he doesn't even belong in club like Arsenal! #Coquelin;;;#Coquelin;9,51492E+17;https://twitter.com/nicks_mufc/status/951491560205463552
Omgitsminabo;11/01/2018 14:30;0;1;thanks Francis Coquelin for what you've done @arsenal fc. Nice stay at valencia #coyg #CHEARS;;@arsenal;#coyg #CHEARS;9,51491E+17;https://twitter.com/Omgitsminabo/status/951491464952983553
MailSport;11/01/2018 14:30;17;36;Francis Coquelin completes £10.6m move from Arsenal to Valencia http:// dailym.ai/2EwPfho;;;;9,51491E+17;https://twitter.com/MailSport/status/951491452739227648
Sport_RightNow;11/01/2018 14:29;0;0;Francis Coquelin completes move from Arsenal to Valencia https:// goo.gl/fb/ZYQZ4x #mail;;;#mail;9,51491E+17;https://twitter.com/Sport_RightNow/status/951491339983736833
Rishavcric777;11/01/2018 14:29;0;0;DEAL DONE: Valencia have completed the £12 million signing of Francis Coquelin from Arsenal. The contract is up to 2022. pic.twitter.com/05Nnal3dcd;;;;9,51491E+17;https://twitter.com/Rishavcric777/status/951491216314527744
Totooo_18;11/01/2018 14:29;1;3;Francis Coquelin off to Valencia for £12m Never forget this moment when Eden Hazard turned him into a human fidget spinner and sent his career back to the Stone Age. #Coquelin pic.twitter.com/fIWrESTJaA;;;#Coquelin;9,51491E+17;https://twitter.com/Totooo_18/status/951491215836569600
AjihEjeh;11/01/2018 14:28;0;0;Valencia sign Coquelin It has been confirmed that Francis Coquelin has joined Valencia on a long-term deal for... https:// fb.me/1L8JdFMRr;;;;9,51491E+17;https://twitter.com/AjihEjeh/status/951491105329213440
cixqo;11/01/2018 14:28;0;0;Francis Coquelin has agreed to join #LaLiga side #Valencia on a four-and-a-half-year contract following a decade with #Arsenal , the #Spanish club announced on Thursday. Francis #Coquelin completed his £10.6million move to Valencia on Thursday pic.twitter.com/BNwF9qnZXH;;;#LaLiga #Valencia #Arsenal #Spanish #Coquelin;9,51491E+17;https://twitter.com/cixqo/status/951490919563481090
ArsenalFC_MP;11/01/2018 14:28;0;0;Francis Coquelin agrees to join Valencia: French midfielder to join La Liga side after making 160 first-team appearances for us since joining from Laval in 2008 http:// dlvr.it/Q9pt4V pic.twitter.com/nm9u3qKxBs;;;;9,51491E+17;https://twitter.com/ArsenalFC_MP/status/951490914937053184
osportsblog;11/01/2018 14:27;0;0;OFFICIAL : Valencia have completed the signing of Francis Coquelin from Arsenal in a deal worth £12m. #AFC pic.twitter.com/bipKKdirMM;;;#AFC;9,51491E+17;https://twitter.com/osportsblog/status/951490881965740032
Joviland964;11/01/2018 14:27;0;0;#Francis Coquelin https:// twitter.com/plazadeportiva _/status/951490780564283392 …;;;#Francis;9,51491E+17;https://twitter.com/Joviland964/status/951490837111861249
audujohnpaul;11/01/2018 14:27;0;0;Francis Coquelin First Interview as a Valencia Player. https:// youtu.be/795FfNCFBjE via @YouTube;;@YouTube;;9,51491E+17;https://twitter.com/audujohnpaul/status/951490797597315072
nicks_mufc;11/01/2018 14:27;0;0;Francis Coquelin deserves to be in some Mid-table French Ligue 1 club! His luck is very good that club like Valencia CF signed him! Valencia CF is great club, Coquelin dont belong there! Heck he doesn't even belong in club like Arsenal! #Coquelin;;;#Coquelin;9,51491E+17;https://twitter.com/nicks_mufc/status/951490750096683008
EPLnewsSKY;11/01/2018 14:27;0;1;Valencia sign Coquelin Valencia have confirmed the signing of midfielder Francis Coquelin from Arsenal on a four-and-a-half year deal with a £71.2m release clause in his contract. http:// ift.tt/2D2a9sn;;;;9,51491E+17;https://twitter.com/EPLnewsSKY/status/951490733353119744
FOOTYnewsSKY;11/01/2018 14:27;0;0;Valencia sign Coquelin Valencia have confirmed the signing of midfielder Francis Coquelin from Arsenal on a four-and-a-half year deal with a £71.2m release clause in his contract. http:// ift.tt/2D2a9sn;;;;9,51491E+17;https://twitter.com/FOOTYnewsSKY/status/951490707235201024
nicks_mufc;11/01/2018 14:27;0;0;Francis Coquelin deserves to be in some Mid-table French Ligue 1 club! His luck is very good that club like Valencia CF signed him! Valencia CF is great club, Coquelin dont belong there! Heck he doesn't even belong in club like Arsenal! #Coquelin;;;#Coquelin;9,51491E+17;https://twitter.com/nicks_mufc/status/951490673944899584
nicks_mufc;11/01/2018 14:27;0;0;Francis Coquelin deserves to be in some Mid-table French Ligue 1 club! His luck is very good that club like Valencia CF signed him! Valencia CF is great club, Coquelin dont belong there! Heck he doesn't even belong in club like Arsenal! #Coquelin;;;#Coquelin;9,51491E+17;https://twitter.com/nicks_mufc/status/951490637034999808
IsItSoccer;11/01/2018 14:26;0;0;Francis Coquelin has passed his medical and is now officially completed a £12m move to Valencia #TransferTalk #Valencia pic.twitter.com/WA0CwLCwro;;;#TransferTalk #Valencia;9,51491E+17;https://twitter.com/IsItSoccer/status/951490628180836353
btsportscore;11/01/2018 14:26;28;147;"Francis Coquelin is officially a Valencia player! • Reported £12m fee • Signs a contract until 2022 • Won the FA Cup twice with Arsenal I have seen the team, they are going along very well, they are third in the table."" #BTSportScore pic.twitter.com/l3Y5bK41bN""";;;#BTSportScore;9,5149E+17;https://twitter.com/btsportscore/status/951490482764468230
Arsenal_Fanly;11/01/2018 14:26;0;0;Valencia announce signing of Francis Coquelin from Arsenal on contract unt... #Arsenal https:// fanly.link/49757e3411 pic.twitter.com/OGJ1AnOWSf;;;#Arsenal;9,5149E+17;https://twitter.com/Arsenal_Fanly/status/951490395334115328
Gooners_Report;11/01/2018 14:25;9;17;Francis Coquelin at Arsenal: 160 appearances 0 goals 3 assists 28 yellow cards 1 red card #MerciCoq pic.twitter.com/Y3vCne8tYR;;;#MerciCoq;9,5149E+17;https://twitter.com/Gooners_Report/status/951490370919006208
jimmie_gay;11/01/2018 14:25;0;0;Francis Coquelin Just Quit Arsenal For Valencia http:// ift.tt/2D4l6Kc via @G4celeb;;@G4celeb;;9,5149E+17;https://twitter.com/jimmie_gay/status/951490337956081669
iReal_Cynthia;11/01/2018 14:25;0;0;Francis Coquelin Just Quit Arsenal For Valencia http:// ift.tt/2D4l6Kc via @g4celeb;;@g4celeb;;9,5149E+17;https://twitter.com/iReal_Cynthia/status/951490337549246466
Hot_Candy_B;11/01/2018 14:25;0;0;Francis Coquelin Just Quit Arsenal For Valencia http:// ift.tt/2D4l6Kc via @g4celeb;;@g4celeb;;9,5149E+17;https://twitter.com/Hot_Candy_B/status/951490337415065600
PipiDiva;11/01/2018 14:25;0;0;Francis Coquelin Just Quit Arsenal For Valencia http:// ift.tt/2D4l6Kc via @G4celeb;;@G4celeb;;9,5149E+17;https://twitter.com/PipiDiva/status/951490337167544321
