username;date;retweets;favorites;text;geo;mentions;hashtags;id;permalink
PMsoccer_;11/01/2018 17:10;0;0;Francis Coquelin claims he should have left Arsenal before pic.twitter.com/zaSEQFwZOX;;;;9,51532E+17;https://twitter.com/PMsoccer_/status/951531834734759936
SoccersAm_;11/01/2018 17:10;0;0;Francis Coquelin claims he should have left Arsenal before pic.twitter.com/nYI3BSBvbb;;;;9,51532E+17;https://twitter.com/SoccersAm_/status/951531825066860547
FootyHubHQ;11/01/2018 17:10;0;0;Francis Coquelin claims he should have left Arsenal before pic.twitter.com/P5XycJgFi0;;;;9,51532E+17;https://twitter.com/FootyHubHQ/status/951531820314710017
EPLFooty_;11/01/2018 17:10;0;1;Francis Coquelin claims he should have left Arsenal before pic.twitter.com/vQ1uks2ql4;;;;9,51532E+17;https://twitter.com/EPLFooty_/status/951531814539145222
SlySportsHQ;11/01/2018 17:10;0;0;Francis Coquelin is excited by the new challenge that awaits him at Valencia - but admits it is one he probab.. pic.twitter.com/ArRuQF80cJ;;;;9,51532E+17;https://twitter.com/SlySportsHQ/status/951531805475246081
BTSpurt_;11/01/2018 17:10;0;0;Francis Coquelin is excited by the new challenge that awaits him at Valencia - but admits it is one he probab.. pic.twitter.com/euhZHesTGK;;;;9,51532E+17;https://twitter.com/BTSpurt_/status/951531794163265536
MOTDnot;11/01/2018 17:10;0;0;Francis Coquelin claims he should have left Arsenal before pic.twitter.com/vp1Qj0YCzQ;;;;9,51532E+17;https://twitter.com/MOTDnot/status/951531755206475776
ArsenalFCAddict;11/01/2018 17:10;0;0;Francis Coquelin regrets not having left #Arsenal sooner for #Valencia #transfer | Evening Standard http://www. football-addict.com/article/arsena l-fc/standard/5a57b54ce054472da20a49cc/francis-coquelin-regrets-not-having-left-arsenal-sooner-for-valencia-transfer?lang=en&utm_campaign=post-auto&utm_medium=twitter&utm_source=arsenal-addict-en …;;;#Arsenal #Valencia #transfer;9,51532E+17;https://twitter.com/ArsenalFCAddict/status/951531738693554176
ArsenalFCAddict;11/01/2018 17:10;0;0;#Arsenal midfielder Francis Coquelin completes move to #Valencia | Sports Mole http://www. football-addict.com/article/arsena l-fc/sportsmole/5a57b54de054472da20a49cd/arsenal-midfielder-francis-coquelin-completes-move-to-valencia?lang=en&utm_campaign=post-auto&utm_medium=twitter&utm_source=arsenal-addict-en …;;;#Arsenal #Valencia;9,51532E+17;https://twitter.com/ArsenalFCAddict/status/951531735405289472
VCF__Nordic;11/01/2018 17:09;1;6;Francis Coquelin is the 14th French player in the Valencia history. pic.twitter.com/rc67nGOQ9S;;;;9,51532E+17;https://twitter.com/VCF__Nordic/status/951531574197211139
transfer_lines;11/01/2018 17:06;0;0;£12m transfer of Francis Coquelin to @valenciacf completed, the midfielder leaves @Arsenal after 10yrs pic.twitter.com/ZV0QdKoR8s;;@valenciacf @Arsenal;;9,51531E+17;https://twitter.com/transfer_lines/status/951530892232708096
adamsuprayit;11/01/2018 17:06;0;0;#HappyKyungsooDay #JODOHWASIATBAPAK436 La Nyalla #Indosiar23 #memetwit #ElshintaHits Francis Coquelin Frozen Air Mineral Switch Medicaid https:// twitter.com/KementerianLHK /status/951394603457916928 …;;;#HappyKyungsooDay #JODOHWASIATBAPAK436 #Indosiar23 #memetwit #ElshintaHits;9,51531E+17;https://twitter.com/adamsuprayit/status/951530855922507776
nglifestyle_ng;11/01/2018 17:06;0;0;#Nglifestyle #Sport #update (Arsenal midfielder Francis Coquelin completes move to Valencia) Valencia announce that they have completed the signing of Arsenal midfielder Francis Coquelin for a fee reportedly in the region of... https:// goo.gl/okTvHC pic.twitter.com/YuVdaMf41G;;;#Nglifestyle #Sport #update;9,51531E+17;https://twitter.com/nglifestyle_ng/status/951530765656952832
EliteOffers;11/01/2018 17:05;0;0;Francis Coquelin claims he should have left Arsenal before pic.twitter.com/s9uiWgOSl5;;;;9,5153E+17;https://twitter.com/EliteOffers/status/951530425666686977
Sport_RightNow;11/01/2018 17:04;0;0;Francis Coquelin claims he should have left Arsenal before https:// goo.gl/fb/RX3dQn #mail;;;#mail;9,5153E+17;https://twitter.com/Sport_RightNow/status/951530362018189312
English_AS;11/01/2018 17:04;12;20;"I almost regret not coming before"" Valencia have unveiled new signing Francis Coquelin https:// en.as.com/en/2018/01/11/ football/1515684871_432649.html … pic.twitter.com/z2s9KgWOrs""";;;;9,5153E+17;https://twitter.com/English_AS/status/951530272897499136
Abdul_Ent;11/01/2018 17:02;0;0;Arsenal’s Francis Coquelin completes Valencia move http:// dlvr.it/Q9qtdc pic.twitter.com/F8hLv42xI3;;;;9,5153E+17;https://twitter.com/Abdul_Ent/status/951529699997401088
FCEArsenal;11/01/2018 17:01;0;0;Arsenal midfielder Francis Coquelin completes move to Valencia http://www. fcexclusive.com/news/arsenal/a rsenal-midfielder-francis-coquelin-completes-move-to-valencia-5001583 … (Source: Sports Mole);;;;9,5153E+17;https://twitter.com/FCEArsenal/status/951529516094119938
RealClintone;11/01/2018 17:01;0;0;Good bye FRANCIS COQUELIN , your passion for @Arsenal was unmeasured, maybe you were not the problem, but you have to get new test and adventure. Personally i loved you. I shed tears for you. Success bro! #Coquelin #Arsenal @coquelin #COYG #WeAreTheArsenal #WengerOut #valencia;;@Arsenal @coquelin;#Coquelin #Arsenal #COYG #WeAreTheArsenal #WengerOut #valencia;9,51529E+17;https://twitter.com/RealClintone/status/951529451254374401
TransferScout;11/01/2018 17:01;0;0;Francis Coquelin claims he should have left Arsenal before http:// dlvr.it/Q9qtB5 pic.twitter.com/Ro8HHdJFzl;;;;9,51529E+17;https://twitter.com/TransferScout/status/951529423555063808
RoyJoe84;11/01/2018 17:00;0;0;All the best to #FrancisCoquelin in Valencia! A @Arsenal player for many years who took his chance and always gave his best despite his limitations! #Goodservant;;@Arsenal;#FrancisCoquelin #Goodservant;9,51529E+17;https://twitter.com/RoyJoe84/status/951529369545166848
waskco;11/01/2018 17:00;0;0;Transfer News: Done Deal: Valencia have completed the £12m signing of Francis Coquelin from… https://www. instagram.com/p/Bd0fKEzntJm/;;;;9,51529E+17;https://twitter.com/waskco/status/951529344463245313
_AllAboutFootie;11/01/2018 16:59;0;0;Thank you francis #coquelin #onceagunneralwaysagunner;;;#coquelin #onceagunneralwaysagunner;9,51529E+17;https://twitter.com/_AllAboutFootie/status/951529122873987072
Gooner0001;11/01/2018 16:59;0;0;All the best Francis Coquelin at your new club @valenciacf pic.twitter.com/fDRpci436w;;@valenciacf;;9,51529E+17;https://twitter.com/Gooner0001/status/951529075897663489
SM_Headlines;11/01/2018 16:58;0;0;Arsenal midfielder Francis Coquelin completes move to Valencia http:// sm.mg/dfd9gyy #arsenal #vcf #valenciacf;;;#arsenal #vcf #valenciacf;9,51529E+17;https://twitter.com/SM_Headlines/status/951528869147873283
SMLaLiga;11/01/2018 16:58;0;0;Arsenal midfielder Francis Coquelin completes move to Valencia http:// sm.mg/t587c2d #arsenal #vcf #valenciacf;;;#arsenal #vcf #valenciacf;9,51529E+17;https://twitter.com/SMLaLiga/status/951528865561706497
SMArsenal;11/01/2018 16:58;0;0;Arsenal midfielder Francis Coquelin completes move to Valencia http:// sm.mg/y7hbty6 #arsenal;;;#arsenal;9,51529E+17;https://twitter.com/SMArsenal/status/951528861728149505
Zak_Wagman;11/01/2018 16:57;0;0;Thank you Francis #Coquelin for 10 years of excellent service at @Arsenal . All the best at @valenciacf_en - we’ll miss your passion in N London! pic.twitter.com/7o6q8c7oaV;;@Arsenal @valenciacf_en;#Coquelin;9,51529E+17;https://twitter.com/Zak_Wagman/status/951528535998558208
Hunccho;11/01/2018 16:55;1;3;Francis Coquelin departing Arsenal on a lowkey.. The same way Gabriel Paulista left the club.. Lowkey;;;;9,51528E+17;https://twitter.com/Hunccho/status/951527998200705024
KoooraAe;11/01/2018 16:54;0;0;Francis Coquelin claims he should have left Arsenal before: Francis Coquelin is excited by… https:// goo.gl/fb/GBQ5MF;;;;9,51528E+17;https://twitter.com/KoooraAe/status/951527777496457216
Aaremustty;11/01/2018 16:53;0;0;Francis Coquelin gone no replacement yet in his department. A fantastic player who was recalled from loan to savage Arsenal's season 4 seasons ago. Good luck .;;;;9,51528E+17;https://twitter.com/Aaremustty/status/951527557379346432
Arsenal_Eternal;11/01/2018 16:52;0;2;Good luck Francis Coquelin for the future! #afc pic.twitter.com/AiYNnG86Yz;;;#afc;9,51527E+17;https://twitter.com/Arsenal_Eternal/status/951527304571867142
Domingortiz;11/01/2018 16:50;2;12;Highlights de Francis Coquelin . • http:// bit.ly/HighlightsCoqu elin … pic.twitter.com/34vG4Y0Sn5;;;;9,51527E+17;https://twitter.com/Domingortiz/status/951526808733839360
SlMPLYARSENAL;11/01/2018 16:48;4;7;Francis Coquelin 's Valencia contract has a release clause worth €80m. Meanwhile #AFC prepare to sell Alexis Sanchez for €20m! You can't make this shit up!;;;#AFC;9,51526E+17;https://twitter.com/SlMPLYARSENAL/status/951526322815172608
noor905332;11/01/2018 16:47;0;0;DEAL DONE: Valencia have completed the £12m signing of Francis Coquelin from Arsenal. He's signed a deal until 2022. (Source: @valenciacf ) #Valencia #arsenal pic.twitter.com/Mvr5eg2tFw;;@valenciacf;#Valencia #arsenal;9,51526E+17;https://twitter.com/noor905332/status/951526049858322434
ArsenalFC_fl;11/01/2018 16:47;3;10;Francis Coquelin 's Valencia contract has a release clause worth €80m. https://www. football.london/arsenal-fc/tra nsfer-news/coquelin-arsenal-valencia-transfer-news-14141904 …;;;;9,51526E+17;https://twitter.com/ArsenalFC_fl/status/951526043755667456
seancardo;11/01/2018 16:47;2;1;#ValenciaCF confirm the signing of Francis Coquelin from #Arsenal on a contract until 2022. #LaLiga #PL #seanknows pic.twitter.com/5ikHosau0g;;;#ValenciaCF #Arsenal #LaLiga #PL #seanknows;9,51526E+17;https://twitter.com/seancardo/status/951525946632400904
thetranzfertalk;11/01/2018 16:46;0;0;Francis Coquelin completes his move to Valencia for £12m, with Valencia including a huge £71m release clause. #Valencia #Arsenal #Coquelin pic.twitter.com/CclInSeMkW;;;#Valencia #Arsenal #Coquelin;9,51526E+17;https://twitter.com/thetranzfertalk/status/951525824544559104
Abdul_Ent;11/01/2018 16:46;0;0;Arsenal’s Francis Coquelin completes Valencia move http:// dlvr.it/Q9qnYM pic.twitter.com/Gc1U7i1Lii;;;;9,51526E+17;https://twitter.com/Abdul_Ent/status/951525692885286913
Ragulkumar1207;11/01/2018 16:44;0;0;DEAL DONE: Valencia have completed the £12m signing of Francis Coquelin from Arsenal. He's signed a deal until 2022. pic.twitter.com/2LipsHUWMy;;;;9,51525E+17;https://twitter.com/Ragulkumar1207/status/951525332703522816
RichJolly;11/01/2018 16:43;1;4;Farewell Francis Coquelin , a fine player alongside Santi Cazorla and perhaps not without him, after a curious Arsenal career: https:// twitter.com/TifoFootball_/ status/951524193270730753 …;;;;9,51525E+17;https://twitter.com/RichJolly/status/951524896730992641
cueballs85;11/01/2018 16:42;0;1;Not the greatest but always put in 110%, good luck at Valencia Francis #Coquelin;;;#Coquelin;9,51525E+17;https://twitter.com/cueballs85/status/951524731148259329
khmalR;11/01/2018 16:40;0;0;Thankyou @FrancisCoquelin . All the best at Valencia. #onceAgoonerAlwaysAgooner https:// twitter.com/Twt_ArsenalMY/ status/951475584000974851 …;;@FrancisCoquelin;#onceAgoonerAlwaysAgooner;9,51524E+17;https://twitter.com/khmalR/status/951524249004531712
TifoFootball_;11/01/2018 16:40;1;6;Francis Coquelin showed glimpses of promise at Arsenal, but @RichJolly explains how the Gunners not only lost one player with Santi Cazorla's horrific injury - but two. http:// bit.ly/CoquelinCareer pic.twitter.com/vfMzmbq1fP;;@RichJolly;;9,51524E+17;https://twitter.com/TifoFootball_/status/951524193270730753
ozrikk;11/01/2018 16:37;0;1;In 2008 we sign Francis Coquelin and in 2018 we sell him. What a servant to the club. FA Youth Cup winner and FA Cup winner. Merci beaucoup, Francis.;;;;9,51524E+17;https://twitter.com/ozrikk/status/951523595288825856
CarlBovis_AFC;11/01/2018 16:37;29;140;Sad that Francis Coquelin has left Arsenal. Maybe not the best player in the world, but a lot better than most made out! Always gave 100% and loved the club... I wish he'd scored a goal though, he would've gone ballistic in celebration! #AFC pic.twitter.com/uXgbheVEwr;;;#AFC;9,51524E+17;https://twitter.com/CarlBovis_AFC/status/951523551655485440
ivan_vasilev;11/01/2018 16:36;0;0;All the best to you Francis #Coquelin;;;#Coquelin;9,51523E+17;https://twitter.com/ivan_vasilev/status/951523325242740738
ojobabatundeiso;11/01/2018 16:36;0;0;I've got to say that Arsenal fans will miss Francis Coquelin 's loyalty and tenacity. The guy's way of celebrating was second to none.;;;;9,51523E+17;https://twitter.com/ojobabatundeiso/status/951523254849634306
LucasThurgood;11/01/2018 16:36;0;1;Still can’t believe Francis Coquelin never scored a goal for @Arsenal . Phenomenal achievement.;;@Arsenal;;9,51523E+17;https://twitter.com/LucasThurgood/status/951523195479384065
_CubanCigars;11/01/2018 16:35;0;0;lmao the certified benchwarmer is departing Francis Coquelin;;;;9,51523E+17;https://twitter.com/_CubanCigars/status/951522923688407040
Arsenalobs29;11/01/2018 16:33;0;0;Good luck to Francis Coquelin , an amazing strong soldier, for his new challenge in Valencia and thanks for all ! #WeAreTheArsenal pic.twitter.com/UhrhsawhcH;;;#WeAreTheArsenal;9,51522E+17;https://twitter.com/Arsenalobs29/status/951522453666320384
proudcannon;11/01/2018 16:33;0;0;BBC Sport - Francis Coquelin : Valencia agree to sign Arsenal midfielder http://www. bbc.co.uk/sport/football /42642141 …;;;;9,51522E+17;https://twitter.com/proudcannon/status/951522446745702402
GPLF_N;11/01/2018 16:33;0;1;BREAKING: Valencia confirm signing of Francis Coquelin from Arsenal on contract until 2022. Fee around £12m. #afc;;;#afc;9,51522E+17;https://twitter.com/GPLF_N/status/951522384267366400
wixsports;11/01/2018 16:32;0;1;Francis Coquelin claims he should have left Arsenal before - http:// wixsports.com/francis-coquel in-claims-he-should-have-left-arsenal-before/ … #sports pic.twitter.com/6UiULOwQpf;;;#sports;9,51522E+17;https://twitter.com/wixsports/status/951522214263869442
africa_sport;11/01/2018 16:30;0;0;Valencia announce signing of Francis Coquelin from Arsenal on contract until 2022 |… https://www. africa-football.com/2018/01/11/val encia-announce-signing-of-francis-coquelin-from-arsenal-on-contract-until-2022-football-news-south_africa/ … pic.twitter.com/6NfGD5CXBy;;;;9,51522E+17;https://twitter.com/africa_sport/status/951521779885002755
obiwobi_17;11/01/2018 16:30;0;0;looks like dt and troopz can't bully me anymore FRANCIS COQUELIN >VIEIRA;;;;9,51522E+17;https://twitter.com/obiwobi_17/status/951521775866798080
Arsenal_Fanly;11/01/2018 16:30;0;0;Valencia announce signing of Francis Coquelin from Arsenal on contract until 2022 #AFC https:// fanly.link/aff4ec19b8 pic.twitter.com/wBybUaeA5s;;;#AFC;9,51522E+17;https://twitter.com/Arsenal_Fanly/status/951521750923317248
ArsenalFCAddict;11/01/2018 16:30;0;0;Francis Coquelin claims he should have left #Arsenal before | Daily Mail http://www. football-addict.com/article/arsena l-fc/dailymail/5a57abc3e054473c955e86c3/francis-coquelin-claims-he-should-have-left-arsenal-before?lang=en&utm_campaign=post-auto&utm_medium=twitter&utm_source=arsenal-addict-en …;;;#Arsenal;9,51522E+17;https://twitter.com/ArsenalFCAddict/status/951521654265602048
scorehighlights;11/01/2018 16:30;0;0;Francis Coquelin completes move from Arsenal to Valencia Click He... pic.twitter.com/uYLWErIgxH;;;;9,51522E+17;https://twitter.com/scorehighlights/status/951521639736532992
scorehighlights;11/01/2018 16:29;0;0;Francis Coquelin claims he should have left Arsenal before Click He... pic.twitter.com/OVeqrEXmYB;;;;9,51522E+17;https://twitter.com/scorehighlights/status/951521577346138119
vrushabh4;11/01/2018 16:29;0;0;Francis Coquelin 's finest hour in an Arsenal shirt was him taking down a fellow team mate while defending You'll be missed, Legend @Arsenal @ArsenalFanTV @harshshah_ #AFC pic.twitter.com/K3graS24Ft;;@Arsenal @ArsenalFanTV @harshshah_;#AFC;9,51521E+17;https://twitter.com/vrushabh4/status/951521466822025216
arsenalnewsonly;11/01/2018 16:28;0;0;#Gooners #Gunners #AFC #COYG Francis Coquelin makes move to Valencia #GoonerFamily http:// dld.bz/g584c;;;#Gooners #Gunners #AFC #COYG #GoonerFamily;9,51521E+17;https://twitter.com/arsenalnewsonly/status/951521281668800512
shokomichael;11/01/2018 16:28;0;1;The 8pm news reader on @eNCA pronounced former Arsenal defender Francis Coquelin as 'Kukula' I'm relocating to Mars;;@eNCA;;9,51521E+17;https://twitter.com/shokomichael/status/951521159236988928
Hitusays;11/01/2018 16:28;0;0;Best of luck to Francis Coquelin who joined Valencia in a £12m deal potentially rising upto £17m. Won two FA cup t… https:// twitter.com/i/web/status/9 51508994186792962 …;;;;9,51521E+17;https://twitter.com/Hitusays/status/951521128748605440
FCEArsenal;11/01/2018 16:28;0;0;Francis Coquelin claims he should have left Arsenal before http://www. fcexclusive.com/news/arsenal/f rancis-coquelin-claims-he-should-have-left-arsenal-before-5001485 … (Source: Mail Online);;;;9,51521E+17;https://twitter.com/FCEArsenal/status/951521095773016069
KonetTv;11/01/2018 16:27;0;0;Francis Coquelin Joins Valencia from Arsenal http:// konet-tv.com/2018/01/11/fra ncis-coquelin-joins-valencia-from-arsenal/ … pic.twitter.com/6B0LJXg8sA;;;;9,51521E+17;https://twitter.com/KonetTv/status/951521076210819072
Engr_Oladimeji;11/01/2018 16:27;0;0;Valencia have completed the signing of French midfielder Francis Coquelin from Arsenal on a deal until 2022.;;;;9,51521E+17;https://twitter.com/Engr_Oladimeji/status/951520981889282048
Galatix_news;11/01/2018 16:27;0;0;Valencia have confirmed the signing of midfielder Francis Coquelin from Arsenal on a four-and-a-half year deal with a £71.2m release clause in his contract. http://www. galatixnews.com/2018/01/valenc ia-announce-signing-of-francis.html …;;;;9,51521E+17;https://twitter.com/Galatix_news/status/951520963413372928
Arsenal_Fanly;11/01/2018 16:26;0;0;Francis Coquelin admits he should have left Arsenal for Valencia six month... #Arsenal https:// fanly.link/05bf4b8f4d pic.twitter.com/fjeaKBn40e;;;#Arsenal;9,51521E+17;https://twitter.com/Arsenal_Fanly/status/951520719552286720
ojobabatundeiso;11/01/2018 16:25;0;0;Valencia have signed French midfielder Francis Coquelin from Arsenal for £12m on a 4 year deal… https://www. instagram.com/p/Bd0bRn6B_TP/;;;;9,5152E+17;https://twitter.com/ojobabatundeiso/status/951520487959597056
iArsenalApp;11/01/2018 16:25;0;0;Daily Mail: Francis Coquelin claims he should have left Arsenal before http://www. football-news365.co.uk/go/82276187;;;;9,5152E+17;https://twitter.com/iArsenalApp/status/951520353590894597
MaraudingMessi;11/01/2018 16:23;1;7;The reason FC is after every club name is cause in stands for Francis Coquelin , because he’s an ever present at every single club in the world. Most influential player of all time;;;;9,5152E+17;https://twitter.com/MaraudingMessi/status/951519990611660801
MattAPrentice;11/01/2018 16:23;0;0;Mixed feelings on Coq, he was infuriating at times but I loved his physicality. I really wanted to see him finally get a goal. @franciscoquelin https:// twitter.com/afc_foundation /status/951477794990673926 …;;@franciscoquelin;;9,5152E+17;https://twitter.com/MattAPrentice/status/951519912081674240
arsenalbuzztap;11/01/2018 16:23;0;1;dailymail​.co​.uk >> Francis Coquelin claims he should have left Arsenal before http:// buzztap.com/-KFpXq0;;;;9,5152E+17;https://twitter.com/arsenalbuzztap/status/951519908583694337
ArsenalNewsUK;11/01/2018 16:22;0;0;Francis Coquelin claims he should have left Arsenal before http://www. arsenalnews.co.uk/francis-coquel in-claims-he-should-have-left-arsenal-before/ …;;;;9,5152E+17;https://twitter.com/ArsenalNewsUK/status/951519604018380801
fantasyiteam;11/01/2018 16:21;3;4;: Francis Coquelin has joined Valencia from Arsenal for a reported £12m. He has a reported release clause of €80m! pic.twitter.com/wcUDbGrb3Z;;;;9,51519E+17;https://twitter.com/fantasyiteam/status/951519486590488582
scorehighlights;11/01/2018 16:20;0;0;Francis Coquelin completes move from Arsenal to Valencia Click He... pic.twitter.com/mJlZoQnOde;;;;9,51519E+17;https://twitter.com/scorehighlights/status/951519096033697792
1Tate;11/01/2018 16:17;0;0;Sad to see #FrancisCoquelin leave The @Arsenal without ever scoring a goal. He's a good lad though and young too! Best wishes to him!;;@Arsenal;#FrancisCoquelin;9,51518E+17;https://twitter.com/1Tate/status/951518446361202690
dhilDnA;11/01/2018 16:16;0;2;Thank you for giving your 100% each time you're on the pitch, thank you for your service @FrancisCoquelin . All the best in Spain. #COYG pic.twitter.com/QYNl2UqJkM;;@FrancisCoquelin;#COYG;9,51518E+17;https://twitter.com/dhilDnA/status/951518307659653120
Heathyheath_;11/01/2018 16:16;0;0;My favourite Francis Coquelin moment was when Hazard made a fool out of him last season. That was iconic;;;;9,51518E+17;https://twitter.com/Heathyheath_/status/951518231155675137
openn_eu;11/01/2018 16:15;0;0;#NEWS #SPAIN Francis Coquelin leaves Arsenal for #Spain : - Francis Coquelin leaves Arsenal… https:// goo.gl/fb/FBLUQJ;;;#NEWS #SPAIN #Spain;9,51518E+17;https://twitter.com/openn_eu/status/951518064776044545
sportsnewuk;11/01/2018 16:14;0;0;Francis Coquelin completes move from Arsenal to Valencia : Francis Coquelin has agree.. http:// dld.bz/g575d pic.twitter.com/XOjUp9S2o2;;;;9,51518E+17;https://twitter.com/sportsnewuk/status/951517686625906689
AmirAbdRazak;11/01/2018 16:11;0;0;Goodbye francis Coquelin;;;;9,51517E+17;https://twitter.com/AmirAbdRazak/status/951516965230669825
v1vaz;11/01/2018 16:11;0;1;Arsenal midfielder Francis Coquelin makes €13,6m move to Valencia #FIFA18 #football #Arsenal #Valencia #news #TransferNews #Sport #EPL2018 #London #Spain #France #FUT #Interest #FAN #easports #PS4 #xbox pic.twitter.com/cKkdOo2v9H;;;#FIFA18 #football #Arsenal #Valencia #news #TransferNews #Sport #EPL2018 #London #Spain #France #FUT #Interest #FAN #easports #PS4 #xbox;9,51517E+17;https://twitter.com/v1vaz/status/951516870687035393
ArsenalArena;11/01/2018 16:10;12;86;OFFICIAL: Francis Coquelin has signed for Valencia. Always loved his passion and hard work! I wish him the best of luck! pic.twitter.com/hRscCaeN3H;;;;9,51517E+17;https://twitter.com/ArsenalArena/status/951516793591533568
ToastedPigeon;11/01/2018 16:10;0;1;Forget Sam's Club Switch to Reg's Club! Its #NationalMilkDay and he's gonna milk dem suckas on Rocket League! Forget Alexis Sanchez or Francis Coquelin , Reg is the real balling superstar! https://www. twitch.tv/regenaldinho;;;#NationalMilkDay;9,51517E+17;https://twitter.com/ToastedPigeon/status/951516747580002304
Football_WT;11/01/2018 16:10;3;5;DEAL DONE: Valencia have completed the £12m signing of Francis Coquelin from Arsenal. He's signed a deal until 2022. (Source: @valenciacf ) pic.twitter.com/1v9Y1xii9Q;;@valenciacf;;9,51517E+17;https://twitter.com/Football_WT/status/951516722560815105
Blessingfash;11/01/2018 16:08;0;0;Arsenal’s Francis Coquelin completes Valencia move http:// nnd.ng/Q9pgsh via @todayng pic.twitter.com/UgqDM5dSu5;;@todayng;;9,51516E+17;https://twitter.com/Blessingfash/status/951516074813591553
AldreneKimz;11/01/2018 16:07;0;0;Valencia have confirmed the arrival of Francis Coquelin from Arsenal, Man-Utd meet Sanchez, Hazard and Walcott on the move http://www. kenyaregionalnews.co.ke/news/item/983- transfer-news-updates-man-utd-meet-sanchez-arsenal-chelsea.html#.Wlenw5wMAAc.twitter …;;;#;9,51516E+17;https://twitter.com/AldreneKimz/status/951515843497742336
RoyalArsenal_FC;11/01/2018 16:06;2;8;Good luck to Francis Coquelin at Valencia, thanks for the effort you put in for The Arsenal pic.twitter.com/Xh3rHkm2Xk;;;;9,51516E+17;https://twitter.com/RoyalArsenal_FC/status/951515787608674304
Tips97533945;11/01/2018 16:04;1;2;Look at me Meet me FREE > http:// bit.ly/2yzfQff Chris Williamson Nigel Farage Dark Souls Arctic Monkeys Cameron Brannagan Rigby & Peller Francis Coquelin The World Ends With You Sanchez Mkhitaryan Fast Eddie dating girls cute beauty funny love travel phuket massage pic.twitter.com/xTVvvOwBow;;;;9,51515E+17;https://twitter.com/Tips97533945/status/951515080306372610
JuniorAmanze;11/01/2018 16:04;0;0;Francis Coquelin spent 10 years at Arsenal and still just 26 years old, I think Arsenal has lost the touch of turning young players to world beaters;;;;9,51515E+17;https://twitter.com/JuniorAmanze/status/951515048681369603
newsaddup;11/01/2018 16:02;0;0;Francis Coquelin completes move from Arsenal to Valenci... pic.twitter.com/1nYoRFolPT;;;;9,51515E+17;https://twitter.com/newsaddup/status/951514762168487937
TimesSport;11/01/2018 16:01;5;12;Francis Coquelin has signed for @valenciacf_en after a decade with @Arsenal #AFC His contract includes a £71 million buy-out clause https://www. thetimes.co.uk/edition/sport/ francis-coquelin-joins-valencia-from-arsenal-with-71m-buy-out-clause-jvklm8g98 …;;@valenciacf_en @Arsenal;#AFC;9,51514E+17;https://twitter.com/TimesSport/status/951514432538112000
acl_sports;11/01/2018 16:00;2;1;NEW POST: La Liga: Valencia confirm Francis Coquelin deal - https:// goo.gl/zvFioB pic.twitter.com/pZJ6pRgz86;;;;9,51514E+17;https://twitter.com/acl_sports/status/951514281719115776
VCFAddict;11/01/2018 16:00;0;0;Francis Coquelin , nuevo jugador del #ValenciaCF #SomVCF #amuntVCF #VCF | Instagram http://www. futbol-addict.com/article/valenc ia-cf/instagram/5a57a4a3e054470277153f87/francis-coquelin-nuevo-jugador-del-valenciacf-1-7-somvcf-amuntvcf-vcf?lang=es&utm_campaign=post-auto&utm_medium=twitter&utm_source=valencia-addict …;;;#ValenciaCF #SomVCF #amuntVCF #VCF;9,51514E+17;https://twitter.com/VCFAddict/status/951514175326621699
