username;date;retweets;favorites;text;geo;mentions;hashtags;id;permalink
AssadP3C;31/05/2018 20:16;0;2;Quite possibly the coolest man in football history. Immensely talented and cool as a player, super cool as a manager, has won everything there is to win and walks out on Real Madrid on his terms. To top it off, he’s a bloody good looking fella too!! What a guy. #Zidane pic.twitter.com/h6NxBZ7VfI;;;#Zidane;1,00233E+18;https://twitter.com/AssadP3C/status/1002328019103637505
Mathz_11;31/05/2018 20:16;0;0;@GarethBale11 Send zidane a tribute. Your amazing final will instantly be forgotten by madrid fans if no message. Not doing yourself a favour;;@GarethBale11;;1,00233E+18;https://twitter.com/Mathz_11/status/1002327998970892288
GoalUSA;31/05/2018 20:16;0;1;Is Real Madrid targeting Mauricio Pochettino to replace Zinedine Zidane ? Get all the latest transfer gossip: http://www. goal.com/en/news/transf er-news-rumours-live-madrid-want-pochettino-to-replace/1lfdkbqnv9yk91srp7s4g12dcd …;;;;1,00233E+18;https://twitter.com/GoalUSA/status/1002327992121602049
shahultalk;31/05/2018 20:16;0;1;OFFICIAL : Arsene Wenger will be announced as Real Madrid manager, he is in Spain and will attend press conference at 14:00 after Zidane . വാട്ട്‌സാപിൽ കിടന്നു കളിക്കുന്നുണ്ട്;;;;1,00233E+18;https://twitter.com/shahultalk/status/1002327984253087744
GoalUK;31/05/2018 20:16;18;24;Is Real Madrid targeting Mauricio Pochettino to replace Zinedine Zidane ? Get all the latest transfer gossip: http://www. goal.com/en/news/transf er-news-rumours-live-madrid-want-pochettino-to-replace/1lfdkbqnv9yk91srp7s4g12dcd …;;;;1,00233E+18;https://twitter.com/GoalUK/status/1002327982160171009
GoalAustralia;31/05/2018 20:16;0;0;Is Real Madrid targeting Mauricio Pochettino to replace Zinedine Zidane ? Get all the latest transfer gossip: http://www. goal.com/en/news/transf er-news-rumours-live-madrid-want-pochettino-to-replace/1lfdkbqnv9yk91srp7s4g12dcd …;;;;1,00233E+18;https://twitter.com/GoalAustralia/status/1002327968331567104
goal;31/05/2018 20:16;16;94;Is Real Madrid targeting Mauricio Pochettino to replace Zinedine Zidane ? Get all the latest transfer gossip: http://www. goal.com/en/news/transf er-news-rumours-live-madrid-want-pochettino-to-replace/1lfdkbqnv9yk91srp7s4g12dcd …;;;;1,00233E+18;https://twitter.com/goal/status/1002327954830102530
Drilleh;31/05/2018 20:16;0;0;Ohh sorry m8 didn’t know posting on social media about a farewell or a “birthday wish” was soo important to you. Maybe he said it in the dms lol just because he don’t make a post about it don’t mean he “ doesn’t give af” it’s Zidane ffs and everyone respects him .;;;;1,00233E+18;https://twitter.com/Drilleh/status/1002327934936539136
iamnomanshah;31/05/2018 20:16;0;0;"Real madrid says goodbye to the man who changed it all for real madrid. He made the Royal club"" a Royal club. Made us the king of Europe. Now he's leaving us in tears. You are the best and your achievements reflects that. GRACIAS ZIDANE . *tears drop*""";;;;1,00233E+18;https://twitter.com/iamnomanshah/status/1002327912907984897
LasaetaRubia9;31/05/2018 20:16;0;0;Zidane left without a loss at Camp Noe. GOAT.;;;;1,00233E+18;https://twitter.com/LasaetaRubia9/status/1002327901327544320
Nuriniho;31/05/2018 20:16;0;0;I’ve been reading articles about Zidane all day ffs;;;;1,00233E+18;https://twitter.com/Nuriniho/status/1002327889386397703
sebreros;31/05/2018 20:16;0;0;All Time favorite player each sport COPY...PASTE...EDIT...GO!! NBA - Michael Jordan NFL - Peyton Manning Soccer - Zinedine Zidane MLB - Mariano Rivera NHL - No me gusta Boxing - Julio César Chávez Wrestling- Negro Navarro Tennis - Serena Williams;;;;1,00233E+18;https://twitter.com/sebreros/status/1002327883170373632
Kemi_ashefon;31/05/2018 20:15;0;0;Zinedine Zidane Quits Real Madrid http:// kemiashefonlovehaven.com/?p=23654 pic.twitter.com/oOkmZfdcte;;;;1,00233E+18;https://twitter.com/Kemi_ashefon/status/1002327856050065408
mohamoud_mire;31/05/2018 20:15;1;8;That means wenger and ferguson started low level teams and built thier own winning teams. But zidane and guardiola they started with already winning teams.;;;;1,00233E+18;https://twitter.com/mohamoud_mire/status/1002327854871441414
dakyhuanakiir1;31/05/2018 20:15;0;1;It was a great man, may God bless, protect him, n hope to real Madrid to get a good #coach like Zidane .... Respect!!;;;#coach;1,00233E+18;https://twitter.com/dakyhuanakiir1/status/1002327830162747392
MeinHamzaHun;31/05/2018 20:15;0;2;Maybe one of the reasons why Ronaldo wants to leave Real madrid. #Zidane pic.twitter.com/ltgGxXsM80;;;#Zidane;1,00233E+18;https://twitter.com/MeinHamzaHun/status/1002327828489232385
shaulino1;31/05/2018 20:15;1;4;Zidane has always been a crack nothing but respect to him. 3/3 champions leagues that’s literally unmatched!we can say his teams weren’t dominant but they got results! Excited to see what he does next https:// twitter.com/footballdailyu k/status/1002189843504488448 …;;;;1,00233E+18;https://twitter.com/shaulino1/status/1002327823720169473
247_news;31/05/2018 20:15;0;0;newsheadlines247 : Zidane announces shock resignation as Real Madrid ... http:// newsheadline247.blogspot.com/2018/05/zidane -announces-shock-resignation-as.html?spref=tw …;;;;1,00233E+18;https://twitter.com/247_news/status/1002327745446236160
GoalcomNigeria;31/05/2018 20:15;2;2;Transfer news & rumours LIVE: Madrid want Pochettino to replace Zidane http:// dlvr.it/QVn3R7 pic.twitter.com/XdqGvGUUhZ;;;;1,00233E+18;https://twitter.com/GoalcomNigeria/status/1002327733475557377
iAm_BigAce;31/05/2018 20:15;0;0;Ronaldo: I don’t know if I’m coming back Fans: I heard Neymar Sr. Is already in negotiations Zidane : pic.twitter.com/G88qeG9aQE;;;;1,00233E+18;https://twitter.com/iAm_BigAce/status/1002327720049676289
FUCKOFFBENZEMA;31/05/2018 20:15;0;1;Zidane should lowkey become a scout;;;;1,00233E+18;https://twitter.com/FUCKOFFBENZEMA/status/1002327660595466240
KIWALABYEABDUL1;31/05/2018 20:14;0;0;The unresolved futures of Gareth Bale and Cristiano Ronaldo will have contributed to the Zinedine Zidane 's decision to leave Real Madrid, says Guillem;;;;1,00233E+18;https://twitter.com/KIWALABYEABDUL1/status/1002327520501489664
nwimme33;31/05/2018 20:14;0;0;"Let's try this one COPY AND PASTE; Favorite COACH! NFL/Football: Brandon Matich NBA: Jerry Sloan CFB/Football: Still Brandon Matich CMBB: Coach K NHL: Scotty Bowman MLB: Jim Leland BOXING: Cya DaMotto NCAABASEBALL: Augie Garrido SOCCER: Zidane";;;;1,00233E+18;https://twitter.com/nwimme33/status/1002327520308486145
OsogoWinyo;31/05/2018 20:14;1;0;#MoreWinningGames CHEZA GAME NA USHINDE BET! PATA SURE TIPS +ODDS @MwalimuBets ..DAILY PAY AFTER WIN DEALS!! 100% GUARANTEED WIN!!! FOR SERIOUS HIGH STAKERS ONLY! #MadarakaDay #RomeDL #NationalPrayerDay #ChomaNaNgoma Zinedine Zidane #UberEats Real Madrid The Elephant WIN!;;@MwalimuBets;#MoreWinningGames #MadarakaDay #RomeDL #NationalPrayerDay #ChomaNaNgoma #UberEats;1,00233E+18;https://twitter.com/OsogoWinyo/status/1002327457104646145
jx_correa;31/05/2018 20:13;0;2;We need Zidane or Arsen Wenger;;;;1,00233E+18;https://twitter.com/jx_correa/status/1002327341618479104
okinemaynard;31/05/2018 20:13;0;1;Oh zidane Ibi me wey you do me like that https:// twitter.com/meldo_10/statu s/1002162907420004352 …;;;;1,00233E+18;https://twitter.com/okinemaynard/status/1002327308672360450
Yaris__omar;31/05/2018 20:13;2;0;Check out this Amazon deal: Seagate 4TB BarraCuda Pro 7200RPM SATA 6Gb/s ... by Seagate https:// amzn.to/2Le0Xkv via @amazon On sale for $140 #Android #Xiaomi #Google #Amazon #Deals #storage #Google #JSFamilyVacation #pcmasterrace #RealMadrid #Zidane #FormulaD;;@amazon;#Android #Xiaomi #Google #Amazon #Deals #storage #Google #JSFamilyVacation #pcmasterrace #RealMadrid #Zidane #FormulaD;1,00233E+18;https://twitter.com/Yaris__omar/status/1002327288271261697
JurkuchM;31/05/2018 20:13;0;3;Zidane ’s step down might have been the wisest mover EVER;;;;1,00233E+18;https://twitter.com/JurkuchM/status/1002327256100954117
NzShotoe;31/05/2018 20:13;0;0;#Zidane Zidane . Zinedine Zidane quits as Real Madrid coach after Champions League t... http:// bit.ly/2H8heoB;;;#Zidane;1,00233E+18;https://twitter.com/NzShotoe/status/1002327253303349248
hamzahaaji;31/05/2018 20:13;1;1;I hope dechamps gets sacked, zidane becomes france coach and wins the world cup.;;;;1,00233E+18;https://twitter.com/hamzahaaji/status/1002327227973980161
all_news_wsport;31/05/2018 20:13;0;0;Zinedine Zidane will manage France in the future - Didier Deschamps https:// allnewsdaily.net/2018/05/31/zin edine-zidane-will-manage-france-in-the-future-didier-deschamps/ …;;;;1,00233E+18;https://twitter.com/all_news_wsport/status/1002327212060807168
SportsbookBTC;31/05/2018 20:13;0;0;Why Zidane chose to leave Real Madrid after three seasons http:// dlvr.it/QVn31d → via http:// betbitcoin.pro √ pic.twitter.com/RjAE8DzLtc;;;;1,00233E+18;https://twitter.com/SportsbookBTC/status/1002327206272516096
dieguillolopez;31/05/2018 20:13;0;0;Real Madrid eye Tottenham's Mauricio Pochettino as top candidate to replace Zinedine Zidane - reports http:// dlvr.it/QVn2zP pic.twitter.com/XGnsQ6bFu4;;;;1,00233E+18;https://twitter.com/dieguillolopez/status/1002327190086696960
ramirezaalfonso;31/05/2018 20:13;1;4;Zidane leaving hurts me;;;;1,00233E+18;https://twitter.com/ramirezaalfonso/status/1002327150807134208
SummerBlandings;31/05/2018 20:13;0;0;Zinedine Zidane leaves Real Madrid: What next for Champions League winners? https:// bbc.in/2JkbHQM via @josephjett pic.twitter.com/iEYSBFbY1z;;@josephjett;;1,00233E+18;https://twitter.com/SummerBlandings/status/1002327134243704832
Lendrizle;31/05/2018 20:12;0;0;Zidane quitting just in time for his summer job as the World Cup. pic.twitter.com/IcPBlK4Pnl;;;;1,00233E+18;https://twitter.com/Lendrizle/status/1002327098659307520
Riffy_;31/05/2018 20:12;0;1;"Pep changes football in his first 4 years as manager Overrated, can't win without Messi. Needs to prove himself in a major league"" Zidane wins basically everything in first 3 years as manager ""GOAT manager, should just retire now. Has achieved everything in the game"" Erm?""";;;;1,00233E+18;https://twitter.com/Riffy_/status/1002327087926177792
Po275;31/05/2018 20:12;0;0;Zidane is the luckiest manager in champions league history;;;;1,00233E+18;https://twitter.com/Po275/status/1002327078962855939
yoruba_dev;31/05/2018 20:12;0;0;"More like  Zidane sends his regards"" https:// twitter.com/LordSnow/statu s/1000774815563870208 …""";;;;1,00233E+18;https://twitter.com/yoruba_dev/status/1002327062995259392
bombshellalerts;31/05/2018 20:12;0;0;Zidane drops Real bombshell https:// ift.tt/2xFzFl9;;;;1,00233E+18;https://twitter.com/bombshellalerts/status/1002327022675341312
SatyadevAbhiram;31/05/2018 20:12;0;0;Don't forget the squad zidane operated with and the squash Jose is operating with.... Jose is rebuilding united .... Zidane took a very built team... I'm not saying what he's done with the team is easy.. But he did it with a finished product;;;;1,00233E+18;https://twitter.com/SatyadevAbhiram/status/1002327009668653056
atmxsphere_;31/05/2018 20:12;0;1;would much prefer zidane over sarri #cfc;;;#cfc;1,00233E+18;https://twitter.com/atmxsphere_/status/1002326942677381120
kalovehaven;31/05/2018 20:12;0;0;New post (Zinedine Zidane Quits Real Madrid) has been published on Kemi Ashefon Love Haven - http:// kemiashefonlovehaven.com/?p=23654 pic.twitter.com/spdnqPsozD;;;;1,00233E+18;https://twitter.com/kalovehaven/status/1002326935622569985
GoalSG;31/05/2018 20:12;0;0;Transfer news & rumours LIVE: Madrid want Pochettino to replace Zidane http:// dlvr.it/QVn2Yn pic.twitter.com/Z64BlDLKgU;;;;1,00233E+18;https://twitter.com/GoalSG/status/1002326909663842306
GoalComIreland;31/05/2018 20:12;0;0;Transfer news & rumours LIVE: Madrid want Pochettino to replace Zidane http:// dlvr.it/QVn2XY pic.twitter.com/hMpoAgAcuI;;;;1,00233E+18;https://twitter.com/GoalComIreland/status/1002326901623361538
GoalcomSA;31/05/2018 20:12;2;5;Transfer news & rumours LIVE: Madrid want Pochettino to replace Zidane http:// dlvr.it/QVn2X4 pic.twitter.com/35LyZhMk4O;;;;1,00233E+18;https://twitter.com/GoalcomSA/status/1002326898712514560
GoalcomKenya;31/05/2018 20:12;0;0;Transfer news & rumours LIVE: Madrid want Pochettino to replace Zidane http:// dlvr.it/QVn2Tt pic.twitter.com/jrKPNV9qMo;;;;1,00233E+18;https://twitter.com/GoalcomKenya/status/1002326895801786370
goal_ghana;31/05/2018 20:12;0;0;Transfer news & rumours LIVE: Madrid want Pochettino to replace Zidane http:// dlvr.it/QVn2TY pic.twitter.com/hCbKpxGrcL;;;;1,00233E+18;https://twitter.com/goal_ghana/status/1002326892429504512
DrTSquare;31/05/2018 20:12;0;0;Yup. Zidane won 8 trophies in 3yrs. Pep won 14 in 4yrs. But someone will say Zizou is a better coach. Leave them. https:// twitter.com/registability/ status/1002164905162760192 …;;;;1,00233E+18;https://twitter.com/DrTSquare/status/1002326881780330498
MichelleFaker;31/05/2018 20:12;0;0;What Cristiano Ronaldo has posted on Instagram after Zinedine Zidane leaves Real Madrid: http:// youtu.be/PIt9O0pzukU?a via @YouTube;;@YouTube;;1,00233E+18;https://twitter.com/MichelleFaker/status/1002326871642726406
svines13;31/05/2018 20:11;0;1;All Time favorite player each sport COPY, PASTE, EDIT..GO!! NBA - MJ NFL - Jerry Rice NCAAF - Bo Jackson NCAAB - Christian Laettner NCAA(W) - Lindsay Whalen MLB - Kirby Puckett NHL - Gretzky Soccer - Zidane Boxing - Tyson Wrestling - Roddy Roddy Piper;;;;1,00233E+18;https://twitter.com/svines13/status/1002326837006094337
TaylerConnoll;31/05/2018 20:11;0;0;Seeing some real lazy journalism in the hours following the zidane departure. I reckon betslips should have to be published alongside articles. Would stop the whole ‘told you so ‘culture;;;;1,00233E+18;https://twitter.com/TaylerConnoll/status/1002326804311543808
jeremysmith98;31/05/2018 20:11;0;0;It makes lots of sense. Certainly more than Jose to United. But he's still there for the moment. And i reckon there's only two jobs that interest Zidane . He's done one. He'll do France then quit for good.;;;;1,00233E+18;https://twitter.com/jeremysmith98/status/1002326772174721026
VanDerJazza;31/05/2018 20:11;0;0;@DannyRosser87 @17jmf RT @MirrorFootball : Real Madrid 'target Jurgen Klopp as Zinedine Zidane 's replacement - Friday's gossip: https://www. mirror.co.uk/sport/football /transfer-news/real-madrid-target-liverpool-boss-12630180 … pic.twitter.com/JzdcTbT;;@DannyRosser87 @17jmf @MirrorFootball;;1,00233E+18;https://twitter.com/VanDerJazza/status/1002326768957698049
brianwater;31/05/2018 20:11;0;0;I liked a @YouTube video http:// youtu.be/DlgMYgczrX0?a Who Will Real Madrid Choose To Replace Zinedine Zidane ?;;@YouTube;;1,00233E+18;https://twitter.com/brianwater/status/1002326732530241541
E_maniy;31/05/2018 20:11;0;1;Why zidane why;;;;1,00233E+18;https://twitter.com/E_maniy/status/1002326696438259712
maweenuh_gee;31/05/2018 20:11;0;0;Do NOT disrespect Zaddy Zidane;;;;1,00233E+18;https://twitter.com/maweenuh_gee/status/1002326678629040128
cash_ak47;31/05/2018 20:11;0;0;Big thanks Zinedine Zidane , we Ronaldo fans appreciate you a lot. Good luck;;;;1,00233E+18;https://twitter.com/cash_ak47/status/1002326650552487941
NeeMala_A;31/05/2018 20:11;1;0;I hope United get rid of Mou and appoint Zidane ... I fucking hate Mourinhos coaching style;;;;1,00233E+18;https://twitter.com/NeeMala_A/status/1002326643929747457
yg_chiino08;31/05/2018 20:11;0;0;Zidane deciding to leave Real Madrid sucks. The man won 3 Champions League Finals 3 Years in a Row. He won La Liga. I mean EVERYTHING in the short time he was manager over RM. His replacement has big shoes to fill....;;;;1,00233E+18;https://twitter.com/yg_chiino08/status/1002326634505089025
BlakeCarr3;31/05/2018 20:11;0;1;Thank you Zidane for 3 unforgettable seasons! Living Legend #HalaMadrid;;;#HalaMadrid;1,00233E+18;https://twitter.com/BlakeCarr3/status/1002326633762705408
MannyCYC;31/05/2018 20:10;0;0;Zidane really left after 3 peating in Champions.;;;;1,00233E+18;https://twitter.com/MannyCYC/status/1002326589751742464
Kairupaneric;31/05/2018 20:10;0;0;Zinedine Zidane only told one Real Madrid player he was quitting Bernabeu - not Ronaldo http:// shr.gs/KbBGQYN;;;;1,00233E+18;https://twitter.com/Kairupaneric/status/1002326587654602752
aaabeljnr;31/05/2018 20:10;0;0;Zidane has delivered success and resigned. Nigerian leaders haven't delivered success so why should they? Lol https:// twitter.com/badgalmaddie_/ status/1002171544037154816 …;;;;1,00233E+18;https://twitter.com/aaabeljnr/status/1002326586195050497
SuperStatsDave;31/05/2018 20:10;0;0;#MNUFC road to MLS Cup in 3 easy steps: 1: Replace Heath with Zidane 2: Acquire Cristiano Ronaldo 3: Acquire Gareth Bale https:// twitter.com/espnstatsinfo/ status/1002325358136266754 …;;;#MNUFC;1,00233E+18;https://twitter.com/SuperStatsDave/status/1002326571338919936
nybulletins;31/05/2018 20:10;0;0;Zinedine Zidane resigns as manager of Real Madrid just days after winning Champions League | ESPN FC http:// video.nybulletins.com/2018/05/31/zin edine-zidane-resigns-as-manager-of-real-madrid-just-days-after-winning-champions-league-espn-fc/ …;;;;1,00233E+18;https://twitter.com/nybulletins/status/1002326530494738433
fbbsix;31/05/2018 20:10;0;0;| Zinedine Zidane replacement: Liverpool await Real Madrid approach for Jurgen Klopp: Look away now, Liverpo.. : http:// dld.bz/gQyc4;;;;1,00233E+18;https://twitter.com/fbbsix/status/1002326521288282112
bentiddy;31/05/2018 20:10;0;0;Real Madrid 'in shock move for Premier League boss' to replace Zidane https://www. mirror.co.uk/sport/football /transfer-news/real-madrid-target-liverpool-boss-12630180 …;;;;1,00233E+18;https://twitter.com/bentiddy/status/1002326494255906816
WillMoreSports;31/05/2018 20:10;0;0;New video by ESPN: Zinedine Zidane resigns as manager of Real Madrid just days after winning Champions League | ESPN FC https:// youtu.be/ZaWegw50Lx4;;;;1,00233E+18;https://twitter.com/WillMoreSports/status/1002326467714387969
DineenNick;31/05/2018 20:10;0;0;Zidane to United. Please.;;;;1,00233E+18;https://twitter.com/DineenNick/status/1002326463306256384
footy90com;31/05/2018 20:10;0;0;RECAP: Huddersfield Town news and transfer rumours LIVE: Everton appoint Marco Silva, Zinedine Zidane leaves ... Football News: #stokecity #Premier_League Retweet to let your friends know! http:// footy90.com/news/article/1 2595895-RECAP-Huddersfield-Town-news-and-transfer-rumours-LIVE-Everton-appoint-Marco-Silva-Zinedine-Zidane-leaves- …;;;#stokecity #Premier_League;1,00233E+18;https://twitter.com/footy90com/status/1002326454200340480
lizerrtth;31/05/2018 20:10;0;0;It’s a show about a football club. It’s funny asf and they’re inviting Zidane to manage their club;;;;1,00233E+18;https://twitter.com/lizerrtth/status/1002326452065488898
Kelroydaily;31/05/2018 20:10;1;0;Why is zidane in this? looool need answers https:// twitter.com/TrollFootball/ status/1002277041461379073 …;;;;1,00233E+18;https://twitter.com/Kelroydaily/status/1002326450022895616
kdb_stylin;31/05/2018 20:10;0;0;I not giving Zidane a guarantee for success like Jose pep simeone or carlo.he says he is taking a break tho there is a hint of him wanting to coach France;;;;1,00233E+18;https://twitter.com/kdb_stylin/status/1002326408394362881
theDextazLab;31/05/2018 20:10;0;0;Transfer news & rumours LIVE: Madrid want Pochettino to replace Zidane http://www. goal.com/en/news/11/tra nsfer-zone/2018/06/01/45205192/transfer-news-rumours-live-madrid-want-pochettino-to-replace …;;;;1,00233E+18;https://twitter.com/theDextazLab/status/1002326404510486529
thefootballfly;31/05/2018 20:09;0;3;#MickMcCarthy as Zinedine #Zidane replacement @#RealMadrid anybody? pic.twitter.com/mi4kMjQINM;;@;#MickMcCarthy #Zidane #RealMadrid;1,00233E+18;https://twitter.com/thefootballfly/status/1002326328916566016
hottakeitudePGP;31/05/2018 20:09;0;0;Can we reserve Zidane after Pep?;;;;1,00233E+18;https://twitter.com/hottakeitudePGP/status/1002326274801483776
wickesmike;31/05/2018 20:09;0;0;All Time favorite player each sport COPY, PASTE, EDIT..GO!! NBA - Larry Bird NFL - Joe Montana NCAAF - Cadillac Williams NCAAB - Kenny Anderson NCAA(W) - None MLB - Wade Boggs NHL - Kovalchuk Soccer - Zidane Boxing - George Foreman Wrestling - Road Warriors;;;;1,00233E+18;https://twitter.com/wickesmike/status/1002326263573438464
hobsterlobster;31/05/2018 20:09;1;14;Been doing my homework on Bielsa. A lot of Real Madrid fans (best team in europe) are wanting him to replace zidane there. Biggest lolz ever seen if he chooses to come to Leeds instead of madrid. Mind you, we are the real champions of europe after all. #lufc;;;#lufc;1,00233E+18;https://twitter.com/hobsterlobster/status/1002326195621462016
AtomicSyzygy;31/05/2018 20:09;0;0;#Zidane to coach #USMNT ?? #soccer;;;#Zidane #USMNT #soccer;1,00233E+18;https://twitter.com/AtomicSyzygy/status/1002326181566451712
KinJesus1;31/05/2018 20:09;1;5;I wanted Zidane forever no matter what even if we go trophy less. He made the team look like a family . Everyone was happy . He gained everyone’s trust . The only coach to make brave rotation. The only coach to be able to Convince Cristiano. He’s so humble and good ! Damn it;;;;1,00233E+18;https://twitter.com/KinJesus1/status/1002326171068051457
adel_21dz;31/05/2018 20:09;0;0;Zidane resign as king with all is pride and a perfect legacy, if only some people couldve done the same;;;;1,00233E+18;https://twitter.com/adel_21dz/status/1002326143117221888
nobleicon_;31/05/2018 20:09;0;0;Zidane Resigns As Real Madrid… https://www. instagram.com/p/Bjda_z5Hx59/ ?utm_source=ig_twitter_share&igshid=1kb026recbzv9 …;;;;1,00233E+18;https://twitter.com/nobleicon_/status/1002326114436599808
Abchiroma_;31/05/2018 20:08;0;0;but zidane why https:// twitter.com/marcainenglish /status/1002324941298192384 …;;;;1,00233E+18;https://twitter.com/Abchiroma_/status/1002326076817920001
iffy_atbest;31/05/2018 20:08;0;0;Im saying its not look up napoli's tactics.. the longer it goes the more Sarri and his ppl may look to take another offer instead of waiting. Its a super slippery slope especially with Zidane quitting today. Old days Roman wouldve paid Conte to leave and Paid to get Sarri;;;;1,00233E+18;https://twitter.com/iffy_atbest/status/1002326015354564611
Noir_khyl;31/05/2018 20:08;0;0;Madrid losing Zidane , Rinaldo and Bale. It's like they're running away from something;;;;1,00233E+18;https://twitter.com/Noir_khyl/status/1002325987554676737
adunlea;31/05/2018 20:08;0;0;Zidane steps down as Real Madrid boss days after Champions League success (via @thejournal_ie ) http:// the42.ie/4045971;;@thejournal_ie;;1,00233E+18;https://twitter.com/adunlea/status/1002325975642853377
okduet;31/05/2018 20:08;0;0;Transfer news & rumours LIVE: Madrid want Pochettino to replace Zidane https://www. okduet.com/transfer-news- rumours-live-madrid-want-pochettino-to-replace-zidane/ …;;;;1,00233E+18;https://twitter.com/okduet/status/1002325956021899265
KinJesus1;31/05/2018 20:08;0;1;Even Morata who didn’t get enough chances under Zidane and got pissed as well as left Madrid has wished Zidane . It’s been more than 12 hours and Bale wants to say he hasn’t heard anything ? pic.twitter.com/LSUQAiFW2i;;;;1,00233E+18;https://twitter.com/KinJesus1/status/1002325929530667008
AleeTuron;31/05/2018 20:08;0;2;Sport comments loads of bullshit actually never believe them, they envy real’s 3 Champions runs, and Zidane has far more respect won than guardiola had due to his past as player;;;;1,00233E+18;https://twitter.com/AleeTuron/status/1002325915983077377
trinhhuuminhly;31/05/2018 20:08;0;0;Liverpool at panic stations as Real target Klopp as No.1 replacement for Zidane : http:// youtu.be/p6hHoc7s51M?a qua @YouTube;;@YouTube;;1,00233E+18;https://twitter.com/trinhhuuminhly/status/1002325909460971522
SerMelendez;31/05/2018 20:08;0;1;All Time favorite player each sport COPY...PASTE...EDIT...GO!! NBA - Patrick Ewing NFL - Dan Marino Soccer - Zinedine Zidane MLB - Francisco Lindor NHL - Wayne Gretzky Boxing - Alexis Arguello Wrestling- Rayo de Jalisco Jr Tennis - Serena Williams;;;;1,00233E+18;https://twitter.com/SerMelendez/status/1002325896492134400
TimesSport;31/05/2018 20:08;26;36;#THFC are ready to demand the full value of Mauricio Pochettino's contract to release him to succeed Zinedine Zidane at the Bernabéu https://www. thetimes.co.uk/edition/sport/ mauricio-pochettino-will-cost-real-madrid-42m-ll6z8clzq …;;;#THFC;1,00233E+18;https://twitter.com/TimesSport/status/1002325853177634816
hunty__5;31/05/2018 20:07;0;1;#pureclass favourite ever player #themaster #no5 #zidane;;;#pureclass #themaster #no5 #zidane;1,00233E+18;https://twitter.com/hunty__5/status/1002325844436619264
charliegillno1;31/05/2018 20:07;0;0;Wonder if Zidane fancies a challenge now;;;;1,00233E+18;https://twitter.com/charliegillno1/status/1002325841467138048
JSemckenFT;31/05/2018 20:07;1;1;Cristiano’s future? New transfers? Who follows Zidane . I ponder the future of #realmadrid https:// fulltime.soccer/2018/05/31/wha ts-next-for-real-madrid/ …;;;#realmadrid;1,00233E+18;https://twitter.com/JSemckenFT/status/1002325815626027008
ahmed_baggio;31/05/2018 20:07;0;0;Imagine being #Zidane;;;#Zidane;1,00233E+18;https://twitter.com/ahmed_baggio/status/1002325808978055169
RegularOG;31/05/2018 20:07;0;0;GRACIAS ZIDANE . One hell of a player one hell of a manager https:// twitter.com/realmadrid/sta tus/1002164216831315969 …;;;;1,00233E+18;https://twitter.com/RegularOG/status/1002325791986741250
VloneEb;31/05/2018 20:07;0;1;Zidane jus gon leave;;;;1,00233E+18;https://twitter.com/VloneEb/status/1002325735686668288
