username;date;retweets;favorites;text;geo;mentions;hashtags;id;permalink
bennjani07;31/05/2018 19:49;0;3;Zidane going out as player and manager at the very top unbelievable record...Wenger for Madrid maybe?;;;;1,00232E+18;https://twitter.com/bennjani07/status/1002321213392183296
etinosaobayiuwa;31/05/2018 19:49;0;0;Zidane and Cristiano!!! A match made in the stars. Zizu has as much respect for CR7 as the Portuguese has for the Frenchman. Zidane knows that CR7 would take on some of his old teammates.;;;;1,00232E+18;https://twitter.com/etinosaobayiuwa/status/1002321186427232256
alliyu_S;31/05/2018 19:49;0;0;Oga, what do you have to say about zidane leaving you guys? @nibras_iya;;@nibras_iya;;1,00232E+18;https://twitter.com/alliyu_S/status/1002321168588828674
JaynaRDaviskz;31/05/2018 19:49;0;0;FVCG: Zinedine Zidane Resigns As Real Madrid Manager http:// redseto.com/champions-leag ue/zinedine-zidane-resigns-as-real-madrid-manager/ …;;;;1,00232E+18;https://twitter.com/JaynaRDaviskz/status/1002321164004462592
aazailani_jr;31/05/2018 19:49;1;1;Zidane resigns Wenger to Madrid trending Real Madrid fans: pic.twitter.com/95DbnnRstR;;;;1,00232E+18;https://twitter.com/aazailani_jr/status/1002321144089849856
SGJones4;31/05/2018 19:49;0;0;Either way, as much as I'd like to see Zidane in the #PremierLeague I genuinely can't see it happening.;;;#PremierLeague;1,00232E+18;https://twitter.com/SGJones4/status/1002321132773572608
Reverse_TK;31/05/2018 19:49;0;0;now the Pep fanboys trying to discredit Zidane 's achievements at Real finally get how we see Pep: a man who was lucky enough to coach a stacked team and get them to do a job for him;;;;1,00232E+18;https://twitter.com/Reverse_TK/status/1002321113781866496
Wazupnaija;31/05/2018 19:49;0;0;'It hit them like a bomb' - how Zidane 's decision to leave shocked Real Madrid - http:// whazupnaija.com/it-hit-them-li ke-a-bomb-how-zidanes-decision-to-leave-shocked-real-madrid/ … pic.twitter.com/pgrrt9I34e;;;;1,00232E+18;https://twitter.com/Wazupnaija/status/1002321106731130880
Dozi_e30;31/05/2018 19:49;0;0;"Use the words  Zidane Resigned"" out like was he kicked Out? https:// twitter.com/brfootball/sta tus/1002320337139204097 …""";;;;1,00232E+18;https://twitter.com/Dozi_e30/status/1002321080382623745
Doolan9;31/05/2018 19:49;5;18;Klopp beats Zidane as Liverpool boss named best manager in world https://www. liverpoolecho.co.uk/sport/football /football-news/jurgen-klopp-beats-zinedine-zidane-14727666 …;;;;1,00232E+18;https://twitter.com/Doolan9/status/1002321080265080832
sir_emil_;31/05/2018 19:48;0;0;Maybe the Zidane -Real Madrid exit is a prank....;;;;1,00232E+18;https://twitter.com/sir_emil_/status/1002321052553408512
PaulDHennan;31/05/2018 19:48;0;0;Roman: Zizi, you want job? I give you more money Zidane : Yes comrade! Hello Real? I quit Roman: Zizi I don't like Chelsea any more, England won't let me in. No job sry. Zidane :;;;;1,00232E+18;https://twitter.com/PaulDHennan/status/1002321033771315203
Cameron___Grant;31/05/2018 19:48;0;0;Mourinho and Pep will never, ever be able to say they have done that. Even tho Zidane had Real Madrid he will still go down as one of the best managers ever. Is there nothing that man can't do;;;;1,00232E+18;https://twitter.com/Cameron___Grant/status/1002321007372324867
_MsEvie_;31/05/2018 19:48;0;0;Zidane deserves more attention from the media;;;;1,00232E+18;https://twitter.com/_MsEvie_/status/1002320968486998022
ColinHulyer;31/05/2018 19:48;0;0;Zinedine Zidane has decided to become the next manager of Chelsea.....because he says he needs a break from football https:// twitter.com/bbcsport/statu s/1002318698131148802 …;;;;1,00232E+18;https://twitter.com/ColinHulyer/status/1002320961700548608
sldn315;31/05/2018 19:48;0;0;If I was Zidane I'd only consider the French National team coaching role next. High chance their current golden generation will dominate international football for the next decade. Afterwards retire from the sport having won everything as both player and coach;;;;1,00232E+18;https://twitter.com/sldn315/status/1002320951630065664
IamAnselKevin;31/05/2018 19:48;0;0;Zidane gets minimal credit. Liverpool lost due to their own fuck ups. Pep is at least one of the top 2 managers out there ...;;;;1,00232E+18;https://twitter.com/IamAnselKevin/status/1002320925600157696
archieeee_c;31/05/2018 19:48;0;3;missing zidane already;;;;1,00232E+18;https://twitter.com/archieeee_c/status/1002320909430996992
hlawyer90;31/05/2018 19:48;1;1;we will miss the legend “ zidane “ #زيدان pic.twitter.com/nArcyVXC3s;;;#;1,00232E+18;https://twitter.com/hlawyer90/status/1002320906444836864
soccerbasement;31/05/2018 19:48;0;0;Zidane grew tired of not being allowed to make decisions at Madrid http://www. dailymail.co.uk/sport/football /article-5791165/Zinedine-Zidane-grew-tired-not-allowed-make-decisions-Real-Madrid.html …;;;;1,00232E+18;https://twitter.com/soccerbasement/status/1002320904058097664
ColinHulyer;31/05/2018 19:48;0;8;Zinedine Zidane has decided to become the next manager of Chelsea.....because he says he needs a break from football;;;;1,00232E+18;https://twitter.com/ColinHulyer/status/1002320851776221184
AflahAmin98;31/05/2018 19:48;0;1;He killed me twice #Zidane pic.twitter.com/k2nn5D7Qwr;;;#Zidane;1,00232E+18;https://twitter.com/AflahAmin98/status/1002320824890634240
lorddjerry;31/05/2018 19:48;0;0;You could make the same argument about pep at barca.. Even he couldn't win 2 champions leagues back to back. Zidane is a genius. The proof is in the pudding.;;;;1,00232E+18;https://twitter.com/lorddjerry/status/1002320820314804226
PhilSchoen;31/05/2018 19:47;0;1;The US isn’t ready for Zidane . He’s a manager, not necessarily a teacher.;;;;1,00232E+18;https://twitter.com/PhilSchoen/status/1002320808801394688
soccerbasement;31/05/2018 19:47;0;0;Zinedine Zidane quits Real Madrid: What does that mean for football? http://www. dailymail.co.uk/sport/football /article-5792819/Zinedine-Zidane-quits-Real-Madrid-does-mean-football.html …;;;;1,00232E+18;https://twitter.com/soccerbasement/status/1002320790782541825
SGJones4;31/05/2018 19:47;0;0;I'd love to see #Zidane in the @premierleague My thought though is with his limited management experience, what would he be like with a lesser team - which it would inevitably be compared to #RealMadrid . Yes... he's won so much, but Real is Real - C Ronaldo, G Bale, K Benzema etc https:// twitter.com/BBCSport/statu s/1002318698131148802 …;;@premierleague;#Zidane #RealMadrid;1,00232E+18;https://twitter.com/SGJones4/status/1002320780619866112
ElliotAwudus;31/05/2018 19:47;0;0;Zidane leaves Real Madrid: All the reaction http://www. espnfc.com/blog/the-toe-p oke/65/post/3514469/zinedine-zidane-leaves-real-madrid-all-the-reaction-from-his-shock-exit …;;;;1,00232E+18;https://twitter.com/ElliotAwudus/status/1002320728207888384
saidmadrid5;31/05/2018 19:47;0;0;#bbcfootball Andy west article over Zidane 's exit is disappointing. An article based on rumours but no http:// facts.You can tell Andy isn't a big fan of Real Madrid .very poor article;;;#bbcfootball;1,00232E+18;https://twitter.com/saidmadrid5/status/1002320728094593024
willbrownsydney;31/05/2018 19:47;0;1;Zidane to @Glentoran to form the Keenan, Smyth, McFall dream team?;;@Glentoran;;1,00232E+18;https://twitter.com/willbrownsydney/status/1002320725594726400
EladioDeGarcia;31/05/2018 19:47;0;0;Thanks a lot great #Zidane Thank you for so many unforgetable moments Thank you for giving us so many emotions and so many moments of happiness You are unique and unrepeatable A million thanks for everything #Zinedine @realmadrid https:// twitter.com/realmadrid/sta tus/1002205574715584512 …;;@realmadrid;#Zidane #Zinedine;1,00232E+18;https://twitter.com/EladioDeGarcia/status/1002320709257973760
owaissiddiqui11;31/05/2018 19:47;0;0;Zidane , 9 titles in two years and five months: UEFA Champions League FIFA Club World Cup UEFA European Super Cup La Liga Spanish Super Cup #HalaMadrid Thank you @Zidane _Zinedine pic.twitter.com/LRjIhwkyCN;;@Zidane;#HalaMadrid;1,00232E+18;https://twitter.com/owaissiddiqui11/status/1002320698742923264
OLUSEYl;31/05/2018 19:47;0;0;Zidane Gets Fresh Job Offer Hours After Resignation https:// naijja.com/zidane-gets-fr esh-job-offer-hours-after-resignation/ … pic.twitter.com/BJAQFCIwfR;;;;1,00232E+18;https://twitter.com/OLUSEYl/status/1002320665209442304
unbiasedcunt;31/05/2018 19:47;0;6;thats not fucking Zidane LMAO;;;;1,00232E+18;https://twitter.com/unbiasedcunt/status/1002320638047113216
F9SportsNG;31/05/2018 19:47;0;0;Zinedine Zidane is being linked with a Premier League move on Friday's back pages https:// bbc.in/2swy76U;;;;1,00232E+18;https://twitter.com/F9SportsNG/status/1002320629981425665
Bashirboy;31/05/2018 19:47;0;1;Hahahaha...Ya Allah answer his prayers and let Wenger be appointed as http:// R.Madrid next coach to succeed Zidane . :-D :-D;;;;1,00232E+18;https://twitter.com/Bashirboy/status/1002320592396279808
ScrausScraus;31/05/2018 19:47;0;0;wow Zidane should’ve been cast as Lex Luthor https:// twitter.com/brfootball/sta tus/1002320337139204097 …;;;;1,00232E+18;https://twitter.com/ScrausScraus/status/1002320582984298496
eccentric_lad;31/05/2018 19:47;0;1;Well, as of right now, I'd rather prefer a bald headed ruthless winner like Zidane than a 60-something chain smoker who has won fuck all and whose lungs might collapse any second.;;;;1,00232E+18;https://twitter.com/eccentric_lad/status/1002320578890620934
Independent;31/05/2018 19:46;5;19;Zidane left Madrid with a calm certainty, the same way he coached them https://www. independent.co.uk/sport/football /european/zinedine-zidane-real-madrid-next-manager-mauricio-pochettino-florentino-perez-dimite-deja-a8377471.html?utm_term=Autofeed&utm_campaign=Echobox&utm_medium=Social&utm_source=Twitter#link_time=1527804972 … pic.twitter.com/HVauM6A430;;;#link_time;1,00232E+18;https://twitter.com/Independent/status/1002320557432561664
_MoeBenzo;31/05/2018 19:46;0;2;Zinedine Zidane 's three seasons as Real Madrid boss... Champions League La Liga Spanish Super Cup Fifa Club World Cup UEFA Super Cup Job done. Thank you Zizou Real Madrid’s side line will never be the same..;;;;1,00232E+18;https://twitter.com/_MoeBenzo/status/1002320520405274624
AflahAmin98;31/05/2018 19:46;0;1;Goodbye #zidane;;;#zidane;1,00232E+18;https://twitter.com/AflahAmin98/status/1002320508178685952
Andrewlemaylake;31/05/2018 19:46;0;0;Zidane won the Champions Leaguex3, La Liga, Supercopax2, Club World Cup x2 Supercopa and more in just 2 and a half years. And you knocking Zidane for not winning Copa del Rey . Quit reaching boy;;;;1,00232E+18;https://twitter.com/Andrewlemaylake/status/1002320504299114496
ThabisoDeus;31/05/2018 19:46;0;0;Zidane gave up just like how the French did when Hitler was on their doorstep.;;;;1,00232E+18;https://twitter.com/ThabisoDeus/status/1002320492638932992
MICNTV;31/05/2018 19:46;0;0;Will POCHETTINO become the new REAL MADRID MANAGER? #realmadrid #Pochettino #RMA #RMCF #Football #MauricioPochettino #Zidane pic.twitter.com/BBHIrL1x91;;;#realmadrid #Pochettino #RMA #RMCF #Football #MauricioPochettino #Zidane;1,00232E+18;https://twitter.com/MICNTV/status/1002320487664349185
yannahabib;31/05/2018 19:46;0;1;Thank you Zidane ! My favorite Real Madrid coach ever https:// twitter.com/realmadriden/s tatus/1002200726880358400 …;;;;1,00232E+18;https://twitter.com/yannahabib/status/1002320479237992448
NotiVirals;31/05/2018 19:46;0;0;Didier Deschamps admits Zinedine Zidane WILL become France boss - but insists he is not under extra pressure http:// ceesty.com/wHgVnz pic.twitter.com/KJZaVawVvw;;;;1,00232E+18;https://twitter.com/NotiVirals/status/1002320442172981248
NotiVirals;31/05/2018 19:46;0;0;Real Madrid 'target Liverpool boss Jurgen Klopp' in shock move after Zinedine Zidane 's resignation http:// ceesty.com/wHgVbX pic.twitter.com/2zV3JZpcmm;;;;1,00232E+18;https://twitter.com/NotiVirals/status/1002320425357983744
baburkhwaja;31/05/2018 19:46;0;0;Zidane is not a good politician and you must be an exceptional politician to want to stay at the helm at Real Madrid.;;;;1,00232E+18;https://twitter.com/baburkhwaja/status/1002320420480020481
DannyGannon;31/05/2018 19:46;0;0;@UnaiEmery_ has one, why doesnt zidane ?;;@UnaiEmery_;;1,00232E+18;https://twitter.com/DannyGannon/status/1002320417405784075
anglew_meth;31/05/2018 19:46;0;0;Real Madrid ‘target Liverpool boss Jurgen Klopp’ in shock move after Zinedine Zidane ’s resignation https:// livetechinfo.com/real-madrid-ta rget-liverpool-boss-jurgen-klopp-in-shock-move-after-zinedine-zidanes-resignation/ … pic.twitter.com/18etll1S22;;;;1,00232E+18;https://twitter.com/anglew_meth/status/1002320367489310721
ahnnyjekyll;31/05/2018 19:46;0;0;Tbh zidane was given a life with advantages ...no stress either bale, asensio or Ronaldo was always the solution https:// twitter.com/7salmy/status/ 1002253278854434818 …;;;;1,00232E+18;https://twitter.com/ahnnyjekyll/status/1002320351232253952
JulianKastrati;31/05/2018 19:45;0;1;On Zidane leaving RMA: always leave on top of your game! #leadershiplessons;;;#leadershiplessons;1,00232E+18;https://twitter.com/JulianKastrati/status/1002320286493102083
hassan_saleem2;31/05/2018 19:45;1;1;Thank you #Zidane #ZidaneQuitteleReal #RealMadrid #ChampionsLeagueFinal #3ChampionsLeaues #Legend #EndodEra pic.twitter.com/R2sua55KNp;;;#Zidane #ZidaneQuitteleReal #RealMadrid #ChampionsLeagueFinal #3ChampionsLeaues #Legend #EndodEra;1,00232E+18;https://twitter.com/hassan_saleem2/status/1002320236945793024
TrapLordRay;31/05/2018 19:45;9;0;We lost Wenger and the following weeks we lost Zidane . Manando the the reason i did it yeeahhh;;;;1,00232E+18;https://twitter.com/TrapLordRay/status/1002320207124291586
BI_Mijinyawa;31/05/2018 19:45;1;0;...or even zidane himself https:// twitter.com/badgalmaddie_/ status/1002171544037154816 …;;;;1,00232E+18;https://twitter.com/BI_Mijinyawa/status/1002320184084975617
worldbestkopiko;31/05/2018 19:45;1;0;Zidane just calmly waited to win the 3rd consecutive UCL and retire in peace, Nigerian leaders will stay for two terms as president, run for governor and still struggle for senate;;;;1,00232E+18;https://twitter.com/worldbestkopiko/status/1002320164623470592
SivanJohn_;31/05/2018 19:45;19;33;Apparently even before Zidane announced his departure, president Florentino Perez has already send Raul to negotiate terms with Mauricio Pochettino about the possibility of managing Real Madrid. World Cup aside, we certainly got an interesting summer [via @FutbolistasAXEM ] pic.twitter.com/OCDx2eSWKM;;@FutbolistasAXEM;;1,00232E+18;https://twitter.com/SivanJohn_/status/1002320131500924928
talkSPORT;31/05/2018 19:45;9;34;Zidane 's future plan? https:// talksport.com/football/curre nt-france-boss-didier-deschamps-expects-zinedine-zidane-manage-les-bleus-eventually …;;;;1,00232E+18;https://twitter.com/talkSPORT/status/1002320068296900608
TheSunFootball;31/05/2018 19:45;14;38;EXCLUSIVE: Real Madrid eye Premier League manager to take over from Zinedine Zidane http:// thesun.uk/6014D9CSG pic.twitter.com/SegWPIctRn;;;;1,00232E+18;https://twitter.com/TheSunFootball/status/1002320067885924352
delors_z;31/05/2018 19:44;1;0;Zidane wants to lay back in France and eat croissants https:// twitter.com/tsf_podcast/st atus/1002148866676920320 …;;;;1,00232E+18;https://twitter.com/delors_z/status/1002320019252969473
lfclimitless;31/05/2018 19:44;1;0;Both Marca and AS readers favor Klopp to replace Zidane via https:// ift.tt/2kF669I;;;;1,00232E+18;https://twitter.com/lfclimitless/status/1002320016681947137
ftblislife;31/05/2018 19:44;2;1;Zidane as Madrid coach (2016-18) UEFA Champions League UEFA Super Cup Club World Cup Spanish Super Cup Liga #UCL #UCLfinal pic.twitter.com/V4gmACexwl;;;#UCL #UCLfinal;1,00232E+18;https://twitter.com/ftblislife/status/1002320014932873217
ksekoni_;31/05/2018 19:44;1;0;Zidane ’s last appearance at the Bernabeu is him lifting a UCL and celebrating his 3rd straight https:// twitter.com/elaficionadofc /status/1002294867568062465 …;;;;1,00232E+18;https://twitter.com/ksekoni_/status/1002320006577782784
sir_emil_;31/05/2018 19:44;1;0;If Nyantakyi was like Zidane , well....;;;;1,00232E+18;https://twitter.com/sir_emil_/status/1002319999317544960
randytorresnyc;31/05/2018 19:44;1;0;Given how Madrid likes to play, Zidane may bring back Pastor Maldonado! YNWA;;;;1,00232E+18;https://twitter.com/randytorresnyc/status/1002319994955423744
gertrudeangela9;31/05/2018 19:44;1;0;Zidane steps down as Real Madrid head coach in shock announcement https://www. theguardian.com/football/2018/ may/31/zinedine-zidane-real-madrid-manager-steps-down?CMP=share_btn_tw …;;;;1,00232E+18;https://twitter.com/gertrudeangela9/status/1002319961753309185
GreatfulHeart_;31/05/2018 19:44;0;0;zidane left a great legacy;;;;1,00232E+18;https://twitter.com/GreatfulHeart_/status/1002319952441995266
2jz_Cali;31/05/2018 19:44;0;0;Brah this morning I could've sworn zidane was coming back but damn the kid left;;;;1,00232E+18;https://twitter.com/2jz_Cali/status/1002319933324300288
DotBall;31/05/2018 19:44;0;0;Real Madrid could poach new boss from the Premier League, Chelsea may bid for Zidane , plus more. #worldcup;;;#worldcup;1,00232E+18;https://twitter.com/DotBall/status/1002319909177712642
Naijaurban;31/05/2018 19:44;0;0;Zidane reveals how Sergio Ramos reacted to his resignation from Real Madrid, speaks on future https:// naijaurban.com/zidane-reveals -how-sergio-ramos-reacted-to-his-resignation-from-real-madrid-speaks-on-future/ …;;;;1,00232E+18;https://twitter.com/Naijaurban/status/1002319862704824321
NtimEmanovic;31/05/2018 19:44;0;0;Zidane : I'm leaving My mind: https:// twitter.com/ntznm/status/1 002266149713793029 …;;;;1,00232E+18;https://twitter.com/NtimEmanovic/status/1002319824876441600
OHLNOJHLWHL;31/05/2018 19:44;0;1;Zinedine Zidane Leaves Real Madrid On a Wining Note He Says !;;;;1,00232E+18;https://twitter.com/OHLNOJHLWHL/status/1002319816970113024
Farhan4nowtimes;31/05/2018 19:43;0;0;real madrid: Zidane quits Real Madrid as manager http:// yatra24.unaux.com/real-madrid-zi dane-quits-real-madrid-as-manager/ …;;;;1,00232E+18;https://twitter.com/Farhan4nowtimes/status/1002319790621581315
japanbullet;31/05/2018 19:43;0;0;Soccer: Zidane quits as Real Madrid coach after 3rd Champions League https://www. japanbullet.com/sport/soccer-z idane-quits-as-real-madrid-coach-after-3rd-champions-league …;;;;1,00232E+18;https://twitter.com/japanbullet/status/1002319766965583872
LordKabelo;31/05/2018 19:43;2;0;"Zidane was suppose to be our Alex Ferguson. The 1 trophy + CL qualification per season at least"" manager we deserve https:// twitter.com/VincentJurist/ status/1002318415011504128 …""";;;;1,00232E+18;https://twitter.com/LordKabelo/status/1002319698036494338
ShirazAq96;31/05/2018 19:43;0;0;But did Zidane ever say such a thing?;;;;1,00232E+18;https://twitter.com/ShirazAq96/status/1002319679032037377
EfranAgazade;31/05/2018 19:43;0;1;Managing Real Madrid has never been easy, but the post- Zidane challenge may be even more difficult. https:// twitter.com/Forbes/status/ 1002229473914257413 …;;;;1,00232E+18;https://twitter.com/EfranAgazade/status/1002319644701724674
MunirWhatsGood;31/05/2018 19:43;0;1;Zidane , Cristiano, and Bale to man united? #SalaamJumaat #alomae;;;#SalaamJumaat #alomae;1,00232E+18;https://twitter.com/MunirWhatsGood/status/1002319617702805505
eccentric_lad;31/05/2018 19:43;0;1;Come to think of it, if Zidane signs for us, Hazard definitely stays with us. One can always dream.;;;;1,00232E+18;https://twitter.com/eccentric_lad/status/1002319595603193857
gTrends_jp;31/05/2018 19:43;0;0;http:// bit.ly/view * Samantha Bee * Zidane * Greasy Grove Treasure Map * Adrift * Rod Blagojevich * Dinesh D'souza * National Donut Day 2018 * Upgrade * Tiger Woods * Nikolas Cruz * Harvey Weinstein * Top Gun 2 * Right to Try * Jermaine Gresham * Reverie * Fallout 76…;;;;1,00232E+18;https://twitter.com/gTrends_jp/status/1002319576221093889
Dozi_e30;31/05/2018 19:43;2;0;Zidane is a very wise coach. This is what Wenger shld have done years ago.;;;;1,00232E+18;https://twitter.com/Dozi_e30/status/1002319565303492610
newsgwcom;31/05/2018 19:43;0;1;Tottenham fear boss Mauricio Pochettino will replace Zinedine Zidane at Real Madrid THE NEWS - GROUP OF WORLD - http:// newsgw.com/tottenham-fear -boss-mauricio-pochettino-will-replace-zinedine-zidane-at-real-madrid/ … pic.twitter.com/254vMMaku7;;;;1,00232E+18;https://twitter.com/newsgwcom/status/1002319564502421504
slavayachnin;31/05/2018 19:43;0;0;Zinedine Zidane QUITS as Real Madrid's manager https:// dailym.ai/2HatyVq via @MailOnline;;@MailOnline;;1,00232E+18;https://twitter.com/slavayachnin/status/1002319562979794944
CrumbsTMT;31/05/2018 19:42;0;1;Announce now that they want Zidane and only Zidane , then after lengthy talks appoint Jim Jefferies anyway.;;;;1,00232E+18;https://twitter.com/CrumbsTMT/status/1002319556063432704
EpicForgeGames;31/05/2018 19:42;0;0;New game! https:// youtu.be/-jf6VDTZwYg https:// play.google.com/store/apps/det ails?id=com.epicforge.arcade.game.runner.football.run … Enjoy it! #football #videojuegos #Zidane #EstaVez #game #free #runner #WorldCup #WorldCup2018 #MundialRusia2018 #Mundial #Mundial2018 #futbol #Enjoy;;;#football #videojuegos #Zidane #EstaVez #game #free #runner #WorldCup #WorldCup2018 #MundialRusia2018 #Mundial #Mundial2018 #futbol #Enjoy;1,00232E+18;https://twitter.com/EpicForgeGames/status/1002319552989028352
CearaMacintyre;31/05/2018 19:42;0;8;Gerrard to Rangers. Ross to Sunderland. Emery to Arsenal. Silva to Everton. Lampard to Derby. Rowett to Stoke. McKinnon to Morton. Hopkin to Shrewsbury. Zidane to St Mirren. The only logical way.;;;;1,00232E+18;https://twitter.com/CearaMacintyre/status/1002319550644400128
Luis_TheMan07;31/05/2018 19:42;0;0;I know I’ve been annoying with all my Zidane tweets today but man, he put Madrid at the top and achieved what no other team has been able to. He proved everyone wrong and leaves humbly. #GraciasZZ #HalaMadrid;;;#GraciasZZ #HalaMadrid;1,00232E+18;https://twitter.com/Luis_TheMan07/status/1002319536991948801
brahahaa;31/05/2018 19:42;0;0;I respect your decision. Thanks for everything. We will miss you Zizou !! You’re living legend . #Zidane #RealMadrid pic.twitter.com/xFkkcF1kVJ;;;#Zidane #RealMadrid;1,00232E+18;https://twitter.com/brahahaa/status/1002319497414434817
Jonnynono;31/05/2018 19:42;0;0;I’m glad he was loyal to Keylor. Keylor has never been the problem and Flo’s infatuation with DeGea has always been misplaced in my opinion. Even Rafa Nadal had really nice things to say about Zidane today. Anyway Zizou’s gonna take the reins of Les Bleus and win a WC in 2022!;;;;1,00232E+18;https://twitter.com/Jonnynono/status/1002319491798306821
pzakeria31;31/05/2018 19:42;0;2;Real Madrid coach Zinedine Zidane said today he was leaving the Spanish giants, just days after winning the Champions League for the third year in a row #AFP #ZinedineZidane Pierre-Philippe Marcou pic.twitter.com/tqjEZO0pXI pic.twitter.com/9H01No6cTU;;;#AFP #ZinedineZidane;1,00232E+18;https://twitter.com/pzakeria31/status/1002319489197838336
jimmyalonzo10;31/05/2018 19:42;0;0;I literally cannot think of a good coach to take over Madrid, pocchetino looks ok. But none will ever manage RM like Zidane has.;;;;1,00232E+18;https://twitter.com/jimmyalonzo10/status/1002319468922654720
Naijaurban;31/05/2018 19:42;0;1;Real Madrid to announce Tottenham manager, Pochettino as Zidane ’s replacement https:// naijaurban.com/real-madrid-to -announce-tottenham-manager-pochettino-as-zidanes-replacement/ …;;;;1,00232E+18;https://twitter.com/Naijaurban/status/1002319449775661056
mlares75_y;31/05/2018 19:42;1;4;First, Zidane resigns, then, Matias Almeyda is fired how is this possible #Chivas #RealMadrid;;;#Chivas #RealMadrid;1,00232E+18;https://twitter.com/mlares75_y/status/1002319425486254080
Naijaurban;31/05/2018 19:42;0;0;Zinedine Zidane : How Real Madrid players reacted to manager’s resignation https:// naijaurban.com/zinedine-zidan e-how-real-madrid-players-reacted-to-managers-resignation/ …;;;;1,00232E+18;https://twitter.com/Naijaurban/status/1002319425423466496
MSNSouthAfrica;31/05/2018 19:42;0;0;"Cristiano Ronaldo proud"" to have played under Zinedine Zidane as Frenchman stands down as Real Madrid boss http://www. msn.com/en-za/sports/f ootball/cristiano-ronaldo-proud-to-have-played-under-zinedine-zidane-as-frenchman-stands-down-as-real-madrid-boss/ar-AAy520e?ocid=ob-tw-enza-861 …""";;;;1,00232E+18;https://twitter.com/MSNSouthAfrica/status/1002319418657869826
Naijaurban;31/05/2018 19:42;0;0;Zinedine Zidane : Real reason manager quit Real Madrid https:// naijaurban.com/zinedine-zidan e-real-reason-manager-quit-real-madrid/ …;;;;1,00232E+18;https://twitter.com/Naijaurban/status/1002319389029519360
ikushkush;31/05/2018 19:42;0;0;BBC Sport - Zinedine Zidane : Real Madrid boss stands down five days after Champions League win http://www. bbc.com/sport/football /44315700 …;;;;1,00232E+18;https://twitter.com/ikushkush/status/1002319386730999808
Badmanncooks;31/05/2018 19:42;0;0;Zidane came in like a boss, and left like a boss;;;;1,00232E+18;https://twitter.com/Badmanncooks/status/1002319372722032640
ViCktorr_;31/05/2018 19:42;0;0;Madrid was already threatening Zidane with a sack, there were rumours of Poch, this was someone that had won back to back UCL. It's a good thing he left, I hope there sorry asses struggle badly with their next managers;;;;1,00232E+18;https://twitter.com/ViCktorr_/status/1002319351020769280
NengiAyah;31/05/2018 19:42;0;0;I would like to see zidane as the new Chelsea boss to be honest;;;;1,00232E+18;https://twitter.com/NengiAyah/status/1002319349343051776
