username;date;retweets;favorites;text;geo;mentions;hashtags;id;permalink
onfarbawnmoore;29/06/2017 20:42;0;0;#49-1;;;#49;8,80572E+17;https://twitter.com/onfarbawnmoore/status/880572088771383297
B_Hamm17;29/06/2017 20:41;0;0;Floyd is a bum;;;;8,80572E+17;https://twitter.com/B_Hamm17/status/880572081318096896
fuufnf;29/06/2017 20:41;0;0;I had to unlike this 5 times, so I could re like it 6 more.;;;;8,80572E+17;https://twitter.com/fuufnf/status/880572073088778240
bezzarii;29/06/2017 20:41;9;117;49-2 gonna ko him in the rematch too;;;;8,80572E+17;https://twitter.com/bezzarii/status/880572067669831682
LightningLegend;29/06/2017 20:41;0;0;Kek;;;;8,80572E+17;https://twitter.com/LightningLegend/status/880572063269793792
Addymj_458;29/06/2017 20:41;1;0;49-1 then ko the Russian;;;;8,80572E+17;https://twitter.com/Addymj_458/status/880572054826778625
Floyd2122;29/06/2017 20:41;0;1;:/;;;;8,80572E+17;https://twitter.com/Floyd2122/status/880572053920899072
Metta_World_Mat;29/06/2017 20:41;3;1;McGregor is so far out of his league...W/ that said, dude will be cashing a FAT check https:// twitter.com/bso/status/880 570391973945344 …;;;;8,80572E+17;https://twitter.com/Metta_World_Mat/status/880572051035045888
StevieeeWx;29/06/2017 20:41;10;186;Shots fired;;;;8,80572E+17;https://twitter.com/StevieeeWx/status/880572047591710720
dwyatt225;29/06/2017 20:41;0;2;While you're reaching back to throw those uppercuts, expect to be hit in the face about 4 to 5 times. Still hope you win tho.;;;;8,80572E+17;https://twitter.com/dwyatt225/status/880572043145519109
_JoeMac86;29/06/2017 20:41;0;1;pic.twitter.com/ZGN9WjFqFj;;;;8,80572E+17;https://twitter.com/_JoeMac86/status/880572031896571904
TerryAvfc91;29/06/2017 20:41;0;0;@Villa_Gorilla1;;@Villa_Gorilla1;;8,80572E+17;https://twitter.com/TerryAvfc91/status/880572028633395200
own_the_game;29/06/2017 20:41;0;2;@A_Charterz 0-1;;@A_Charterz;;8,80572E+17;https://twitter.com/own_the_game/status/880572024615124993
OfficialSkinny1;29/06/2017 20:41;0;0;That left hand makes you believe loool I love it, team McGregor every day;;;;8,80572E+17;https://twitter.com/OfficialSkinny1/status/880572024174907392
The_Burgess;29/06/2017 20:41;0;0;GG @TheNotoriousMMA you have no chance. #TBE #TMT https:// twitter.com/FloydMayweathe r/status/880363572181606401 …;;@TheNotoriousMMA;#TBE #TMT;8,80572E+17;https://twitter.com/The_Burgess/status/880572007833714688
Shawnwi94145638;29/06/2017 20:41;0;3;Conor just started some shit;;;;8,80572E+17;https://twitter.com/Shawnwi94145638/status/880572007301218304
Iv197245;29/06/2017 20:41;24;182;pic.twitter.com/4wttCdfawl;;;;8,80572E+17;https://twitter.com/Iv197245/status/880572006185533442
DeposterChild;29/06/2017 20:41;0;0;Floyd might KO him in the 1st round RT @BSO : Mayweather and McGregor training videos from today side by side. pic.twitter.com/jHZXwXJm2S;;@BSO;;8,80572E+17;https://twitter.com/DeposterChild/status/880571999021658112
noahtheoutlaw;29/06/2017 20:41;0;6;pic.twitter.com/o7Uy1YyMP7;;;;8,80572E+17;https://twitter.com/noahtheoutlaw/status/880571969334390784
good_republican;29/06/2017 20:41;0;0;You can knock out Mayweather he's weak but he has endurance De La Hoya had him against the ropes. You have to bash him to win.;;;;8,80572E+17;https://twitter.com/good_republican/status/880571967383973890
AlanMil64642134;29/06/2017 20:41;0;0;49-1;;;;8,80572E+17;https://twitter.com/AlanMil64642134/status/880571967342030848
ogjeezus;29/06/2017 20:41;0;0;This will forever be my favorite video of McGregor . https:// twitter.com/causewereguys/ status/880568565845413888 …;;;;8,80572E+17;https://twitter.com/ogjeezus/status/880571959360327680
zeekclyde;29/06/2017 20:41;0;0;That Mcgregor video was sad, he is gonna get waxed;;;;8,80572E+17;https://twitter.com/zeekclyde/status/880571958940889089
EamonnCasey88;29/06/2017 20:41;0;0;Hahahaha;;;;8,80572E+17;https://twitter.com/EamonnCasey88/status/880571948346093574
RyanLFC1997;29/06/2017 20:41;1;13;When does the press start for this fight!;;;;8,80572E+17;https://twitter.com/RyanLFC1997/status/880571946278297600
missnatalia2017;29/06/2017 20:41;0;0;Vas y fort CHAMPION.;;;;8,80572E+17;https://twitter.com/missnatalia2017/status/880571944164352002
NeXusBoss_;29/06/2017 20:41;0;0;Lmao;;;;8,80572E+17;https://twitter.com/NeXusBoss_/status/880571937314938882
mmaballer13;29/06/2017 20:41;0;0;Please also watch this https:// youtu.be/hmdJXCBU068;;;;8,80572E+17;https://twitter.com/mmaballer13/status/880571937210089472
MichaelOHagan2;29/06/2017 20:41;0;1;Getting old;;;;8,80572E+17;https://twitter.com/MichaelOHagan2/status/880571936291606529
MichealSinatra;29/06/2017 20:41;0;0;Slowly sinking.... pic.twitter.com/mVJAtSrLub;;;;8,80572E+17;https://twitter.com/MichealSinatra/status/880571935582715904
Krisis1324;29/06/2017 20:41;0;0;Notorious Conor McGregor savage;;;;8,80572E+17;https://twitter.com/Krisis1324/status/880571927353597952
Cantona_Collar;29/06/2017 20:41;0;1;your boxing is terrible.;;;;8,80572E+17;https://twitter.com/Cantona_Collar/status/880571923427729412
CreachJesse;29/06/2017 20:41;0;0;Maclife;;;;8,80572E+17;https://twitter.com/CreachJesse/status/880571899868311554
AlexBialyj;29/06/2017 20:41;0;0;@matty78 has seen them moves.;;@matty78;;8,80572E+17;https://twitter.com/AlexBialyj/status/880571898349989888
Luckybaldwin221;29/06/2017 20:41;0;1;McGregor gotta be trolling https:// twitter.com/bso/status/880 570391973945344 …;;;;8,80572E+17;https://twitter.com/Luckybaldwin221/status/880571897766793216
TaviousKellum;29/06/2017 20:41;0;0;I think Floyd Mayweather would beat Conor McGregor . Cast your vote now! https:// cards.twitter.com/cards/18ce54fg l4f/47kog …;;;;8,80572E+17;https://twitter.com/TaviousKellum/status/880571897691471872
ErickMolinar83;29/06/2017 20:41;0;1;Lol;;;;8,80572E+17;https://twitter.com/ErickMolinar83/status/880571896676311041
1sttimedad;29/06/2017 20:41;0;1;So you've no clue about boxing. Figures;;;;8,80572E+17;https://twitter.com/1sttimedad/status/880571892477952000
DanielSherratt;29/06/2017 20:41;0;0;So it starts;;;;8,80572E+17;https://twitter.com/DanielSherratt/status/880571890112364544
GifJifApp;29/06/2017 20:41;42;118;pic.twitter.com/kdlrO964lI;;;;8,80572E+17;https://twitter.com/GifJifApp/status/880571887558037506
Blue_GoldPride;29/06/2017 20:41;0;0;One is using a heavy bag. The other a speed bag. Please train a little before commenting;;;;8,80572E+17;https://twitter.com/Blue_GoldPride/status/880571881404985351
Derrick_MSU_106;29/06/2017 20:41;2;3;Watch this, then go to @TheNotoriousMMA page and watch his... This shit ain't gone be fair! #MayweatherMcGregor https:// twitter.com/BleacherReport /status/880416231609729024 …;;@TheNotoriousMMA;#MayweatherMcGregor;8,80572E+17;https://twitter.com/Derrick_MSU_106/status/880571878410260483
Lord_Stroe;29/06/2017 20:41;0;1;Floyd is not capable of KOing Conor so I guess nothing can stop him Conor's all the way up;;;;8,80572E+17;https://twitter.com/Lord_Stroe/status/880571869191122945
JaysonTatumSZN;29/06/2017 20:41;0;1;Sftu ur gonna lose;;;;8,80572E+17;https://twitter.com/JaysonTatumSZN/status/880571865185517574
samwhelchel;29/06/2017 20:41;0;1;Mcgregor is either about to get a rude awakening, or he's posting these videos so that we think he is going to lose.;;;;8,80572E+17;https://twitter.com/samwhelchel/status/880571861741993984
errormichael;29/06/2017 20:41;0;0;Hahahahaha;;;;8,80572E+17;https://twitter.com/errormichael/status/880571856448880640
FuckingFranchu;29/06/2017 20:41;0;0;El Ewan McGregor . ¿No?????;;;;8,80572E+17;https://twitter.com/FuckingFranchu/status/880571854553067522
bhfaught;29/06/2017 20:41;0;2;He hits hard enough, however, I just don't see him landing that shot on Mayweather pic.twitter.com/oyn8ogR3dO;;;;8,80572E+17;https://twitter.com/bhfaught/status/880571852321689600
MichaelOHagan2;29/06/2017 20:41;0;3;;;;;8,80572E+17;https://twitter.com/MichaelOHagan2/status/880571850388099072
WoodChuckson;29/06/2017 20:41;0;0;I've screenshot yours too. You should know better! How is a boxer with a pro record of 0-0-0 gonna beat the greatest boxer of his era? Stop!;;;;8,80572E+17;https://twitter.com/WoodChuckson/status/880571841642983426
JayWatkins83;29/06/2017 20:41;0;0;Here's evidence as to why I'm definitely not taking this Mayweather Vs McGregor fight seriously smh http:// fb.me/387PVksjg;;;;8,80572E+17;https://twitter.com/JayWatkins83/status/880571840984428544
ryanmcaleenan6;29/06/2017 20:41;2;22;49-1;;;;8,80572E+17;https://twitter.com/ryanmcaleenan6/status/880571836974718976
DevinDavinci;29/06/2017 20:40;1;0;Nigga wanna kick so bad RT @BleacherReport : McGregor getting ready for Floyd... (via @TheNotoriousMMA ) pic.twitter.com/yYisgBKP8N;;@BleacherReport @TheNotoriousMMA;;8,80572E+17;https://twitter.com/DevinDavinci/status/880571808109514753
boxingmantalk;29/06/2017 20:40;1;0;Alrighty, who wants to rant to me about the Mayweather- McGregor fight #Boxing #Talk #Funstuff #Letsdothis;;;#Boxing #Talk #Funstuff #Letsdothis;8,80572E+17;https://twitter.com/boxingmantalk/status/880571804519215105
Arde_K;29/06/2017 20:40;0;1;Wrong Manny innit :DD;;;;8,80572E+17;https://twitter.com/Arde_K/status/880571800828215296
comentaristaufc;29/06/2017 20:40;0;1;O que vcs acham? Se Demian ganhar e for inteligente desafia o McGregor . Porque parar um cara igual o Tyron vai ser surreal. #combatenews;;;#combatenews;8,80572E+17;https://twitter.com/comentaristaufc/status/880571797233684481
KalanYoung;29/06/2017 20:40;0;19;Do you honestly think that? Mayweather will play with him;;;;8,80572E+17;https://twitter.com/KalanYoung/status/880571793895034881
TyeCrane_;29/06/2017 20:40;1;1;Sound effects . He lost!!!RT @BleacherReport : McGregor getting ready for Floyd... (via @TheNotoriousMMA ) pic.twitter.com/IG3UEgNDFO;;@BleacherReport @TheNotoriousMMA;;8,80572E+17;https://twitter.com/TyeCrane_/status/880571789172240384
dem12packfan;29/06/2017 20:40;1;2;He will get destroyed moving like that with Money!;;;;8,80572E+17;https://twitter.com/dem12packfan/status/880571762316124160
TheNotoriousMMA;29/06/2017 20:40;10702;27047;You are in quicksand.;;;;8,80572E+17;https://twitter.com/TheNotoriousMMA/status/880571756494376960
HoopKJHoop;29/06/2017 20:40;0;1;Oh its over for Mcgregor https:// twitter.com/BSO/status/880 570391973945344 …;;;;8,80572E+17;https://twitter.com/HoopKJHoop/status/880571710151512064
N_AnthonyAzzato;29/06/2017 20:40;1;0;R.I.P. McGregor https:// twitter.com/bleacherreport /status/880546986277130240 …;;;;8,80572E+17;https://twitter.com/N_AnthonyAzzato/status/880571701901373440
Abel22953862;29/06/2017 20:40;0;0;#UfcEnGol Tanto musculo t dan muxa fuerza pero t merman muxo el fondo fisico x el oxigeno k necesitas para moverlo X eso mcgregor es bestial;;;#UfcEnGol;8,80572E+17;https://twitter.com/Abel22953862/status/880571693399494656
Kyle2hig;29/06/2017 20:40;0;0;Go ahead and when you do you'll be missing @TheNotoriousMMA create history;;@TheNotoriousMMA;;8,80572E+17;https://twitter.com/Kyle2hig/status/880571689586884609
AdrianMan12;29/06/2017 20:40;0;0;@TheNotoriousMMA is playing mind games with these videos lol;;@TheNotoriousMMA;;8,80572E+17;https://twitter.com/AdrianMan12/status/880571669672230912
comentaristaufc;29/06/2017 20:40;0;3;O que vcs acham? Se Demian ganhar e for inteligente desafia o McGregor . Porque parar um cara igual o Tyron vai ser surreal. #revistacombate;;;#revistacombate;8,80572E+17;https://twitter.com/comentaristaufc/status/880571664106491905
DRtheMighty;29/06/2017 20:40;0;0;He has to be joking;;;;8,80572E+17;https://twitter.com/DRtheMighty/status/880571658309955584
2KadafiFatal;29/06/2017 20:40;0;0;The King of Fighting LETS GO CHAMP;;;;8,80572E+17;https://twitter.com/2KadafiFatal/status/880571651104141316
sufizzle;29/06/2017 20:40;0;0;The incredibly long odds of Conor McGregor against Floyd Mayweather http://www. espn.co.uk/boxing/story/_ /id/19749355 …;;;;8,80572E+17;https://twitter.com/sufizzle/status/880571647723528192
bamamuscle63;29/06/2017 20:40;1;2;Looks like McGregor is training for WWE's Great Balls of Fire PPV.;;;;8,80572E+17;https://twitter.com/bamamuscle63/status/880571616790540288
Lord_Stroe;29/06/2017 20:39;0;10;He couldn't KO Conor if he tried his hardest to so... invalid;;;;8,80572E+17;https://twitter.com/Lord_Stroe/status/880571576047030272
stephen51999;29/06/2017 20:39;2;39;49-1;;;;8,80572E+17;https://twitter.com/stephen51999/status/880571564818911232
togood2222;29/06/2017 20:39;0;0;"I liked a @YouTube video http:// youtu.be/EtBv1Jk8qF8?a Conor McGregor : I Want Khabib in Russia After Mayweather Boxing Match""""";;@YouTube;;8,80572E+17;https://twitter.com/togood2222/status/880571552579899392
ChizNuke;29/06/2017 20:39;8;60;Please help McGregor pic.twitter.com/IIfpIFBgvg;;;;8,80572E+17;https://twitter.com/ChizNuke/status/880571551954894848
ZarafonitisD31;29/06/2017 20:39;0;3;Floyds taking it 100% , this is a win win for mcgregor anyways, even if he's losing he's making more than he ever has;;;;8,80572E+17;https://twitter.com/ZarafonitisD31/status/880571546481381381
TheTone13;29/06/2017 20:39;0;0;You starting to sound like @espn;;@espn;;8,80572E+17;https://twitter.com/TheTone13/status/880571541406330880
AnaHissa;29/06/2017 20:39;0;11;"Conor McGregor publica vídeo de treino: Você nunca viu esses golpes"" | May-mac | http:// GloboEsporte.com http:// sportv.globo.com/site/combate/m ay-mac/noticia/2017/06/conor-mcgregor-publica-video-de-treino-voce-nunca-viu-esses-golpes.html …""";;;;8,80572E+17;https://twitter.com/AnaHissa/status/880571517796577280
KickingUpDust;29/06/2017 20:39;0;10;Those punches are slow. Floyd seeing those as soon as you swing.;;;;8,80571E+17;https://twitter.com/KickingUpDust/status/880571491947032576
TheGrantDowling;29/06/2017 20:39;5;135;bum life? mcgregor is making more in this fight than his career earnings combined. floyd is changing mcregor's life lol.;;;;8,80571E+17;https://twitter.com/TheGrantDowling/status/880571487907856384
RadarDoMMA;29/06/2017 20:39;0;0;"#MMA : Conor McGregor publica vídeo de treino: Você nunca viu esses golpes"" http:// dlvr.it/PR58bb pic.twitter.com/Wb2gSNhYVG""";;;#MMA;8,80571E+17;https://twitter.com/RadarDoMMA/status/880571480311910400
maxjudge59;29/06/2017 20:39;0;0;Get a room;;;;8,80571E+17;https://twitter.com/maxjudge59/status/880571471747309572
MJudahBrave;29/06/2017 20:39;0;0;You don't know what you're trying to talk about;;;;8,80571E+17;https://twitter.com/MJudahBrave/status/880571449861324801
UltimateAppFan;29/06/2017 20:39;0;0;http:// ift.tt/2t6Ia2o http:// ift.tt/2smHh8I Video – Conor McGregor Working the Bag ahead of McGregor vs Mayweather #UltimateFightFan;;;#UltimateFightFan;8,80571E+17;https://twitter.com/UltimateAppFan/status/880571442093580288
dgreenaway2;29/06/2017 20:39;0;0;I think your a warrior Dillian even Aj knows it Wilder knows it your the type of bloke who deserves title shot u the McGregor of bx anyplace;;;;8,80571E+17;https://twitter.com/dgreenaway2/status/880571432845152257
Skelf9;29/06/2017 20:39;0;0;Seen them about 5 times now;;;;8,80571E+17;https://twitter.com/Skelf9/status/880571397751402498
MickeyL1C4;29/06/2017 20:39;7;86;McGregor sure he really wants to do this?;;;;8,80571E+17;https://twitter.com/MickeyL1C4/status/880571380068122624
pasquiniandrew;29/06/2017 20:39;0;0;To be honest, I could probably do what McGregor is doing in his video.;;;;8,80571E+17;https://twitter.com/pasquiniandrew/status/880571376796524545
TheTone13;29/06/2017 20:39;0;0;Nah chap you can't be serious. How can you be so sure of something that hasn't happened yet???????????????????????????;;;;8,80571E+17;https://twitter.com/TheTone13/status/880571363211214848
JoshMistry;29/06/2017 20:39;0;0;McGregor omg looks so slow, his footwork I'm out;;;;8,80571E+17;https://twitter.com/JoshMistry/status/880571354097082368
1sttimedad;29/06/2017 20:38;0;1;That's the only reason;;;;8,80571E+17;https://twitter.com/1sttimedad/status/880571282240262144
Westsidestory12;29/06/2017 20:38;0;0;That painting gonna' look bad if you lose;;;;8,80571E+17;https://twitter.com/Westsidestory12/status/880571266985598979
JakeSorkin;29/06/2017 20:38;0;1;Good luck @TheNotoriousMMA @DannyDavidson25 https:// twitter.com/floydmayweathe r/status/880363572181606401 …;;@TheNotoriousMMA @DannyDavidson25;;8,80571E+17;https://twitter.com/JakeSorkin/status/880571264313774080
stephen51999;29/06/2017 20:38;0;5;49-1;;;;8,80571E+17;https://twitter.com/stephen51999/status/880571257380581376
Bali_Would;29/06/2017 20:38;0;0;mcgregor look dumb slow with the hand speed https:// twitter.com/TheNotoriousMM A/status/880568103427428352 …;;;;8,80571E+17;https://twitter.com/Bali_Would/status/880571224677654528
theahnsolo;29/06/2017 20:38;0;0;not at all lmao look at how floyd is in one place lmao and McGregor is moving his feet and body not just head lmao smh sit yo ass down https:// twitter.com/thedingojohnso n/status/880570644810915840 …;;;;8,80571E+17;https://twitter.com/theahnsolo/status/880571219904532480
WoodChuckson;29/06/2017 20:38;0;0;You CAN'T be serious!;;;;8,80571E+17;https://twitter.com/WoodChuckson/status/880571206327558145
matt76chico;29/06/2017 20:38;0;0;Do you think you're gonna beat Floyd;;;;8,80571E+17;https://twitter.com/matt76chico/status/880571200803676160
KINGCHRXS;29/06/2017 20:38;0;0;Ahhh man. McGregor is gonna die. https:// twitter.com/BSO/status/880 570391973945344 …;;;;8,80571E+17;https://twitter.com/KINGCHRXS/status/880571182180745216
kekedreanna;29/06/2017 20:38;0;0;Conor McGregor probably has great stamina huh;;;;8,80571E+17;https://twitter.com/kekedreanna/status/880571176128524288
1sttimedad;29/06/2017 20:38;0;0;Or Swindlers List...Mea a culpa;;;;8,80571E+17;https://twitter.com/1sttimedad/status/880571174236950528
johnsison06;29/06/2017 20:38;0;3;I think Mayweather's gonna kick McGregor 's ass - I'm sorry, but that's it.;;;;8,80571E+17;https://twitter.com/johnsison06/status/880571173632954368
Wallace_Tom1;29/06/2017 20:38;0;0;I think Floyd Mayweather would beat Conor McGregor . Cast your vote now! https:// cards.twitter.com/cards/18ce54fg l4f/47kog …;;;;8,80571E+17;https://twitter.com/Wallace_Tom1/status/880571166104092674
ulyssesromo;29/06/2017 20:38;0;0;floyd is going to win . Mcgregor can only win wit a lucky shot on floyd;;;;8,80571E+17;https://twitter.com/ulyssesromo/status/880571137838637057
JustinVenturini;29/06/2017 20:38;0;0;No, even if they were same age mcgregor would kill him. Knows how to truly fight. Floyd just good at fight where u can only punch;;;;8,80571E+17;https://twitter.com/JustinVenturini/status/880571132168069120
Mister_Clean40;29/06/2017 20:38;0;2;I love my dude McGregor but wtf is this https:// twitter.com/thenotoriousmm a/status/880568103427428352 …;;;;8,80571E+17;https://twitter.com/Mister_Clean40/status/880571127269138432
Lord_Stroe;29/06/2017 20:38;0;0;You're all talk you ain't watching this illegally you're paying like everyone else papi nutz;;;;8,80571E+17;https://twitter.com/Lord_Stroe/status/880571124186316802
Cippy911;29/06/2017 20:38;1;4;Mcgregor fans think this is an mma fight. It's not. It's boxing. Easiest fight of Mayweathers career;;;;8,80571E+17;https://twitter.com/Cippy911/status/880571117160636416
SpencaJs;29/06/2017 20:38;1;6;When I die I want to be reincarnated as Conor McGregor;;;;8,80571E+17;https://twitter.com/SpencaJs/status/880571103030202368
Rabiflynn;29/06/2017 20:38;0;1;100%;;;;8,80571E+17;https://twitter.com/Rabiflynn/status/880571091416166401
Tebzattm1;29/06/2017 20:38;0;0;Datz why i think Conor wil go old skool with his style..he'll use his height&reach in this fight too;;;;8,80571E+17;https://twitter.com/Tebzattm1/status/880571084940210177
burton3285;29/06/2017 20:37;0;0;so fucking annoying when corny white people say fam;;;;8,80571E+17;https://twitter.com/burton3285/status/880571077046435840
henoss_t;29/06/2017 20:37;0;1;McGregor is gonna die wow https:// twitter.com/bleacherreport /status/880546986277130240 …;;;;8,80571E+17;https://twitter.com/henoss_t/status/880571075767226369
_Bursey_;29/06/2017 20:37;0;6;Nah bro McGregor is going to win first round by KO;;;;8,80571E+17;https://twitter.com/_Bursey_/status/880571064845316097
restmoms;29/06/2017 20:37;0;0;I think Floyd Mayweather would beat Conor McGregor . Cast your vote now! https:// cards.twitter.com/cards/18ce54fg l4f/47kog …;;;;8,80571E+17;https://twitter.com/restmoms/status/880571055861108736
EleanorBlueman;29/06/2017 20:37;0;0;B r e x i t e e r;;;;8,80571E+17;https://twitter.com/EleanorBlueman/status/880571047988404224
B4dStr1ng;29/06/2017 20:37;0;1;All free trade agreements giving us anything like we have will result in us agreeing to all the freaking rules.;;;;8,80571E+17;https://twitter.com/B4dStr1ng/status/880571029495713794
Oms2g00d;29/06/2017 20:37;0;1;McGregor for me I'm tryna see Floyd get busted;;;;8,80571E+17;https://twitter.com/Oms2g00d/status/880571016975659009
henoss_t;29/06/2017 20:37;0;0;Neither has Floyd. McGregor isn't going to land a single punch wow https:// twitter.com/thenotoriousmm a/status/880568103427428352 …;;;;8,80571E+17;https://twitter.com/henoss_t/status/880570978627203072
JoshLing10;29/06/2017 20:37;0;0;Not sure if Mayweather puts him away cause Mayweather's power is crap from brittle hands and McGregor can take a punch. But yeah, it's bad.;;;;8,80571E+17;https://twitter.com/JoshLing10/status/880570969412124672
Jay__Arron;29/06/2017 20:37;0;1;@TheNotoriousMMA the greatest champion to walk this planet..sorry CHAMP CHAMP!!;;@TheNotoriousMMA;;8,80571E+17;https://twitter.com/Jay__Arron/status/880570950244339719
arrowace23;29/06/2017 20:37;0;0;Honestly don't think Floyd will see'em either. Unfortunately, he's dodging your shit all day long. Sooo hope I'm wrong.;;;;8,80571E+17;https://twitter.com/arrowace23/status/880570939385286657
Onlythetruth427;29/06/2017 20:37;0;2;He's gonna have to move a lot faster than that and with more fluidity;;;;8,80571E+17;https://twitter.com/Onlythetruth427/status/880570923727765504
kennyguye;29/06/2017 20:37;0;0;I liked a @YouTube video http:// youtu.be/3xUoBLf8wDQ?a I Am Boxing: Conor McGregor Working the Bag ahead of McGregor vs Mayweather;;@YouTube;;8,80571E+17;https://twitter.com/kennyguye/status/880570879587078146
Drewfioo;29/06/2017 20:37;0;0;McGregor bouta get that ass taxed https:// twitter.com/BSO/status/880 570488228990976 …;;;;8,80571E+17;https://twitter.com/Drewfioo/status/880570875807899648
TManna56;29/06/2017 20:37;0;2;Everyone knows Floyd is boutta work him, but this man McGregor can make history lol I'm tryna see that happen;;;;8,80571E+17;https://twitter.com/TManna56/status/880570861794840576
kzkizer;29/06/2017 20:37;0;2;If Conor McGregor knocks out Floyd so many of y'all are gonna be salty lol;;;;8,80571E+17;https://twitter.com/kzkizer/status/880570860947615753
SportsJOEdotie;29/06/2017 20:37;0;0;McGregor enlists the help of former two-weight world champion http:// bit.ly/2u39heT;;;;8,80571E+17;https://twitter.com/SportsJOEdotie/status/880570841683161088
ILIFT6;29/06/2017 20:37;0;0;@TonyFergusonXT asking number 1 to beg him for a fight LMAO, fight someone relevant and WIN too bad @TheNotoriousMMA chose @TeamKhabib xx;;@TonyFergusonXT @TheNotoriousMMA @TeamKhabib;;8,80571E+17;https://twitter.com/ILIFT6/status/880570839825035267
jay_landy;29/06/2017 20:36;0;0;But then we have to agree to all the rules of the EU, that's not what the electorate voted for. Surely there's a third way.;;;;8,80571E+17;https://twitter.com/jay_landy/status/880570824301961216
CGohVash;29/06/2017 20:36;0;0;McGregor might die in ring https:// twitter.com/bso/status/880 570391973945344 …;;;;8,80571E+17;https://twitter.com/CGohVash/status/880570820908679168
grindhard__1;29/06/2017 20:36;0;0;I think Floyd Mayweather would beat Conor McGregor . Cast your vote now! https:// cards.twitter.com/cards/18ce54fg l4f/47kog …;;;;8,80571E+17;https://twitter.com/grindhard__1/status/880570813463887872
maxjudge59;29/06/2017 20:36;0;0;Those rag heads know how to fight!;;;;8,80571E+17;https://twitter.com/maxjudge59/status/880570808065818624
NotoriousKO1994;29/06/2017 20:36;0;0;Conor McGregor vs. Khabib Nurmagomedov in Russia? UFC Champ Wants It http://www. mmanews.com/conor-mcgregor -vs-khabib-nurmagomedov-in-russia-ufc-champ-wants-it/ … via @mmanewsdotcom;;@mmanewsdotcom;;8,80571E+17;https://twitter.com/NotoriousKO1994/status/880570807717687300
1sttimedad;29/06/2017 20:36;0;1;Means nowt. That was an amateur boxer punching a Brazilian Jui Jitsu player. Pro boxer is a diff game;;;;8,80571E+17;https://twitter.com/1sttimedad/status/880570803846352896
morrow_steve;29/06/2017 20:36;0;0;Is he training to fight a sloth?;;;;8,80571E+17;https://twitter.com/morrow_steve/status/880570783055171584
ahhdeeh;29/06/2017 20:36;0;4;Don't show him nuttin!;;;;8,80571E+17;https://twitter.com/ahhdeeh/status/880570766496063489
Blue_GoldPride;29/06/2017 20:36;0;0;Probably training with 16 oz gloves on;;;;8,80571E+17;https://twitter.com/Blue_GoldPride/status/880570758510063616
MrGGlenn;29/06/2017 20:36;1;0;Lol @these McGregor training videos;;@these;;8,80571E+17;https://twitter.com/MrGGlenn/status/880570751635640323
LiveFromTheFive;29/06/2017 20:36;0;0;Yeaaaaaaah McGregor bout to get McSlept. https:// twitter.com/bleacherreport /status/880416231609729024 …;;;;8,80571E+17;https://twitter.com/LiveFromTheFive/status/880570726067163136
GainzRUs;29/06/2017 20:36;2;16;To everyone who keeps saying McGregor is too slow what fucking gym do you train at where they have you hitting bags at 100% clowns https:// twitter.com/thenotoriousmm a/status/880568103427428352 …;;;;8,80571E+17;https://twitter.com/GainzRUs/status/880570718202716160
cristianc_esp;29/06/2017 20:36;0;0;Cárgate a Floyd.;;;;8,80571E+17;https://twitter.com/cristianc_esp/status/880570713295507461
TomMcCoyTBE;29/06/2017 20:36;0;1;Let your fellow Irishman @NiallOfficial walk you out on 8/26, there is nobody it better for you Conor. Niall is the man #MayweatherMcGregor;;@NiallOfficial;#MayweatherMcGregor;8,80571E+17;https://twitter.com/TomMcCoyTBE/status/880570702989934592
