username;date;retweets;favorites;text;geo;mentions;hashtags;id;permalink
DLeeXIII;29/06/2017 20:36;0;0;Conner McGregor is about to get that ass waxed for 12 rounds then beaten by decision... https:// twitter.com/bso/status/880 570391973945344 …;;;;8,80571E+17;https://twitter.com/DLeeXIII/status/880570689849372678
feliperfection;29/06/2017 20:36;2;1;mcgregor wins in 3 seconds bet;;;;8,80571E+17;https://twitter.com/feliperfection/status/880570665862025217
MMAEcho;29/06/2017 20:36;0;1;Some disappointing news for Irish fans. McGregor and Mayweather will go on a world tour to promote the fight but... http:// fb.me/sHvtDHU9;;;;8,80571E+17;https://twitter.com/MMAEcho/status/880570640885063680
Sal_Grins23;29/06/2017 20:36;0;0;My dude going in hard;;;;8,80571E+17;https://twitter.com/Sal_Grins23/status/880570635549671424
aagarner4218;29/06/2017 20:36;4;40;You are one of the bravest men today. Walking into a fight knowing you have no fucking chance of winning. Tip of the hat to you.;;;;8,80571E+17;https://twitter.com/aagarner4218/status/880570622174273536
BlancarteJose;29/06/2017 20:36;0;0;@TheNotoriousMMA is gonna get caught like that watch;;@TheNotoriousMMA;;8,80571E+17;https://twitter.com/BlancarteJose/status/880570620110487552
Dro_Torres13;29/06/2017 20:36;0;11;Too slow for @FloydMayweather;;@FloydMayweather;;8,80571E+17;https://twitter.com/Dro_Torres13/status/880570608387588096
tutunji;29/06/2017 20:36;0;0;@TheNotoriousMMA you messed up fam https:// twitter.com/floydmayweathe r/status/880363572181606401 …;;@TheNotoriousMMA;;8,80571E+17;https://twitter.com/tutunji/status/880570601169182721
_maxpacheco;29/06/2017 20:35;0;1;This shits hilarious. Watch this, then watch Floyd's video. McGregor is gonna die. Won't last more than 3 rounds. I'll put money with anyone https:// twitter.com/bleacherreport /status/880546986277130240 …;;;;8,80571E+17;https://twitter.com/_maxpacheco/status/880570558504726532
Brasfield_51;29/06/2017 20:35;0;0;We all know who the better fighter is though ( @TheNotoriousMMA ) https:// twitter.com/sleepyfhwc/sta tus/880544916090142720 …;;@TheNotoriousMMA;;8,80571E+17;https://twitter.com/Brasfield_51/status/880570555920994304
rcoledaniels7;29/06/2017 20:35;0;0;I hope Conor Mcgregor knocks you out first round @FloydMayweather https:// twitter.com/floydmayweathe r/status/880363572181606401 …;;@FloydMayweather;;8,80571E+17;https://twitter.com/rcoledaniels7/status/880570555002490880
Niktazzy;29/06/2017 20:35;0;2;Please tell me these videos of McGregor are fake.... at this point idk if he can hit a speed bag at a fast pace;;;;8,8057E+17;https://twitter.com/Niktazzy/status/880570490674442240
tuitdepor;29/06/2017 20:35;0;0;Conor McGregor pidió enfrentar a Khabib en Rusia luego de pelear con Mayweather. https:// goo.gl/WNfUyz pic.twitter.com/4NPn9M5Scu;;;;8,8057E+17;https://twitter.com/tuitdepor/status/880570472399851520
bornhippppy;29/06/2017 20:35;0;3;I don't even like mayweather, but he's gone give McGregor that WORK;;;;8,8057E+17;https://twitter.com/bornhippppy/status/880570468071219200
perfect___black;29/06/2017 20:35;0;0;;;;;8,8057E+17;https://twitter.com/perfect___black/status/880570404787671040
mullinsman20;29/06/2017 20:35;0;0;Apparently picking on women these days;;;;8,8057E+17;https://twitter.com/mullinsman20/status/880570403520950273
dca_official98;29/06/2017 20:35;0;0;Going to put mayweather on he's ass;;;;8,8057E+17;https://twitter.com/dca_official98/status/880570400123604994
BSO;29/06/2017 20:35;21002;26611;Mayweather and McGregor training videos from today side by side. pic.twitter.com/cAJDPy9Dwn;;;;8,8057E+17;https://twitter.com/BSO/status/880570391973945344
ijustasquirrel;29/06/2017 20:35;0;1;Why we all will pay...;;;;8,8057E+17;https://twitter.com/ijustasquirrel/status/880570388694126592
B4dStr1ng;29/06/2017 20:35;0;1;Why rule them out then? They have done just that effectively or did you miss the Tory stance on this all. You'll all been fooled.;;;;8,8057E+17;https://twitter.com/B4dStr1ng/status/880570365407375360
Tebzattm1;29/06/2017 20:35;0;0;Uppercut mate!!;;;;8,8057E+17;https://twitter.com/Tebzattm1/status/880570365013086208
Nzuki_101;29/06/2017 20:35;0;0;Mayweather vs. McGregor - '180 Million Dollar Dance' Trailer https:// youtu.be/SO6cIlxMhco via @YouTube;;@YouTube;;8,8057E+17;https://twitter.com/Nzuki_101/status/880570362953650179
britboxsuk;29/06/2017 20:35;0;0;PADDYPOWER-20/1 #Mayweather to beat #Mcgregor ,new customers,winnings paid in free bets +T&C's http:// bit.ly/padpow10 #MayweatherMcGregor pic.twitter.com/qCCTQ3Wv14;;;#Mayweather #Mcgregor #MayweatherMcGregor;8,8057E+17;https://twitter.com/britboxsuk/status/880570359149461504
boxingcor;29/06/2017 20:35;0;0;PADDYPOWER-20/1 #Mayweather to beat #Mcgregor ,new customers,winnings paid in free bets +T&C's http:// bit.ly/padpow10 #MayweatherMcGregor pic.twitter.com/13VcOMlYYv;;;#Mayweather #Mcgregor #MayweatherMcGregor;8,8057E+17;https://twitter.com/boxingcor/status/880570345694089217
DannyJEmma;29/06/2017 20:35;0;1;Mcgregor wasn't goin for speed obviously lol;;;;8,8057E+17;https://twitter.com/DannyJEmma/status/880570336269537281
Ddempsey_18;29/06/2017 20:35;0;0;Floyd Mayweather is a MONSTER! I got $100 for anybody willing to bet against me w McGregor;;;;8,8057E+17;https://twitter.com/Ddempsey_18/status/880570329168478208
1sttimedad;29/06/2017 20:34;0;13;You do realise that 'that' was amateur at best. Conor was a very good amateur to be fair;;;;8,8057E+17;https://twitter.com/1sttimedad/status/880570315247669248
Bugsy_Wins;29/06/2017 20:34;0;0;Way too slow.. RIP McGreggor;;;;8,8057E+17;https://twitter.com/Bugsy_Wins/status/880570301276454912
tomdux1996;29/06/2017 20:34;0;1;;;;;8,8057E+17;https://twitter.com/tomdux1996/status/880570289230360577
gfr7sh;29/06/2017 20:34;0;1;I think Floyd Mayweather would beat Conor McGregor . Cast your vote now! https:// cards.twitter.com/cards/18ce54fg l4f/47kog …;;;;8,8057E+17;https://twitter.com/gfr7sh/status/880570289146515456
isa5ismail;29/06/2017 20:34;1;2;Out your mind if you think mcgregor touchin floyd https:// twitter.com/floydmayweathe r/status/880363572181606401 …;;;;8,8057E+17;https://twitter.com/isa5ismail/status/880570278807560192
CarlEllis22;29/06/2017 20:34;0;0;Omg he's going to get killed.;;;;8,8057E+17;https://twitter.com/CarlEllis22/status/880570265134149635
LukasRoss;29/06/2017 20:34;0;0;That weiner don't want it and is going to retire;;;;8,8057E+17;https://twitter.com/LukasRoss/status/880570264299290624
Dilla_Soul;29/06/2017 20:34;0;0;Conor Mcgregor is my man but Floyd gonna smoke his boots;;;;8,8057E+17;https://twitter.com/Dilla_Soul/status/880570245001490432
Billyallnight;29/06/2017 20:34;0;2;Box Nate after;;;;8,8057E+17;https://twitter.com/Billyallnight/status/880570240387526656
nairapark;29/06/2017 20:34;0;0;#Nigeria #news - Boxing: McGregor given Sunday deadline for Mayweather bout http://www. nairapark.com/news/149461359 3/boxing-mcgregor-given-sunday-deadline-for-mayweather&t=9394 …;;;#Nigeria #news;8,8057E+17;https://twitter.com/nairapark/status/880570204585152520
HamadMarzooq;29/06/2017 20:34;0;0;انزين تطب لي بساحة قطعه ٢؟;;;;8,8057E+17;https://twitter.com/HamadMarzooq/status/880570155318824960
jaazziefiz;29/06/2017 20:34;0;2;If mcgregor wins, I'll leave my baby daddy. BETTT https:// twitter.com/thenotoriousmm a/status/880568103427428352 …;;;;8,8057E+17;https://twitter.com/jaazziefiz/status/880570121194004485
BoxingBulletin;29/06/2017 20:34;0;0;Floyd Mayweather v Conor McGregor : Paulie Malignaggi in talks to assist UFC champion http:// ift.tt/2u4jHuZ #boxing;;;#boxing;8,8057E+17;https://twitter.com/BoxingBulletin/status/880570109777018880
JA3LAN17;29/06/2017 20:34;0;1;Floyd has quicker hands I don't know he might get McGregor together;;;;8,8057E+17;https://twitter.com/JA3LAN17/status/880570102365773824
BoxingBulletin;29/06/2017 20:34;0;0;Conor McGregor recruits Paulie Malignaggi in preparation for Floyd Mayweather http:// ift.tt/2tvhqfj #boxing;;;#boxing;8,8057E+17;https://twitter.com/BoxingBulletin/status/880570098368602112
3BILLZMusic;29/06/2017 20:34;0;2;Go listen to my mixtape for free. If you think it sucks you didn't waste any money;;;;8,8057E+17;https://twitter.com/3BILLZMusic/status/880570082266624001
Tailor___Made;29/06/2017 20:34;0;2;Why cant some of yall bring urself to admit McGregor gonna lose. He may not get his ass whipped but hes gonna lose in a unanimous decision;;;;8,8057E+17;https://twitter.com/Tailor___Made/status/880570079028670470
chief_danney;29/06/2017 20:34;0;0;This is really exciting bc @edsheeran and @TheNotoriousMMA . Need I say more?;;@edsheeran @TheNotoriousMMA;;8,8057E+17;https://twitter.com/chief_danney/status/880570075555745792
KennethT1963;29/06/2017 20:33;0;0;Stop the fight! This man is going to get seriously embarrassed!;;;;8,8057E+17;https://twitter.com/KennethT1963/status/880570048406061060
marzouk_1aa;29/06/2017 20:33;0;0;Team Mcgregor;;;;8,8057E+17;https://twitter.com/marzouk_1aa/status/880570044668891136
BigDigAbbdog;29/06/2017 20:33;0;0;@TheNotoriousMMA end him.;;@TheNotoriousMMA;;8,8057E+17;https://twitter.com/BigDigAbbdog/status/880570030374567936
ikortneyschmitt;29/06/2017 20:33;0;1;forever rootin for #Mcgregor https:// twitter.com/thenotoriousmm a/status/880568103427428352 …;;;#Mcgregor;8,8057E+17;https://twitter.com/ikortneyschmitt/status/880570009776422913
_PaolaMassiel;29/06/2017 20:33;0;1;pic.twitter.com/KWbHSathHT;;;;8,8057E+17;https://twitter.com/_PaolaMassiel/status/880570004202299397
ewhigham;29/06/2017 20:33;0;0;McGregor 's a straight clown man https:// twitter.com/CauseWereGuys/ status/880568565845413888 …;;;;8,8057E+17;https://twitter.com/ewhigham/status/880570004089032704
MarcusCherAu;29/06/2017 20:33;0;1;@robinblackmma could you do a clip looking at 5 possible stratergies @TheNotoriousMMA could disrupt boxing?;;@robinblackmma @TheNotoriousMMA;;8,8057E+17;https://twitter.com/MarcusCherAu/status/880569979845746688
KickAssCantona;29/06/2017 20:33;0;1;@TheNotoriousMMA any chance at all Conor of getting a follow back;;@TheNotoriousMMA;;8,8057E+17;https://twitter.com/KickAssCantona/status/880569974804406273
jay_landy;29/06/2017 20:33;0;0;Robust debate is healthy in a democracy. But why agree to SM & CU and all rules that go with it before the negotiations have even begun.;;;;8,8057E+17;https://twitter.com/jay_landy/status/880569973030236160
jose7r_;29/06/2017 20:33;0;0;NOTORIOUS MCGREGOR https:// twitter.com/thenotoriousmm a/status/880568103427428352 …;;;;8,8057E+17;https://twitter.com/jose7r_/status/880569961961279489
Crash_Bandecoot;29/06/2017 20:33;0;0;Floyd aint built like that. I do think Floyd will win tho. 2 things we know about McGregor is that he can take a punch, & he's strong.;;;;8,8057E+17;https://twitter.com/Crash_Bandecoot/status/880569958643716096
WoodChuckson;29/06/2017 20:33;0;4;He was thrown down. Not knocked down. #FakeNews;;;#FakeNews;8,8057E+17;https://twitter.com/WoodChuckson/status/880569957389668352
nassclark;29/06/2017 20:33;3;2;Bout to shmack McGregor https:// twitter.com/floydmayweathe r/status/880363572181606401 …;;;;8,8057E+17;https://twitter.com/nassclark/status/880569949244313600
SevereMMA;29/06/2017 20:33;6;8;Video - Conor McGregor Working the Bag ahead of McGregor vs Mayweather http:// severemma.com/2017/06/video- conor-mcgregor-working-bag-ahead-mcgregor-vs-mayweather/ … #MayweatherMcGregor pic.twitter.com/VyzG3ym3bT;;;#MayweatherMcGregor;8,8057E+17;https://twitter.com/SevereMMA/status/880569940557869057
MustardTigerrr;29/06/2017 20:33;0;0;You better kick him in the face, you won't out box him;;;;8,8057E+17;https://twitter.com/MustardTigerrr/status/880569939353944064
C__LTE;29/06/2017 20:33;0;0;Y'all real Live think McGregor gon win;;;;8,8057E+17;https://twitter.com/C__LTE/status/880569928629329920
1sttimedad;29/06/2017 20:33;0;0;Anyone else reminded of @HitmanHatton and his training and exclamation punching pre his fight v Mayweather? I love Conor but...;;@HitmanHatton;;8,8057E+17;https://twitter.com/1sttimedad/status/880569926804754435
Dunnetgary;29/06/2017 20:33;0;1;Got a whole rack on Floyd someone take mcgregor on some big boy shit;;;;8,8057E+17;https://twitter.com/Dunnetgary/status/880569919125024768
NotoriousAloush;29/06/2017 20:33;0;1;CHAMP CHAMP BY KO;;;;8,8057E+17;https://twitter.com/NotoriousAloush/status/880569891446804484
Tebzattm1;29/06/2017 20:33;0;0;Bro Conor is not a power puncher lyk ppl make him to be..his precision&timing makes his punches effective.glove sizes dnt rily matter;;;;8,8057E+17;https://twitter.com/Tebzattm1/status/880569882248695808
TheTone13;29/06/2017 20:33;0;0;I've screenshot your tweet. So when Conor beats Floyd.... Be prepared;;;;8,8057E+17;https://twitter.com/TheTone13/status/880569874501840896
mullinsman20;29/06/2017 20:33;0;1;I hope you crush Gayweather! Here for ya brotha!!!;;;;8,8057E+17;https://twitter.com/mullinsman20/status/880569856357089280
BlakeHamilton52;29/06/2017 20:33;0;0;I think Conor McGregor would beat Floyd Mayweather. Cast your vote now! https:// cards.twitter.com/cards/18ce54fg l4f/47kog …;;;;8,8057E+17;https://twitter.com/BlakeHamilton52/status/880569829031383041
maximusin3d;29/06/2017 20:32;0;0;pic.twitter.com/RkiLHVJxl8;;;;8,8057E+17;https://twitter.com/maximusin3d/status/880569803492044800
Dan3HitU;29/06/2017 20:32;0;0;I do not believe for a second that McGregor has said he wants to fight Khabib, never mind in Russia. Seems like Dana's blowing smoke again.;;;;8,8057E+17;https://twitter.com/Dan3HitU/status/880569786362728448
JimmyCannoli;29/06/2017 20:32;0;0;pic.twitter.com/ZHndA89HC6;;;;8,8057E+17;https://twitter.com/JimmyCannoli/status/880569771594481666
MorganPCampbell;29/06/2017 20:32;1;3;I love the painting on the wall of McGregor 's gym.... him landing a left hand against Mayweather, who's a southpaw for some reason.;;;;8,8057E+17;https://twitter.com/MorganPCampbell/status/880569759829544960
ToughGuy1563;29/06/2017 20:32;0;0;Tony, put serious heat on fatty to get him in the fight. Otherwise, he'll hide and waste everyone's time until @TheNotoriousMMA recks him;;@TheNotoriousMMA;;8,8057E+17;https://twitter.com/ToughGuy1563/status/880569755551363077
fcb_addict;29/06/2017 20:32;0;0;49-1 babehh;;;;8,8057E+17;https://twitter.com/fcb_addict/status/880569737213865984
JEvangelist30;29/06/2017 20:32;0;0;I liked a @YouTube video http:// youtu.be/THEKhtdcYRw?a Conor McGregor 's Opponents Before and After Beating Them (NEW);;@YouTube;;8,8057E+17;https://twitter.com/JEvangelist30/status/880569733736693760
evaanaboo;29/06/2017 20:32;0;0;IT'S OBI WAN'S LIGHTSABER, IT HAS EWAN MCGREGOR 'S VOICE ON IT;;;;8,8057E+17;https://twitter.com/evaanaboo/status/880569697955180544
mmaballer13;29/06/2017 20:32;0;0;Please also watch this with @TheNotoriousMMA https:// youtu.be/IKfoBlhrCZw;;@TheNotoriousMMA;;8,8057E+17;https://twitter.com/mmaballer13/status/880569694297538560
m4t2014;29/06/2017 20:32;0;1;Yes you're;;;;8,8057E+17;https://twitter.com/m4t2014/status/880569688836657152
CouponAdvisor;29/06/2017 20:32;0;0;Mayweather VS McGregor Boxing Tickets are Here #boxingmatchtickets https:// coupon-advisor.com/coupon/mayweat her-vs-mcgregor-boxing-tickets …;;;#boxingmatchtickets;8,8057E+17;https://twitter.com/CouponAdvisor/status/880569684218839042
GordanKnott;29/06/2017 20:32;0;0;official Twitter anything is terrible. Remix for Android is pretty good.;;;;8,8057E+17;https://twitter.com/GordanKnott/status/880569674748055553
TheTone13;29/06/2017 20:32;0;0;You'll be the one eating your words when Conor knocks Floyd out chap. Eeeeejit;;;;8,8057E+17;https://twitter.com/TheTone13/status/880569662735609858
dca_official98;29/06/2017 20:32;0;0;Bring on 26th August get to see @TheNotoriousMMA KO mayweather;;@TheNotoriousMMA;;8,8057E+17;https://twitter.com/dca_official98/status/880569655550758913
EyesackA;29/06/2017 20:32;0;0;pic.twitter.com/XIzuddGE9G;;;;8,8057E+17;https://twitter.com/EyesackA/status/880569649477423104
MichaelBuckle17;29/06/2017 20:32;0;2;Defend The Belt;;;;8,8057E+17;https://twitter.com/MichaelBuckle17/status/880569645866008576
steezycriiiis;29/06/2017 20:32;0;2;mayweather v. mcgregor fight bouta be so crazyyyy;;;;8,8057E+17;https://twitter.com/steezycriiiis/status/880569643013873664
stigmatiic;29/06/2017 20:32;0;0;Mcgregor doesn't stand a chance good lord;;;;8,8057E+17;https://twitter.com/stigmatiic/status/880569640543555584
JamesLyonss;29/06/2017 20:32;0;1;Conor McGregor about to shock the world;;;;8,8057E+17;https://twitter.com/JamesLyonss/status/880569624877613056
_PatrickPrunty_;29/06/2017 20:32;0;1;McGregor has a slight chance to shock the world https:// twitter.com/thenotoriousmm a/status/880568103427428352 …;;;;8,8057E+17;https://twitter.com/_PatrickPrunty_/status/880569620582682624
CaidenRodgers;29/06/2017 20:32;0;1;Hope? You know McGregor is the Vegas underdog right.;;;;8,8057E+17;https://twitter.com/CaidenRodgers/status/880569599191896065
karatake6;29/06/2017 20:32;0;0;Ha! This is a joke.;;;;8,8057E+17;https://twitter.com/karatake6/status/880569577926565888
lacamfield;29/06/2017 20:32;0;6;He really thinks he's going to win.;;;;8,8057E+17;https://twitter.com/lacamfield/status/880569577146638337
OvacionVE;29/06/2017 20:32;0;0;"#Boxeo | [FOTOS]  McGregor no tiene chance"", según expertos uruguayos | http:// bit.ly/2to9KLc pic.twitter.com/HmVSxilSev""";;;#Boxeo;8,8057E+17;https://twitter.com/OvacionVE/status/880569571509497856
ImehEkop;29/06/2017 20:31;0;0;Conor McGregor to Floyd: I've Got Boxing Training Video http://www. tmz.com/2017/06/29/con or-mcgregor-boxing-training-video-floyd-mayweather/ …;;;;8,8057E+17;https://twitter.com/ImehEkop/status/880569540345823233
Tyler55Davidson;29/06/2017 20:31;0;0;@TheNotoriousMMA I'm a New World Scot so ireland?scotland?..close enough beat that fucker down dude. Sincerely lost member of Clan Davidson. https:// twitter.com/TheNotoriousMM A/status/880568103427428352 …;;@TheNotoriousMMA;;8,8057E+17;https://twitter.com/Tyler55Davidson/status/880569536793202688
aarronrobson;29/06/2017 20:31;0;4;pic.twitter.com/3CDE7GKweR;;;;8,8057E+17;https://twitter.com/aarronrobson/status/880569527829803008
Spriggan55;29/06/2017 20:31;1;3;He gonna whoop McGregor ass!;;;;8,8057E+17;https://twitter.com/Spriggan55/status/880569525015429121
Mamii_Mia;29/06/2017 20:31;0;0;My sister and mom are literally arguing about how Mayweather is going to slap McGregor .... Gtfo;;;;8,8057E+17;https://twitter.com/Mamii_Mia/status/880569522284974082
6villadon;29/06/2017 20:31;1;0;Connor Mcgregor looks slow af in a boxing ring lol;;;;8,8057E+17;https://twitter.com/6villadon/status/880569512172560384
TMAN1138pm;29/06/2017 20:31;1;1;I like him in real-life.. #LongWayAround was excellent! RT to @mcgregor _ewan;;@mcgregor;#LongWayAround;8,8057E+17;https://twitter.com/TMAN1138pm/status/880569506132656128
king_promo_;29/06/2017 20:31;0;0;Lol @TonyFergusonXT;;@TonyFergusonXT;;8,80569E+17;https://twitter.com/king_promo_/status/880569471592783872
Bonehova;29/06/2017 20:31;0;0;Coming soon to @ImShannonLee is #beastmode the rise of @thenotoriousmma an audio doc about how a… https://www. instagram.com/p/BV8Se4igNoq/;;@ImShannonLee @thenotoriousmma;#beastmode;8,80569E+17;https://twitter.com/Bonehova/status/880569447156764672
logantelford5;29/06/2017 20:31;2;13;McGregor won't land a punch https:// twitter.com/bleacherreport /status/880416231609729024 …;;;;8,80569E+17;https://twitter.com/logantelford5/status/880569431163883520
bradallen2329;29/06/2017 20:31;0;26;Your looking real slow fam;;;;8,80569E+17;https://twitter.com/bradallen2329/status/880569412159459329
PhatyC1127;29/06/2017 20:31;0;1;I BELIEVE IN @TheNotoriousMMA !!! The world will witness the fall of @FloydMayweather ! @Brick_Fare @zwilbanks87 https:// twitter.com/TheNotoriousMM A/status/880568103427428352 …;;@TheNotoriousMMA @FloydMayweather @Brick_Fare @zwilbanks87;;8,80569E+17;https://twitter.com/PhatyC1127/status/880569394065055744
BlueBloodsBlue;29/06/2017 20:31;0;1;Wow! Key Lime Oreos are freakin amazing. This 4th of July I'm Ewan McGregor in Trainspotting trying not to eat the whole bag.;;;;8,80569E+17;https://twitter.com/BlueBloodsBlue/status/880569384741335044
MobileALTraffic;29/06/2017 20:31;1;0;Accident McGregor Ave just North of Airport Blvd;;;;8,80569E+17;https://twitter.com/MobileALTraffic/status/880569375715201025
rgmtrade;29/06/2017 20:31;0;0;Khabib Tiramisumenov;;;;8,80569E+17;https://twitter.com/rgmtrade/status/880569374771425280
St3v0_24;29/06/2017 20:31;1;0;Every single boxer who is an actual professional will put McGregor to sleep;;;;8,80569E+17;https://twitter.com/St3v0_24/status/880569350742093825
Israfil30;29/06/2017 20:31;1;6;"Conor is the real Rocky"" - Sylvester Stallone.""";;;;8,80569E+17;https://twitter.com/Israfil30/status/880569341166616577
ai2k_;29/06/2017 20:31;0;5;No shit because Floyd is a 40 year old boxer and McGregor is a MMA fighter in his prime...;;;;8,80569E+17;https://twitter.com/ai2k_/status/880569325874294784
Braclem;29/06/2017 20:30;1;14;pic.twitter.com/kY1y9whl2J;;;;8,80569E+17;https://twitter.com/Braclem/status/880569278159867904
PaulByr46981224;29/06/2017 20:30;0;0;Keep it real, stick to the game plan and not to play his games;;;;8,80569E+17;https://twitter.com/PaulByr46981224/status/880569268193996800
domfogs;29/06/2017 20:30;0;1;don't know about that one but as a McGregor fan that's the hope;;;;8,80569E+17;https://twitter.com/domfogs/status/880569243170942976
artofboxinginc;29/06/2017 20:30;1;1;via @ThaBoxingVoice / Manny Pacquiao vs. Jeff Horn Preview, Conor McGregor Sparring Paulie Malignaggi? http:// ow.ly/ryOZ50cuMDs;;@ThaBoxingVoice;;8,80569E+17;https://twitter.com/artofboxinginc/status/880569238498541568
fjpp83;29/06/2017 20:30;0;0;En menudo fregao se ha metido Mcgregor ... https:// twitter.com/UgarteJaime/st atus/880528306042540032 …;;;;8,80569E+17;https://twitter.com/fjpp83/status/880569217984024576
AlexColeGoggles;29/06/2017 20:30;0;18;Who sells mixtapes anymore? Got any 8-track;;;;8,80569E+17;https://twitter.com/AlexColeGoggles/status/880569185742532608
TomMcCoyTBE;29/06/2017 20:30;0;0;@TheNotoriousMMA walk out at #MayweatherMcGregor with @NiallOfficial;;@TheNotoriousMMA @NiallOfficial;#MayweatherMcGregor;8,80569E+17;https://twitter.com/TomMcCoyTBE/status/880569168956768256
bostard_2;29/06/2017 20:30;0;1;Mcgregor don't stand a chance https:// twitter.com/niggacommentar y/status/880501164185440256 …;;;;8,80569E+17;https://twitter.com/bostard_2/status/880569167249670144
NzNwordHistory;29/06/2017 20:30;28;234;You've never seen these moves #Goat #JoeyKarate pic.twitter.com/Sx3ABzdXyH;;;#Goat #JoeyKarate;8,80569E+17;https://twitter.com/NzNwordHistory/status/880569155019194368
Big_Phily79;29/06/2017 20:30;0;1;Conor mcgregor , why not? He's tryin boxing, why not cricket too??;;;;8,80569E+17;https://twitter.com/Big_Phily79/status/880569145305161728
AdonnisGraves;29/06/2017 20:30;0;0;If tv had snap filters id make McGregor a Klansmen on fight night.;;;;8,80569E+17;https://twitter.com/AdonnisGraves/status/880569136828436480
WoodChuckson;29/06/2017 20:30;0;0;If you don't see what it means, then you don't understand what it's saying. The blank stare...concern and the lack of it all.;;;;8,80569E+17;https://twitter.com/WoodChuckson/status/880569136463593472
_ElMejorRM;29/06/2017 20:30;0;0;49-1 King;;;;8,80569E+17;https://twitter.com/_ElMejorRM/status/880569117626859521
zainz__;29/06/2017 20:30;0;0;Mayweather has got this fight but would be sick to see mcgregor KO him https:// twitter.com/thenotoriousmm a/status/880568103427428352 …;;;;8,80569E+17;https://twitter.com/zainz__/status/880569116175863810
demace1;29/06/2017 20:30;0;0;Acabo de ver el video que subió McGregor y es Slow Motion vs el que subió Mayweather.;;;;8,80569E+17;https://twitter.com/demace1/status/880569115336777728
LiderEsDeporte;29/06/2017 20:30;0;0;"#Boxeo | Califican de ridículo"" el Mayweather- McGregor | http:// bit.ly/2tpK0hI pic.twitter.com/rIULu4H8YH""";;;#Boxeo;8,80569E+17;https://twitter.com/LiderEsDeporte/status/880569107925434368
buzzer1999;29/06/2017 20:30;0;0;;;;;8,80569E+17;https://twitter.com/buzzer1999/status/880569107787112448
angels_win;29/06/2017 20:29;0;8;I will give everything I have to watch you knock out Floyd;;;;8,80569E+17;https://twitter.com/angels_win/status/880569063969144832
_BasketBallKid;29/06/2017 20:29;0;0;L;;;;8,80569E+17;https://twitter.com/_BasketBallKid/status/880569050849570819
PC_BasedGod;29/06/2017 20:29;3;8;If mcgregor win ion wanna hear nun of this ohhh Floyd is old bs;;;;8,80569E+17;https://twitter.com/PC_BasedGod/status/880569039147237376
MPluchinotta;29/06/2017 20:29;0;3;Yo connor mcgregor;;;;8,80569E+17;https://twitter.com/MPluchinotta/status/880569038291714049
litawhiskey;29/06/2017 20:29;0;2;#209;;;#209;8,80569E+17;https://twitter.com/litawhiskey/status/880569032377745408
JoshLing10;29/06/2017 20:29;0;0;The more I see footage of McGregor do anything boxing related, the more I think...he's not going to land a fucking punch.;;;;8,80569E+17;https://twitter.com/JoshLing10/status/880569031891144704
TheRallyMullet;29/06/2017 20:29;0;1;Nah after the previous hit shots I'm trained like Conor McGregor;;;;8,80569E+17;https://twitter.com/TheRallyMullet/status/880569014212329473
Tx_sweet_tea;29/06/2017 20:29;0;1;Agreed on Another Note , We Bettin on Da Big 1 , I Got McGregor;;;;8,80569E+17;https://twitter.com/Tx_sweet_tea/status/880568999314149380
ahcros;29/06/2017 20:29;0;0;Maybe this confrontational griping is the reason CDN Feds have downplayed the 150 so severely. Barely mentioning a thing.;;;;8,80569E+17;https://twitter.com/ahcros/status/880568984990433281
wsixbolter;29/06/2017 20:29;0;0;#trolljob I love it;;;#trolljob;8,80569E+17;https://twitter.com/wsixbolter/status/880568974680797184
junkhost;29/06/2017 20:29;0;0;McGregor vs Mayweather Is Nothing Compared To This http:// junkhost.com/2017/06/mcgreg or-vs-mayweather-is-nothing-compared-to-this/ …;;;;8,80569E+17;https://twitter.com/junkhost/status/880568966304849920
