username;date;retweets;favorites;text;geo;mentions;hashtags;id;permalink
apklein51;14/03/2017 20:36;0;0;Barcelona will be happy to see him arrive in summer!;;;;8,41795E+17;https://twitter.com/apklein51/status/841795138137477121
UmarAbdulmajeed;14/03/2017 20:31;0;0;Barcelona meet with Hector Bellerin 's agent as transfer is imminent http:// fb.me/5DslfCgYn;;;;8,41794E+17;https://twitter.com/UmarAbdulmajeed/status/841793952793694210
DjFlizzyFlame;14/03/2017 20:17;0;0;Media reports that FC Barcelona are in talks with Arsenal over signing Hector Bellerin https:// tmblr.co/ZW7Pnw2JY5lA6;;;;8,4179E+17;https://twitter.com/DjFlizzyFlame/status/841790411748319232
smjabarkhil;14/03/2017 20:00;0;0;I have just bought Hector Bellerin in #dreamleaguesoccer pic.twitter.com/MouFlX85cp;;;#dreamleaguesoccer;8,41786E+17;https://twitter.com/smjabarkhil/status/841786045565943809
Artikeldumay;14/03/2017 19:30;0;0;Hector Bellerin - Hector Bellerin . (AP Photo/Christophe Ena) http:// ow.ly/KXKu50abrkG;;;;8,41779E+17;https://twitter.com/Artikeldumay/status/841778668267573248
FootyPremier;14/03/2017 19:28;0;0;Arsenal in talks with Barcelona over Hector Bellerin sale - http:// plnews.co.uk/arsenal-in-tal ks-with-barcelona-over-hector-bellerin-sale/ … pic.twitter.com/NOKrKBKqi6;;;;8,41778E+17;https://twitter.com/FootyPremier/status/841778080230313984
gbeduhubng;14/03/2017 19:13;0;0;Arsenal in ‘talks’ with Barcelona over sale of right-back “ Hector Bellerin ” https://www. gbeduhub.com/arsenal-talks- barcelona-sale-right-back-hector-bellerin/ … pic.twitter.com/hQ7DQuW93e;;;;8,41774E+17;https://twitter.com/gbeduhubng/status/841774298708774917
BellerinPace;14/03/2017 18:52;0;1;when u see hector bellerin sprinting https:// twitter.com/garylineker/st atus/841763627015237632 …;;;;8,41769E+17;https://twitter.com/BellerinPace/status/841769063911120897
Domque23;14/03/2017 18:12;1;2;@HectorBellerin @Phil_Coutinho welcome to @FCBarcelona_es .!!!;;@HectorBellerin @Phil_Coutinho @FCBarcelona_es;;8,41759E+17;https://twitter.com/Domque23/status/841758955462365184
MadeteIan;14/03/2017 18:11;1;0;@HectorBellerin please dont leave us;;@HectorBellerin;;8,41759E+17;https://twitter.com/MadeteIan/status/841758800243761157
ChatSoccer;14/03/2017 18:10;0;0;Report: Barcelona in Negotiations to Bring Hector Bellerin Back From Arsenal http://www. chatsports.com/soccer/a/sourc e/report-barcelona-in-negotiations-to-bring-hector-bellerin-back-from-arsenal-13354615 … via @chatsports;;@chatsports;;8,41759E+17;https://twitter.com/ChatSoccer/status/841758510534787072
ultra_barcelona;14/03/2017 18:01;0;1;Report: Barcelona in Negotiations to Bring Hector Bellerin Back From Arsenal: According to Diario Sport. The front… http:// dlvr.it/Nd8vFy pic.twitter.com/IyTi5CWePV;;;;8,41756E+17;https://twitter.com/ultra_barcelona/status/841756233270927360
jamesbunyan;14/03/2017 17:59;0;0;his ability to evade the advances of Barcelona;;;;8,41756E+17;https://twitter.com/jamesbunyan/status/841755787756204033
KunaalPuthran1;14/03/2017 17:51;0;0;@HectorBellerin are you leaving arsenal fc and us( your beloved fans)??;;@HectorBellerin;;8,41754E+17;https://twitter.com/KunaalPuthran1/status/841753771025735680
barcanewsonly;14/03/2017 17:50;0;0;#FCBarcelona #Barca #Blaugrana Report: Barcelona in Negotiations to Bring Hector Bellerin Back From Arsenal http:// dld.bz/f5KNe;;;#FCBarcelona #Barca #Blaugrana;8,41753E+17;https://twitter.com/barcanewsonly/status/841753329554358273
BlaugranesBarca;14/03/2017 17:41;2;6;Report: Barcelona in Negotiations to Bring Hector Bellerin Back From Arsenal http://www. barcablaugranes.com/2017/3/14/1492 7202/report-barcelona-transfer-hector-bellerin-from-arsenal?utm_campaign=barcablaugranes&utm_content=chorus&utm_medium=social&utm_source=twitter …;;;;8,41751E+17;https://twitter.com/BlaugranesBarca/status/841751081478692865
luism8989;14/03/2017 17:41;2;1;Report: Barcelona in Negotiations to Bring Hector Bellerin Back From Arsenal http://www. barcablaugranes.com/2017/3/14/1492 7202/report-barcelona-transfer-hector-bellerin-from-arsenal?utm_campaign=luism8989&utm_content=chorus&utm_medium=social&utm_source=twitter …;;;;8,41751E+17;https://twitter.com/luism8989/status/841751080396591104
FCKNCHAMBERS;14/03/2017 17:34;1;7;why does hector bellerin look like lord farquaad from shrek;;;;8,41749E+17;https://twitter.com/FCKNCHAMBERS/status/841749342683820033
barcanewsonly;14/03/2017 17:03;1;2;#FCBarcelona #Barca #Blaugrana Barcelona Transfer News: Latest on Hector Bellerin to Arsenal Rumours http:// dld.bz/f5JYt;;;#FCBarcelona #Barca #Blaugrana;8,41742E+17;https://twitter.com/barcanewsonly/status/841741613739171840
MessiBots;14/03/2017 17:01;0;2;Barcelona have made Arsenal full-back Hector Bellerin (21) a priority target for the summer transfer window. [SPORT];;;;8,41741E+17;https://twitter.com/MessiBots/status/841741078697000960
BarcaNewsForum;14/03/2017 16:58;19;33;Barcelona have made Arsenal full-back Hector Bellerin (21) a priority target for the summer transfer window. [SPORT];;;;8,4174E+17;https://twitter.com/BarcaNewsForum/status/841740261260644352
McKinnz88;14/03/2017 16:51;0;0;being able to disappear it's amazing how he does it;;;;8,41739E+17;https://twitter.com/McKinnz88/status/841738651700731904
SeedoorPiston;14/03/2017 16:24;0;0;Yo @HectorBellerin you pick up the phone from @jmbartomeu and tell him:WHAT'S UP https://www. youtube.com/watch?v=eZRCJL J6djA … xD;;@HectorBellerin @jmbartomeu;;8,41732E+17;https://twitter.com/SeedoorPiston/status/841731663512113152
Noe_Brd;14/03/2017 15:54;0;0;We don't want you @HectorBellerin in barcelona;;@HectorBellerin;;8,41724E+17;https://twitter.com/Noe_Brd/status/841724169289113601
TomPike91;14/03/2017 15:43;0;0;Rumours are saying your going Barcelona @HectorBellerin ? Please tell me it's all lies;;@HectorBellerin;;8,41721E+17;https://twitter.com/TomPike91/status/841721447336824833
GoonerGaunty73;14/03/2017 15:35;0;0;Arsenal 'open talks with Barcelona over £35million sale' of Hector Bellerin http:// ift.tt/2mJN042;;;;8,41719E+17;https://twitter.com/GoonerGaunty73/status/841719468111872000
9ja_Arsenal;14/03/2017 15:31;0;0;Hector Bellerin : Arsenal to meet Barcelona in April to discuss mega summer transfer http:// dlvr.it/Nd6FY6;;;;8,41718E+17;https://twitter.com/9ja_Arsenal/status/841718473399058432
footy_social;14/03/2017 15:23;0;0;Arsenal have opened talks with Barcelona over the £35m transfer of Héctor Bellerín . (Source: SPORT)… http:// dlvr.it/Nd651V;;;;8,41716E+17;https://twitter.com/footy_social/status/841716330747199488
PaulPaultcox;14/03/2017 15:19;0;0;nothing waste of space;;;;8,41715E+17;https://twitter.com/PaulPaultcox/status/841715466062176256
ArsenaFansclub;14/03/2017 15:13;0;1;Hector Bellerin : Arsenal to meet Barcelona in April to discuss mega summer transfer - Daily Star http:// dlvr.it/Nd5v9r;;;;8,41714E+17;https://twitter.com/ArsenaFansclub/status/841713853071273985
ArsenalNewdaily;14/03/2017 15:13;0;1;Hector Bellerin : Arsenal to meet Barcelona in April to discuss mega summer transfer - Daily Star http:// dlvr.it/Nd5v2n;;;;8,41714E+17;https://twitter.com/ArsenalNewdaily/status/841713836436537345
ArsenalPlaza;14/03/2017 15:13;0;1;Hector Bellerin : Arsenal to meet Barcelona in April to discuss mega summer transfer - Daily Star http:// dlvr.it/Nd5v25;;;;8,41714E+17;https://twitter.com/ArsenalPlaza/status/841713836272963584
OlasunkanmiIbik;14/03/2017 15:07;0;0;Barcelona in talks with Arsenal over Hector Bellerin http://www. footballflakes.com/barcelona-in-t alks-with-arsenal-over-hector-bellerin/ …;;;;8,41712E+17;https://twitter.com/OlasunkanmiIbik/status/841712394237812736
DaprinceBlog1;14/03/2017 15:01;0;0;Hector Bellerin Arsenal in ‘talks’ with Barcelona over sale of right-back http:// dlvr.it/Nd5dwp pic.twitter.com/QRjVEHvLnL;;;;8,41711E+17;https://twitter.com/DaprinceBlog1/status/841710960209420288
DaprinceBlog1;14/03/2017 14:58;0;0;Hector Bellerin Arsenal in ‘talks’ with Barcelona over sale of right-back https:// goo.gl/fb/u3Hzkd;;;;8,4171E+17;https://twitter.com/DaprinceBlog1/status/841710187551559680
VivaswanM;14/03/2017 14:52;0;0;speed and loyalty towards Arsenal.;;;;8,41709E+17;https://twitter.com/VivaswanM/status/841708704508588032
Gabe2553;14/03/2017 14:44;0;1;im so sorry daniel;;;;8,41707E+17;https://twitter.com/Gabe2553/status/841706524716212224
fcbarcelona_luv;14/03/2017 14:34;0;0;Barcelona Transfer News: Latest on Hector Bellerin to Arsenal http:// Rumours.Barcelona are reportedly ready.. http:// fantasticoh.com/beep?id=8b22ab be0f8a41fd …;;;;8,41704E+17;https://twitter.com/fcbarcelona_luv/status/841704151948111872
xhelua;14/03/2017 14:28;0;0;Representatives of Arsenal and Barcelona have met to discuss the transfer of right back Héctor Bellerín , according to reports in Spain.;;;;8,41703E+17;https://twitter.com/xhelua/status/841702645089873921
ArsenalFCLover5;14/03/2017 14:15;0;0;Great to see both and Alex Ox and Héctor Bellerín in attendance at the Emirates to show their support for the Arsenal U23s vs. Man City.;;;;8,41699E+17;https://twitter.com/ArsenalFCLover5/status/841699214996328448
drrhymes442;14/03/2017 14:06;0;1;LET GET BACK UP AND WIN OUR REMAINING MATCHES;;;;8,41697E+17;https://twitter.com/drrhymes442/status/841697032834306052
goonersteve12;14/03/2017 14:05;6;3;@HectorBellerin @Arsenal Can i get a shoutout to my son Hector please Hector. Named after you! pic.twitter.com/ue3GI25gyA;;@HectorBellerin @Arsenal;;8,41697E+17;https://twitter.com/goonersteve12/status/841696779544494080
bristolgman;14/03/2017 14:05;0;0;@HectorBellerin Hector is a top bloke - he had his picture taken with my 3 sons on Oxford St #topblokehector;;@HectorBellerin;#topblokehector;8,41697E+17;https://twitter.com/bristolgman/status/841696690293899264
aymanzl;14/03/2017 13:59;0;1;next hector bellerin;;;;8,41695E+17;https://twitter.com/aymanzl/status/841695303812153345
openomroep;14/03/2017 13:57;0;0;#rumours #roddels Barcelona Transfer News: Latest on Hector Bellerin to Arsenal Rumours… https:// goo.gl/fb/yG0yF8;;;#rumours #roddels;8,41695E+17;https://twitter.com/openomroep/status/841694898965348353
saglotech;14/03/2017 13:54;0;0;Barcelona Transfer News: Latest on Hector Bellerin to Arsenal Rumours http:// dlvr.it/Nd4HCs Via @EBDailyNews;;@EBDailyNews;;8,41694E+17;https://twitter.com/saglotech/status/841693938830397440
PulseNigeria247;14/03/2017 13:46;0;0;Hector Bellerin : Arsenal in ‘talks’ with Barcelona over sale of right-back http:// bit.ly/2nppPKM pic.twitter.com/PYrtX5UrNi;;;;8,41692E+17;https://twitter.com/PulseNigeria247/status/841691928710266880
BingoByte;14/03/2017 13:43;0;0;Hector Bellerin to Barcelona: Arsenal to meet La Liga club in April http://www. bingobyte.com/hector-belleri n-to-barcelona-arsenal-to-meet-la-liga-club-in-april/ … pic.twitter.com/9B8u8UwqVP;;;;8,41691E+17;https://twitter.com/BingoByte/status/841691231612784640
EdwardHumphries;14/03/2017 13:39;0;0;Arsenal transfer news: Barcelona in talks over Hector Bellerin move http://www. arsenalnews247.tk/2017/03/14/ars enal-transfer-news-barcelona-in-talks-over-hector-bellerin-move/ … pic.twitter.com/ofCb9c7SKL;;;;8,4169E+17;https://twitter.com/EdwardHumphries/status/841690185175826432
kmgituka;14/03/2017 13:38;0;0;Fuvkin sell @HectorBellerin now!!? @Arsenal Don't even try man;;@HectorBellerin @Arsenal;;8,4169E+17;https://twitter.com/kmgituka/status/841689945899184128
PulseSports247;14/03/2017 13:38;0;0;Hector Bellerin : Arsenal in ‘talks’ with Barcelona over sale of right-back http:// dlvr.it/Nd40dr pic.twitter.com/VVgaMfWmA4;;;;8,4169E+17;https://twitter.com/PulseSports247/status/841689932062121984
SabrinaVivianne;14/03/2017 13:34;0;0;Death by Bellerin's lips #arsenal #gooner #hectorbellerin https://www. instagram.com/p/BRoBsiUDVfk/;;;#arsenal #gooner #hectorbellerin;8,41689E+17;https://twitter.com/SabrinaVivianne/status/841688979913244672
Shrutzzers;14/03/2017 13:33;0;0;@HectorBellerin you are my favorite human being;;@HectorBellerin;;8,41689E+17;https://twitter.com/Shrutzzers/status/841688707501453313
madridista00712;14/03/2017 13:15;0;0;Hector Bellerin incoming;;;;8,41684E+17;https://twitter.com/madridista00712/status/841684096703201281
openn_world;14/03/2017 13:09;0;0;#news #rumours Barcelona Transfer News: Latest on Hector Bellerin to Arsenal Rumours… https:// goo.gl/fb/L2v8LX;;;#news #rumours;8,41683E+17;https://twitter.com/openn_world/status/841682787333681152
SportlineNG;14/03/2017 13:06;1;0;Barcelona 'planning £35m Hector Bellerin move' - https:// goo.gl/MdwXRJ pic.twitter.com/OnlOYK9JiY;;;;8,41682E+17;https://twitter.com/SportlineNG/status/841681841656545281
thesignalng;14/03/2017 13:05;0;0;Arsenal in Talk With Barcelona Over Hector Bellerin Sales http:// tinyurl.com/go2c8tk;;;;8,41682E+17;https://twitter.com/thesignalng/status/841681716989255680
FCEArsenal;14/03/2017 13:01;0;0;Barcelona 'planning £35m Hector Bellerin move' http://www. fcexclusive.com/news/arsenal/b arcelona-planning-ps35m-hector-bellerin-move-563429 … (Source: Sports Mole);;;;8,41681E+17;https://twitter.com/FCEArsenal/status/841680596002840576
SM_Headlines;14/03/2017 12:55;0;0;Barcelona 'planning £35m Hector Bellerin move' http:// sm.mg/wy4bxks #arsenal #FCBlive #ViscaBarca;;;#arsenal #FCBlive #ViscaBarca;8,41679E+17;https://twitter.com/SM_Headlines/status/841679292262154245
Barcelona_SM;14/03/2017 12:55;0;1;Barcelona 'planning £35m Hector Bellerin move' http:// sm.mg/52hpbn9 #FCBlive #ViscaBarca;;;#FCBlive #ViscaBarca;8,41679E+17;https://twitter.com/Barcelona_SM/status/841679286692134912
SMArsenal;14/03/2017 12:55;0;0;Barcelona 'planning £35m Hector Bellerin move' http:// sm.mg/k28hvrj #arsenal;;;#arsenal;8,41679E+17;https://twitter.com/SMArsenal/status/841679285429645314
_GoonerPrincess;14/03/2017 12:46;0;0;we love @HectorBellerin , but work on your crosses. Future is bright!;;@HectorBellerin;;8,41677E+17;https://twitter.com/_GoonerPrincess/status/841676962821210113
DublinGunner37;14/03/2017 12:40;0;1;€40 million ???? More like £50 million one of the best RB's in the world and young.;;;;8,41675E+17;https://twitter.com/DublinGunner37/status/841675442432167937
g_hitsforreal;14/03/2017 12:36;0;0;Arsenal in talks with Barcelona over Hector Bellerin sale http:// leave4sports.com/2017/03/14/ars enal-in-talks-with-barcelona-over-hector-bellerin-sale …;;;;8,41674E+17;https://twitter.com/g_hitsforreal/status/841674319214309377
openomroep;14/03/2017 12:32;0;0;#news #rumours Barcelona Transfer News: Latest on Hector Bellerin to Arsenal Rumours… https:// goo.gl/fb/nUQvjm;;;#news #rumours;8,41673E+17;https://twitter.com/openomroep/status/841673287637819393
1yarders;14/03/2017 12:25;0;0;@ArsenalFanTV Cant you all chip in and buy him another jacket? the fella thinks @HectorBellerin plays left back.;;@ArsenalFanTV @HectorBellerin;;8,41672E+17;https://twitter.com/1yarders/status/841671538336288770
CRSaltmarsh;14/03/2017 12:15;0;0;best attribute does not = what he needs to work on.;;;;8,41669E+17;https://twitter.com/CRSaltmarsh/status/841669208035450880
BehruGunner;14/03/2017 12:11;0;0;getting bulldozed by Marcus Alonso ..;;;;8,41668E+17;https://twitter.com/BehruGunner/status/841668098793046016
Arsenal_Danny49;14/03/2017 12:10;0;0;Barcelona have opened talks with Arsenal over a £35m move for Hector Bellerin . #AFC #Arsenal pic.twitter.com/ezIrBLTvpu;;;#AFC #Arsenal;8,41668E+17;https://twitter.com/Arsenal_Danny49/status/841667965103833088
abdoulgh;14/03/2017 12:08;0;0;Guy, you promised loyalty @HectorBellerin https:// twitter.com/tomgunner14/st atus/841667103216287745 …;;@HectorBellerin;;8,41667E+17;https://twitter.com/abdoulgh/status/841667345651232768
tomgunner14;14/03/2017 12:07;45;24;Barcelona have opened talks with Arsenal over a £35m move for Hector Bellerin . [Sport] pic.twitter.com/O4hQqYzrTH;;;;8,41667E+17;https://twitter.com/tomgunner14/status/841667103216287745
UnofficialPL;14/03/2017 12:03;0;0;Barcelona Transfer News: Latest on Hector Bellerin to Arsenal Rumours http:// bleacherreport.com/articles/26978 92-barcelona-transfer-news-latest-on-hector-bellerin-to-arsenal-rumours?utm_source=dlvr.it&utm_medium=twitter …;;;;8,41666E+17;https://twitter.com/UnofficialPL/status/841666041944072192
Timiochukwu2;14/03/2017 12:03;0;0;#bleacher Barcelona Transfer News: Latest on Hector Bellerin to Arsenal Rumours https:// goo.gl/fb/z21Ft9;;;#bleacher;8,41666E+17;https://twitter.com/Timiochukwu2/status/841666018883837955
Eurosport_UK;14/03/2017 12:00;1;2;Bad news, @Arsenal . @FCBarcelona are confident of signing @HectorBellerin ! Euro Papers http:// bit.ly/2njs3hT pic.twitter.com/17vAbD1mkQ;;@Arsenal @FCBarcelona @HectorBellerin;;8,41665E+17;https://twitter.com/Eurosport_UK/status/841665228760875008
VendorNaija;14/03/2017 11:57;0;0;Barcelona Transfer News: Latest on Hector Bellerin to Arsenal Rumours -… http:// dlvr.it/Nd1qhg @ToyinIbitoye http:// vendornaija.co.cc;;@ToyinIbitoye;;8,41665E+17;https://twitter.com/VendorNaija/status/841664669970399232
wotshaking;14/03/2017 11:52;0;0;Barcelona Transfer News: Latest on Hector Bellerin to Arsenal Rumours http://www. whatshaking.com/barcelona-tran sfer-news-latest-on-hector-bellerin-to-arsenal-rumours/ …;;;;8,41663E+17;https://twitter.com/wotshaking/status/841663324714606593
The_RealTune;14/03/2017 11:51;0;1;I wanna see him playing for FC Barcelona Hector Bellerin;;;;8,41663E+17;https://twitter.com/The_RealTune/status/841663030534496256
3tking;14/03/2017 11:48;0;0;Barcelona Transfer News: Latest on Hector Bellerin to Arsenal Rumours https:// goo.gl/fb/gp2cNO;;;;8,41662E+17;https://twitter.com/3tking/status/841662267737440256
Sport_News01;14/03/2017 11:47;0;0;Barcelona Transfer News: Latest on Hector Bellerin to Arsenal Rumours http:// bleacherreport.com/articles/26978 92-barcelona-transfer-news-latest-on-hector-bellerin-to-arsenal-rumours?utm_source=dlvr.it&utm_medium=twitter … #Soccer #WorldFootball #LaLiga #FCBarcelona;;;#Soccer #WorldFootball #LaLiga #FCBarcelona;8,41662E+17;https://twitter.com/Sport_News01/status/841661998836269056
juanmuriango;14/03/2017 11:39;0;0;Barcelona Transfer News: Latest on Hector Bellerin to Arsenal Rumours http:// dlvr.it/Nd1MLP;;;;8,4166E+17;https://twitter.com/juanmuriango/status/841660082580475904
Izeeq;14/03/2017 11:39;0;0;Barcelona Transfer News: Latest on Hector Bellerin to Arsenal Rumours http:// dlvr.it/Nd1SgK;;;;8,4166E+17;https://twitter.com/Izeeq/status/841659987474575360
TheUSAbulletin;14/03/2017 11:33;0;0;Barcelona Transfer News: Latest on Hector Bellerin to Arsenal Rumours http:// theusabulletin.com/2017/03/14/bar celona-transfer-news-latest-on-hector-bellerin-to-arsenal-rumours/ …;;;;8,41658E+17;https://twitter.com/TheUSAbulletin/status/841658490120749057
XavsFutbol;14/03/2017 11:32;0;0;Hector Bellerin and Gareth Barry got a shout in this article. Get a grip, man.;;;;8,41658E+17;https://twitter.com/XavsFutbol/status/841658368934727683
ChatSoccer;14/03/2017 11:31;0;0;Barcelona Transfer News: Latest on Hector Bellerin to Arsenal Rumours http://www. chatsports.com/soccer/a/sourc e/barcelona-transfer-news-latest-on-hector-bellerin-to-arsenal-rumours-13353215 … via @chatsports;;@chatsports;;8,41658E+17;https://twitter.com/ChatSoccer/status/841658128408166401
90minz;14/03/2017 11:21;0;0;Barcelona meet with Hector Bellerin ’s agent as transfer is imminent http://www. soccerinfomania.com/barcelona-to-r esume-talks-for-hector-bellerin/ … pic.twitter.com/6Q279QjbbG;;;;8,41655E+17;https://twitter.com/90minz/status/841655431269343232
soccerinfomania;14/03/2017 11:21;0;0;Barcelona meet with Hector Bellerin ’s agent as transfer is imminent http://www. soccerinfomania.com/barcelona-to-r esume-talks-for-hector-bellerin/ … pic.twitter.com/F4Lcoht4Xh;;;;8,41655E+17;https://twitter.com/soccerinfomania/status/841655415897223169
djgunz9ja;14/03/2017 11:20;0;0;Barcelona meet with Hector Bellerin ’s agent as transfer is imminent http://www. soccerinfomania.com/barcelona-to-r esume-talks-for-hector-bellerin/ … pic.twitter.com/0ysASeUBn5;;;;8,41655E+17;https://twitter.com/djgunz9ja/status/841655402655801346
StAnthony_jr;14/03/2017 11:20;0;0;Barcelona meet with Hector Bellerin ’s agent as transfer is imminent http://www. soccerinfomania.com/barcelona-to-r esume-talks-for-hector-bellerin/ … pic.twitter.com/O0c0Gv9ZS2;;;;8,41655E+17;https://twitter.com/StAnthony_jr/status/841655391331196929
jogo_viktor;14/03/2017 11:20;0;1;Barcelona meet with Hector Bellerin ’s agent as transfer is imminent http://www. soccerinfomania.com/barcelona-to-r esume-talks-for-hector-bellerin/ … pic.twitter.com/ULaox8eqio;;;;8,41655E+17;https://twitter.com/jogo_viktor/status/841655374868541440
___Timmy10___;14/03/2017 11:20;0;0;Barcelona are reportedly in talks with Arsenal defender Hector Bellerin ’s agent ahead of making a bid of over €40m to sign him this summer.;;;;8,41655E+17;https://twitter.com/___Timmy10___/status/841655266479284224
BarcelonaBuzz;14/03/2017 11:18;0;0;Barcelona Transfer News: Latest on Hector Bellerin to Arsenal Rumours http:// dlvr.it/Nd0yhY #Soccer #WorldFootball [Bleacher Report];;;#Soccer #WorldFootball;8,41655E+17;https://twitter.com/BarcelonaBuzz/status/841654683324182530
MarcusMckinley2;14/03/2017 11:11;0;0;If @Arsenal sell @HectorBellerin to Barca I'm done;;@Arsenal @HectorBellerin;;8,41653E+17;https://twitter.com/MarcusMckinley2/status/841652962086834176
nanakweso9;14/03/2017 11:05;0;0;continue making yourself good spewing that to yourself.;;;;8,41651E+17;https://twitter.com/nanakweso9/status/841651441274146816
Ryanstinson19;14/03/2017 10:58;0;0;Legend mate , was at that game was brilliant !;;;;8,4165E+17;https://twitter.com/Ryanstinson19/status/841649721106145280
Suleman56164064;14/03/2017 10:45;0;0;ntial Â£35million transfer of right-back Hector Bellerin , according;;;;8,41646E+17;https://twitter.com/Suleman56164064/status/841646408692191232
CitehNews;14/03/2017 10:38;0;0;Carl Jenkinson scores last-gasp equaliser for Arsenal U23s in front of Arsene Wenger and Hector Bellerin http:// bit.ly/2mIzwpf;;;;8,41645E+17;https://twitter.com/CitehNews/status/841644681360363521
zesty_barcelona;14/03/2017 10:38;0;1;Arsenal in talks with Barcelona over Hector Bellerin sale http://www. dailymail.co.uk/sport/football /article-4311964/Arsenal-talks-Barcelona-Bellerin-sale.html?ITO=1490&ns_mchannel=rss&ns_campaign=1490 … pic.twitter.com/UNUYWIqe1y;;;;8,41645E+17;https://twitter.com/zesty_barcelona/status/841644660284088322
FanAnticsFC;14/03/2017 10:30;12;3;Arsenal have opened talks with Barcelona over the £35m transfer of Héctor Bellerín . (Source: SPORT) #FanAntics pic.twitter.com/MtDGtnfLd3;;;#FanAntics;8,41643E+17;https://twitter.com/FanAnticsFC/status/841642671454187520
almasx10;14/03/2017 10:29;0;0;We are once again back to that time of year when 'Barcelona open HECTOR BELLERIN talks with Arsenal' comes up all over again. pic.twitter.com/NA9OhVYvax;;;;8,41642E+17;https://twitter.com/almasx10/status/841642459197247488
EdwardHumphries;14/03/2017 10:22;0;0;Arsenal in talks with Barcelona over Hector Bellerin sale http://www. arsenalnews247.tk/2017/03/14/ars enal-in-talks-with-barcelona-over-hector-bellerin-sale/ … pic.twitter.com/Il9BkaCypA;;;;8,41641E+17;https://twitter.com/EdwardHumphries/status/841640575568879616
Ahmed_Ma3abreh;14/03/2017 10:11;0;0;@FCBarcelona plz don't bring @HectorBellerin , he is a weak defender , bring someone like @VictorMoses and @KurtZouma #FCBarcelona #برشلونة;;@FCBarcelona @HectorBellerin @VictorMoses @KurtZouma;#FCBarcelona #;8,41638E+17;https://twitter.com/Ahmed_Ma3abreh/status/841637858804957185
monsieurmeemy;14/03/2017 10:09;0;0;Arsenal in talks with Barcelona over Hector Bellerin sale http://www. dailymail.co.uk/sport/football /article-4311964/Arsenal-talks-Barcelona-Bellerin-sale.html?ITO=1490&ns_mchannel=rss&ns_campaign=1490 …;;;;8,41637E+17;https://twitter.com/monsieurmeemy/status/841637467874873344
Eurosport_UK;14/03/2017 10:07;3;0;Bad news, @Arsenal . @FCBarcelona are confident of signing @HectorBellerin ! Euro Papers http:// bit.ly/2njs3hT pic.twitter.com/newnBtiKkH;;@Arsenal @FCBarcelona @HectorBellerin;;8,41637E+17;https://twitter.com/Eurosport_UK/status/841636988348452865
9ja_Arsenal;14/03/2017 10:06;0;1;Carl Jenkinson scores last-gasp equaliser for Arsenal U23s in front of Arsene Wenger and Hector Bellerin http:// dlvr.it/NczNG2;;;;8,41637E+17;https://twitter.com/9ja_Arsenal/status/841636609921441792
rumorstransfers;14/03/2017 10:05;0;0;Barcelona have made Hector Bellerin their biggest priority this summer according to AS .;;;;8,41636E+17;https://twitter.com/rumorstransfers/status/841636378597314560
ConcodiaCrescit;14/03/2017 10:00;0;0;And now @HectorBellerin seems to be off to Barcelona. @Arsenal @ArsenalFanTV we wouldn't be able to keep hold of a cold if we got one. AFC;;@HectorBellerin @Arsenal @ArsenalFanTV;;8,41635E+17;https://twitter.com/ConcodiaCrescit/status/841635262824370178
DJPOLY_M;14/03/2017 10:00;0;0;Carl Jenkinson scores last-gasp equaliser for Arsenal U23s in front of Arsene Wenger and Hector Bellerin http:// dlvr.it/NczGs3;;;;8,41635E+17;https://twitter.com/DJPOLY_M/status/841635167424802816
macheochoco;14/03/2017 10:00;0;0;Carl Jenkinson scores last-gasp equaliser for Arsenal U23s in front of Arsene Wenger and Hector Bellerin http:// dlvr.it/NczGhg;;;;8,41635E+17;https://twitter.com/macheochoco/status/841635149552934912
kigsjc;14/03/2017 10:00;0;0;Carl Jenkinson scores last-gasp equaliser for Arsenal U23s in front of Arsene Wenger and Hector Bellerin http:// dlvr.it/NczGGQ;;;;8,41635E+17;https://twitter.com/kigsjc/status/841635108687765504
ArsenalNewsUK;14/03/2017 09:57;0;0;Carl Jenkinson scores last-gasp equaliser for Arsenal U23s in front of Arsene Wenger and Hector Bellerin http://www. arsenalnews.co.uk/carl-jenkinson -scores-last-gasp-equaliser-for-arsenal-u23s-in-front-of-arsene-wenger-and-hector-bellerin/ …;;;;8,41634E+17;https://twitter.com/ArsenalNewsUK/status/841634454024130560
