username;date;retweets;favorites;text;geo;mentions;hashtags;id;permalink
Germanwhip_UK;26/08/2016 20:58;0;1;"Please chill out with some music @_harmonielondon .And enjoy your Achievements in ""Global Sport.Your the very best.Enjoy""";;@_harmonielondon;;7,69323E+17;https://twitter.com/Germanwhip_UK/status/769323246223290368
mm5jmcta11;26/08/2016 20:57;0;0;News: Man solves Rubik’s Cube faster than Usain Bolt wins 100 meter race http://www. meragem.com/traffics/2016/ 08/17/news-man-solves-rubiks-cube-faster-than-usain-bolt-wins-100-meter-race-2/ …;;;;7,69323E+17;https://twitter.com/mm5jmcta11/status/769323012562702337
Valdensius;26/08/2016 20:57;0;0;Usain Bolt Donates All His $20 Million Olympic Earnings to His Former School http:// theguard1an.com/usain-bolt-don ates-all-his-20-million-olympic-earnings-to-his-former-school/ …;;;;7,69323E+17;https://twitter.com/Valdensius/status/769322939682545664
ipipeditup;26/08/2016 20:56;0;0;Dude getting it in. I see you Usain Bolt https:// twitter.com/theracedraft/s tatus/767504034009747456 …;;;;7,69323E+17;https://twitter.com/ipipeditup/status/769322731276034048
YoloPiggeh;26/08/2016 20:56;0;0;@PurolatorInc I bet your drivers are the only sprinters in the world faster then Usain Bolt;;@PurolatorInc;;7,69323E+17;https://twitter.com/YoloPiggeh/status/769322648274890752
Diabetes_kill;26/08/2016 20:56;0;0;News: Man solves Rubik’s Cube faster than Usain Bolt wins 100 meter race http://www. meragem.com/cure/2016/08/1 7/news-man-solves-rubiks-cube-faster-than-usain-bolt-wins-100-meter-race/ …;;;;7,69323E+17;https://twitter.com/Diabetes_kill/status/769322585859293184
mamanAgosto;26/08/2016 20:56;0;0;"happy to be fast ;-) https://www. dpreview.com/news/435533479 9/two-rio-photographers-captured-almost-exactly-the-same-usain-bolt-photo-and-both-went-viral … @usainbolt @UsainBoltF @UsainBoltDaily @UsainBoltTNews";;@usainbolt @UsainBoltF @UsainBoltDaily @UsainBoltTNews;;7,69323E+17;https://twitter.com/mamanAgosto/status/769322581128155136
kdotram;26/08/2016 20:56;0;0;And they're missing some guy named Usain Bolt https:// twitter.com/deadspin/statu s/769287983715454977 …;;;;7,69323E+17;https://twitter.com/kdotram/status/769322580406784001
ariffalyahya77;26/08/2016 20:55;0;0;you know what else is running this morning? My nose.. dripping faster than Usain Bolt;;;;7,69322E+17;https://twitter.com/ariffalyahya77/status/769322343139192832
GreysArillope;26/08/2016 20:54;0;0;At his maximum speed, Usain Bolt legally cannot sprint through a school zone.;;;;7,69322E+17;https://twitter.com/GreysArillope/status/769322206572576768
IAMDJJUNKY;26/08/2016 20:54;0;0;usain - bolts -pregnant-girlfriend-says-nothing-happened- bolt -is-innocent-video/ http:// fb.me/6suJWqVN9;;;;7,69322E+17;https://twitter.com/IAMDJJUNKY/status/769322099806732288
sexygirl3160;26/08/2016 20:53;0;0;Usain Bolt Multi Million Dollar Networth!Million Dollar House And Cars https:// youtu.be/ZiquqwlG1g8 via @YouTube;;@YouTube;;7,69322E+17;https://twitter.com/sexygirl3160/status/769321948769845248
andraywright;26/08/2016 20:53;0;0;Usain Bolt Multi Million Dollar Networth!Million Dollar House And Cars https:// youtu.be/ZiquqwlG1g8 via @YouTube;;@YouTube;;7,69322E+17;https://twitter.com/andraywright/status/769321900074041344
ARW69NET;26/08/2016 20:53;0;0;Usain Bolt Multi Million Dollar Networth!Million Dollar House And Cars https:// youtu.be/ZiquqwlG1g8 via @YouTube;;@YouTube;;7,69322E+17;https://twitter.com/ARW69NET/status/769321853143945216
ARW69NET;26/08/2016 20:52;0;0;Usain Bolt Multi Million Dollar Networth!Million Dollar House And Cars: http:// youtu.be/ZiquqwlG1g8?a via @YouTube;;@YouTube;;7,69322E+17;https://twitter.com/ARW69NET/status/769321611644272641
Olympics__News;26/08/2016 20:51;1;1;Usain Bolt Donates All His $20 Million Olympic Earnings to His ... - http:// snopes.com http:// bit.ly/2bEL47N;;;;7,69322E+17;https://twitter.com/Olympics__News/status/769321524511645696
buteradornans;26/08/2016 20:51;1;0;usain bolt who? https:// twitter.com/conexaobieber/ status/769312113772888064/video/1 …;;;;7,69322E+17;https://twitter.com/buteradornans/status/769321523433893888
RJMcL;26/08/2016 20:50;1;5;Kris Boyd showing Usain Bolt like speed for his goal https:// twitter.com/bbcandyburke/s tatus/769278811481530368 …;;;;7,69321E+17;https://twitter.com/RJMcL/status/769321064522457088
LeahleahsL;26/08/2016 20:49;0;0;ENTER FOR A CHANCE TO WIN A GOLD TRACK SPIKE SIGNED BY THE WORLD’S FASTEST MAN: USAIN BOLT . http:// us.puma.com/en_US/Sweeps_E ntry.html …;;;;7,69321E+17;https://twitter.com/LeahleahsL/status/769320881432567808
HarryRalph3;26/08/2016 20:49;0;14;Why is Usain Bolt looking like he bout to be the star of 'the Bachelor Jamaica' season 1? #theBachelorJA pic.twitter.com/tyd0vquRBI;;;#theBachelorJA;7,69321E+17;https://twitter.com/HarryRalph3/status/769320818044080128
Somelrhalder;26/08/2016 20:48;0;1;@AustinMahone I wonder how you can meet so many people at once . Lol picked up the speed of Usain Bolt ? haha;;@AustinMahone;;7,69321E+17;https://twitter.com/Somelrhalder/status/769320566457335808
elengx;26/08/2016 20:47;0;0;9ja Talk: Preacher Claims Usain Bolt Is A Devil Worshiper http:// 9jatalkss.blogspot.com/2016/08/preach er-claims-usain-bolt-is-devil.html?spref=tw …;;;;7,6932E+17;https://twitter.com/elengx/status/769320450694479874
MirandaStakeley;26/08/2016 20:47;0;0;@MiaFarrow This is so cute! (iamarierose's video) https:// instagram.com/p/BJfz93XjPRB/ @usainbolt @TheEllenShow @RonanFarrow;;@MiaFarrow @usainbolt @TheEllenShow @RonanFarrow;;7,6932E+17;https://twitter.com/MirandaStakeley/status/769320294322413568
CyKirk21198;26/08/2016 20:45;0;0;Mecca's Angel dubbed 'the grey Usain Bolt ' by jockey Paul Mulrennan after sprint triumph at York;;;;7,6932E+17;https://twitter.com/CyKirk21198/status/769319785008160768
barbarast23;26/08/2016 20:44;0;0;Usain Bolt runs as guide for blind Paralympic champion Guilhermina... http:// bit.ly/2bEKzuL #iwork4thehartford pic.twitter.com/gtvICqTRNK;;;#iwork4thehartford;7,6932E+17;https://twitter.com/barbarast23/status/769319713893588992
TalentRefresh;26/08/2016 20:43;0;0;(Image: http:// iStock.com/Alija ) The world’s fastest man, Usain St. Leo Bolt , continues to captivate the world… http:// fb.me/2L7uD1q8z;;;;7,69319E+17;https://twitter.com/TalentRefresh/status/769319380756881408
Espy52;26/08/2016 20:43;0;2;The man likes to have fun!;;;;7,69319E+17;https://twitter.com/Espy52/status/769319289971089408
ABCXYZLetters;26/08/2016 20:42;0;0;#tokyo2020 I'm the Usain Bolt of the Orb Flip Event! #nailingit #werq #yas #everything … https://www. instagram.com/p/BJlzDM4AOmq/ #newszbreakin;;;#tokyo2020 #nailingit #werq #yas #everything #newszbreakin;7,69319E+17;https://twitter.com/ABCXYZLetters/status/769319218789711876
travismillr;26/08/2016 20:42;1;1;for the cheap cheap price of £25,000;;;;7,69319E+17;https://twitter.com/travismillr/status/769319143011221504
Germanwhip_UK;26/08/2016 20:42;0;3;"You are now ""Theworld_UK :Legend""";;;;7,69319E+17;https://twitter.com/Germanwhip_UK/status/769319091777798144
TravelZuluBlog;26/08/2016 20:42;0;0;When i set out for my 3rd and final olympics i texted the boys @usainbolt @michaelphelps … https://www. instagram.com/p/BJlzqWgDkMy/;;@usainbolt @michaelphelps;;7,69319E+17;https://twitter.com/TravelZuluBlog/status/769319050044436480
FLOMATIC_;26/08/2016 20:40;0;0;please sewa is Usain Bolt powering your speech? God relax now #TweeterRadio;;;#TweeterRadio;7,69319E+17;https://twitter.com/FLOMATIC_/status/769318671416193024
AndersonOdane;26/08/2016 20:39;0;1;I want one of those cool watch. Awesome;;;;7,69318E+17;https://twitter.com/AndersonOdane/status/769318493246201856
ABCXYZLetters;26/08/2016 20:37;0;0;#tokyo2020 I'm the Usain Bolt of the Orb Flip Event! #nailingit #werq #yas #everything … https://www. instagram.com/p/BJlzDM4AOmq/ #newszbreakin;;;#tokyo2020 #nailingit #werq #yas #everything #newszbreakin;7,69318E+17;https://twitter.com/ABCXYZLetters/status/769317798531260417
mathasif_sukri;26/08/2016 20:37;0;0;If you ever think of giving up,think again, why did you start it ~~~~ Usain Bolt;;;;7,69318E+17;https://twitter.com/mathasif_sukri/status/769317753551413250
eduardoplacer;26/08/2016 20:36;0;0;#tokyo2020 I'm the Usain Bolt of the Orb Flip Event! #nailingit #werq #yas #everything … https://www. instagram.com/p/BJlzDM4AOmq/;;;#tokyo2020 #nailingit #werq #yas #everything;7,69318E+17;https://twitter.com/eduardoplacer/status/769317703391801345
shezibelli1;26/08/2016 20:36;0;0;News: Usain Bolt pictured with another mystery woman as he parties into the small hours for second night in London - http:// ranatex.com/plurk/index.ph p/2016/08/24/news-usain-bolt-pictured-with-another-mystery-woman-as-he-parties-into-the-small-hours-for-second-night-in-london-4/ …;;;;7,69318E+17;https://twitter.com/shezibelli1/status/769317584114155520
mm5jmcta11;26/08/2016 20:35;0;0;News: Man solves Rubik’s Cube faster than Usain Bolt wins 100 meter race http://www. meragem.com/traffics/2016/ 08/17/news-man-solves-rubiks-cube-faster-than-usain-bolt-wins-100-meter-race/ …;;;;7,69317E+17;https://twitter.com/mm5jmcta11/status/769317374516404228
disclaimit;26/08/2016 20:35;0;0;Usain Bolt Donates All His $20 Million Olympic Earnings to His Former School - http:// snopes.com http:// goo.gl/fb/h9LqsM;;;;7,69317E+17;https://twitter.com/disclaimit/status/769317269323321345
JOriginals03;26/08/2016 20:33;0;0;Usain Bolt 2016 Olympic T-shirt http:// pinterest.com/pin/4958886089 53723277/ …;;;;7,69317E+17;https://twitter.com/JOriginals03/status/769316904783732736
JOriginals03;26/08/2016 20:33;0;0;USAIN BOLT JAMAICA 2016 Olympic Mug http:// pinterest.com/pin/4958886089 53723273/ …;;;;7,69317E+17;https://twitter.com/JOriginals03/status/769316837335203840
JOriginals03;26/08/2016 20:33;0;0;Usain Bolt Jamaica Olympic Winner t-shirt http:// pinterest.com/pin/4958886089 53723271/ …;;;;7,69317E+17;https://twitter.com/JOriginals03/status/769316797237567488
JOriginals03;26/08/2016 20:32;0;0;USAIN BOLT Olympic 2016 Mug http:// pinterest.com/pin/4958886089 53723265/ …;;;;7,69317E+17;https://twitter.com/JOriginals03/status/769316566089564160
JOriginals03;26/08/2016 20:32;0;0;USAIN BOLT Olympic 2016 Mug http:// pinterest.com/pin/4958886089 53723264/ …;;;;7,69317E+17;https://twitter.com/JOriginals03/status/769316506006130688
starboyonline1;26/08/2016 20:31;0;0;If Usain Bolt were a dog… h ... http:// funny.starboyonline.net/funny/if-usain -bolt-were-a-dog-httpift-tt2btheda … #funny #lol #meme #hilarious #funnypictures #humor #comedy pic.twitter.com/1MXrl6Wu5M;;;#funny #lol #meme #hilarious #funnypictures #humor #comedy;7,69316E+17;https://twitter.com/starboyonline1/status/769316474167046144
Mellow1263;26/08/2016 20:31;0;0;#Repost @elvajamaica @usainbolt What a Great Philanthropic donation… https://www. instagram.com/p/BJlycBZADkGq -L6ao4VDy_xvrQ6lzYAt89Ptfs0/ …;;@elvajamaica @usainbolt;#Repost;7,69316E+17;https://twitter.com/Mellow1263/status/769316353773797376
sonderman_joe;26/08/2016 20:31;0;0;That's quite a list. Don't forget all those speedy Bobcats!;;;;7,69316E+17;https://twitter.com/sonderman_joe/status/769316265080958976
guyfromsamoa;26/08/2016 20:30;0;0;you Greatest Of All Time. G. O. A. T.;;;;7,69316E+17;https://twitter.com/guyfromsamoa/status/769316115625324544
GhanaNdwom;26/08/2016 20:29;1;5;Usain Bolt Donates All His $20 Million Olympic Earnings to His Former School - 233 Prime |... http:// fb.me/O8mKaXAC;;;;7,69316E+17;https://twitter.com/GhanaNdwom/status/769315938323816448
Desaroo22;26/08/2016 20:29;0;2;ew i woke up with a sore throat this morning and my nose is running more than usain bolt .;;;;7,69316E+17;https://twitter.com/Desaroo22/status/769315923450888192
JdubbTala;26/08/2016 20:29;2;0;These tough guys is tough until they hear them gunshots then they turn into @usainbolt;;@usainbolt;;7,69316E+17;https://twitter.com/JdubbTala/status/769315892807147520
NaturalVanity11;26/08/2016 20:29;0;0;Usain Bolt Donates All His $20 Million Olympic Earnings to His Former School http:// fb.me/1tB1ixXOw;;;;7,69316E+17;https://twitter.com/NaturalVanity11/status/769315745880834048
OlivaRiggle;26/08/2016 20:28;0;0;Keep Your Post-Coital Selfies With Usain Bolt —Cashing In On Celebrity Hookups Is Tired - Complex http:// dlvr.it/M731gs;;;;7,69316E+17;https://twitter.com/OlivaRiggle/status/769315534424842240
guyfromsamoa;26/08/2016 20:27;0;0;I'd say in terms of global reach and attraction ... @usainbolt is the greatest drawcard;;@usainbolt;;7,69315E+17;https://twitter.com/guyfromsamoa/status/769315335618998272
aDDmoreJuice;26/08/2016 20:27;0;0;I liked a @YouTube video http:// youtu.be/2BC1FMUBZG0?a Usain Bolt turning up in Rio for his 30th Birthday! Skip to 1:00;;@YouTube;;7,69315E+17;https://twitter.com/aDDmoreJuice/status/769315322411225092
aDDmoreJuice;26/08/2016 20:27;0;0;Usain Bolt turning up in Rio for his 30th Birthday! Skip to 1:00 https:// youtu.be/2BC1FMUBZG0 via @YouTube;;@YouTube;;7,69315E+17;https://twitter.com/aDDmoreJuice/status/769315313389219840
mclovin242;26/08/2016 20:25;0;0;Listen to Win ( Usain Bolt & Team Jamaica Dedication) by Vybz Kartel on #AppleMusic . https:// itun.es/ca/GbPoeb?i=11 44688892 …;;;#AppleMusic;7,69315E+17;https://twitter.com/mclovin242/status/769314851046821888
ShellyCurran;26/08/2016 20:24;2;4;Every day it's a new record I wish Bruce would interject in this crisis than the private life of #usainbolt https:// twitter.com/owenjamesja/st atus/769314052220727296 …;;;#usainbolt;7,69315E+17;https://twitter.com/ShellyCurran/status/769314574851944448
janaenadams;26/08/2016 20:24;3;3;I ran like Usain Bolt from the quad to my room in that thunderstorm;;;;7,69315E+17;https://twitter.com/janaenadams/status/769314550084673536
Rangaaaa__;26/08/2016 20:23;0;0;Usain Bolt cheated on his girl back home and she ain't even one bit embarrassed;;;;7,69314E+17;https://twitter.com/Rangaaaa__/status/769314328889659393
brettlowry1994;26/08/2016 20:21;0;0;Usain Bolt got girl this year because he was running away from that coochie.;;;;7,69314E+17;https://twitter.com/brettlowry1994/status/769313774335561729
artbyeris;26/08/2016 20:18;0;0;When Usain Bolt retires, only then will track and field be competitive #HOTTAKE;;;#HOTTAKE;7,69313E+17;https://twitter.com/artbyeris/status/769313134205079552
wilesbeil;26/08/2016 20:18;0;0;I wonder what my head, and fiction make up more than I never produces serenity the next Usain Bolt or needed answers or had;;;;7,69313E+17;https://twitter.com/wilesbeil/status/769312980307632128
GBelousss;26/08/2016 20:17;0;0;How many packs a day does Usain Bolt smoke?;;;;7,69313E+17;https://twitter.com/GBelousss/status/769312800246116352
chocoLITdrop44;26/08/2016 20:16;0;1;My Godson was like Usain Bolt out here, started off slow but came from behind and smoked em #FootballPractice;;;#FootballPractice;7,69313E+17;https://twitter.com/chocoLITdrop44/status/769312702850338816
Cavalli512;26/08/2016 20:16;0;0;they forgot to include Usain Bolt ! Lol the wizzler man himself!;;;;7,69313E+17;https://twitter.com/Cavalli512/status/769312615948398592
femi_legacy;26/08/2016 20:16;0;0;"To all the Ladies who love Usain Bolt , hope you all will love him in this aspect If he ( Bolt ) finished in 9.98secs in bed...""";;;;7,69313E+17;https://twitter.com/femi_legacy/status/769312588505186304
robinson_iam;26/08/2016 20:15;0;1;" @Cristiano : Congratulations my friend @usainbolt for your triple gold! pic.twitter.com/SZzTztbrCQ """"";;@Cristiano @usainbolt;;7,69312E+17;https://twitter.com/robinson_iam/status/769312442069426176
Locksinbrisbane;26/08/2016 20:15;0;0;Pics surface of Usain Bolt making out with different woman the same night he allegedly cheated on GF http:// ow.ly/YFdT503JVjy;;;;7,69312E+17;https://twitter.com/Locksinbrisbane/status/769312319348367360
mrsjaz2;26/08/2016 20:14;0;0;Usain Bolt . Watch yo eye. pic.twitter.com/T4oFYgEnVd;;;;7,69312E+17;https://twitter.com/mrsjaz2/status/769312051504160768
shezibelli1;26/08/2016 20:14;0;0;News: Usain Bolt pictured with another mystery woman as he parties into the small hours for second night in London - http:// ranatex.com/plurk/index.ph p/2016/08/24/news-usain-bolt-pictured-with-another-mystery-woman-as-he-parties-into-the-small-hours-for-second-night-in-london-3/ …;;;;7,69312E+17;https://twitter.com/shezibelli1/status/769311998890958849
DME_dwards;26/08/2016 20:12;0;0;nice of you to put on your best shoes for the occasion Mr Pipe!! #UsainBolt;;;#UsainBolt;7,69312E+17;https://twitter.com/DME_dwards/status/769311660549017604
SuperconsWorld;26/08/2016 20:10;0;0;Science News: Genetic Engineering Will Produce Future Usain Bolts , Trump Is Bad, Bad, Bad on Science -… http:// dlvr.it/M72lYX;;;;7,69311E+17;https://twitter.com/SuperconsWorld/status/769310987769950208
KLawlor_10;26/08/2016 20:09;0;0;"Awwwww yiss Dioner  Usain Bolt "" Navarro is back with the #BlueJays !!!""";;;#BlueJays;7,69311E+17;https://twitter.com/KLawlor_10/status/769310790704922628
PhyMathWorld;26/08/2016 20:07;0;0;Science News: Genetic Engineering Will Produce Future Usain Bolts , Trump Is Bad, Bad, Bad on Science -… http:// dlvr.it/M72kBZ;;;;7,6931E+17;https://twitter.com/PhyMathWorld/status/769310373124026368
NonTheistNews1;26/08/2016 20:07;0;0;Science News: Genetic Engineering Will Produce Future Usain Bolts , Trump Is Bad, Bad, Bad on Science -… http:// dlvr.it/M72k2k;;;;7,6931E+17;https://twitter.com/NonTheistNews1/status/769310350466428928
shezibelli1;26/08/2016 20:07;0;0;News: Usain Bolt pictured with another mystery woman as he parties into the small hours for second night in London - http:// ranatex.com/plurk/index.ph p/2016/08/24/news-usain-bolt-pictured-with-another-mystery-woman-as-he-parties-into-the-small-hours-for-second-night-in-london-2/ …;;;;7,6931E+17;https://twitter.com/shezibelli1/status/769310213048528896
rehman_shamsur;26/08/2016 20:06;0;0;Usain Bolt 'caught in bed with Brazilian student' in Rio amid rumours he is to marry girlfriend Kasi Bennett http:// bit.ly/2bLQP2k;;;;7,6931E+17;https://twitter.com/rehman_shamsur/status/769309953861517312
bewarebiebur;26/08/2016 20:05;0;1;lol sofias story justin bieber or usain bolt ??;;;;7,6931E+17;https://twitter.com/bewarebiebur/status/769309933171073024
sayshafreeman;26/08/2016 20:05;0;2;I think Usain Bolt is my new favourite person. He is absolutely hilarious. I sit and watch his snapchats and absolutely howl at him.;;;;7,6931E+17;https://twitter.com/sayshafreeman/status/769309770620829697
alan_carpenter;26/08/2016 20:04;0;1;A mutually inconvenient distance ... Mo Farah challenges Usain Bolt to a race over distance chosen by fans https://www. theguardian.com/sport/2013/jul /28/mo-farah-usain-bolt-race?CMP=share_btn_tw …;;;;7,6931E+17;https://twitter.com/alan_carpenter/status/769309679944015873
itsDJSupreme;26/08/2016 20:02;0;1;Money well spent #usainbolt https://www. instagram.com/p/BJlvLZODDmU/;;;#usainbolt;7,69309E+17;https://twitter.com/itsDJSupreme/status/769309186333245440
diamondnewsngr;26/08/2016 20:02;0;0;#LatestNews : Usain Bolt , most decorated sprinter of all time;;;#LatestNews;7,69309E+17;https://twitter.com/diamondnewsngr/status/769308963728945156
snookerloopyno1;26/08/2016 20:01;0;1;both of them made boyd look like usain bolt;;;;7,69309E+17;https://twitter.com/snookerloopyno1/status/769308910679367680
gproof1;26/08/2016 20:01;0;1;Usain Bolt Donates All His $20 Million Olympic Earnings to His Former School http:// theguard1an.com/usain-bolt-don ates-all-his-20-million-olympic-earnings-to-his-former-school/ …;;;;7,69309E+17;https://twitter.com/gproof1/status/769308910654283777
kenneth2nice;26/08/2016 20:00;0;0;usain bolt is the greatest. All event he entered for, he won gold in all;;;;7,69309E+17;https://twitter.com/kenneth2nice/status/769308664293457920
DanielIngram93;26/08/2016 20:00;3;12;Usain Bolt , stealing his celebrations from Pokemon since 1998 #Jamesdiditfirst pic.twitter.com/wDEzpMtKr0;;;#Jamesdiditfirst;7,69309E+17;https://twitter.com/DanielIngram93/status/769308588741390336
Crazyerol123;26/08/2016 20:00;0;1;Check out Bambi Street Art ' Usain Bolt ' 2014 Print Framed To A Gallery Standard https://www. ebay.co.uk/itm/1522200103 81 … @eBay;;@eBay;;7,69308E+17;https://twitter.com/Crazyerol123/status/769308489793597440
Kwamedavid1;26/08/2016 19:59;0;0;Usain Bolt Donates All His $20 Million Olympic Earnings to His Former School - http:// m.peacefmonline.com/pages/local/so cial/201608/290092.php …;;;;7,69308E+17;https://twitter.com/Kwamedavid1/status/769308428921692160
mm5jmcta11;26/08/2016 19:59;0;0;FOX News: Ellen DeGeneres accused of racism over Usain Bolt tweet http://www. meragem.com/traffics/2016/ 08/17/fox-news-ellen-degeneres-accused-of-racism-over-usain-bolt-tweet/ …;;;;7,69308E+17;https://twitter.com/mm5jmcta11/status/769308350798442496
dilettante10;26/08/2016 19:59;0;0;Usain Bolt Brought Up to 10 #Women Back to His London Hotel Room https://www. yahoo.com/news/usain-bol t-brought-10-women-160755225.html …;;;#Women;7,69308E+17;https://twitter.com/dilettante10/status/769308192648159233
GbruceA;26/08/2016 19:58;0;0;Home of the World's greatest sprinter @usainbolt Stay tuned for never seen before footage of the… https://www. instagram.com/p/BJluthkDKHX/;;@usainbolt;;7,69308E+17;https://twitter.com/GbruceA/status/769308162860183552
dbbmonica;26/08/2016 19:58;0;0;Sprinter Usain Bolt from Jamaica, attends a press conference for... http:// goo.gl/fb/UP9GHB #krizevcipriljutomeru;;;#krizevcipriljutomeru;7,69308E+17;https://twitter.com/dbbmonica/status/769307973248282624
love_scroll;26/08/2016 19:57;0;0;#lovescroll #madailygist : [ Usain Bolt heads back to his hotel with trio of ladies after an… http:// bit.ly/2bqnSsg pic.twitter.com/w3mjJa2aZm;;;#lovescroll #madailygist;7,69308E+17;https://twitter.com/love_scroll/status/769307816591036416
mm5jmcta11;26/08/2016 19:56;0;0;The Independent – Sport: Rio 2016 day 12 schedule: Mo Farah, Usain Bolt and Justin Gatlin in action as Hannah… http://www. meragem.com/traffics/2016/ 08/17/the-independent-sport-rio-2016-day-12-schedule-mo-farah-usain-bolt-and-justin-gatlin-in-action-as-hannah-mills-saskia-clark-for-for-gold/ …;;;;7,69308E+17;https://twitter.com/mm5jmcta11/status/769307593571348480
luke_anderson1;26/08/2016 19:55;0;0;How does Usain Bolt get a pass for cheating on his banging gf?;;;;7,69307E+17;https://twitter.com/luke_anderson1/status/769307295968813056
TriggaPlay85;26/08/2016 19:53;0;0;"Niggas be low on cash and just start hating for no reason about nonsense!  Usain Bolt really not that fast bro""""";;;;7,69307E+17;https://twitter.com/TriggaPlay85/status/769306905877544960
Andrew_InStre;26/08/2016 19:53;0;1;The Tories want to privatise the #NHS so quickly than Usain Bolt . @SophiaCannon #BBCPapers;;@SophiaCannon;#NHS #BBCPapers;7,69307E+17;https://twitter.com/Andrew_InStre/status/769306792643952640
itz_Danbee;26/08/2016 19:52;0;0;Usain Bolt Donates All His $20 Million Olympic Earnings to His Former School: World fastest runner, Usain Bol... http:// bit.ly/2bWzPpd;;;;7,69307E+17;https://twitter.com/itz_Danbee/status/769306572954542081
wonugames;26/08/2016 19:51;0;0;[ Usain Bolt heads back to his hotel with trio of ladies after another night of partying (Photos) - http:// bit.ly/2bqnSsg;;;;7,69306E+17;https://twitter.com/wonugames/status/769306219702001664
vickydoro;26/08/2016 19:51;0;0;[ Usain Bolt heads back to his hotel with trio of ladies after another night of partying (Photos) - http:// bit.ly/2bqnSsg;;;;7,69306E+17;https://twitter.com/vickydoro/status/769306218590511104
Shopaholic_651;26/08/2016 19:51;0;0;[ Usain Bolt heads back to his hotel with trio of ladies after another night of partying (Photos) - http:// bit.ly/2bqnSsg;;;;7,69306E+17;https://twitter.com/Shopaholic_651/status/769306217449684992
Akintola_jr;26/08/2016 19:51;0;0;[ Usain Bolt heads back to his hotel with trio of ladies after another night of partying (Photos) - http:// bit.ly/2bqnSsg;;;;7,69306E+17;https://twitter.com/Akintola_jr/status/769306212777222144
NigerianLegend;26/08/2016 19:51;0;0;[ Usain Bolt heads back to his hotel with trio of ladies after another night of partying (Photos) - http:// bit.ly/2bqnSsg;;;;7,69306E+17;https://twitter.com/NigerianLegend/status/769306211632242688
MrFemi1;26/08/2016 19:51;0;1;[ Usain Bolt heads back to his hotel with trio of ladies after another night of partying (Photos) - http:// bit.ly/2bqnSsg;;;;7,69306E+17;https://twitter.com/MrFemi1/status/769306210424291328
magbedu2;26/08/2016 19:51;0;0;[ Usain Bolt heads back to his hotel with trio of ladies after another night of partying (Photos) - http:// bit.ly/2bqnSsg;;;;7,69306E+17;https://twitter.com/magbedu2/status/769306209233108993
magbedu;26/08/2016 19:51;0;0;[ Usain Bolt heads back to his hotel with trio of ladies after another night of partying (Photos) - http:// bit.ly/2bqnSsg;;;;7,69306E+17;https://twitter.com/magbedu/status/769306207987331072
MaDailyGist;26/08/2016 19:51;1;0;[ Usain Bolt heads back to his hotel with trio of ladies after another night of partying (Photos) - http:// bit.ly/2bqnSsg;;;;7,69306E+17;https://twitter.com/MaDailyGist/status/769306206972280832
ma_views;26/08/2016 19:51;0;0;[ Usain Bolt heads back to his hotel with trio of ladies after another night of partying (Photos) - http:// bit.ly/2bqnSsg;;;;7,69306E+17;https://twitter.com/ma_views/status/769306205810458624
LizzySuga;26/08/2016 19:51;0;0;[ Usain Bolt heads back to his hotel with trio of ladies after another night of partying (Photos) - http:// bit.ly/2bqnSsg;;;;7,69306E+17;https://twitter.com/LizzySuga/status/769306202299858946
lafforfact;26/08/2016 19:51;0;0;[ Usain Bolt heads back to his hotel with trio of ladies after another night of partying (Photos) - http:// bit.ly/2bqnSsg;;;;7,69306E+17;https://twitter.com/lafforfact/status/769306201091895297
